,Unnamed: 0,anime_id,name,genre,type,episodes,rating,members,synopsis
0,1100,22147,Amagi Brilliant Park,"Comedy, Magic",TV,13,7.68,217003,"Seiya Kanie, a smart and extremely narcissistic high school student, believes that the beautiful but reserved Isuzu Sento has invited him on a date at an amusement park called Amagi Brilliant Park. Much to his chagrin, not only is the location a run-down facility, the supposed date is merely a recruitment tour where Sento and Princess Latifa Fleuranza, the owner of the theme park, ask him to become the parks new manager. Their cause for desperation? As stipulated in a land-use contract, Amagi has less than three months to meet a quota of 500,000 guests, or the park will be closed for good and the land redeveloped by a greedy real-estate company.Seiya is won over by the revelation that Amagi is no ordinary amusement park; many of its employees are Maple Landers—mysterious magical beings who live in the human world and are nourished by the energy created by people having fun. Entrusted with the hopes and dreams of this far-off enchanted land, Seiya must now use his many skills to bring Amagi back on its feet, or watch it crumble before his eyes."
1,1101,1946,Ashita no Nadja,"Adventure, Drama, Historical, Romance, Shoujo",TV,50,7.68,13742,"This story takes place about one hundred years ago. Nadja is a bright, cheerful girl who was raised in an orphanage near London, England. Nadja was entrusted to the orphanage when she was a baby. So she thought her father and mother were dead. But before her thirteenth birthday, she found out that her mother might be alive..Nadja sets out on a journey to find her mother! With all of Europe as the stage, Nadjas exciting adventure begins!(Source: AniDB)"
2,1102,67,Basilisk: Kouga Ninpou Chou,"Action, Adventure, Fantasy, Historical, Romance, Samurai, Supernatural",TV,24,7.68,98144,"For centuries, the Iga and Kouga ninja clans have engaged in a bitter war. But when a ceasefire is ordered by the powerful warlord Ieyasu Tokugawa, the two clans are forced to put down their arms.Years later, Gennosuke Kouga, heir of the Kouga clan, and Oboro Iga, heir of the Iga clan, have fallen in love. Through marriage, both heirs aim to bring peace to the clans. But their hopes are dashed when flames of rivalry between their clans are reignited, and they are dragged into another war.Ieyasus two grandsons have both claimed to be the next heir to the shogunate. To resolve this dispute, both the Kouga and Iga are ordered to send their 10 best warriors to fight in a bloody battle royale, with each clan representing one of the potential shogunate heirs. Two scrolls with the names of the fighters are given and are to be marked in blood upon the given fighters death. The prize for winning is the favor of the Tokugawa shogunate for a thousand years. Torn between their love for each other and duty to their clans, Gennosuke and Oboro must ultimately decide the fate of their clans."
3,1103,32365,Boruto: Naruto the Movie - Naruto ga Hokage ni Natta Hi,"Action, Comedy, Martial Arts, Shounen, Super Power",Special,1,7.68,16868,Bundled with the limited edition of Blu-ray/DVD of Boruto: Naruto the Movie.
4,1104,14345,Btooom!,"Action, Psychological, Sci-Fi, Seinen",TV,12,7.68,329561,"Ryouta Sakamoto is unemployed and lives with his mother, his only real achievement being that he is Japans top player of the popular online video game Btooom! However, his peaceful life is about to change when he finds himself stranded on an island in the middle of nowhere, with a small green crystal embedded in his left hand and no memory of how he got there. To his shock, someone has decided to recreate the game he is so fond of in real life, with the stakes being life or death.Armed with a bag full of unique bombs known as ""BIM,"" the players are tasked with killing seven of their fellow participants and taking their green crystals in order to return home. Initially condemning any form of violence, Ryouta is forced to fight when he realizes that many of the other players are not as welcoming as they may seem. Teaming up with Himiko, a fellow Btooom! player, they attempt to get off of the island together, coming closer and closer to the truth behind this contest of death."
5,1105,11359,Dragon Ball Kai: Mirai ni Heiwa wo! Goku no Tamashii yo Eien ni,"Action, Comedy, Fantasy, Sci-Fi, Shounen, Super Power",Special,1,7.68,17166,Special episode about Trunks going back to the future and fighting the Androids. Also known as episode 98 of Dragon Ball Kai.
6,1106,428,Kaleido Star: Aratanaru Tsubasa - Extra Stage,"Adventure, Comedy, Drama, Shoujo",OVA,1,7.68,9248,"Sora Naegino has finally consolidated herself as Kaleido Stages greatest star ever, and a new star starts to shine as Rosetta Passel is selected to participate in the next attraction in a main role. But when things start to go wrong in the rehearsals, Rosetta starts to question her abillity to take the role, as her own capacity to remain in Kaleido Stage. Meanwhile, Fool also struggles with his demons from the past. "
7,1107,4188,Mahou Sensei Negima! Shiroki Tsubasa Ala Alba,"Adventure, Comedy, Ecchi, Harem, Magic, Romance, Shounen, Supernatural, Vampire",OVA,3,7.68,15616,OVA episodes that are bundled with the limited edition of the manga volumes 23-25. First episode to cover chapters 176 and 177 of the manga. Second episode to cover chapters 178-180. And third episode to cover chapters 182 and 183.
8,1108,340,Mutsu Enmei Ryuu Gaiden: Shura no Toki,"Action, Historical, Martial Arts, Samurai, Shounen",TV,26,7.68,13959,"Legends tell of an invincible martial art known as Mutsu Enmei-Ryu, an unarmed style that allows the user to defeat any number of armed opponents using incredible speed and strength. This is the story of three generations of those who bear the name Mutsu, and their encounters and battles with the strongest fighters of their era. (Source: ANN)"
9,1109,10588,Persona 4 the Animation,"Adventure, Mystery, School, Sci-Fi, Super Power, Supernatural",TV,25,7.68,134942,"Serial murders have recently plagued Inaba, with the police struggling to find any leads. Despite this, due to his parents going abroad for work, Yuu Narukami moves to the small town to live with his uncle for a year. He enrolls at Yasogami High School, where he meets and befriends Yousuke Hanamura, Chie Satonaka, and Yukiko Amagi.While hanging out together after school, the group fills Yuu in on the urban legend known as the ""Midnight Channel""—a mysterious TV channel that only appears at midnight on rainy days while the viewer is alone. Curious about the claim, Yuu decides to tune in that night, only to see the next victim of the serial murders appear on the screen instead. He also finds himself being drawn into the TV, which intrigues his newfound friends enough to want to investigate.Yuu ends up falling into the world within the TV, which is blanketed by a thick fog and swarming with hostile creatures known as ""Shadows."" Realizing that this world is somehow connected to the murders, the Investigation Team forms with the goal of uncovering the mystery behind the incidents."
10,1110,5958,Sora no Otoshimono,"Comedy, Ecchi, Harem, Romance, Sci-Fi, Shounen, Supernatural",TV,13,7.68,227681,"Ever since he was a child, Tomoki Sakurai has always woke up with tears after a dream of an angel. His childhood friend Sohara Mitsuki worries about this and decides to seek the help of Eishirou Sugata, an eccentric sky maniac. He concludes that Tomokis dream is undoubtedly connected to what is known as the New World, a floating anomaly that scientists have failed to understand.Recruiting the New World Discovery Clubs first members, Eishirou schedules a time to meet up in order to observe the mystery in the sky. That day, Tomokis peaceful life is changed forever when a strange girl falls from the sky and begins to call him master.Sora no Otoshimono follows the daily activities of the New World Discovery Club as they begin to learn more about the Angeloids that have arrived on Earth."
11,1111,14669,Aura: Maryuuin Kouga Saigo no Tatakai,"Comedy, Drama, Romance, School, Supernatural",Movie,1,7.67,22599,"Ichirou Satou is an ordinary high school student who pretended that he was a hero by the name of ""Maryuuin Kouga"" back in middle school, which led to others frequently bullying him. Now that he has left this embarrassing phase behind, he does his best to avoid standing out and live a peaceful life, although he feels the world has become quite dull. But when he makes his way back to school one night to grab a textbook he left in class, he runs into a strange girl wearing a costume.This girl, Ryouko Satou, happens to be his classmate and is affected by the exact same condition that he once had, holding on to a delusion that she is someone else and dressing up to reflect this. The very next day, Ichirou is asked by his teacher to become friends with Ryouko, to which he adamantly refuses, unwilling to be reminded of his own history. When he sees that she is being bullied just as he once was, however, the boy makes it his responsibility to take care of her and break her free from that which what once plagued him—the perfect job for Maryuuin Kouga."
12,1112,1478,City Hunter: Goodbye My Sweetheart,"Adventure, Comedy, Shounen",Special,1,7.67,2832,"Ryo Saeba (aka the City Hunter), is a private detective in the city of Tokyo. Together with sidekick Kaori Makimura, Ryo is hired by actress Emi Makaze to find her long lost brother. The womans brother turns out to be ""The Professor"", a dillusional ex-soldier whos planing to destroy the Shinjuku district of Tokyo. Kaori is assigned to guard Emi, but they both get caught up in the Professors scheme. The City Hunter must save them, without allowing downtown Tokyo to be destroyed. (Source: ANN)"
13,1113,8331,Detective Conan Magic File 4: Osaka Okonomiyaki Odyssey,"Comedy, Mystery, Police, Shounen",OVA,1,7.67,6460,"Another special to accompany the release of the 14th feature film, The Lost Ship in the Sky. Along with a number of previous episodes, the original episode contained within will take place after the events of the film."
14,1114,455,Fantastic Children,"Adventure, Fantasy, Mystery, Romance, Sci-Fi",TV,26,7.67,17773,"A group of enigmatic white-haired children has been spotted at different times and places in Europe for over 500 years. Always with the appearance of 11-year-olds, they behave far more mature than they should be, never grow old, and seem to have supernatural power. What they have been seeking is a girl, and the only clue they have is a picture with a crescent moon. Now, in the year of 2012, an athletic boy named Tohma is about to be involved in this centuries-long mystery.(Source: ANN)"
15,1115,18507,Free!,"Comedy, School, Slice of Life, Sports",TV,12,7.67,265791,"Haruka Nanase has a love for water and a passion for swimming. In elementary school, he competed in and won a relay race with his three friends Rin Matsuoka, Nagisa Hazuki, and Makoto Tachibana. After claiming victory at the tournament, the four friends went their separate ways. Years later, they reunite as high school students; however, Rin couldnt care less about returning to the way things used to be. Not only does he attend a different school, but the sole thing important to him is proving that he is a better swimmer than Haruka.After the bitter reunion, Haruka, Nagisa, and Makoto decide to form the Iwatobi High School Swim Club, but they will need a fourth member if they hope to take part in the upcoming tournament. Enter Rei Ryuugazaki, a former member of the track team whom Nagisa recruits. As the time to compete draws near, the four develop a close bond while training intensely to come out on top and settle things between Haruka and Rin once and for all."
16,1116,27411,Ghost in the Shell (2015),"Action, Mecha, Police, Psychological, Sci-Fi",Movie,1,7.67,19872,"In the year 2027, a year following the end of the non-nuclear World War IV, a bomb has gone off in Newport City, killing a major arms dealer who may have ties with the mysterious 501 Organization. Public Security official Daisuke Aramaki hires full-body cyber prosthesis user and hacker extraordinaire, Motoko Kusanagi, to investigate.(Source: Wikipedia)"
17,1117,17729,Grisaia no Kajitsu,"Drama, Harem, Psychological, Romance, School",TV,13,7.67,178166,"Yuuji Kazami is a transfer student who has just been admitted into Mihama Academy. He wants to live an ordinary high school life, but this dream of his may not come true any time soon as Mihama Academy is quite the opposite. Consisting of only the principal and five other students, all of whom are girls, Yuuji becomes acquainted with each of them, discovering more about their personalities as socialization is inevitable. Slowly, he begins to learn about the truth behind the small group of students occupying the academy—they each have their own share of traumatic experiences which are tucked away from the world.Mihama Academy acts as a home for these girls, they are the ""fruit"" which fell from their trees and have begun to decay. It is up to Yuuji to become the catalyst to save them from themselves, but how can he save another when he cannot even save himself?"
18,1118,26023,Haiyore! Nyaruko-san F,"Comedy, Parody, Romance, Sci-Fi",OVA,1,7.67,19620,"A new OVA of the light novel Haiyore! Nyaruko-san, titled Haiyore! Nyaruko-san F, has been green-lit.(Source: MAL News)"
19,1119,21075,Hetalia: The Beautiful World Extra Disc,"Comedy, Historical, Parody",OVA,1,7.67,4788,"Unaired episode adapted from the manga chapter ""I Was Overwhelmed by Heroines."""
20,1120,8217,Jewelpet Twinkle☆,"Fantasy, Magic, School, Shoujo",TV,52,7.67,4110,"In Jewel Land, Jewelpets, creatures who has the natural ability to use magic lived in harmony with the Witches, attending the School of Witchcraft and Wizardry to learn to use magic with their Jewel Eyes. However for Ruby, a white Japanese Hare whose magic sometimes fail, is appointed to go to the Human World to search for her partner. But when she used the card the magicians gave her, she was sent to the Human World by accident. In the Human World, A girl named Akari Sakura met her on the beach on her way to school. At first, Akari cant understand her due to her Jewel Land Language until Ruby took a special candy so she could speak and understand human language. As the day passes, Ruby knew about her problems and later apologized. A Jewel Charm appeared on Akaris hand and she realized it that shes chosen by Ruby to be her partner. After that, she decided to enter the Jewel Star Grand Prix, on the prize is that any wish that they wanted will be granted. Will she be the Next Jewel Star and her wish be granted in the end? Or Itll just end in one big disaster...(Source: Wikipedia) "
21,1121,617,Juubee Ninpuuchou,"Adventure, Fantasy, Historical, Horror, Romance, Shounen, Supernatural",Movie,1,7.67,55697,"Jubei Kibagami wanders feudal Japan as an itinerant swordsman-for-hire. After a past betrayal left him masterless, he has no more patience for warring political factions and their schemes. Unfortunately, both past and political intrigue collide when he meets and saves a female ninja named Kagero from a man with the ability to make his body as hard as stone.The sole survivor of a ninja clan, Kagero continues her teams last mission: investigate a mysterious plague that wiped out an entire village. Jubei wants nothing to do with this, but the stone-like mans allies, a group of ninja with supernatural powers known as the Devils of Kimon, make that option difficult. To make matters worse, a government spy poisons Jubei, promising him an antidote if he can unravel the true intentions of the Devils of Kimon and their connection to the plague. The trail leads to shadow leaders, a plot to overthrow the government, and a man that Jubei thought he would never see again."
22,1122,31798,Kiznaiver,"Drama, Sci-Fi",TV,12,7.67,197912,"Katsuhira Agata is a quiet and reserved teenage boy whose sense of pain has all but vanished. His friend, Chidori Takashiro, can only faintly remember the days before Katsuhira had undergone this profound change. Now, his muffled and complacent demeanor make Katsuhira a constant target for bullies, who exploit him for egregious sums of money. But their fists only just manage to make him blink, as even emotions are far from his grasp.However, one day Katsuhira, Chidori, and four other teenagers are abducted and forced to join the Kizuna System as official ""Kiznaivers."" Those taking part are connected through pain: if one member is injured, the others will feel an equal amount of agony. These individuals must become the lab rats and scapegoats of an incomplete system designed with world peace in mind. With their fates literally intertwined, the Kiznaivers must expose their true selves to each other, or risk failing much more than just the Kizuna System."
23,1123,8841,Kore wa Zombie Desu ka?,"Action, Comedy, Ecchi, Harem, Magic, Supernatural",TV,12,7.67,295782,"Ayumu Aikawa is a 16-year-old high school student who is tragically murdered while investigating a suspicious house. However, he soon awakens next to a strange armored girl called Eucliwood Hellscythe. She reveals herself to be a necromancer who has revived Ayumu, consequently turning him into a zombie! Now immortal, Ayumu sets out to hunt down his killer. One day, while searching in a cemetery, he encounters a boisterous young girl named Haruna, who is fighting a bear with a chainsaw while dressed as a magical girl. After she kills the beast, Haruna attempts to erase Ayumus memories of her, but he instead absorbs her magic for himself. Stripped of her powers, Haruna now orders Ayumu to take up her role of hunting strange creatures known as ""Megalo,"" monsters that roam the human world and terrorize the population.Kore wa Zombie Desu ka? follows the daily antics of the human-turned-zombie Ayumu as he begins his new, ludicrous life where the supernatural becomes the norm."
24,1124,9396,Mitsudomoe Special,"Comedy, School, Slice of Life",Special,1,7.67,11354,A special unaired episode included in the 7th DVD/Blu-ray volume.
25,1125,11371,New Prince of Tennis,"Action, Comedy, Shounen, Sports",TV,13,7.67,30630,"Ryouma Echizen is one of 50 nationally ranked middle school tennis players to receive an invitation for the Japan U-17 tennis training camp. Previously open only to high school players, the exclusive regiment trains the best players in the country for the upcoming U-17 World Cup. The high schoolers are not pleased that these middle schoolers are allowed into the camp, but the middle schoolers easily overwhelm them before they are halted by the coaches.The rules of the camp are soon explained: the players are split into one of 16 courts based on skill, with the best players occupying Court 1. Players move up and down courts based on ""shuffle matches"" that occur before practice begins each day. In anticipation of a game, the middle schoolers are asked to pair up with one another, only to find out that they would not be playing doubles with their partners. Instead, they are pitted against each other in a tiebreaker-style game. The winner of the match would be allowed to stay to further develop their skills whereas the loser would be sent home.For the sake of tennis, friendships and camaraderie are all put on the line. As the fierce competition between the middle and high schoolers persists, the situations they find themselves in goes deeper than just playing to remain in the camp."
26,1126,32542,Sakamoto desu ga?,"Comedy, School, Seinen",TV,12,7.67,171452,"Sophisticated, suave, sublime; all words which describe the exceedingly handsome and patently perfect Sakamoto. Though it is only his first day in high school, his attractiveness, intelligence, and charm already has the girls swooning and the guys fuming with jealousy. No one seems able to derail him, as all attempts at tripping him up are quickly foiled. His sangfroid is indomitable, his wits peerless. Will any of Sakamotos classmates, or even teachers, be able to reach his level of excellence? Probably not, but they just might learn a thing or two trying..."
27,1127,5306,Tales of Symphonia The Animation: Tethe&#039;alla-hen,"Action, Adventure, Fantasy, Magic, Martial Arts, Shounen",OVA,4,7.67,20355,"The second arc of Tales of Symphonia that takes place in the flourishing world of Tethealla. This OVA takes place up to two-thirds of the game, prior to the Derris-Kharlan arc."
29,1129,177,Tsubasa Chronicle,"Action, Adventure, Fantasy, Magic, Romance, Shounen, Supernatural",TV,26,7.67,134705,"During an excavation at the mysterious ruins in Clow Country, Syaoran discovers his childhood friend Princess Sakura appear on the site with wings that disperse into many feathers. As the feathers disappear to different dimensions, so does Sakuras memory. In attempts to save Sakuras life and restore her memory, Syaoran travels through to another world to find a solution. Theres only one thing left he can do. Travel through to different dimensions to collect Sakuras feathers. Helping out with the quest is Kurogane, an exiled ninja from Japan Country who wishes to return to his world, the runaway magician, Fay, who desires to jump between each world never to return to his own and the white meat-bun shaped creature, Mokona."
30,1130,22729,Aldnoah.Zero,"Action, Mecha, Sci-Fi",TV,12,7.66,244193,"The discovery of a hypergate on the Moon once allowed the human race to teleport to Mars. Those who chose to settle there unearthed a technology far more advanced than that of their home planet, which they named ""Aldnoah."" This discovery led to the founding of the Vers Empire of Mars and a declaration of war against the ""Terrans,"" those who stayed behind on Earth. However, a battle on the moon—later called ""Heavens Fall""—caused the hypergate to explode, destroying the moon and leading the two planets to establish an uneasy ceasefire.Their peace was a fragile one, however. Fifteen years later, high school student Inaho Kaizuka witnesses the plotted assassination of the Vers Empires Princess Asseylum Vers Allusia, who had come to Earth in hopes of repairing the relationship between the empire and its homeland. The ceasefire is shattered, and the Martians declare war on the Terrans once again. In the face of this insurmountable enemy, Inaho and his friends must now fight against the Vers Empire to settle the war once and for all."
31,1131,4835,Bleach Movie 3: Fade to Black - Kimi no Na wo Yobu,"Action, Comedy, Shounen, Super Power, Supernatural",Movie,1,7.66,122373,"After a mysterious pair attack Rukia Kuchiki and erase her memories while she is in Seireitei, Ichigo Kurosaki, a substitute Soul Reaper, briefly forgets Rukia, until he is reminded of her by Kon, an Underpod Mod-Soul. Confused, he seeks his towns candy-shop owner, Kisuke Urahara, who opens the pathway to Seireitei for them. Ichigo is then shocked to find that his allies in Seireitei, the Shinigami of the Soul Society, have forgotten him.Filled with action, Kimi no Na wo Yobu follows Ichigo and Kon as they fight against their former comrades while searching for the missing Rukia and discovering her assailants before they strike again."
32,1132,8888,Code Geass: Boukoku no Akito 1 - Yokuryuu wa Maiorita,"Action, Mecha, Military, Sci-Fi",Movie,1,7.66,91105,"It is the year 2017, and Europe is being invaded by the forces of the Holy Britannian Empire. In an attempt to combat the oppositions overwhelming pressure and put an end to the massive casualties, the army forms a special unit called Wyvern, or W-0, composed of former Japanese citizens referred to as ""Elevens."" Recruited from ghettos, these young men and women pilot Knightmare frames—humanoid war machines—into dangerous operations where death awaits, hoping to make a name for themselves.When a European regiment attempting to recapture a crucial city is pinned down by the enemy, its up to W-0 to bail them out. Among those selected for the rescue operation is Lieutenant Akito Hyuuga, known as ""Hannibals Ghost"" due to his prowess on the battlefield. However, the supposed rescue mission becomes suicidal when, in an attempt to take out as many Britannians as possible, the commanding officer initiates the Knightmares self-destruct sequence. In its aftermath, Akito finds that he is the last one standing…"
33,1133,5348,Detective Conan Magic File 2: Kudou Shinichi - The Case of the Mysterious Wall and the Black Lab,"Adventure, Comedy, Mystery, Police, Shounen",OVA,1,7.66,7726,"Magic File 2 was sold at select retailers (7-11 branded equivalents) in Japan, along with PPV episodes of the show (episodes released long before, such as the NY case). The first disc housed the Movie 12 Side-Story OVA, which features Kudou Shinichi and details a bit of the backstory from the upcoming movie. The second disc was the one with the PPV episodes.(Source: DCTP Forum)"
34,1134,9786,Detective Conan: Conan vs. Kid - Jet Black Sniper,"Adventure, Comedy, Mystery, Police, Shounen",Movie,1,7.66,2119,"3D IMAX movie, shown only at the Suntory Museum in Osaka.The story involves a heist taking place on 15 Aug at the Takaramachi Jewelry Museum where a jewel worth 1 Billion Yen is stolen."
