,Unnamed: 0,anime_id,name,genre,type,episodes,rating,members,synopsis
69,469,29093,Grisaia no Meikyuu: Caprice no Mayu 0,Drama,Special,1,8.05,70039,"Having attended Mihama Academy for about a year, Yuuji Kazami has seemingly found his place within the school, but he suddenly decides to pursue a promotion in CIRS. After consulting JB about his intentions, they both thoroughly examine Yuujis documents and dissect the events of his upbringing to determine if the job is fit for him.Meanwhile, unbeknownst to the two, the girls of Mihama uncover some torn documents in Yuujis room. After restoring the papers, they discover the story that has formed—or perhaps broken—Yuuji into the man he is today. However, what was thought to be history has haunted him to the present, and the chains of the past begin to drag him back into the darkness... "
70,470,427,Kaleido Star,"Comedy, Drama, Fantasy, Shoujo",TV,51,8.05,42253,"The Kaleido Stage is known throughout the world for captivating audiences with its amazing acrobatics, innovative routines, and extravagant costumes and sets. It is a place for guests to believe in magic, and Sora Naegino wants nothing more than to be a part of that magic—by becoming an acrobat for the famed circus herself.To realize her dream, she travels from Japan to California to audition for a place in the group. However, Sora learns that she needs much more than her natural talent to bring joy to the faces in the crowd. She quickly discovers just how difficult it is to be a professional performer where the stakes—and the stunts—are higher and mistakes spell danger! To put on performances worthy of the Kaleido Stage, she will need to endure rigorous training, unconventional assignments, fierce competition, and the antics of a mischievous spirit named Fool.Can Sora reach new heights, make new friends, conquer her fears, and surpass her limits to become a Kaleido Star?"
71,471,4280,Kara no Kyoukai 4: Garan no Dou,"Action, Mystery, Supernatural, Thriller",Movie,1,8.05,103600,"Following the events of Satsujin Kousatsu (Zen), Shiki Ryougi has been in a coma for two years due to a traffic accident. When she finally awakens, she has no memories of her past and is plagued by a profound loneliness. Even stranger, she notices dark lines encompassing the things around her, and if she touches them she can disassemble the object—something which completely terrifies her. Her friend, Mikiya Kokutou, enlists the help of Touko Aozaki, a mage who can help Shiki understand what her eyes—the ""Mystic Eyes of Death Perception""—are truly capable of and how to use them properly.  "
73,473,17549,Non Non Biyori,"Comedy, School, Seinen, Slice of Life",TV,12,8.05,133475,"Hotaru Ichijous lifestyle completely changes when she leaves Tokyo and moves with her family to the isolated Asahigaoka village. Her new school has only five students including herself, all sharing a single classroom regardless of grade level. There are no convenience stores in the area, and it can take up to two hours for a bus to arrive.Nevertheless, Hotaru finds herself captivated by the countrysides charm thanks to her four unique schoolmates with whom she quickly forms a genuine bond. The most colorful of them is Renge Miyauchi, a first-grader who is often perceptive despite her age. However, no less intriguing are the three Koshigaya siblings: the quiet oldest brother Suguru, the petite older sister Komari, and the prankish youngest sister Natsumi.Having someone from the city join their cheerful little group enlivens the ordinary days in Asahigaoka. Not only does Hotaru bring firsthand knowledge from the alluring outside world, but her fresh outlook on life welcomes a blossom of change to their usual routine."
75,475,28,Yakitate!! Japan,"Comedy, Shounen",TV,69,8.05,50876,"While countries such as France, England, and Germany all have their own internationally celebrated bread, Japan simply does not have one that can match in reputation.Thus after discovering the wonders of breadmaking at a young age, Kazuma Azuma embarks on a quest to create Japans own unique national bread. And being blessed with unusually warm hands that allow dough to ferment faster, Azuma is able to bring his baking innovations to another level.As he begins working at the prestigious Japanese bakery chain, Pantasia, Azuma encounters other talented bakers and experiences firsthand the competitive world of baking. Along with his newfound friends and rivals, Azuma strives to create new and unparalleled bread that will start a baking revolution. "
76,476,9513,Beelzebub,"Action, Comedy, Demons, School, Shounen, Supernatural",TV,60,8.04,217752,"Ishiyama High is a school populated entirely by delinquents, where nonstop violence and lawlessness are the norm. However, there is one universally acknowledged rule—dont cross first year student Tatsumi Oga, Ishiyamas most vicious fighter.One day, Oga is by a riverbed when he encounters a man floating down the river. After being retrieved by Oga, the man splits down the middle to reveal a baby, which crawls onto Ogas back and immediately forms an attachment to him. Though he doesnt know it yet, this baby is named Kaiser de Emperana Beelzebub IV, or ""Baby Beel"" for short—the son of the Demon Lord!As if finding the future Lord of the Underworld isnt enough, Oga is also confronted by Hildegard, Beels demon maid. Together they attempt to raise Baby Beel—although surrounded by juvenile delinquents and demonic powers, the two of them may be in for more of a challenge than they can imagine."
77,477,14353,Death Billiards,"Drama, Game, Mystery, Psychological, Thriller",Movie,1,8.04,95690,"Two men have just arrived at a location known as Quindecim and are unable to remember how they got there. They are immediately greeted by a young woman who escorts them to a small bar, where a bartender awaits them. They are told that they will have to participate in a game, randomly chosen by roulette, and will be unable to leave until its completion; if they refuse, the consequences will be dire. In addition to the rules of the game, the two men are told to play as if their lives are at stake.The game that has been chosen is billiards. But theres more to it than just pocketing pool balls, as the two are about to find out the outcome could mean life or death."
78,478,8408,Durarara!! Specials,"Action, Comedy, Supernatural",Special,2,8.04,103105,"Celty Sturluson is tasked to deliver a suspicious red handbag as part of her courier duties—the problem is: it is being sought by several organizations. As she makes her way through Ikebukuro toward the place the bag is supposed to be brought to, she is chased by mysterious men speaking a foreign language, and her package ends up dragging many of the citys residents into the conflict.Subsequently, famous actor Yuuhei Hanejima has just arrived in Ikebukuro as part of a special TV program, searching for the best couple to give them a chance to appear in one of his movies. However, Yuuhei Hanejima is actually a stage name for Kasuka Heiwajima, Shizuos younger brother, and when an anonymous internet user threatens to kill the superstar, this user learns the weight of what that relationship means. Moreover, Shizuo discovers that the one responsible for the attempted attack is the meddlesome pest that he loathes with a burning passion."
79,479,13331,Jormungand: Perfect Order,"Action, Adventure, Seinen",TV,12,8.04,81951,"Still in pursuit of her ambitious goal, ingenious arms dealer Koko Hekmatyar, inexpressive child soldier Jonathan “Jonah” Mar, and the rest of their squad continue their mercenary activities. From professional assassins to private militaries, the groups work constantly puts them in the face of danger. But internal conflicts soon arise after Renato ""R"" Socci, one of Kokos bodyguards, is revealed to be an undercover agent for ""Operation Undershaft""—a plan devised by the CIA to infiltrate HCLI and exploit Koko as a tool. Shocked by his betrayal, Kokos leadership is needed now more than ever to rally her squad and rebuild their foundation of trust before they are torn apart.Jormungand: Perfect Order follows Koko and the rest of her crew as they take on persistent adversaries, overcome internal struggles, and make Kokos vision of world peace a reality—where everything is in perfect order."
80,480,4985,Mahou Shoujo Lyrical Nanoha: The Movie 1st,"Action, Comedy, Drama, Magic, Super Power",Movie,1,8.04,20433,"Nanoha Takamachi, an ordinary third-grader, loves her family and friends more than anything else. One day, after having a strange dream in which a ferret gets injured, she sees the very same ferret in real life and rescues it. That ferret turns out to be Yuuno Scrya, a mage from another world who is trying to capture the 21 scattered Jewel Seeds before they cause serious damage to the universe. Yuuno is not powerful enough to capture the Jewel seeds on his own, so he grants Nanoha the intelligent device ""Raising Heart"" and begins training her as a mage.  Unfortunately, the powerful Jewel Seeds attract those with ill intentions. Another mage, Fate Testarossa, is desperate to collect the seeds for some unknown and sinister purpose, though the solemn look in her eyes makes Nanoha think that there is more to Fate than meets the eye. Mahou Shoujo Lyrical Nanoha: The Movie 1st is a retelling of the original series, which tells the story of two young mages and how their strong emotions shape their actions."
81,481,29803,Overlord,"Action, Adventure, Fantasy, Game, Magic, Supernatural",TV,13,8.04,244268,"The final hour of the popular virtual reality game Yggdrasil has come. However, Momonga, a powerful wizard and master of the dark guild Ainz Ooal Gown, decides to spend his last few moments in the game as the servers begin to shut down. To his surprise, despite the clock having struck midnight, Momonga is still fully conscious as his character and, moreover, the non-player characters appear to have developed personalities of their own!Confronted with this abnormal situation, Momonga commands his loyal servants to help him investigate and take control of this new world, with the hopes of figuring out what has caused this development and if there may be others in the same predicament."
82,482,22,Prince of Tennis,"Action, Comedy, School, Shounen, Sports",TV,178,8.04,87643,"At the request of his father, tennis prodigy Ryouma Echizen has returned from America and is ready to take the Japanese tennis scene by storm. Aiming to become the best tennis player in the country, he enrolls in Seishun Academy—home to one of the best middle school tennis teams in Japan. After Ryouma catches the captains eye, he finds himself playing for a spot on the starting lineup in the intra-school ranking matches despite only being a freshman. Due to his age, the rest of the Seishun Boys Tennis Team are initially reluctant to accept him, but his skill and determination convinces them to let him in.Armed with their new ""super rookie,"" Seishun sets out to claim a spot in the National Tournament, hoping to take the coveted title for themselves. In order to do so, the team must qualify by playing through the Tokyo Prefectural and Kanto Regionals. Yet, the road ahead of them is shared by a plethora of strong schools, each playing tennis in unique ways for their own reasons. Ryouma and his teammates must learn to cooperate if they want to become the champions they aspire to be."
84,484,793,xxxHOLiC Movie: Manatsu no Yoru no Yume,"Comedy, Drama, Mystery, Psychological, Supernatural",Movie,1,8.04,41547,"Summer break has arrived, but while his other classmates are out having fun, Kimihiro Watanuki continues to work as compensation for the eccentric Yuuko in her shop. With the spirits and supernatural phenomena that bother him lessening, he pays his dues by cleaning, cooking, and doing whatever else the apparently lazy Yuuko needs.Watanuki, however, gets involved in a new predicament when Yuuko receives a mysterious invitation to a mansion whose owner seeks Yuukos wish-granting ability. When he, Yuuko, and his classmate Shizuka Doumeki make their way to the peculiar residence, they meet others who were summoned by the same strange invitation. All of them are collectors of various unique items, drawn there by the chance to expand their collections. But as the collectors begin to disappear one by one, Watanuki and his companions must solve the mystery and put the case to rest, or find themselves in risk of danger."
85,485,30279,Yuru Yuri San☆Hai!,"Comedy, School, Shoujo Ai, Slice of Life",TV,12,8.04,44335,"The members of the Amusement Club are back with more of Kyouko Toshinous antics, Chinatsu Yoshikawas schemes, Yui Funamis retorts, and Akari Akazas small social presence as they strive to make each day as fun as the last! Whether the activity is an arm wrestling contest or making pancakes together, the group of entertainment-seekers are sure to give it their all.The club members are often joined by their friends in the Student Council, who know how to have a good time as well. While it can get a little chaotic when all eight girls get together, it sure doesnt stop them from meeting up and having fun!"
86,486,28755,Boruto: Naruto the Movie,"Action, Comedy, Martial Arts, Shounen, Super Power",Movie,1,8.03,74690,"The spirited Boruto Uzumaki, son of Seventh Hokage Naruto, is a skilled ninja who possesses the same brashness and passion his father once had. However, the constant absence of his father, who is busy with his Hokage duties, puts a damper on Borutos fire. Upon learning that his father will watch the aspiring ninjas who will participate in the upcoming Chunin exams, Boruto is driven to prove to him that he is worthy of his attention. In order to do so, he enlists the help of Narutos childhood friend and rival, Sasuke Uchiha. The Chunin exams begin and progress smoothly, until suddenly, the Konohagakure is attacked by a new foe that threatens the long-standing peace of the village. Now facing real danger, Naruto and his comrades must work together to protect the future of their cherished home and defeat the evil that terrorizes their world. As this battle ensues, Boruto comes to realize the struggles his father once experienced—and what it truly means to be a ninja."
87,487,10029,Coquelicot-zaka kara,"Historical, Romance, School, Shoujo",Movie,1,8.03,50689,"Atop a hill overlooking a seaside port sits a boarding house named Coquelicot Manor. Since the building is run by her family, Umi Matsuzaki carries out many of the duties involved in managing the small establishment, such as preparing meals for her fellow boarders. When she isnt at home, she is a student at the local high school—one that is currently dealing with a small crisis.In anticipation of the upcoming Olympic Games, a beloved old clubhouse is set to be demolished to make way for a modern building. As a result, a large part of the student body has banded together, working tirelessly to prevent this from happening. Umi finds herself helping the newspaper club to spread information about this cause where she befriends Shun Kazama, whom she gradually begins to fall in love with. But Shun is an orphan who doesnt know much about his origins, and when the two begin searching for clues to the boys past, they discover that they may have a lot more in common than either of them could have thought.[Writtten by MAL Rewrite]"
89,489,790,Ergo Proxy,"Mystery, Psychological, Sci-Fi",TV,23,8.03,265005,"Within the domed city of Romdo lies one of the last human civilizations on Earth. Thousands of years ago, a global ecological catastrophe doomed the planet; now, life outside these domes is virtually impossible. To expedite mankinds recovery, ""AutoReivs,"" humanoid-like robots, have been created to assist people in their day-to-day lives. However, AutoReivs have begun contracting an enigmatic disease called the ""Cogito Virus"" which grants them self-awareness. Re-l Mayer, granddaughter of Romdos ruler, is assigned to investigate this phenomenon alongside her AutoReiv partner Iggy. But what begins as a routine investigation quickly spirals into a conspiracy as Re-l is confronted by humanitys darkest sins.Elsewhere in Romdo, an AutoReiv specialist by the name of Vincent Law must also face his demons when surreal events begin occurring around him. Re-l, Iggy, Vincent, and the child AutoReiv named Pino, will form an unlikely faction as they struggle to uncover Romdos mysteries and ultimately, discover the true purpose of the mythical beings called ""Proxies."""
90,490,9289,Hanasaku Iroha,"Comedy, Drama, Seinen, Slice of Life",TV,26,8.03,150393,"Ohana Matsumae is an energetic and wild teenager residing in Tokyo with her carefree single mother. Abruptly, her mother decides to run away with her new boyfriend from debt collectors, forcing the young girl to fend for herself—as per her mothers ""rely only on yourself"" philosophy—in rural Japan, where her cold grandmother runs a small inn. Driven to adapt to the tranquil lifestyle of the countryside, Ohana experiences and deals with the challenges of working as a maid, as well as meeting and making friends with enthralling people at her new school and the inn."
91,491,15809,Hataraku Maou-sama!,"Comedy, Demons, Fantasy, Romance, Shounen",TV,13,8.03,409037,"Striking fear into the hearts of mortals, the Demon Lord Satan begins to conquer the land of Ente Isla with his vast demon armies. However, while embarking on this brutal quest to take over the continent, his efforts are foiled by the hero Emilia, forcing Satan to make his swift retreat through a dimensional portal only to land in the human world. Along with his loyal general Alsiel, the demon finds himself stranded in modern-day Tokyo and vows to return and complete his subjugation of Ente Isla—that is, if they can find a way back!Powerless in a world without magic, Satan assumes the guise of a human named Sadao Maou and begins working at MgRonalds—a local fast-food restaurant—to make ends meet. He soon realizes that his goal of conquering Ente Isla is just not enough as he grows determined to climb the corporate ladder and become the ruler of Earth, one satisfied customer at a time!Whether its part-time work, household chores, or simply trying to pay the rent on time, Hataraku Maou-sama! presents a hilarious view of the most mundane aspects of everyday life, all through the eyes of a hapless demon lord."
92,492,27989,Hibike! Euphonium,"Drama, Music, School",TV,13,8.03,134694,"Now that Kumiko Oumae has enrolled in Kitauji High School, she hopes to forget about her past. Despite her desire for a fresh start, she gets dragged into the schools band club by her new friends—Sapphire Kawashima and Hazuki Katou—and is once again stuck playing the euphonium. As the band currently stands, they wont be able to participate in the local festival, Sunfest, let alone compete at a national level. The bands new advisor, Noboru Taki, gives them a choice: they can relax and have fun, or practice hard and attempt to get into nationals. Not wanting to repeat her mistakes from middle school, Kumiko is doubtful as to whether they should try for nationals. Amidst the chaos, she learns that her old bandmate, Reina Kousaka (who she had a bitter relationship with) has joined Kitaujis band club. Under the pressure of Noborus strict training, Kumiko and her bandmates must learn to overcome their struggles and find success together."
93,493,5630,Higashi no Eden,"Action, Comedy, Drama, Mystery, Romance, Sci-Fi, Thriller",TV,11,8.03,276593,"On November 22, 2010, Japan was hit by missile strikes, a terrorist act that fortunately did not harm anyone, becoming known as ""Careless Monday."" Quickly forgotten, society goes on about their lives as normal.During her graduation trip to America three months later, friendly college student Saki Morimis life is forever changed when she finds herself saved from unexpected trouble by Akira Takizawa. Takizawa is cheerful, but odd in many ways—he is stark naked and suffers from amnesia, believing himself to be a terrorist. In addition, he possesses a strange cell phone loaded with 8.2 billion yen in digital cash.Despite Takizawas suspicious traits, Saki quickly befriends the enigmatic young man. However, unbeknownst to her, this is the beginning of a thrilling death game involving money, cell phones, and the salvation of the world. Higashi no Eden chronicles Sakis struggle to unravel the mysteries behind her savior, while Takizawa himself battles other individuals armed with similar cell phones and returning memories which reveal his possible connection to the event from months ago."
95,495,30831,Kono Subarashii Sekai ni Shukufuku wo!,"Adventure, Comedy, Fantasy, Supernatural",TV,10,8.03,244877,"After dying a laughable and pathetic death on his way back from buying a game, high school student and recluse Kazuma Satou finds himself sitting before a beautiful but obnoxious goddess named Aqua. She provides the NEET with two options: continue on to heaven or reincarnate in every gamers dream—a real fantasy world! Choosing to start a new life, Kazuma is quickly tasked with defeating a Demon King who is terrorizing villages. But before he goes, he can choose one item of any kind to aid him in his quest, and the future hero selects Aqua. But Kazuma has made a grave mistake—Aqua is completely useless!Unfortunately, their troubles dont end here; it turns out that living in such a world is far different from how it plays out in a game. Instead of going on a thrilling adventure, the duo must first work to pay for their living expenses. Indeed, their misfortunes have only just begun!"
96,496,416,Kurenai no Buta,"Action, Adventure, Comedy, Drama, Historical, Military, Romance",Movie,1,8.03,74028,"After a curse turned him into a pig, World War I ace Marco Pagot becomes Porco Rosso, a mysterious bounty hunter who takes down sky pirates in the Adriatic Sea. He whiles away his days on a secluded island, rarely leaving other than to collect bounties or to visit the beautiful Gina, a songstress and owner of the Hotel Adriano.One day, while traveling to fix his faulty engine, Porco Rosso is gunned down by a young American hotshot named Donald Curtis. Thrilled at the possibility of fame, Donald boldly declares that the flying pig is dead. Not wanting to disappoint Gina, Porco Rosso flees to the famous Piccolo S.P.A. airplane company and takes out a massive loan in order to repair and improve his fighter plane. There, he is surprised to find that the chief engineer of Piccolo S.P.A. is the 17-year-old Fio Piccolo, who hungers for a chance to prove herself. With Fios improvements, Porco Rosso prepares to challenge Donald officially and regain his honor."
97,497,85,Mobile Suit Zeta Gundam,"Drama, Mecha, Military, Sci-Fi, Space",TV,50,8.03,28959,"It is Universal Century 0087, and the One Year War between the Earth Federation and Principality of Zeon is over. The Earth Federation has created an elite task force, known as the Titans, who are responsible for hunting the remaining Zeon forces. However, the power-hungry Titans have shown themselves to be no better than Zeon, spurring the creation of a rebellious faction called the Anti-Earth Union Group (AEUG).17-year-old Kamille Bidan lives in the colony Green Noa, home to a Titan base. Kamille gets in trouble after assaulting a Titan officer, an event that coincides with an attack led by former Zeon ace Char Aznable, now known as AEUG pilot Quattro Bajeena. When Kamille steals a Titans prototype Gundam, he soon finds himself in the middle of the dangerous conflict."
98,498,30240,Prison School,"Comedy, Ecchi, Romance, School, Seinen",TV,12,8.03,227734,"Located on the outskirts of Tokyo, Hachimitsu Private Academy is a prestigious all-girls boarding school, famous for its high-quality education and disciplined students. However, this is all about to change due to the revision of the schools most iconic policy, as boys are now able to enroll as well.At the start of the first semester under this new decree, a mere five boys have been accepted, effectively splitting the student body into a ratio of two hundred girls to one boy. Kiyoshi, Gakuto, Shingo, Andre, and Jo are quickly cast away without having a chance to make any kind of a first impression. Unable to communicate with their fellow female students, the eager boys set their sights on a far more dangerous task: peeping into the girls bath!Its only after their plan is thoroughly decimated by the infamous Underground Student Council that the motley crew find their freedom abruptly taken from them, as they are thrown into the schools prison with the sentence of an entire month as punishment. Thus begins the tale of the boys harsh lives in Prison School, a righteous struggle that will ultimately test the bonds of friendship and perverted brotherhood."
