,Unnamed: 0,anime_id,name,genre,type,episodes,rating,members,synopsis
0,3800,3326,Inaka Isha,"Dementia, Drama, Historical, Psychological",Movie,1,6.88,10030,"A hapless country doctor describes with breathless urgency a night-time summons to attend a young patient. Events soon take on a surreal aspect as ""unearthly horses"" transport him instantaneously to the bedside. The doctor, preoccupied with personal distractions and grievances against those he is employed to care for, fails to find what is revealed to be a vile, fatal wound. He is humiliated by the villagers, who are ""always expecting the impossible from the doctor,"" and doomed to an endless return trip, losing everything. (Source: ANN)"
1,3801,12963,Jewelpet Kira☆Deco!,"Fantasy, Magic, Shoujo",TV,52,6.88,1452,"In the Legends of Jewel Land, the Jewelpets were born from the love and caring of their queen, Jewelina. However a strange meteor crashes into the Mirror Ball, destroying it into a million pieces and its fragments called ""Deco Stones"" were all scattered in Jewel Land. In the present time, Ruby, a dimwitted Rabbit Jewelpet and owner of the Kira Kira Shop, has a thing on sparkly decorations and loves to collect anything that sparkles and shines. However, when she and the others learn about the legend of the Mirror Ball and the Deco Stones, they all decided to go and search for them, until they all meet 5 strange individuals called the KiraDeco 5. The group also has the same goal on wanting to collect the Deco Stones and they befriended the Jewelpets, especially to one of their members: Pink Oomiya. Now, the group need to gather all the Deco Stones and stop the Eternal Darkness from taking over the human world. (Source: ANN) "
2,3802,6297,Kamen Rider Den-O: Imagin Anime 2,"Action, Adventure, Comedy, Kids, Super Power",OVA,12,6.88,472,New 12-episode OVA series featuring the Imagin stars of the popular 2007 Kamen Rider Den-O live action tv series.
3,3803,10098,Kobato.: Hajimete no Kobato.,"Comedy, Drama, Fantasy",Special,8,6.88,6001,"Mini Flash anime from the limited-edition DVDs volumes (episodes 1-6) and Blu-ray Box (episodes 1-8, of which 7 and 8 were new additions to the Blu-ray box)."
4,3804,4262,Koihime†Musou,"Action, Adventure, Fantasy, Historical, Martial Arts",TV,12,6.88,32176,"After witnessing the death of her family at the hands of bandits, Unchou Kanu has devoted her life to protecting the innocent by exterminating any group of bandits she comes across. Over time, Kanus deeds become famous throughout the land—even if she herself remains unknown. During her travels, she runs across a young girl, Chouhi Yokutoku, whose parents suffered a similar fate as Kanus. Finding companionship through their similar pasts, the two girls take a vow of sisterhood and continue to wander the land, determined to bring peace to wherever their journey takes them.During Kanu and Chouhis journey, they meet and travel with several people who are sympathetic to their cause, such as the noble Chouun Shiryuu, the headstrong Bachou Mouki, and the calculating Shokatsuryou Koumei. From problems with local lords to groups of ravaging bandits, Kanu and her friends do what they can to make life a little easier for those in need, wherever they may be."
5,3805,2695,Mobile Suit Gundam 0083: The Fading Light of Zeon,"Action, Adventure, Mecha, Sci-Fi, Space",Movie,1,6.88,4759,"U.C. 0083 - Three years after the end of the catastrophic One Year War, peace on Earth and the colonies is shattered by the presence of the Delaz Fleet, a rogue Zeon military group loyal to the ideals of the late dictator Gihren Zabi. Delaz Fleet`s ace pilot Anavel Gato, once hailed as ""The Nightmare of Solomon"", infiltrates the Federation`s Torrington base in Australia and steals the nuclear-armed Gundam GP02A ""Physalis"" prototype. Rookie pilot Kou Uraki - with the aid of Anaheim Electronics engineer Nina Purpleton and the crew of the carrier Albion - pilots the Gundam GP01 ""Zephyranthes"" prototype in an attempt to recover the stolen Gundam unit and prevent another war from breaking out. (Source: AniDB)"
6,3806,1243,Night Head Genesis,"Drama, Horror, Mystery, Psychological, Supernatural",TV,24,6.88,20856,"Following a 15-year long seclusion in a research facility, brothers Naoto and Naoya Kirihara finally escape after the psychic barrier separating them from the outside world collapses. Abandoned by their parents, who feared their supernatural powers, the siblings now strive for a normal life. However, the two are soon forced to use their talents to save lives as the ""minus energy"" begins to engulf the world and crimes involving psychic abilities gradually multiply.  Learning to control their capabilities and using them for the sake of others will prove challenging, for Naoya is traumatized by his psychic abilities that allow him to read peoples minds; while Naoto has hurt many close ones due to his unstable psychokinetic powers. With the help of the mysterious Shouko Futami, who can see into the future, the Kirihara brothers must find a way to foil the plans of an organization that seems to be linked to the harmful events related to gifted individuals."
7,3807,28819,Okusama ga Seitokaichou!,"Comedy, Ecchi, Romance, School, Shounen",TV,12,6.88,91241,"Hayato Izumi is running for student council president. Hes studious, responsible, down to earth...and completely outmatched by his rival, Ui Wakana. Ui wins in a landslide after promising comprehensive sex education, free condoms, and other exciting reforms. Bloodied but not discouraged, Hayato licks his wounds and settles for vice president.Then Ui moves in with him. As it turns out, their parents made a drunken promise decades ago that their children would one day marry. Ui and Hayato must now balance school life with matrimony, keeping their relationship secret from a prudish student body and learning to live with each other. Can they keep the student council in line and find happiness together? Find out in Okusama ga Seitokaichou!"
8,3808,31980,Okusama ga Seitokaichou! OVA,"Comedy, Ecchi, Romance, Shounen",OVA,1,6.88,13602,Bundled with the limited edition ninth manga volume.
9,3809,9922,Oretachi ni Tsubasa wa Nai: Under the Innocent Sky.,"Comedy, Drama, Ecchi, Harem, Romance",TV,12,6.88,52687,"Haneda Takashi has a secret he cannot speak of. To leave his dull school-life, he was supposed to have escaped to another world. However, he is reeled in by certain ties on his heart. One of these is Kobato, his awkward younger sister. The other is Watarai Asuka, his negligent girlfriend.Chitose Shuusuke is a poor freeloader. He passes his days working at various part-time jobs. One day, he has a disastrous first encounter with Tamaizumi Hiyoko. The next time they meet, Shuusuke discovers that they are fellow employees at his part-time job.Narita Hayato sees himself as a ""hard-boiled"" person. Back-breaking jobs are nothing to him. Hayato shuns normal human contact, but, during the nights, he would get together with delinquents and other denizens of the night. One such night, he meets the cheerful and oblivious Otori Naru.The relationships with these girls will greatly affect these 3 young men. But what, exactly, is the relationship these young men have with each other?(Source: AnimeNFO)"
10,3810,1035,Patalliro Saiyuuki!,"Adventure, Comedy, Fantasy, Shoujo, Shounen Ai",TV,26,6.88,1996,"Genjou Sanzou is a Buddhist monk who has been sent by the Emperor on a journey to find the sacred Buddhist scriptures. One day, Sanzou meets an Earth Deity who tells him that Buddha has sent him a disciple: the mischievous Monkey Deity Son Goku, who was sealed inside of a mountain for five hundred years after wreaking havoc in Heaven! Together with the alcohol-loving playboy Cho Hakkai; the heavenly army General Sagojyou; and their horse, the Dragon Crown Prince Ryuuba; there are plenty of adventures to be had from fighting off monsters to bishounen contests.(Source: ANN and AniDB)"
11,3811,6275,Pokemon Fushigi no Dungeon: Sora no Tankentai - Toki to Yami wo Meguru Saigo no Bouken,"Adventure, Fantasy, Kids",Special,1,6.88,5719,"In a world where Pokémon live and communicate with each other, there are mythical treasures known as the Time Gears that regulate the flow of time in their respective areas. If one is removed from its resting place, time will freeze in that area, so even evil Pokémon do not dare to steal them. But recently, anomalies in time have been appearing throughout the land, causing the appearance of Mystery Dungeons and violent Pokémon. Pokémon exploration teams have been formed to explore these Mystery Dungeons, arrest the violent Pokémon, and help maintain the peace.It turns out that the anomalies in time have not been caused by the recent disappearance of the Time Gears, but by Temporal Tower slowly falling apart and Dialga corrupting into Dark Dialga. The newly infamous thief Juptile had stolen the Time Gears in order to take them to Temporal Tower and stop its deterioration. The Pokémon exploration team Team Pokédans—which consists of Hikozaru and a once-human Pochama—must team up with Juptile to go to the Phantom Land where Temporal Tower is located. If the trio fails, Temporal Tower will completely collapse, leaving the whole world frozen in time forever..."
12,3812,10933,R-15 OVA,"Adventure, Comedy, Ecchi, Harem, Parody, Romance",OVA,1,6.88,12334,"According to Kadokawa, an OVA of R-15 will be bundled with the tenth volume of the novel."
13,3813,13727,Rinne no Lagrange: Kamogawa Days,"Comedy, School, Sci-Fi, Slice of Life",OVA,1,6.88,5793,"As Yoko has her assistant scour the seabed in search of something, Madoka, unable to pilot Midori properly again, returns to Kamogawa to see the New Year in. Upon returning home, Madoka receives New Years letters from Lan and Muginami, updating her about whats going on in their lives, to which Madoka makes a prompt reply. As the months pass by and Madoka moves up a year in school, Lan and Muginami visit an intergalactic replica of Kamogawa on the tourist planet Polyhedron.Takes place between seasons 1 and 2.(Source: Wikipedia)"
14,3814,32151,Senki Zesshou Symphogear GX: Believe in Justice and Hold a Determination to Fist. Specials,"Action, Music, Sci-Fi",Special,4,6.88,1363,Original short episodes featuring characters in super-deformed style.
15,3815,21879,Sword Art Online: Sword Art Offline - Extra Edition,Comedy,Special,1,6.88,27380,Extra episode of Sword Art Offline included in the Sword Art Online: Extra Edition Blu-ray and DVD.
16,3816,26395,Teekyuu 4,"Comedy, Shounen, Sports",TV,12,6.88,10094,Fourth season of Teekyuu series.
17,3817,28835,Tesagure! Bukatsumono Spin-off Purupurun Sharumu to Asobou,"Parody, School, Slice of Life",TV,12,6.88,2007,A spin-off of the Tesagure! Bukatsumono series.
18,3818,688,Uta Kata,"Drama, Magic",TV,12,6.88,16688,"Its the last day of the school term in Kamakura Girls School, and summer is about to begin. Serious but polite 14-year-old Ichika Tachibana is excited to make her summer vacation with her friends a special break to remember! But little does Ichika know that this summer will be more special than she could have ever imagined.While cleaning in an unused school building, Ichika notices an image of an unfamiliar girl in place of her own reflection in a large mirror. Convinced by her friends that she was just seeing things, she is surprised to see the girl in the mirror later that day, holding her lost cell phone. Introducing herself as Manatsu Kuroki, she comes out of the mirror and hands Ichikas phone back—and to Ichikas surprise, the stones on her cell phone charm have changed colors and now allow her to borrow the power of the 12 Djinn that watch over the world.Uta Kata is a tale of a young girl who will realize new things through her interactions with these spirits. As the Djinn show her overwhelming sights, they will soon also bring to her overwhelming thoughts..."
19,3819,6166,Asobi ni Iku yo!,"Comedy, Ecchi, Harem, Romance, Sci-Fi",TV,12,6.87,95005,"Kio is just another boring, nice guy with a boring, nice life until he meets a beautiful, curvaceous cat-girl while attending a memorial service for one of his ancestors. Next thing he knows, hes lying in bed with this half-naked beauty next to him! Her name is Eris, and she has come to Earth to learn more about its inhabitants as a representative of the planet Catian. And shes decided to set up shop at Kios home for her stay on Earth!Unbeknownst to Kio, there are quite a few organizations who will attempt to capture Eris, looking to keep her existence a secret by any means necessary. Whats worse is when people around Kio turn out to secretly be a part of those organizations! Kio will have to work hard to keep Eris safe from these shady groups. Things are about to get mysterious, exciting, and most importantly sexy in Asobi ni Iku yo!"
20,3820,8648,Break Blade Picture Drama,"Comedy, Fantasy",Special,6,6.87,4712,DVD/BD extra.
21,3821,31147,Concrete Revolutio: Choujin Gensou,"Action, Demons, Drama, Fantasy, Mystery, Sci-Fi, Super Power, Supernatural",TV,13,6.87,46938,"On a sunny July day in the 41st year of the Shinka Era, Jirou Hitoyoshi is tasked with covertly listening in on a secret meeting between a top government scientist and an industrial spy. However, his cover is blown, and the spy reveals himself to be an alien in disguise. Amidst the ensuing chaos, Jirou enlists the aid of cafe waitress and magical girl Kikko Hoshino, one of many ""superhumans"" who blend into society and secretly protect humanity from extraterrestrial threats. As a member of the government agency known as the Super Population Research Laboratory, Jirou has the dual task of protecting superhumans that defend humanity and disposing of any deemed too dangerous to live. Having proven herself a worthy ally, Kikko is invited to join the agency as its newest recruit.Fast forward five years: disapproval and distaste for superhumans are now commonplace in Tokyo. From government corruption and conflicting ideas of justice, to the morality of superhuman rights, the relationship between humans and the supernatural minority balances precariously in a world pervaded by whispers of unrest and unease. Under mysterious circumstances, Jirou has betrayed the agency, and is now a fugitive on the run. As he skulks through the rainy back alleys of Shinjuku, he is pursued by the very same superhumans that he himself once recruited."
22,3822,16355,Dansai Bunri no Crime Edge,"Action, Fantasy, Romance, Seinen",TV,13,6.87,60465,"Kiri Haimura has an obsession with beautiful hair—specifically, cutting it. This bizarre trait is what leads him to seek out a rumored long-haired ghost who lives in an abandoned house on a hill. However, he finds not a ghost, but a beautiful girl with long flowing hair named Iwai Mushanokouji, the ""Hair Queen,"" whose hair cannot be cut due to a family curse.Iwai explains that there is a death game surrounding her, and that if she is killed by a cursed object, aptly named a ""Killing Good,"" the wielder gets their wish granted. After protecting Iwai from ""Authors""—Killing Goods users—he learns there is in fact a Killing Good passed down in his own family: a pair of scissors used by his ancestor to commit murders. Naming the scissors ""The Severing Crime Edge,"" he finds that he is able to cut Iwais cursed hair with them, setting her free to live a normal life. However, many Authors seek to kill the Hair Queen, and Kiri will have to protect her in this lethal game of fate."
23,3823,5802,Fantascope: Tylostoma,"Fantasy, Supernatural",OVA,1,6.87,1575,"A man who appears every 700 years.Streaching before the mans eyes the world rusted away to monochrome and gray.Once before the town flourished that is now in ruins.The man now, has a chance meeting with a person, a prositute.A story of passion curling like smoke....Tairosu Tomahs story has begun.(Source: Animenfo)"
24,3824,22513,Freely Tomorrow,Music,Music,1,6.87,1199,"This is part of the album ""Mitchie M feat. Hatsune Miku - Greatest Idol""The Music Video premiered at Vocaloid Cinema Party 2012."
25,3825,32415,Garo: Honoo no Kokuin - Home,"Action, Demons, Fantasy, Magic, Supernatural",Special,1,6.88,2139,"Unaired episode included in the eighth Blu-ray and DVD volume.Ema visits Tinas house after a long time. While singing and spinning yarn, Tina and the children spend a peaceful time together. They reminiscence about Tinas foster mother, Natoria, who had the power to spin the yarn which once carried magic power. And now to the spinning wheel she used and left behind approaches an ominous shadow...(Source: Official Twitter)"
26,3826,4486,Getter Robo G,"Action, Mecha, Sci-Fi, Shounen",TV,39,6.87,1088,"Takes place after the final defeat of the Dinosaur Empire and the death of Musashi Tomoe in the original Getter Robo series.Dr. Saotome, creator of Getter Robo, fears that the peace the Getter Robo team has won will be short lived and that an even greater enemies would appear. Dr. Saotomes fears are justified when the militaristic Hyakki (or ""Hundred demons"") Empire appears, but Dr. Saotome is prepared with the creation of an even more powerful Getter Robo, Getter Robo G and a new Getter Robo base. Also with Musashi Tomoe dead, Dr. Saotome needs a third pilot which he finds in baseball player Benkei Kuruma.(Source: Wikipedia)"
27,3827,3602,Ginga Tetsudou 999: Eternal Fantasy,"Action, Drama, Sci-Fi, Space",Movie,1,6.87,1896,"Based on the story by manga master Leiji Matsumoto (The Cockpit, Queen Emeraldas), the 55 minute featurette picks up one year after the events of Galaxy Express 999 in which a young boy named Tetsuro and his motherly companion Maetel worked to rid the universe on the Mechanized Empire who had taken over Earth.(Source: AniDB)"
28,3828,646,Haunted Junction,"Comedy, Shounen, Supernatural",TV,12,6.87,2504,"Saito High is a high school with its spiritual beings and a principal whose hobby is collecting occult paraphernalia. The school has the prophecy-chosen members of the Holy Student Council to protect it. These students have problems of their own; Haruto Houjo, the president, has a way of summoning spirits, and would resign from his duty for a normal life if it werent for the principal. Kazumi Ryodo, the next member, is good at being possessed and has something for the Hanako. The last member is Mutsuki Asahina, who is a master of exorcism and is attracted to small boys. Unfortunately, these three are in charge of keeping the school in line and defending the world from supernatural beings, and this mission brings them through wacky predicaments.(Source: ANN)"
29,3829,1082,Hikari to Mizu no Daphne,"Comedy, Drama, Mystery, Police, Psychological, Sci-Fi",TV,24,6.87,8876,"In the future, water has covered much of the Earth due to the effects of global warming. The orphaned Maia Mizuki, 15, just graduated from middle school and has already applied for employment in the elite paramilitary Ocean Agency, part of the futuristic world government. Only the best, most intelligent, and physically fit students are eligible for admission. Maia, the series protagonist, is set to become one of the few.But her ideal life quickly falls apart. To her disappointment, Maia unexpectedly fails her entrance exams. Making matters worse, she promptly gets evicted from her house, pick pocketed, taken hostage, then shot. She is ""saved"" by two women (Rena and Shizuka) that are part of an unorthodox help-for-hire organization called Nereids (inspired by the Greek mythological Nereids ). With nowhere to go, Maia joins up with Nereids, taking jobs from capturing wanted criminals to chasing stray cats, often with unexpected results. Gloria and Yu later join up with Nereids.""Daphne"" in the title refers to a subplot that starts midway into the series and eventually become important to Maia. ""Brilliant Blue"" refers to the fact that this is a world covered by water with almost no land. The world consists of vast oceans, a few islands, and floating cities.(Source: Wikipedia)"
30,3830,9957,Hoshizora no Violin,"Historical, Slice of Life",Movie,1,6.87,482,The story is about a boy and his dream of making the best violin.
31,3831,2598,Juusenki L-Gaim,"Action, Adventure, Drama, Mecha, Sci-Fi, Shounen, Space",TV,54,6.87,2211,"In the year 3990, the immortal Oldna Poseidal rules Pentagona, a war-torn solar system of five planets. Daba Myroad is a survivor of the Yaman Clan, just one of numerous native societies nearly wiped out by the tyrant. Living on the remote planet Koam with his friend Mirao Kyao, Daba possesses L-Gaim, a humanoid mecha known commonly as a ""Heavy Metal"" and the last known relic of the Yaman Clan. The pair befriend Fanneria Amu, an aspiring actress, and Lilith Fau, the last surviving fairy in Pentagona while on the run from a band of thieves attempting to steal L-Gaim.Daba promises to fulfill the dying wish of one of the thieves hunting him—an honorable act that leads him to the powerful merchant Amandara Kamandara. With their mission in sight, the ragtag group will face powerful adversaries and become entangled in a rebellion against Poseidals reign."
32,3832,7148,Ladies versus Butlers!,"Comedy, Ecchi, Harem, Romance, School, Seinen",TV,12,6.87,94820,"Hino Akiharu lost his parents when he was small and was adopted into his uncles family. He didnt want to be a burden on his uncles family and decides to enter a free boarding school as a butler, Hakureiryou high school. However, his delinquent boy-like appearance frightens the girls, who make up the majority of the students. Unable to get along with the classmates, Akiharu meets his childhood crush Saikyou Tomomi. "
33,3833,21235,Log Horizon Recap,"Action, Adventure, Fantasy, Magic, Shounen",Special,1,6.87,10245,"Recap of the first six episodes of Log Horizon, aired between episode 6-7."
34,3834,25897,Love Live! School Idol Project: μ&#039;s →NEXT LoveLive! 2014 - Endless Parade Makuai Drama,Comedy,Special,3,6.87,5282,"Bonus included in a Blu-ray/DVD disc of μs live concert that took place in Saitama Super Arena on February 8th and 9th, 2014."
35,3835,273,Mahoutsukai ni Taisetsu na Koto,"Drama, Magic, Shounen, Slice of Life",TV,12,6.87,15152,"Yume Kikuchi, a girl who can use magic, goes to Tokyo to be an apprentice mage to the handsome Masami Oyamada (a professional mage). In Tokyo, Yume learns about magic, helping people, and various other things on her way to being a mage. But she soon also finds out that even just magic alone isnt enough to make someone truly happy...(Source: ANN)"
36,3836,24371,Mobile Suit Gundam Unicorn: Episode EX - 100 Years of Solitude,"Drama, Mecha, Military",Special,1,6.87,2078,"Recap of Mobile Suit Gundam, Mobile Suit Zeta Gundam, Mobile Suit Gundam ZZ and Mobile Suit Gundam: Chars Counterattack focusing on Newtype and Zeonism ideals told before UC episode 7.Included as a bonus on a Volume 7 Blu-ray release of the Mobile Suit Gundam Unicorn OVA."
37,3837,3618,Moyashimon: Kin Gekijou Deluxe,Comedy,Special,4,6.87,4783,"Five-minute shorts expanding on the ""Microbe Theatre"" segments of Moyashimon released as bonus episodes on the limited-edition packages of Moyashimons DVD release."
38,3838,1074,Naruto Narutimate Hero 3: Tsuini Gekitotsu! Jounin vs. Genin!! Musabetsu Dairansen taikai Kaisai!!,"Adventure, Comedy, Game, Shounen",OVA,1,6.87,45188,"Konohagakure hosts a special tournament for ninjas of all ranks, stirring up fervor among the rookies who are eager to prove themselves in a competition against their superiors. Additionally, the winner is granted the opportunity to create their own village decree! Despite his enthusiasm to claim the prize, Naruto Uzumaki fails to focus on the games objective as he becomes obsessed with confronting his teacher, Kakashi Hatake, in single combat."
39,3839,466,One Piece: Taose! Kaizoku Ganzack,"Action, Adventure, Comedy, Fantasy, Shounen, Super Power",OVA,1,6.87,17240,"While Luffy and his crew of Zoro and Nami are starving on their small boat, they are attacked by a large monster. Nami is taken away, while Luffy and Zoro wash up on shore. There they meet a young girl, Medaka, and learn of the sad history of the island. The evil Pirate Ganzack has taken away all the men in the village and enslaved them, including Medakas father. Now Luffy, Zoro, and Medaka must infiltrate Ganzacks base in order to rescue the villagers and Nami. (Source: ANN)"
40,3840,19099,Pokemon: Mewtwo - Kakusei e no Prologue,"Adventure, Fantasy, Kids",Special,1,6.87,4146,"The original story is set before Mewtwo meets Satoshi and his friends in the upcoming films storyline.It will focus on Mewtwos history, goals, and how it became the strongest Pokémon."
41,3841,6560,Popee the Performer,"Comedy, Dementia",TV,39,6.87,1565,"Somewhere in the desert lies the Wolf Zirkus: a strange circus where Popee, a clown in a pink rabbit jumpsuit, shares the stage with Kedamono, a purple creature who wears a mask. Together, they juggle the whims of performing, practicing their acts, and poking fun at each other. In a world where anything seems possible, there is no telling what will happen next during this eccentric spectacle."
