,Unnamed: 0,anime_id,name,genre,type,episodes,rating,members,synopsis
3,12203,730,Houkago no Shokuinshitsu,"Drama, Romance, Yaoi",OVA,2,5.23,4550,"Fresh out of college, Kawase Mitsuro is eager to start his new job as a middle school art teacher. Upon his arrival, he quickly blends in with the masses of girls ogling the toned body of senior teacher Kazama Toshiaki. Kazama ignores the schoolgirls. However, Kazama realizes something is different about Kawase and decides to ask the latter out to dinner. Unconvinced his advances are serious, Kawase goes along with Kazama halfheartedly. When Kazamas true feelings are revealed, will Kawase embrace his potential lover or give in to the expectations of society?"
9,12209,5391,Pico to Chico,"Hentai, Yaoi",OVA,1,5.19,29463,"The crisp rays of summer sun find the effeminate Pico embroiled in yet another heated and lustful fling. While out biking, Pico meets and befriends Chico—a lively boy not much younger than him, but leagues behind in the affairs of the flesh. After the innocent Chico shows his sister in the midst of self-pleasure to Pico, Pico takes it upon himself to educate this confused youth."
13,12213,4866,Pico x CoCo x Chico,"Hentai, Yaoi",OVA,1,5.16,27411,"The young couple Pico and Chico are out for a date in town when a chance encounter has them immediately seduced by the mysterious runaway named CoCo. Pico is instantly drawn in by CoCos spiritual outlook and feminine charms, but little does he know that the swaying of his heart will fuel the sparks of jealousy, passion, and desperation between the trio, ready to engulf them in an inferno of arousal and anxiety at any moment. Two may be company, but is three really a crowd?"
17,12217,1639,Boku no Pico,"Hentai, Yaoi",OVA,1,5.13,57355,"Upbeat and effeminate Pico is working at his grandfathers coffee shop, Café Bebe, for the summer. Tamotsu is a white-collar worker looking for an escape from the mundanity of his everyday life. When they meet at the café, sparks of love and lust quickly draw the two together. Conventional notions of age, gender, and sexuality are broken down as the pair seeks carnal gratification in one anothers company. But do the pleasures of flesh equate to a connection between hearts?"
52,12252,34382,Citrus,"Drama, Romance, School, Yuri",,Unknown,,2459,"During the summer of her freshman year of high school, Yuzu Aiharas mother remarried, forcing her to transfer to a new school. To a fashionable socialite like Yuzu, this inconvenient event is just another opportunity to make new friends, fall in love, and finally experience a first kiss. Unfortunately, Yuzus dreams and style do not conform with her new ultrastrict, all-girls school, filled with obedient shut-ins and overachieving grade-skippers. Her gaudy appearance manages to grab the attention of Mei Aihara, the beautiful and imposing student council president, who immediately proceeds to sensually caress Yuzus body in an effort to confiscate her cellphone.Thoroughly exhausted from her first day, Yuzu arrives home and discovers a shocking truth—Mei is actually her new step-sister! Though Yuzu initially tries to be friendly with her, Meis cold shoulder routine forces Yuzu to begin teasing her. But before Yuzu can finish her sentence, Mei forces her to the ground and kisses her, with Yuzu desperately trying to break free. Once done, Mei storms out of the room, leaving Yuzu to ponder the true nature of her first kiss, and the secrets behind the tortured expression in the eyes of her new sister."
59,12259,33654,Hitorijime My Hero,Yaoi,,Unknown,,1574,"Masahiro Setagawa is a hopeless teenager who is often used by the neighborhood bullies as an errand boy. Defenseless, Masahiro knows that nobody will ever save him. However, his life drastically changes when he meets Kousuke Ooshiba, a man known as the ""Bear Killer,"" who takes down neighborhood gangs.A year later, Masahiro and his former friend, Kensuke Ooshiba, attend high school, only to find that Kousuke is their math teacher. While the three grow closer, Masahiro starts to view Kousuke as his ""hero,"" and Kousuke develops an urging desire to protect Masahiro. However, their normal lives take a turn when Kensukes childhood friend, Asaya Hasekura, returns, seeing Kensuke as more than just a friend, much to his surprise. Will the three boys be able to live a regular high school life? Or will forbidden love keep them apart forever?"
