,Unnamed: 0,anime_id,name,genre,type,episodes,rating,members,synopsis
46,11246,5762,15 Bishoujo Hyouryuuki,"Comedy, Harem, Hentai",OVA,3,6.98,11680,"After a heavy storm, Kazuma Shiraishi finds himself stranded on an uninhabited island somewhere in the Pacific. However, his situation may not be so unlucky, as 15 beautiful women are also marooned alongside him. Kazuma seizes the chance to have sex with these ladies, all while recording his raunchy deeds with three cameras he miraculously found lying on the shore."
47,11247,16642,Ane Koi: Suki Kirai Daisuki.,Hentai,OVA,2,6.98,4115,"Yoshiharu Hayami has always been in love with his older sister Sana. However, his sister decides to leave their house for certain reasons, leaving Yoshiharu worried that his feelings for her might go unnoticed. Unwilling to let go of her, he musters up his courage to confess, as well as taking something very important to her..."
48,11248,4600,Aneki... My Sweet Elder Sister The Animation,Hentai,OVA,4,6.98,6101,"Takumi just cannot stop fantasizing about Saki-senpai, her voluptuous body just stands out anywhere. One day she talks to him on the train and they become friends. Whenever he can, Takumi stares at her form, always getting a hard-on. The next day he finds out they have the same fetish... and so the story begins.(Source: AniDB)"
49,11249,31118,Demon Busters: Ecchi na Ecchi na Demon Taiji The Animation,"Demons, Harem, Hentai, School, Supernatural",OVA,1,6.98,2713,"Kou is a member of the public morals committee at Moriyaji Gakuen, along with his childhood friend Ai and kouhai Karen. One day while he was making the rounds after school, he was attacked by a weird being. He was frozen in fear and could not evade its attack, but he was saved by two girls, Konoka and Lizera. They were ‘daemon busters’ who fight against daemons borne from the lust and cravings of humans. They told him that he was a kyuumashi who could absorb the desires that create daemons, and they asked for his help since his special ability makes their battles much easier. When he uses his ability, it causes him to be able to see girls naked and also makes them horny. If the daemons aren’t defeated, then their lust will cause the whole school to become an orgy. As part of the public morals committee, he can’t let that happen!(Source: Hau~ Omochikaeri!)"
50,11250,12997,Please ♥♥♥♥ Me!,Hentai,OVA,2,6.98,8152,"From the makers of Euphoria and Eroge! Hentai mo Game mo Kaihatsu Zanmai, is CLOCKUPs and Collaboration Works Please Rape Me!Hosaka Ippei is your average Japanese yuppie who works at a rental video shop. He has a wide collection of erotic mangas and hentai at home, all of which are of the rape genre. He is fond of rape and his lifelong dream is to actually rape a woman.Everyday, after his work at the video shop, he goes home through a dark park not because he wants to unwind after a long day, but to get a chance to see a woman getting raped. He stumbles upon Sari, a mysterious loli wearing unorthodox clothing. He takes this chance to rape a woman but his imagination of raping her arouses him too much and ends up ejaculating on her. As Sari wakes up, Ippeis punishment is to let her live with him. Ippei agrees and thinks that this is the perfect opportunity to get free sex.The next day, a girl visits the shop where Ippei works and asks to be a member. Ippei recognizes her as his high school classmate, Yuuma Chidori. Sari tells him that she secretly has a rape fetish and encourages him to rape Yuuma.Yuuma asks Ippei out for a date and Ippei takes his chance to rape his high school crush and fulfill his dream of making her say ""Please Rape Me!"""
51,11251,5784,Ai no Kusabi (2012),"Drama, Romance, Sci-Fi, Yaoi",OVA,4,6.97,17943,"The story is set in the future on the planet named Amoi which is controlled by a supercomputer named Jupiter. Among the mostly male human population, the light-haired elite class is allowed to temporarily keep the dark-haired ""mongrels"" as pets. One elite member, Iason, encounters a mongrel named Riki in the slums and decides to take him in. However, Iason keeps Riki longer than it is socially approved, and rumors abound about their possible relationship."
52,11252,2873,Bible Black Only Version,Hentai,OVA,2,6.97,10176,"Bible Black Only explores the sexual misadventures of the supporting cast from the main Bible Black series. Miss Takashiro reminisces on her demonic capture, Itoh reveals her sadistic side, and Saeki is stalked by her classmates. Bible Black Only is a series of stand-alone episodes that do not affect the continuity of the main Bible Black series, and it contains footage that was previously only available on the R2 Bible Black Perfect Collection DVD.(Source: ANN)"
53,11253,7178,Tony&#039;s Heroine Series: Kanojo wa Hanayome Kouhosei? Cinderella Collection,Hentai,OVA,2,6.97,3550,"Shinjis parents have died in an accident years ago, so he has grown up in an orphanage. Now, years later, he gets approached by a maid with the name Zero who claims that Shinjis father was the only son of a millionaire. His grandfather now intends Shinji to inherit his business. Shinji doesnt feel much for inheriting a company from a person he doesnt know, especially since he has plans for his own life and wants to eventually marry his childhood friend Sae. There is only a slight drawback: his grandfather won’t take no for an answer. He did leave an opt-out option though; if Shinji can find a girl with a certain birthmark, he will be given his freedom and won’t have to inherit and lead the company. The only catch is… the birthmark will only appear after the girl climaxes. How will Shinji manage to get out of this deal while still staying true to his childhood love?"
54,11254,2866,Ane☆Haramix,Hentai,OVA,4,6.96,7712,"Since the early death of his parents, Takami Akitoshi has lived alone with his beautiful elder sister, Hitomi, while concealing his dirty desires for her.One day, a mysterious girl named Mina enters his room. She introduces herself as Death and explains that she came to take his soul because he had reached the end of his lifespan. Hearing his screams, Hitomi runs in and, after the situation is explained to her, asks Mina to spare him.Mina, moved by her earnestness, tells them that if Takami fathers a child within a week, she will let him live another 10 years.Hearing her condition, he turns his face to Hitomi…(Source: AnimeNfo)"
55,11255,22347,Pandra The Animation: Shiroki Yokubou Kuro no Kibou,"Demons, Fantasy, Hentai, Supernatural",OVA,2,6.96,2889,Based on the manga by Erect Sawaru. 
56,11256,1401,Bible Black: New Testament,Hentai,OVA,6,6.95,14097,"Several years have passed since the Walpugis Night incident and several bizarre serial murder cases have occured in the metropolitan area. Dead bodies of couples are discovered murdered during sexual intercourse. The women didnt have any external injuries, but the men were completely burned and carbonized except one part... their genitals. To solve these bizarre incidents, a special detective team called ""Tokken"" is deployed. Included amongst the members of Tokken is Imari who had experienced the events of Walpugis Night. While investigating the incident, they found a mysterious phrase, ""Spear of Longinus,"" and a strange cult group that is related to the incidents.(Source: ANN)"
57,11257,2396,Milk Junkie: Shimai-hen,Hentai,OVA,4,6.95,5508,"Wataru is a young man who moves into an apartment next to Tomoka and Fumie Fusono, two voluptuous sisters who used to know him when he was a shy child. Now Wataru is all grown up, and the Fusono sisters are ready to take full advantage of that fact.(Source: ANN)"
58,11258,3941,Rensa Byoutou,Hentai,OVA,2,6.95,2550,"Two hours away from Tokyo is Kiyosato Hospital.  Shuji is assigned to work there after completing Medical School, but the fact that his father died there during a operation while he was in college haunts him to this day.   In fact, the reason why Shuji became a doctor is the fact his father died and he wanted to be able to investigate just exactly why he died.  Since it was almost 10 years ago, he finding that he is running into a lot of dead ends.  Upon reporting to Kiyosato, he learns that Dr. Takao (the doctor who was operating on Shuji’s father when he died) is now the assistant director of the hospital.  Also on the same day, he sees Misako, his girlfriend from the time that his father died.  However, Shuji soon learns that Misako is now married to Dr. Takao under some suspicious circumstances.  This leads Shuji to investigate Dr. Takao and take back Misako by what ever means are necessary . . . "
59,11259,4360,Uchuu Kaizoku Sara,"Hentai, Sci-Fi, Supernatural",OVA,4,6.95,4777,"Sarah is a most terrible pirate knight who dances her way around the galaxy empire that has been ravaged by war. In the galaxy ruled by a number of power-hungry rival warlords, an evil sadistic web is woven around Sarah, who is slowly guided down to her destruction. When the silver knight Sylia comes across the evil aristocrats who have run the gamut of corruption in the galaxy and the slave traders of darkness, the demonic twins, a desperate predicament is visited upon Sarah!!(Source: dlsite)"
60,11260,21069,Amanee!: Tomodachinchi de Konna Koto ni Naru Nante!,Hentai,OVA,1,6.94,3054,"Based on the same name adult manga by Shiomaneki.Ryouichi goes to his friend Yuus place to play video games, like they do sometimes. It turns out that Yuus aunt Yui has come to visit, and she joins them. But it soon becomes clear that its not a video game she wants to play with Ryouichi...(Source: AniDB)"
61,11261,734,Kizuna: Koi no kara Sawagi,"Drama, Romance, Yaoi",OVA,1,6.94,4127,"On his first day of junior high, Kei Enjoji fell in love at first sight. His heart was immediately captured by the gorgeous Ranmaru Samejima, a young kendo prodigy, and the two slowly formed a deep romantic bond. Now adults and living happily together as a couple, things seem to be going well for Ranmaru and Kei.One morning, host Kei arrives home after a night out drinking with a client. A frequent occurrence, Ranmaru is initially unfazed by Keis drunken state—until he notices three extremely suspicious things: Keis clothing smells of makeup, his chest is stained with lipstick, and he is carrying matches branded with the name of a love hotel. To top it all off, a woman calls the apartment asking for ""Kei-chan,"" and at that, Ranmaru loses it.Hurt by Keis unfaithful actions, Ranmaru storms off. He spends the day reminiscing about years of precious memories, deciding to put them behind him for good—and when he is ""picked up"" by a woman on the streets, he comes to terms with reality. If this is what society wants, and if Kei has truly fallen for a woman, then who is he to stand in their way?"
62,11262,16189,Miboujin Nikki: Akogare no Ano Hito to Hitotsu Yane no Shita,Hentai,OVA,1,6.94,3000,"Based on the erotic game by Orcsoft.Ever since Ayakos husband died, Akito took it upon himself to guard her as his cousin. However, he suddenly realized that this situation can lead to something even more intimate... Will his virginity be in trouble?(Source: HentaiTake)"
63,11263,9308,Oni Chichi 2,Hentai,OVA,2,6.94,11092,"The feisty Natsume, motherly Akira, soft-spoken Fuyu, and innocent Haruka make up the Makino sisters. One week after losing his wife in an accident, the father of the household, Kenichi, starts to view his four daughters in a way that goes beyond a regular parent-child relationship. He soon becomes unable to resist their beautiful figures, and giving in to his carnal incestuous desires, he starts to have his way with them one by one."
64,11264,28309,Oni Chichi 2: Harvest,Hentai,OVA,1,6.94,4310,"Appalled by her father Kenichis carnal desires in targeting her younger sisters, Haruka Makino decides to become a ""sacrifice"" and sate her fathers incestuous libido alone. However, instead of solving the problem, her sisters begin to think that Haruka really plans to seize their father all for herself."
65,11265,17537,Ryou Seibai!: Gakuen Bishoujo Seisai Hiroku,Hentai,OVA,2,6.94,2898,Based on the erotic game by Tinker Bell.
66,11266,14379,Shoujo x Shoujo x Shoujo The Animation,"Harem, Hentai",OVA,2,6.94,3505,"After running away from his eccentric and cruel father and cutting all ties with his family, Kengo receives a desperate plea for help from the daughters of his fathers concubines seven years later. He decides to return home to help them and face his past.(Source: ANN)"
67,11267,33962,Shoujo-tachi no Sadism The Animation,Hentai,OVA,Unknown,6.94,1247,"In hopes of getting the attention of their beloved teacher Souichirou Imai, four girls—Saori Asamiya, Miyako Fujieda, Isuzu Yamamoto, and Suzuhana Makinohara—lure him to an unused clubroom and drug him with an aphrodisiac. Feeling extreme lust toward his students, Souichirou is subjected to their sadistic yet loving advances that could end up as something more than just sexual intercourse."
68,11268,24377,Spocon!,Hentai,OVA,2,6.93,2846,"Tatsuya excelled at all sports during his school years. Now instead of being an athlete, he trains to be a coach at his former teachers school Academy Josho. However, the leader of the swimming club Katsumi tried to seduce him in order to improve her results by any means. He opposed her actions, but could it be that the elite players from other clubs also have the same plan!?(Source: Hau~ Omochikaeri!)"
69,11269,5172,Love Selection The Animation,Hentai,OVA,2,6.92,3780,"The first episode of Love Selection is about a guy named Daiki-kun day-dreaming about having sex with the girl that he is in loved with named Ami-chan. Basically, one of Amis friends decides that she wants to have sex before her school-life ends, and thinks it would be easiest with someone from the class, so she proposes it to the class and drags Ami, and their other friend Yui, into it too. This episode contains no rape scenes, everything is ""mutual"" or close to it. No old fat men, etc...This second episode is about a guy who frequents a restaurant called ""Royal Bust"" because hes infatuated with one of the waitresses named Saiko-chan. Little did he know that the restaurant had a ""Special Sevice Day"" for customers who acquire enough points. Eventually he has his opportunity with Saiko-chan, but is cut short after getting a blowjob and doesnt have sex with her. Through distress from seeing her with a fat old man, he ends up having sex with another waitress named Yayoi-chan, who has secretly been in love with him all this time. This episode contains fat men, ""royal busts,"" and netorare."
70,11270,25923,Oppai Gakuen Marching Band-bu!,Hentai,OVA,1,6.92,2364,"An average boy receives one day a special camera from a mysterious, massively-endowed girl in a bunny suit. This camera has the ability to make any girl photographed with it unbearably horny, deepening their erotic agony with each picture you take. And when the sexual tension finally boils over, the only way to quench these uniformed vixens thirst is by having them service you with their enormous breasts!(Source: J-List)"
71,11271,11067,Oppai Heart: Kanojo wa Kedamono Hatsujouki!?,Hentai,OVA,2,6.92,4072,"Ryuya has an older sister, Miya.  He lives a peaceful school life with his friends.  But one day, he and his friends accidentally drink a medicine juice.  Once you drink it, youll become sexually sensitive and get excited.  The breasts of the girls who drink it will get bigger and they will need to have sex to cool down.  Also, to make a vaccine, they will need to get pregnant.  Ryuya starts having sex with the girls to cool them down and make a vaccine.(Source: ErogeShop)"
72,11272,33981,Pretty x Cation 2 The Animation,Hentai,OVA,Unknown,6.91,939,No synopsis information has been added to this title. Help improve our database by adding a synopsis here.
73,11273,10458,Ran-&gt;Sem: Hakudaku Delmo Tsuma no Miira Tori,Hentai,OVA,2,6.92,4192,"After the disappearance of her sister and finding out she had joined a suspicious enlightenment group seminar, Riko enlisted herself into the course to find her but the only way to reach the same course as her was to rank up and the only way to do so was to help others release... that being through sex. "
74,11274,13785,Uhou Renka,Hentai,OVA,2,6.92,4873,"Ryouhei is suddenly summoned back to his hometown in the countryside. There, he meets Karen the mascot-girl of a lodging house. As he stands entranced by the sight of her bewitching proportions, Nagisa, the sister of Ryouheis ex-girlfriend and the one who introduced him to Karen, looks on uneasily.(Source: AniDB)"
75,11275,11065,Shoukoujo The Animation,Hentai,OVA,2,6.9,4313,Kazuma returns home after a long absence and becomes a part-time home tutor to his younger sister and a few other girls. 
76,11276,203,Words Worth,"Adventure, Demons, Fantasy, Hentai, Magic",OVA,5,6.9,5080,"The legend has survived for generation. The Words Worth tablet, which will unlock the secrets of the Universe for the one who can decipher it, has been shattered. The warring tribes of Light and Shadow blame each other, and their accusations lead to all out war!Astral, the undisciplined heir to the throne of the Shadow Forces, lusts for his bride-to-be, Sharon. But Sharon, an accomplished warrior herself, feels her body drawn toward Caesar, the Shadow Tribe`s bravest swordsman.Sharon battles alongside Caesar during an assault by the Light Forces, and her ferocious beauty captivates Sir Fabris, the leader of the Tribe of Light. Fabris` army loses the battle, but he vows that he will one day get Sharon into his bed, the hard way, if necessary.Meanwhile, Astral takes his sexual frustrations out on Maria, a Light Tribe sorceress who has been taken captive. As Astral penetrates Maria, Sir Fabris prepares to launch a penetration of his own: a full-scale attack on the Tribe of Shadow!(Source: AnimeNfo)"
77,11277,6892,Yokorenbo: Immoral Mother,Hentai,OVA,2,6.9,3890,"Junko lost her husband about ten years ago, and she has been bringing up Ryouichi, her son, alone since then. One day, when he is asleep, she secretly gives him a blowjob and has sex with him. Two years later, she gets remarried. One night, Ryouichi accidentally sees Junko and his new father having sex. He remembers what happened two years ago and feels an irresistible impulse to get her back.(Source: Saishuu)"
78,11278,4010,Alignment You! You! The Animation,"Demons, Hentai, School, Supernatural",OVA,2,6.89,6951,"Takahashi loves Oohara, and Oohara loves Takahashi, but neither of them knows of the others feelings yet. Moreover, Takahashi died. How can their love come to be now?"
79,11279,31117,Ano Ko to Ii Koto,Hentai,OVA,2,6.89,2714,"Konna Mune demo Aisaretai!! (These Breasts Want to be Loved, Too!)High school student Ookoshi discovers the secret of his well-endowed classmate, Takita—it turns out that Takita does not have the breasts that everyone around her believes her to have. Fearing that Ookoshi may expose her secret, Takita ""gives"" him something irresistible as an incentive.Souda Imouto to Renshuu shiyou. (Thats Right! Ill Practice with my Sister!)After arranging a meetup with a girl online and thinking that it may escalate into something lustful, Amis older brother decides to practice having sex with Ami. Of course, she is not willing to let her brother have his way with her, unless he completes a certain ""challenge."""
80,11280,972,Bible Black Gaiden,"Hentai, Supernatural",OVA,2,6.89,14478,"After their rejected request to create a formal student magic club, Hiroko Takashiro, Saki Shidou, and Rie Morita are forced to continue practicing witchcraft in their free time only. One day, Rie comes across a dusty, hand-written book. Found on a sales pile in an antique shop, the manuscript seems to be nothing more than a foreign curiosity.Upon translating the book, the girls discover simple spells designed to bend an unsuspecting victim to the users will and impose ones sexual desires on them. Realizing they have come into possession of a mighty weapon, the group begins fulfilling different requests of other students—be it for love, vengeance, or sexual desire. As the situation spirals out of control, the magic club gradually transforms into a cult of blood, lust, and human sacrifice."
81,11281,12055,Brandish,"Hentai, Supernatural",OVA,2,6.89,6742,"Twiska enjoys visiting local towns and draining the villagers of their cum. Everything is going along well until she encounters Theo, the legendary Hero destined to defeat her. Theo is a cute shouta and addictively good at sex. Now Twiska isnt sure anymore whether she wants to kill him or keep him for herself. "
82,11282,32895,Chijoku no Seifuku,Hentai,OVA,Unknown,6.89,1927,Based on the game by Bishop. 
83,11283,24911,Kyonyuu Try!: Tanki Shuuchuu Chichi Momi Lesson,Hentai,OVA,1,6.89,1930,Based on the adult game by Marine.
84,11284,14539,Love 2 Quad,Hentai,OVA,2,6.89,4931,"One day, the most popular teacher at Akakura Gakuen, Aoi-sensei, approached Wataru and informed him that his help is needed and he must take off his clothes immediately. She was an agent of the secret international defence organization Cradle and asked him to aid in the battle against the enemy ""4D"". In order to defeat ""4D"", he must engage in ecchi activities to gain energy and defeat the enemy with the power of love! His imouto-like osananajimi Honoka, classmate Ermalit, expressionless Mirai from the future and chibi Chitose from the past lend their help. However, they aren’t sure what to do!? And so marked the end of his peaceful single life. (Source: VNDB) "
85,11285,4473,Shoujo Sect,"Comedy, Hentai, Romance, Yuri",OVA,3,6.89,16527,"Ten years ago, Shinobu Handa and Momoko Naitou met on a playground and became friends. Before their separation, they shared a kiss and a promise that they would see each other again. Years later, Shinobu still remembers that vow, but Momoko has forgotten it. Now the two attend the same school. However, their personalities are complete opposites. Shinobu is a delinquent collecting a string of lovers, but Momoko is a serious student and a member of the disciplinary committee. Shinobu uses her flirtatious nature to try to make Momoko rediscover the bond and feelings they once shared. Various stories of love and lust envelop Momoko and Shinobus lives. Can these two find their way back to one another?"
86,11286,10827,Wizard Girl Ambitious,"Fantasy, Hentai",OVA,1,6.89,6007,"Kei is an apprentice knight, when his heart is broken by a failed romance he decides to go on a journey for training.As he was leaving the town, he encountered two beautiful girls waiting just outside the gates. While he was checking them out, he noticed that one of them is dressed as a wizard and the other as a priestess. At the same time he noticed that the priestess was waving a sign, saying help wanted, they noticed him as well and thought that he wanted to join.After talking with them a bit (and surviving their trial) he agreed to protect them on their journey. What starts as a simple journey changed into something totally different... something that would decide the destiny of the whole world...(Source: vndb)"
87,11287,6690,Anata dake Konbanwa,Hentai,OVA,5,6.88,3338,"Shougo has just arrived  town after he was ordered to do so since his grandfather has just died, her parents are busy with work so they told him to go first. Shougo will be the one to inherit all family assets.  Shougo arrives at the residence that will be his new home and he receives a great welcome by the beautiful maid Youko-san. A strange event happens at night, he dreams with someone but cannot really tell who it is, all he knows is that her face looks familiar... Next day he goes to his new school, her fiancé Ayano introduces to him telling him that it was something their parents decided on their own and that she has not accepted him yet, Shougo is in shock since he didnt know about this and many people are now jealous and angry at him since Ayano is the schools idol. Not everything is bad as he has a very warm welcome by a voluptuous beautiful teacher. Later a ghost appears before him, is the girl he saw in his dream last night, what does this means? All Shougo knows is that he has seen that girl before but where? "
88,11288,368,Bible Black,Hentai,OVA,6,6.88,31309,"Every school has secrets, but few leave a stain that wont wash out. In a certain school, there was once a fun club centered around magic but had turned into murder and a lust for power. Sealed and willfully forgotten, the resulting evil of that day remained chained in the schools basement. Twelve years later, high school student Taki Minase, while inspecting the place where the incident took place, uncloaks the secret plastered in blood—a book of magic called ""Black Bible."" Trying his luck with its love curses, he soon finds out the magic proves real and easily penetrates the hearts and bodies of his fellow classmates.The resulting intercourse leaves the student body very vocal, and Minases acts do not go unnoticed. What was at first a simple stroke of curiosity becomes much larger and harder to control. Fully swallowed by the unshackled darkness, everyone he knows becomes a victim, including his childhood friend Kurumi Imari. Torn apart, Minase finally realizes his mistakes and that he must reverse them in time if he ever hopes for him and Imari to come together."
89,11289,4399,Honoo no Haramase Tenkousei,"Harem, Hentai, School, Yuri",OVA,3,6.88,4965,"The main character, Tatsuya Tagami, has an ambition of World Conquest, and the first step of his plan is to make every female classmate pregnant. Unfortunately, his dream is rather impossible in his all-boys school. Hence, he transfers himself to the newly reorganized Hakuka Co-Ed Academy, which was previously an all-girls school. (Source: ANN) "
