,Unnamed: 0,anime_id,name,genre,type,episodes,rating,members,synopsis
0,5300,9403,Shin Mashin Eiyuuden Wataru Majinzan,"Action, Adventure, Comedy, Fantasy, Mecha, Sci-Fi",OVA,2,6.5,213,"Set a few months after the original series, Wataru is called into action once again!"
1,5301,1048,The SoulTaker: Tamashii-gari,"Demons, Horror, Supernatural",TV,13,6.5,15796,"Kyousuke Date comes home one night and finds his mother dying in a pool of her own blood. In her final moments, she stabs him in the chest. After a swift recovery, Kyousuke searches for answers regarding his mothers motives, but finds more than he bargained for when he is attacked by two rival organizations: the Hospital and the Kirihara Group.Kyousuke is surprised to discover that he has a twin sister named Runa, and both groups try to coerce information out of him about her despite his ignorance to her existence. As their assault continues, Kyousuke soon makes another discovery—he has the ability to transform into a terrifying mutant called SoulTaker. With these newfound powers, Kyousuke resolves to crush both organizations, uncover the truth behind his mothers actions, and protect Runa."
2,5302,4475,Toshi wo Totta Wani,Drama,Movie,1,6.5,1638,"A very old crocodile, so old that he had witnessed the building of the pyramids, was suffering from rheumatism, and no longer able to catch his food. In desperation, he decided to eat his great grand son. Although his thousands of years of longevity entitled him to much respect, the family decided he would have to be put down. Unable to bear the disrespect of his family, the old crocodile said goodbye to the Nile. One day the old crocodile met an octopus. The octopus treated her new friend to a variety of fish that she caught just for him. When the night fell, he couldn’t restrain himself from eating one of the octopus’s legs. Since then, the old crocodile began to help himself to the octopus’ leg every night…(Source: AniDB)"
3,5303,3905,Wanpaku Ouji no Orochi Taiji,Adventure,Movie,1,6.5,704,"Susanoo, the youngest child of the creation gods Izanagi and Izanami, is a mighty warrior, easily able to defeat tigers with his bare hands. After his mother dies, Susanoo is devastated. Determined to travel to Heaven to find her, he carves a boat out of a tree, and along with his rabbit companion, Akahana, he prepares to cross the ocean.As Susanoo does not know how to reach Heaven, he first visits his brother, Tsukuyomi, leader of the Night Kingdom, and his sister, Amaterasu, leader of the Light Kingdom. While his siblings can warn Susanoo of the dangers he faces, they are unable to stop him or provide him with the directions to Heaven. As Susanoo continues his journey to the ends of the Earth, Orochi, an eight-headed dragon, awakens to stand in Susanoos path."
4,5304,4537,Yagami-kun no Katei no Jijou,Comedy,OVA,3,6.5,647,"Well, in short, the mother looks like shes 14, and the kid is ""openly"" in love with her—loli x motha-con. His teacher, too, is in love with her mother, and so the love rivals duke it out in classroom, as well as plotting the downfall of their common enemy, his father. The father has a secretary who is in love with him. But once she discovered that he has such a ""young"" wife she turned her attention to his son, who is now torn between his own mother and a naive, motorbike riding girlfriend. (Source: users.skynet.be/mangaguide)"
5,5305,2464,Yoshinaga-san&#039;chi no Gargoyle Specials,"Adventure, Comedy, Fantasy",Special,5,6.5,867,A magic book places Kazumi in a Wonderland-like world.
6,5306,6148,Yurumates,"Comedy, Seinen, Slice of Life",OVA,1,6.5,4549,"Yurume, an 18-year old ""ronin"" and recent high school graduate, has high hopes of being accepted and attending Tokyo University. She moves into an apartment complex, the Maison du Wish, located on the outskirts of Tokyo where other ronins living there are studying for upcoming college acceptance exams."
7,5307,6682,11eyes,"Action, Ecchi, Super Power, Supernatural",TV,12,6.49,133971,"When the Sky turns Red, the Moon turns Black, and monsters begin roaming the streets, Satsuki Kakeru is at a loss for what to do. Along with his best friend Yuka, they try to decipher why they have been sent to this strange world, which is seemingly empty aside from themselves.However, when the ""Red Night"" ends, Kakeru and Yuka believed it was all a dream, until it happens again and they are left in a dangerous situation. They meet four others in the same predicament: Kusakabe Misuzu, an expert swordswoman, Tachibana Kukuri, a strange mute girl who looks uncannily like Kakerus deceased sister, Hirohara Yukiko, a lively young girl whose personality reverts to that of a cold killer when her glasses are removed, and Tajima Takahisa, a young pyrokineticist.As the six of them band together to survive and discover what this mysterious world is, things take a turn for the worse as six shadows appear before them..."
8,5308,1295,A-Ko The Versus,"Action, Adventure, Comedy, Romance, Sci-Fi, Super Power",OVA,2,6.49,2457,"A-ko and B-ko are bounty hunters in an untamed world. When a young heiress, C-ko, falls out of the sky and into their hair, they find themselves battling space pirates and galactic police. Turns out the high-pitched, hungry C-ko holds a secret—the spirit of an ancient evil—and is the center of a plot to destroy the universe!"
9,5309,23583,Akage no Anne Specials,"Drama, Historical, Kids, Shoujo, Slice of Life",Special,2,6.49,331,"A summary of the Akage no Anne full series aired as a TV specials.Anne is an orphan full of imagination. When she arrives at her new home she learns that sometimes you have to be a sensible person too; at the same time her unique character changes, or at least attracts, the people around her. The story covers Annes growth from about eleven to seventeen years old as she makes friends, goes to school and studies. At a difficult point in her life, Anne will have to make a hard choice and perhaps find a new dream.(Source: AniDB)"
10,5310,14373,Arata naru Sekai: World&#039;s/Start/Load/End,Sci-Fi,OVA,1,6.49,13647,"Four high school girls in uniforms walk silently on the barren earth. These girls are time travelers who had been sent 6000 years into the future, from their present in which the same day is endlessly repeated, in order to evade human extinction.They studied time travel in school, were examined by the aptitude test, and were sent to the future as told. What should they do now? They had no idea. The only thing they could take with them from the present was a light, toy-like cellphone. Of course, it receives no signal here.As the girls are walking, they see strange birds flying in the sky, and a discolored river in the distance.Then, one girl finds an abandoned house, and recognizes the name inscribed on the front gates."
11,5311,9166,Attack No.1: Namida no Sekai Senshuken,"Drama, Shoujo, Sports",Movie,1,6.49,248,The third Attack No.1 recap film. This covers the championship arc in New York where the All Japan team plays against the Soviet Union.
12,5312,3132,Boukensha: The Man Was from Spain,"Adventure, Historical",TV,26,6.49,496,"Christopher Columbus is a man of strong will. His life is full of drama.Born in Genoa, he realizes his dream of becoming a sailor, dares to search for a new route, and finally reaches his goal, discovering a new land in the process.Sometimes in desperation, sometimes in excitement, his experiences are truly extraordinary. (Source: AnimeNfo)"
13,5313,4418,Catman Series II,"Comedy, Fantasy, Slice of Life",ONA,8,6.49,755,"In a city filled with anthropomorphic cat-people, Catman lives free of rules and boundaries, doing everything he wants, which often collides with the other inhabitants of the city. Created entirely in flash, with no spoken dialog, Catman instead speaks in English and Japanese subtitles. The series is spread across three so-called seasons, with only the third having been aired."
14,5314,17020,D.C.III: Da Capo III Special,"Drama, Music, Romance, School",Special,1,6.49,3008,Special that counts down the best of the Da Capo theme songs and introduces the characters of Da Capo III.
15,5315,3202,Daisuki! Hello Kitty,"Fantasy, Kids",TV,26,6.49,1468,"The adventures of a young kitten named Kitty with her twin sister Mimi. Its a variety of adventures, including Kitty in some fairy tales as well."
16,5316,1753,Di Gi Charat: Kuchi Kara Bazooka,Comedy,Special,1,6.49,1249,Piyoko and her villainous friends plot for a way to use the mouth rocket to beat Dejikos laser eyes.
17,5317,2647,Dorami-chan: Mini-Dora SOS!!!,"Fantasy, Kids",Movie,1,6.49,178,"This episode is set in the future where the main characters from Doraemon are all grown up and have kids. Minidora (mini doraemon) accidently gets delivered to the Nobitas future house. The sons of Jyaiyan, Suneo and Nobita plays with Minidora with the special goods he brings out of his pocket. But trouble happens when they ran away from Dorami, who came to retrieve Minidora. (Source: ANN)"
18,5318,5088,Fabre-sensei wa Meitantei,Mystery,TV,26,6.49,298,"The world of insects is full of enchantment and amazement. This animation series is inspired by ""the Diary of Insects"" written by Jean Henri Fabre, an outstanding French entomologist and author in the 19th Century. In his original works, Mr. Fabre vividly described the life of insects. In this series all the insects and bugs have been personified and drawn into marvelous animated characters.This is the story of the exciting adventures of a crime-buster in the world of insects! Our heros way of investigation is so unique and always ends with surprising solutions. The interesting ecology of various insects will be described while our ""cool"" hero, Inspector Fabre, analyzes and unties the knots of crimes and conspiracy a la fashion of Sherlock Holmes!"
19,5319,909,Geneshaft,"Adventure, Mecha, Sci-Fi, Space",TV,13,6.49,8643,"In the 21st century mankind was on the brink of destruction. Through genetic engineering however they eradicated such feelings as love and the desire for power. Since women are naturally less agressive than men, women to man ratio was set to 9:1. Now people are engineered to have skills that others view as being necessary. There is a giant ring that now orbits the earth, that sits there and relays information back to an alien race that sent it. Now a team of five women will try to eradicate the alien threat. (Source: ANN)"
20,5320,1158,Geobreeders: File-X Chibi Neko Dakkan,"Adventure, Comedy, Shounen, Supernatural",OVA,3,6.49,1636,"Taba and the Girls of Kagura Total Security Inc. specialize in jobs where their enemy are ""Phantom Cats"". They have a few run ins with the various Government agencies, as well as a gang of Phantom Cats; blowing up a lot of stuff along the way. When one of their own is kidnapped, they have to get her back.(Source: ANN)"
21,5321,8450,Guskou Budori no Denki,Drama,Movie,1,6.49,628,"The Biography of Budori Gusko was the recipient of numerous awards including the Monbusho Selection. The original novella on which the film is based is one of Kenji Miyazawas more famous works, alongside Matasaburo the Wind Imp, Gauche the Cellist and Night on the Galactic Railroad. The story follows the life of a young boy named Gusuko who lives in the countryside with his parents and little sister. A string of droughts and other natural disasters tear the family apart, and Gusuko is forced to leave home and seek his fortunes on his own. Driven by a desire to improve the quality of life of his poor countrymen, he eventually joins a group of scientists called the Iihatov Volcano Department, and there takes part in scientific projects to fight the natural disasters that drove him from his home.(Source: pelleas.net)"
22,5322,31630,"Gyakuten Saiban: Sono &quot;Shinjitsu&quot;, Igi Ari!","Comedy, Drama, Mystery, Police",TV,24,6.49,61410,"Since he was a child, Ryuuichi Naruhodous dream was to become a defense attorney, protecting the innocent when no one else would. However, when the rookie lawyer finally takes on his first case under the guidance of his mentor Chihiro Ayasato, he realizes that the courtroom is a battlefield. In these fast paced trials, Ryuuichi is forced to think outside the box to uncover the truth of the crimes that have taken place in order to prove the innocence of his clients.Gyakuten Saiban: Sono ""Shinjitsu"", Igi Ari! follows Ryuuichi as he tackles cases to absolve the falsely accused of the charges they face. It will not be easy—standing in his path is the ruthless Reiji Mitsurugi, a prosecutor who will stop at nothing to hand out guilty verdicts. With his back against the wall, the defense attorney must carefully examine both evidence and witness testimony, sifting through lies to solve the mystery behind each case. With a shout of ""objection!,"" the battle in the courtroom begins!"
23,5323,1851,Haou Daikei Ryuu Knight: Adeu Legend Final,"Adventure, Comedy, Fantasy, Mecha, Parody",OVA,1,6.49,435,End of the series.
24,5324,1193,Happy Seven: The TV Manga,"Comedy, Fantasy",TV,13,6.49,3287,"Amano Sakogami is a girl who has an unnatural amount of bad luck. One day, she stumbles into the clubroom of the Better Fortune Research Organization, which consists of a boy and seven other girls who secretly use the power of the luck deities to fight against the Magatsugami, monsters who can affect a persons luck & well-being. Amano soon becomes the clubs manager, and joins the club in their fight against the Magatsugami and their controller, Kukitomoe.(Source: ANN) "
25,5325,1884,Himesama Goyoujin,Comedy,TV,12,6.49,1623,"Himeko is supposed to be a common high school student... until she happens to obtain a crown and she becomes a princess. Since then, Nana, the true princess, follows her around to take the crown back. In addition, Leslie and Caren, the thieves, appear to rob her of the crown, and her peaceful life turns into turmoil.(Source: AnimeNfo)"
26,5326,3285,Himitsu no Akko-chan,"Magic, School, Shoujo",TV,94,6.49,1085,"Atsuko ""Akko-chan"" Kagami (known variously as ""Stilly,"" ""Caroline,"" or ""Julie"" in Western versions of the anime) is an energetic elementary school girl who has an affinity for mirrors. One day, her favorite mirror which was given to Akko by her mother (or in some versions, by her father, as a present from India) is broken, and she prefers to bury it in her yard rather than throw it to the trash can. In her dreams, she is contacted by a spirit (or in some cases the Queen of the Mirror Kingdom) who is moved that the little girl would treat the mirror so respectfully and not simply throw it away. Akko-chan is then given the gift of a magical mirror and taught an enchantment that will allow her to transform into anything she wishes.(Source: Wikipedia)"
27,5327,9824,Jigokudou Reikai Tsuushin,"Fantasy, Horror",OVA,1,6.49,479,"Tetsushi, Ryouchin and Shiina are a youthful trio not to be trifled with; they have a fearsome reputation. One day they decide to enter Jingkudou, a store which is rumored to be the gateway to Hell, the storekeeper sure is creepy enough. He tells them a story and after that they decide, with a magical token provided by the storekeeper, to try and find the restless spirit of a murder victim in order to give her release. This is only the start of their supernatural career...(Source: BakaBT)"
28,5328,2293,Kyoushoku Soukou Guyver,"Action, Horror, Sci-Fi, Super Power",Movie,1,6.49,3185,"The plot of this OVA is a rough adaptation of the first four chapters of the Guyver manga. It covers the same basic elements of these chapters; Genesis of the guyver, Fight with Vamore, Fight with Guyver 2 and the introduction of Guyver 3. Main differences are the exclusion of Tetsuro and his replacement by Mizuki, The replacement of Lisker with a female Agent ""Valcuria"", and thus a female Guyver 2. There is also a look at Shos psychology of how he deals with his situation including a very harsh moment where his friends are assassinated in cold blood.One night, high school student Sho Fukamachi discovers a mysterious metal object. Then in a blinding flash of light, Sho finds that he has accidentally fused with the Guyver, a mecha of mysterious alien design.Now, to save his girlfriend, Mizuki Segawa, along with the entire world, Sho must become the Guyver to fight the Chronos Corporation and their biocreatures, called Zoanoids, who are hell-bent on world domination.(Source: Wikipedia)"
29,5329,3932,Magnerobo Ga-Keen,"Action, Mecha, Sci-Fi",TV,39,6.49,416,"Dr. Kazuki, who perceived of an invasion of Earth by the Izaru people builds a robot based on the science of magnetism and sphere joint theory. Undergoing a dangerous augmentation process, Dr. Kazukis daughter Mai becomes the pilot of ""Mighty"" or ""Magnetman Minus"". Takeshi Houjou becomes the pilot of ""Puraiza"" or ""Magnetman Plus"". The pilots would hold each other and then physically trasform their joint bodies in a metallic plate locking itself on the Gakeen (Short for ""Gathering Keen"") robots frame thus enabling the super robot to move and fight. This sequence was notable, to an adults eye, for its almost-sexual connotation.(Source: Wikipedia)"
30,5330,2046,Mahou no Tenshi Creamy Mami: Long Goodbye,"Comedy, Fantasy, Magic, Romance, Shoujo",OVA,1,6.49,476,"Shingo is planning the film ""A Story of Two Worlds"" starring Megumi. Yuus transformation into Creamy Mami is happening without her wanting it. She is asked to star in the film too. But the magic doesnt last..."
31,5331,3356,Mahoutsukai Sally,"Fantasy, Magic, School, Shoujo",TV,109,6.49,1478,"Sally, the kind but mischievous princess of the Land of Magic, has developed an interest in the human world. Wanting to experience it for herself, she runs away and meets two girls her age—Yoshiko ""Yocchan"" Hanamura and Sumire Kasugano—at a department store. They quickly become friends and spend time at Sallys mansion, which she conjured with magic.The two girls realize they forgot something at the store, and despite it having closed for the night, they leave to fetch the item. Sally and her younger brother Cub, who had been sent by their parents to retrieve her, follow them and discover that they have been captured by a pair of thieves who were attempting to rob the store. Utilizing their magic, Sally and Cub drive the thieves away and rescue the girls, who remain unaware of Sallys powers.Attached to her new friends and the fun of the human world, Sally decides to stay, taking up the surname Yumeno and attending school with Yocchan and Sumire. Cub chooses to live with her and together they make a variety of new friends and go on various adventures, all the while spicing up their lives with magic."
32,5332,5386,Miyamoto Musashi: Souken ni Haseru Yume,"Action, Historical, Martial Arts, Samurai",Movie,1,6.49,3721,"The films story centers on Musashi Miyamoto, one of the most famous swordsmen in Japanese history. He pioneered the Hyouhou Niten Ichi-ryuu style of two-sword fighting and wrote The Book of Five Rings, a book that has been compared to Sun Tzus The Art of War for its insight on tactics and strategy."
33,5333,4617,Nana Toshi Monogatari: Hokkyokukai Sensen,"Drama, Sci-Fi",OVA,2,6.49,1085,"In 2099, Earth has shifted off its axis and begins to rotate at an angle of 90% to the 20th-century equator. Three years of natural disasters follows, and when things settle down, Earths ten billion population has died and only two million moon colonists remain.Some return to begin the repopulation of the world in seven new cities and the remaining colonists of the moon fear that their former neighbors might pose a threat and construct a ring of defensive satellites to trap them on the newly repopulated homeworld.(Source: AniDB)"
34,5334,33038,Nuwa Chengzhang Riji,"Comedy, Fantasy",TV,30,6.49,3106,"This story follows an orphan girl rumoured to be a successor of ""Nuwa"", the goddess of creation in ancient Chinese mythology."
35,5335,2550,Onboro Film,"Comedy, Parody",Movie,1,6.49,1507,"A scene from an American animated piece called ""Dudley Do Right"" shows a scene in which a queen is tied to a railroad track with ropes and shouting, ""Help!"" This image was often used in serial action films of the silent comedy period. In this short film, a western-style hero fights a villain and saves a beautiful woman in the same situation. This classical scene, however, is marred, blurred and smudged because the film itself is very old. Not only does the hero have to fight the villain, but he also has to struggle hard against the bad condition of the film.(Source: AniDB)"
36,5336,5056,Penguin Musume♥Heart Special,"Comedy, Ecchi, School, Slice of Life",Special,1,6.49,2564,ONA Special episode #11.5. 
37,5337,21703,Pokemon XY: New Year Special,"Action, Adventure, Comedy, Fantasy, Kids",Special,1,6.49,2270,Recap episode.
38,5338,14935,Pokemon: Utae Meloetta - Rinka no Mi wo Sagase!,"Adventure, Comedy, Fantasy, Kids",OVA,1,6.49,1701,"Meloetta has throat trouble, Pikachu and Snivy search for the Rinka Berries for her throat cure. Meowth and Wobbuffet run after Meloetta. The 23rd Pikachu short, bundled with the August 2012 issue of Shogakukans Ciao shoujo magazine.(Source: AniDB) "
39,5339,24935,Recorder to Randoseru Mi☆ Special,"Comedy, School, Seinen, Slice of Life",Special,1,6.49,2752,Unaired episode 13 included on the Blu-ray/DVD volume of the Recorder to Randoseru Mi☆ series.
40,5340,10013,Shouwa Monogatari (Movie),"Drama, Historical",Movie,1,6.49,878,"Dramatic story of the Yamazaki family during the year Showa 39 (1964), the year that Tokyo hosted the Summer Olympics."
41,5341,6251,Sketchbook: Full Color&#039;s Picture Drama,"Comedy, Slice of Life",Special,6,6.49,1487,Short specials from the DVDs.
42,5342,1662,Space Fantasia 2001 Nights,"Drama, Sci-Fi, Seinen, Space",OVA,1,6.49,1284,"Based on Yukinobu Hoshinos 1984 manga in ""Action Comics; shot in ""Super Perspective Technique"".It is the 21st century, and two young people were chosen. Adam was sent off into a space ship and was sent off into outer space...(Source: ANN, AniDB)"
43,5343,30246,Space☆Dandy 2nd Season Picture Drama,"Comedy, Sci-Fi, Space",Special,3,6.49,1150,"Picture drama episodes included on the Blu-ray/DVD volume eight, nine, and ten."
44,5344,19953,Zetsumetsu Kigu Shoujo: Amazing Twins,"Magic, Slice of Life",OVA,2,6.49,7418,"Amane Todoroki is a young girl who is straightforward but also unthinking. She will try her very best in everything and say, ""I dont know how to answer you if you ask me whether this can be done. I just believe it can. If not, then nothing will get started!"" She easily gets stuck in her thinking, but she can also get easily moved at something small and start crying.(Source: MAL News)"
45,5345,27405,Zou no Senaka: Tabidatsu Hi,"Drama, Seinen, Slice of Life",OVA,1,6.49,136,"When elephants are about to die, they will leave their herd and die alone. When a person knows that he is about to die, what will he choose? Its lung cancer, and it has already metastasized. There are probably 6 months left. Its a story about a mans last few steps in his life. Its probably quite different from the elephants."
46,5346,1734,Ajimu: Kaigan Monogatari,"Comedy, Drama, Romance, School",ONA,4,6.48,9102,"Seventeen year old Nakaido Hirosuke is just your average high school student. One morning as he arrives at the train station on his way to school, he catches sight of a beautiful girl, Ajimu Yasuna, and immediately falls for her. The two of them get to know each other and become friends, but he cant confess his feelings and she is unsure of hers. As events and other people present obstacles for the potential couple to clear, their relationship begins to develop and their feelings become clear.(Source: ANN)"
47,5347,4667,B-Densetsu! Battle Bedaman Enkon,"Adventure, Comedy, Kids, Shounen",TV,51,6.48,2512,"It is not uncommon to wish upon shooting stars. But for B-DaPlayers all around the world, what they seek is not for their wishes to be granted. Gazing upon what many would assume are just rocks shrunk to the size of a pebble by atmospheric entry and fallen to the earth, the fated ones see instead what are known as Strike Shots—powerful marbles originating from the vast and mystical outer space. After achieving triumph in the war against his ultimate foes, Yamato Daiwa continues his journey as a rising B-DaPlayer, looking to obtain a new power worthy of his improved battle gear."
48,5348,4070,Black Jack: Dr. Pinoko no Mori no Bouken,Comedy,Special,1,6.48,1272,"Dr. Black Jack forgot his doctors bag, and his assistant (plus self-claimed ""wife"") Pinoko rushed to deliver the bag but found herself lost in the forest. Guided by a butterfly, she found that many animals in the forest are sick or injured, and Pinoko used her knowledge to help those animals.(Source: ANN)"
49,5349,13169,Buta,"Adventure, Comedy, Fantasy, Historical",Movie,1,6.48,4850,"A few days before Fox officially inherits the treasured heirloom in his family—a mysterious map, the Tufugu Pirates storm into his house and kidnap him, taking the strange map with them.Buta, a powerful mercenary, is hired by shady characters to help them seek the treasure. In a stroke of great luck, Buta and Fox meet in the underbelly of a pirate ship. Will Fox be able to convince Buta to save him, or will the fabled treasure fall into the hands of crooks?"
