,Unnamed: 0,anime_id,name,genre,type,episodes,rating,members,synopsis
4,5704,30385,Valkyrie Drive: Mermaid,"Action, Ecchi, Fantasy, Shoujo Ai",TV,12,6.38,45400,"Naïve 16-year-old Mamori Tokonome is accustomed to being teased at school for having an unfortunate surname that can also be read as ""virgin."" However, young Mamori will soon have to get used to being teased in other ways...Kidnapped during gym class, Mamori wakes up only to find herself stranded and under attack on the exotic island of Mermaid. Luckily, enigmatic fellow castaway Mirei Shikishima knows exactly how to take the lead—through a passionate kiss, Mirei unleashes Mamoris Exter transformation abilities, turning the innocent red-head into a battle-ready cutlass through the power of arousal.The duo will need to tap into that power as Mermaid Island is full of potential friends and foes: Charlotte, the sadistic Liberator of an Exter harem; the gluttonous and crafty Meifon; the mysterious but charismatic Akira Hiiragi; and the erotic biker duo Lady Lady. Mamori and Mireis powerful and intimate embrace is the only way for the pair to ensure their survival on this scandalous island."
8,5708,454,.hack//Gift,"Comedy, Fantasy, Game",OVA,1,6.37,15411,"As an expression of gratitude for the heroes of both the "".hack//Sign"" and the "".hack"" game series, Helba has prepared a special event for all the characters to find the newly established ""Twilight Hot Springs."" The characters can get their well deserved rest and relaxation by having a soak in the wonderful hot springs, but there is only one problem—the hot springs are hidden and there have been mysterious player murders. With the only clue being the word “GIFT,"" the race has begun to find the culprit and the location of the hot springs."
13,5713,9935,Chocolat no Mahou,"Drama, Magic, Shoujo, Supernatural",OVA,13,6.37,3800,"Chocolatier Chocolat Aikawa and her enigmatic acquaintance Cacao Theobroma run a shop named Chocolat Noir, which is famous for its specially crafted chocolates, known to miraculously grant wishes. A variety of troubled individuals find themselves in front of the shop, seeking its merchandise, but these chocolates are expensive—each customer must pay with their most precious belonging.Although Chocolat seems to be a lady who would have no problems of her own, due to her ability to grant wishes, beneath her mysterious facade is a distressed young girl who has not settled a score from her past..."
15,5715,2760,Densetsu Kyojin Ideon: Sesshoku-hen,"Drama, Mecha, Sci-Fi, Space",Movie,1,6.37,1740,"Scouring the universe in pursuit of knowledge, mankind has discovered three large trucks and a giant spaceship belonging to an extinct alien civilization on the planet Solo. During their excavation, a humanoid alien race known as the Buff Clan arrives at Solo, and Karala Ajiba—daughter of the Buff Clans military leader—flies down to the planet against orders. In hunting for Karala, the Buff Clan attacks and destroys the Earth settlement to bring her back.Desperate to stave off their assaulters, earthlings Cosmo Yuuki, Kasha Imhof, and Bes Jordan board the trucks, which form into the powerful giant robot Ideon when combined. As they fight back against their enemies, the remaining survivors board the spacecraft Solo Ship and flee, while the Buff Clan relentlessly seeks Ideon and the mysterious power source contained within it."
23,5723,16149,Kick-Heart,"Comedy, Romance, Sports",Movie,1,6.37,8007,"By day, Romeo Maki is a respectable man who loves bringing gifts to the local orphanage, and Juliet is a newly employed nun working at said orphanage. However, by night, they are Masked Man M and Lady S, popular professional wrestlers. Kick-Heart tells the story of what happens when this dynamic pair meet in the ring, the only place where they can express their hidden desires."
51,5751,28713,Isuca: Gokuraku,"Comedy, Ecchi, Romance, Seinen, Supernatural",OVA,1,6.36,9464,"The OVA will be bundled with the 7th volume of the manga, scheduled to ship on August 26, 2015. It will be a sea bathing episode.(Source: MAL News)"
72,5772,25839,Bonjour♪Koiaji Pâtisserie,"Comedy, Harem, Romance, Shoujo, Slice of Life",ONA,24,6.35,22127,"With dreams of becoming a pâtissiere, Sayuri Haruno has worked hard for her scholarship to Fleurir Confectionery Academy, an elite school designed to train world class pastry chefs. The staff consists of unrivalled pâtissiers, who work with absolute precision—the prince-like Mitsuki Aoi, famous for his work with chocolate; the friendly and extroverted Gilbert Hanafusa, an expert in confectionery hailing from France; and the stoic Yoshinosuke Suzumi, who has perfected the art of Japanese sweets.Upon admission to the school, Sayuri is thrust into a world of advanced baking, surrounded by both supportive and charming staff and fascinating classmates. Sayuris attention is captured by the dedicated Ryou Kouzuki, who seems to share the same determination to achieve his dream.Sayuri is set on the path for greatness, and her newly cultivated culinary skill will help her handle any challenge the school throws her way."
96,5796,30585,Taifuu no Noruda,"Drama, School, Sci-Fi, Supernatural",Movie,1,6.35,14281,"On the eve of a junior high schools cultural festival, Typhoon No. 8 slowly approaches the isolated Okinawan town of Naha. A mysterious girl wearing a strange necklace suddenly appears alongside the storm, catching Shuuichi Azuma off guard. After getting into a fight with his best friend Kenta Saijou over his decision to quit the baseball team, Azuma notices the same girl standing atop an electrical tower when lightning strikes, cutting power to the school and causing her to tumble down below. Unwilling to stay in the same room as Saijou, Azuma runs off to rescue the strange girl as the storm intensifies."
