,Unnamed: 0,anime_id,name,genre,type,episodes,rating,members,synopsis
68,1168,13245,New Prince of Tennis Specials,"Action, Comedy, Shounen, Sports",Special,7,7.65,5524,"Shouhei Zenya (The Night Before The Invitation)Prior to the U-17 training camp invitations, the middle schoolers spend their last few days of leisure relaxing and goofing off with each other. Kami no Ko vs Koutei (Child of God vs. Emperor)The tiebreaker-style elimination match between Rikkai University-Affiliated Middle Schools Seiichi Yukimura and Genichirou Sanada pits two of the ""Three Demons against each other. As the two fight to stay in the camp, the history between the ""Child of God"" and the ""Emperor is revealed.Densetsu wo Tsugusha-tachi (The One That Stands On Top)In the next set of tiebreaker-style elimination matches, Shitenhouji Middle Schools Kenya Oshitari and Kuranosuke Shiraishi must face off. As both players have been harboring heavy feelings since the Nationals one year prior, they decide to settle it in this high-stakes match.Shousha no Imi (What it Means to be a Winner)Following the elimination matches, the winners are treated to a luxurious experience after a brutal training session. Some of the middle schoolers contend with each other over the point of the camp now that the losers are gone. They decide to settle their disagreements in the most appropriate way possible: by playing table tennis.Otoko-tachi no Kizuna (Bonds Between Men)After Hyoutei Academys Choutarou Ootori loses his first court shuffle match, he becomes disheartened and begins to question if he deserves to stay in the camp. Rikkais Bunta Marui decides to give him some advice to help him overcome his defeat.Tenshi to Seijo (Angel and Bible)The court shuffle matches between Courts 3 and 5 pairs Rikkais Akaya Kirihara and Shitenhoujis Kuranosuke Shiraishi together. As the game grows progressively more difficult, Kirihara becomes agitated by their opponents. Remembering a promise he made to Kiriharas teammate, Shiraishi must prevent the young boy from losing control of his temper at all costs.Himitsu no Ouji-sama (Prince of Secrets)The middle schoolers become restless and irritated when the camps food supply begins to run low from a harsh storm. Seishun Academys Satoshi Horio must deliver a bag to his teammate, Ryouma Echizen, but the angry middle schoolers start to believe that he is hiding food from them. In an attempt to claim the bags contents, they all begin to fight each other as Horio tries to outsmart and run past them."
69,1169,3673,Nijuu Mensou no Musume,"Action, Adventure, Mystery",TV,22,7.65,21009,"Chiko is the daughter of the wealthy Mikamo family who has to live with her aunt and uncle after her parents passed away. Because her aunt wants to inherit the Mikamo familys wealth, she gives Chiko poisoned food. One day, however, shes kidnapped by the Nijuu Mensou (20 Faces) and decides to join his clan. (Source: ZOMG)"
70,1170,21667,Non Non Biyori: Okinawa e Ikukoto ni Natta,"Comedy, School, Seinen, Slice of Life",OVA,1,7.65,25169,"While spending a summer day at the department store, Suguru Koshigaya wins the lottery’s grand prize—four tickets to Okinawa! Filled with awe and excitement, the girls of Asahigaoka do various things to prepare for the trip. From practicing how to ride on an airplane to buying travel essentials at the convenience store, they do everything beforehand so they can enjoy their time in Okinawa to the fullest extent.A departure from the familiar scenery of Asahigaoka is a new experience for Renge Miyauchi, but that does not stop her from pondering how her perspective of the world may change. As the day of the trip draws near, a promise is made."
71,1171,3848,"One Piece Movie 9: Episode of Chopper Plus - Fuyu ni Saku, Kiseki no Sakura","Action, Adventure, Comedy, Fantasy, Shounen, Super Power",Movie,1,7.65,29771,"As Nami has fallen seriously ill, the Straw Hats head to Drum Island in search of a doctor. However, they learn that there is only one doctor left on the island, the reclusive Dr. Kureha who currently resides at the top of a mountain. With a sick Nami in tow, Monkey D. Luffy and Sanji set out on an arduous journey to seek her help. Meanwhile, the return of Wapol—Drum Islands former king—and his brother spells trouble for the islands inhabitants. As the one responsible for the current lack of doctors, Wapol has finally returned to take back his position as the peoples despot and absolute ruler.With the help of new allies like the half-human reindeer Chopper Tony Tony, the Straw Hat Crew must overcome all the obstacles in its way to save Namis life and stop Wapol from plunging Drum Island back into tyranny. (Source: Wikipedia) "
72,1172,26243,Owari no Seraph,"Action, Drama, Shounen, Supernatural, Vampire",TV,12,7.65,315630,"With the appearance of a mysterious virus that kills everyone above the age of 13, mankind becomes enslaved by previously hidden, power-hungry vampires who emerge in order to subjugate society with the promise of protecting the survivors, in exchange for donations of their blood.Among these survivors are Yuuichirou and Mikaela Hyakuya, two young boys who are taken captive from an orphanage, along with other children whom they consider family. Discontent with being treated like livestock under the vampires cruel reign, Mikaela hatches a rebellious escape plan that is ultimately doomed to fail. The only survivor to come out on the other side is Yuuichirou, who is found by the Moon Demon Company, a military unit dedicated to exterminating the vampires in Japan.Many years later, now a member of the Japanese Imperial Demon Army, Yuuichirou is determined to take revenge on the creatures that slaughtered his family, but at what cost?Owari no Seraph is a post-apocalyptic supernatural shounen anime that follows a young mans search for retribution, all the while battling for friendship and loyalty against seemingly impossible odds."
73,1173,5419,Paniponi Dash!: Danjite Okonaeba Kishin mo Kore wo Saku,"Comedy, Parody, School",Special,1,7.65,6929,Paniponi Dash! special included in the DVD-Box.
74,1174,46,Rurouni Kenshin: Meiji Kenkaku Romantan - Ishinshishi e no Chinkonka,"Drama, Historical, Samurai, Shounen",Movie,1,7.65,33191,"The war against the Tokugawa Shogunate ended years ago. But there are some who are not happy with the outcome. Shigure Takimi watched his friends and family get slashed down in the name of freedom and prosperity. Now he and a band of desperate rebels have sworn to settle one final score. Only one man stands in their way: Kenshin Himura. But when Shigure discovers Kenshins true identity as the Hitokiri Battousai, his fight becomes a personal vendetta.(Source: ANN)"
75,1175,16241,"Yondemasu yo, Azazel-san. Z","Comedy, Demons, Supernatural",TV,13,7.65,20640,"The second season of Yondemasu yo, Azazel-san."
76,1176,2198,Aa! Megami-sama!: Sorezore no Tsubasa Specials,"Comedy, Magic, Romance, Seinen, Supernatural",Special,2,7.64,16986,"When Keiichi found his grandpas diary and saw a treasure map inside, Skuld and Urd started to feel a great urge to search it. With the company of his friends, Keiichi arrives to Honda Inn, the place indicated on the map. Once the party is inside, they meet Honda Chieko, who seems to share a certain promise with Keiichi. Apart from all that confusion, its time for Keiichi to have enough courage to say the words ""I love you"" to Belldandy."
77,1177,1239,Bishoujo Senshi Sailor Moon SuperS,"Drama, Magic, Romance, Shoujo",TV,39,7.64,55056,"SuperS centers heavily on Chibi-usa and the Sailor Team. A new enemy, the Dead Moon Circus, has now appeared. Their motive is to find the Golden Dream Mirror that would be used to rule the world. To do this, the enemy attacks innocent victims for their Dream Mirrors and test their energy. Chibi-usa also has a new ally on her side, Pegasus. This season also sees the Sailor Senshi obtaining new powers. "
78,1178,2768,CLAMP in Wonderland 2,"Action, Comedy, Drama, Fantasy, Magic, Music, Romance",Music,1,7.64,13985,A short animation which features clips from all of CLAMPs works between 1995 and 2006.
79,1179,2514,Detective Conan OVA 04: Conan and Kid and Crystal Mother,"Adventure, Mystery, Police, Shounen",OVA,1,7.64,8974,"Once again, Kaitou Kid has a target in mind: the Crystal Mother, Europes largest topaz owned by Queen Selizabeth of the Principality of Ingram. He intends to steal this jewel while the Queen is stuck on a train from Tokyo to Osaka. However, Kids abilities are put to the test, as the Queen has already concealed the gem somewhere aboard the train. Conan Edogawa, who is among trains passengers, suspects an attack from the phantom thief and begins investigating on his own, while Inspector Ginzou Nakamori is ready for a new confrontation against the elusive jewelry robber. "
80,1180,1394,Future GPX Cyber Formula Saga,"Drama, Sci-Fi, Shounen, Sports",OVA,8,7.64,1040,"After his disappointing loss in the last round of the 14th Cyber Formula World Grand Prix, which causes him the championship, Hayato Kazami decides that he needs a change and switches over to the Sugo Garland SF-03 for the 15th Cyber Formula World Grand Prix while he waits for the newest Asurada design. However, his hope to make up for the past years letdown is made difficult when Aoi ZIP Formula undergoes a major restructuring and brings in Kyoshiro Nagumo as the new president of the team. The new car that he brought to the team, driven by newcomer Phil Fritz, is seemingly unbeatable...(Source: ANN)"
81,1181,17187,Ghost in the Shell: Arise - Border:1 Ghost Pain,"Mecha, Police, Psychological, Sci-Fi",Movie,1,7.64,31747,"The animes story is set in 2027, one year after the end of the fourth non-nuclear war. New Port City is still reeling from the wars aftermath when it suffers a bombing caused by a self-propelled mine. Then, a military member implicated in arms-dealing bribes is gunned down.During the investigation, Public Security Sections Daisuke Aramaki encounters Motoko Kusanagi, the cyborg wizard-level hacker assigned to the militarys 501st Secret Unit. Batou, a man with the ""eye that does not sleep,"" suspects that Kusanagi is the one behind the bombing. The Niihama Prefectural Police detective Togusa is pursuing his own dual cases of the shooting death and a prostitutes murder. Motoko herself is being watched by the 501st Secret Units head Kurutsu and cyborg agents.(Source: ANN)"
82,1182,11663,Hakuouki OVA,"Action, Drama, Historical, Samurai, Supernatural",OVA,2,7.64,7791,"Two short OVA of Hakuouki distributed to those who purchased all six volumes of the DVD. A fandisc game ""Hakuoki Zuisouroku"" and an official parody ""Hakuoki SSL (a high school parody)"" were animated."
83,1183,270,Hellsing,"Action, Horror, Seinen, Supernatural, Vampire",TV,13,7.64,308995,"Hellsing, an organization specializing in dealing with supernatural threats, is called in to eliminate a vampire that is turning the villagers of Cheddar into ghouls. To put an end to this, the leader of the organization, Sir Integra Fairbrook Wingates Hellsing, dispatches her most formidable asset: a powerful vampire known as Alucard.Armed with only a single handgun, Alucard wreaks havoc on the monsters plaguing Cheddar. However, a young police officer, Seras Victoria, gets caught up in the chaos and becomes mortally wounded as a result. Taking pity on the girl, Alucard gives her a choice: die as a human or live on as a vampire. Seras accepts his offer and begins a new life as a member of Hellsing.Though it was her decision, Seras struggles with the fact that she is no longer human. Nevertheless, she must embrace being a creature of the night soon if she wants to survive on the front lines in the fight between humans and the supernatural."
84,1184,1356,Hokuto no Ken 2,"Action, Drama, Martial Arts, Super Power",TV,43,7.64,11090,In the second series after Raoh has been defeated by Kenshiro a new rival appears. The Gentou Kouken warriors. Falco the successor of the Gentou Kouken takes orders from an evil ruler by the name of Jacko. He claims to be the man chosen by the Tentei and issues orders to his subordinates to capture anyone living in order to build up his Imperial Capital. Kenshiro once again rises out of the shadows and puts an end to his tyrannical ways. Amidst the mayhem Lynn gets captured and gets taken to the land of the Shura where only ruthless fighters exist. Now Kenshiro must pursue the captor and defeat the 3 Rasho of the land in order to escape with his life and with Lynn.
85,1185,6553,Junjou Romantica Special,"Comedy, Romance, Shounen Ai",Special,1,7.64,17378,Voice actors comment various scenes from the anime.
86,1186,1567,Kaitou Saint Tail,"Adventure, Magic, Romance, Shoujo",TV,43,7.64,8794,"Meimi Haneoka, 14, is a normal girl during the daytime, but during the night, she assumes the ""position"" of Saint Tail, a modern-day Robin Hood who steals from thieves and gives items back to their original owners. She is aided by her friend, Seira Mimori, a nun-in-training, and she is chased by her classmate (and soon-to-be love interest), Daiki Asuka (often called ""Asuka Jr.""). (Source: ANN)"
87,1187,15437,Kore wa Zombie Desu ka? of the Dead OVA,"Action, Comedy, Ecchi, Harem, Magic, Supernatural",OVA,1,7.64,54828,An unaired OVA episode of Kore wa Zombie Desu ka? of the Dead. It is the 11th episode and was bundled with the sixth volume of the manga. 
88,1188,13655,Little Busters!,"Comedy, Drama, School, Slice of Life, Supernatural",TV,26,7.64,138655,"As a child, Riki Naoe shut himself from the world, thanks to a diagnosis of narcolepsy following the tragic deaths of his parents. However, Riki is saved when, one fateful day, a boy named Kyousuke recruits him into a team who call themselves the Little Busters. Accompanied by Masato, Kengo, and Rin, these misfits spend their childhood fighting evil and enjoying their youth.Years pass, and even in high school, the well-knit teammates remain together. Kyousuke decides to re-ignite the Little Busters by forming a baseball team as it will be his last school year with them. They have a problem though: there arent enough members! The tables have turned, for it is now Rikis turn to reach out and recruit new friends into the Little Busters, just like Kyousuke had once done for him.Then, an omen surfaces—Rin finds a strange letter attached to her cat, assigning them the duty of uncovering the ""secret of this world"" by completing specific tasks. Just what is this secret, and why is it being hidden? Its up to the Little Busters to find out!"
89,1189,334,Marmalade Boy,"Comedy, Drama, Romance, Shoujo",TV,76,7.64,24745,"Miki Koishikawa is a high school student who enjoys a very simple life. However, her ordinary life is about to be turned upside down, and she may not be able to handle everything that is coming her way.After a very ""fun"" holiday in Hawaii, her parents have decided to get a divorce. As if this wasn’t enough of a shock for the poor girl, she also discovers that they will soon be re-marrying and swapping partners with another couple who they met on holiday. In order to include Miki in this shocking turn of events, they ask her to give the new couple a chance, and set up a dinner date with everyone. Miki may have tried to be emotionally prepared for her new parents, but what she was not expecting was their handsome son Matsuura Yuu.Miki develops an instant crush for Yuu. What starts off as a lovely friendship between them soon develops into romantic feelings which they are both finding hard to control. But more trouble is ahead in their relationship, as both Miki and Yuu have admirers of their own who are trying very hard to keep them separated."
90,1190,7651,Ningen Shikkaku: Director&#039;s Cut-ban,"Drama, Historical, Psychological, Seinen",Movie,1,7.64,4292,"A theatrical film version of Madhouses Aoi Bungaku Series anime. The film will re-edit the four episodes based on Osamu Dazais No Longer Human (Ningen Shikkaku) novel, which have character designs inspired by manga artist and novel illustrator Takeshi Obata. This ""directors cut"" will include new ""navigation"" footage which is being created specifically for the film with narrator Masato Sakai."
91,1191,1029,Omoide Poroporo,"Drama, Romance, Slice of Life",Movie,1,7.64,39589,"Taeko Okajima is a 27-year-old, independent woman who spent her entire life in Tokyo. Looking to unwind from the rush of the big city, she decides to visit her family in the country to help out during the harvest.On the train there, Taeko vividly recalls her memories as a schoolgirl in the initial stages of puberty, as if she is on a trip with her childhood self. A young farmer named Toshio picks her up at the station, and they quickly develop a friendship. During her stay, Taeko forms strong bonds with family and friends, learning the contrasts between urban and rural life, as well as the struggles and joys of farming.Nostalgic and bittersweet, Omoide Poroporo takes on Taekos journey as an adult woman coming to terms with her childhood dreams compared to the person she is today."
92,1192,209,R.O.D the TV,"Action, Adventure, Comedy, Drama, Sci-Fi, Super Power",TV,26,7.64,47053,"Anita King, Maggie Mui, and Michelle Cheung are the Paper Sisters. They run the Three Sisters Detective Agency in Hong Kong which is dedicated to solving cases involving books. They are hired as local guides for Nenene Sumiregawa, a Japanese novelist who has been struggling with writers block following the disappearance of her longtime friend, Yomiko Readman. The sisters are all Paper Masters—individuals with the power to control paper—and with their abilities, they save Nenene from the dangerous terrorists targeting her at a book signing. But in case they strike again, the sisters remain as her bodyguards to protect her from further harm.This is a dream come true for bookworms Maggie and Michelle who love Nenenes stories, but the young Anita cannot stand books despite her powers over paper. The three struggle to adapt to their new daily life in Japan, guarding Nenene while continuing their detective work under a mysterious organization, Dokusensha. However, the more they get to know Nenene, the more they discover the link between her, the disappearance of her friend Yomiko, and the mysterious books Dokusensha sends the Paper Masters to investigate. What began as a simple job ends up a bigger case than they have ever had before. Are these girls really willing to risk their lives over literature?"
93,1193,15775,Saint☆Oniisan,"Comedy, Seinen, Slice of Life",OVA,2,7.64,33668,"Jesus Christ and Gautama Buddha, the founders of Christianity and Buddhism, are living together as roommates in a Tokyo apartment while taking a vacation on Earth. The comedy often involves jokes about Christianity, Buddhism, and all things related, as well as the main characters attempts to hide their identities and understand modern society in Japan."
94,1194,10469,Sayonara Zetsubou Sensei Special,"Comedy, Mystery, Parody",Special,1,7.63,9669,"A new special episode that was distributed to those who purchase all three Blu-ray box sets of Sayonara Zetsubou Sensei series on January 31, 2012. "
95,1195,16524,Suisei no Gargantia,"Action, Adventure, Mecha, Sci-Fi",TV,13,7.64,170754,"In the distant future, a majority of humans have left the Earth, and the Galactic Alliance of Humanity is founded to guide exploration and ensure the prosperity of mankind. However, a significant threat arises in the form of strange creatures called Hideauze, resulting in an interstellar war to prevent humanitys extinction. Armed with Chamber, an autonomous robot, 16-year-old lieutenant Ledo of the Galactic Alliance joins the battle against the monsters. In an unfortunate turn of events, Ledo loses control during the battle and is cast out to the far reaches of space, crash-landing on a waterlogged Earth.On the blue planet, Gargantia—a large fleet of scavenger ships—comes across Chamber and retrieves it from the ocean, thinking they have salvaged something of value. Mistaking their actions for hostility, Ledo sneaks aboard and takes a young messenger girl named Amy hostage, only to realize that the residents of Gargantia are not as dangerous as he had believed. Faced with uncertainty, and unable to communicate with his comrades in space, Ledo attempts to get his bearings and acclimate to a new lifestyle. But his peaceful days are about to be short-lived, as there is more to this ocean-covered planet than meets the eye. "
96,1196,10714,Towa no Quon 3: Mugen no Renza,"Action, Super Power, Supernatural",Movie,1,7.64,19053,The story follows a boy named Quon and others who suddenly wake up with supernatural powers.
97,1197,32899,Watashi ga Motete Dousunda,"Comedy, Harem, Romance, School, Shoujo",TV,12,7.64,57638,"Kae Serinuma is a very kind second-year high school student and a devoted otaku. A little known fact about her, though, is that shes obsessed with BL, or Boys Love. Serinuma cant help but to fantasize about her male classmates falling for each other and enjoys imagining them together. A more known fact about Serinuma, however, is that she’s noticeably overweight. While watching her favorite show one day, Serinuma witnesses the death of her most beloved character. Utterly depressed, she cant muster up the energy to eat her meals, let alone attend school. After an entire week, she finally recovers. But now theres something unusual about her—during the time she refused to leave her room, she ended up losing a large amount of weight and has somehow become strikingly beautiful!Now catching the eye of everyone who sees her, she finds herself at the center of attention of four boys she has always known at her school. Though they all wish to spend time with her, Serinuma would much rather they spend time falling in love with one another. How will Serinuma deal with the four boys pursuing her BL-obsessed self?"
98,1198,10216,"Yondemasu yo, Azazel-san. (TV)","Comedy, Demons, Supernatural",TV,13,7.64,42147,"Akutabe is a detective who summons devils to solve the troubles of his clients. One day, a low class devil Azazel Atsushi is summoned by Akutabe and is used harshly by him and his assistant Rinko."
99,1199,6408,&quot;Bungaku Shoujo&quot; Movie,"Drama, Mystery, Romance, School",Movie,1,7.63,40984,"The protagonist of the story, Konoha Inoue, is a seemingly normal senior high 2nd year student. His high school life, other than a hinted incident 2 years ago, can be summed up as normal- if one can dismiss the secret fact that he used to be a female bestselling romance author. Due to that incident, however, he has now vowed never to write again.This continued on until he was forced to join the literary club by the literary club president, the 3rd year female student Amano Tooko, a beautiful girl who has a taste for eating literary works. Now he has been tasked with writing her snack every day after school.(Source: To Say Nothing of the Dog) "
