,Unnamed: 0,anime_id,name,genre,type,episodes,rating,members,synopsis
0,400,9941,Tiger &amp; Bunny,"Action, Comedy, Mystery, Super Power",TV,25,8.12,104075,"In Stern Bild City, those with special abilities are called ""NEXT,"" and can use their powers for good or bad. A unique organized group of NEXT appear regularly on Hero TV, where they chase down evildoers to bring limelight to their sponsors and earn Hero Points in the hopes of becoming the next ""King of Heroes.""Kotetsu T. Kaburagi, known as ""Wild Tiger,"" is a veteran hero whose performance has been dwindling as of late, partially due to his inability to cooperate with other heroes. After a disappointing season in which most of the other heroes far outperformed Tiger, he is paired up with a brand new hero who identifies himself by his real name—Barnaby Brooks Jr.Barnaby, nicknamed ""Bunny"" by his frivolous new partner, quickly makes it clear that the two could not be more different. Though they mix as well as oil and water, Tiger and Bunny must learn to work together, both for the sake of their careers and to face the looming threats within Stern Bild."
1,401,14813,Yahari Ore no Seishun Love Comedy wa Machigatteiru.,"Comedy, Drama, Romance, School",TV,13,8.12,353876,"Hachiman Hikigaya is an apathetic high school student with narcissistic and semi-nihilistic tendencies. He firmly believes that joyful youth is nothing but a farce, and everyone who says otherwise is just lying to themselves. In a novel punishment for writing an essay mocking modern social relationships, Hachimans teacher forces him to join the Volunteer Service Club, a club that aims to extend a helping hand to any student who seeks their support in achieving their goals. With the only other club member being the beautiful ice queen Yukino Yukinoshita, Hachiman finds himself on the front line of other peoples problems—a place he never dreamed he would be. As Hachiman and Yukino use their wits to solve many students problems, will Hachimans rotten view of society prove to be a hindrance or a tool he can use to his advantage?"
3,403,21855,Hanamonogatari,"Comedy, Mystery, Supernatural",TV,5,8.11,124886,"Now that Koyomi Araragi and Hitagi Senjougahara have graduated, very few familiar faces remain at Naoetsu Private High School, one of them being Kanbaru Suruga, holder of the Monkeys Paw. When she begins to hear talk of a mysterious being known as the ""Devil,"" who will magically solve any problem, she immediately thinks these rumors are about her and decides to investigate.She discovers the Devil is actually Rouka Numachi, a former rival from junior high who is providing free advice to those who seek her out now that she is no longer able to play basketball due to a leg injury. Acting as a collector of misfortune, she enjoys relieving the stress of her clients by providing them with the false hope of having their problems solved. Although Kanbaru sees no real harm being done, she reprimands Rouka for lying and heads home, relieved she is not the cause of the rumors. But when she finds that her left hand has reverted back to its human form, she may have a reason to worry after all..."
5,405,2159,Ookiku Furikabutte,"Comedy, Sports",TV,25,8.11,49599,"Ren Mihashi was the ace of his middle schools baseball team, but due to his poor pitching, they could never win. Constant losses eventually lead to his teammates bullying him and reached the point where his teammates no longer tried to win, causing Mihashi to graduate with little self-esteem. As a result, Mihashi decides to go to a high school in a different prefecture where he has no intention of playing baseball. Unfortunately, upon his arrival at Nishiura High, he is dragged into joining their new team as the starting pitcher.Although unwilling at first, Mihashi realizes that this is a place where he will be accepted for who he is; with help from the catcher Takaya Abe, he starts to have more confidence in his own abilities. Abe, seeing the potential in Mihashi, makes it a goal to help him become a pitcher worthy of being called an ace."
6,406,28297,Ore Monogatari!!,"Comedy, Romance, Shoujo",TV,24,8.11,200833,"With his muscular build and tall stature, Takeo Gouda is no ordinary high school freshman. However, behind Takeos intimidating appearance lies a pure heart of gold, and he is considered a hero by his male peers for his courage and chivalry. Unfortunately for Takeo, his appearance does not bode well for his love life. As if his looks were not already enough to scare the opposite sex away, Takeos cool, handsome best friend and constant companion Makoto Sunakawa easily, and unintentionally, steals the hearts of the female students—including every girl Takeo has ever liked.One day, when Takeo saves cute Rinko Yamato from being molested, he falls in love with her instantly. Unfortunately, he suspects that she might be interested in Sunakawa. Despite his romantic feelings for Yamato continuing to bloom, Takeo decides to act as her cupid, even as he yearns for his own love story."
8,408,2154,Tekkon Kinkreet,"Action, Adventure, Psychological, Supernatural",Movie,1,8.11,46018,"The streets of Treasure Town are said to belong to ""The Cats."" They know everything that goes on in the city, and no one can stir up trouble without going through them first. In reality, The Cats are a pair of orphan boys called Black and White, who aren’t afraid of anything or anyone. But their rule of the streets is challenged when the Yakuza come to town and start making changes. The wild Black and the carefree White have no one to rely on but themselves to get their Treasure Town back to the way it was. But their bond is tested as they quickly realize going back to how things were may no longer be an option."
10,410,861,xxxHOLiC,"Comedy, Drama, Mystery, Psychological, Supernatural",TV,24,8.11,150872,"Kimihiro Watanuki can see spirits and other assorted supernatural creatures, which is quite a bothersome ability he strongly dislikes. On the way home one day, while plagued by some spirits, he is inexplicably compelled to enter a strange house. There, he encounters Yuuko, a mysterious woman who claims to be able to rid him of the ability to see and attract the troublesome creatures—for a price. She demands that he work at her ""store"" that grants wishes to people, and thus begins Watanukis adventures through weird and wonderful events."
11,411,1689,Byousoku 5 Centimeter,"Drama, Romance, Slice of Life",Movie,3,8.1,324035,"What happens when two people love each other but just arent meant to be together? Takaki Toono and Akari Shinohara are childhood friends, but circumstances beyond their control tear them apart. They promise to stay in contact, and although the progression of time widens the distance between them, the chain of memories remains ever-present.Byousoku 5 Centimeter is a romantic drama that focuses on the mundane and harsh reality of long-distance relationships. Stuck in the past and unable to make any new memories, Takaki and Akari cling to the hope of seeing each other again. They live their everyday lives half-heartedly, both hurting themselves and the people around them."
12,412,34103,Danganronpa 3: The End of Kibougamine Gakuen - Kibou-hen,"Action, Horror, Mystery, Psychological",Special,1,8.1,29969,"The Future Foundation is in shambles after the Final Killing Game and the revelation of the true culprit. As a desperate plot arises from one of the survivors to rid the world of despair once and for all, the remaining Future Foundation members must band together to stop this atrocity from taking place. Fortunately, they find themselves with help from a group of unlikely allies as they race against the clock to stop their world from being changed.In this finale to the Hopes Peak storyline of the Danganronpa series, the players in this neverending death game begin to understand the true meaning behind despair, hope, and atonement."
13,413,3665,Ginga Eiyuu Densetsu Gaiden: Rasen Meikyuu,"Drama, Military, Sci-Fi, Space",OVA,28,8.1,7712,"Ginga Eiyuu Densetsu Gaiden (1999) is the second of two OVA adaptations of side stories from the Ginga Eiyuu Densetsu novel series. This second adaptation follows the achievements of Yang Wen-li of the Free Planets Alliance before the fateful Battle of Astarte, and continues the tales of Reinhard von Müsel and Siegfried Kircheis of the Galactic Empire.Spiral LabyrinthYang is propelled to the spotlight after his famous evacuation of civilians from El Facil. Following an unofficial double promotion and a flurry of media attention, he chronicles his research of the Year 730 Mafia—a close-knit group of Alliance military officers centered around the famed tactician Bruce Ashbey. He investigates a startling claim by Ashbeys deceased widow that may have enormous political ramifications: that the great war hero was not killed in action but murdered.The MutineerReinhard and Kircheis are posted on the destroyer Hameln II, docked at Iserlohn Fortress. After gaining the respect of the crew, Reinhards leadership is tested when the captain is severely wounded and passes command authority to Reinhard, the next-highest ranking officer on deck.The DuelistWhile Reinhard and Kircheis are working in the Imperial capital Odin, Reinhard learns of a mining rights dispute involving Dorothea von Schaffhausen, a friend of his sister Annerose von Grünewald. Upon hearing that Count Herxheimer intends to settle the matter with a duel, Reinhard volunteers to represent the Schaffhausen family.The RetrieverAfter falling out of favor with the nobility, Count Herxheimer is trying to escape to the Free Planets Alliance with a stolen Seffle particle generator prototype. Reinhard is tasked with retrieving both the prototype and the defector, but is only assigned the cruiser Hässliche Entlein due to the confidential nature of the mission.The Third Battle of TiamatTo commemorate the 30th year of the reign of Kaiser Friedrich IV, the Empire announces a large-scale military campaign against the Free Planets Alliance. In the ensuing clash between the Imperial expeditionary force and three Alliance fleets, Reinhards timely intervention shapes the tides of war."
15,415,7711,Karigurashi no Arrietty,Fantasy,Movie,1,8.1,97910,"While spending the summer at his aunts house, the young but sickly Shou makes an amazing discovery: after following the house cat into the bushes, he gets a glimpse of a miniature girl about the size of his finger! Calling her kind ""Borrowers,"" as they survive on tiny bits of human possessions, the girl introduces herself as Arrietty. As he discovers that she lives in the house basement with her parents, Pod and Homily, Shou becomes imaginably excited at the idea of such unique neighbors.However, he fails to understand the adversities they face on a daily basis. In addition to keeping their existence hidden, they must also embark on perilous adventures into human territory, from the house to the outdoors, in order to make a living. Despite her parents warnings, Arrietty befriends Shou, stirring up unexpected events that may change their lives forever.Delighting the eye and conquering the heart, the breath-taking story of a friendship transcending the tensions between two different human kinds begins."
16,416,77,Mahou Shoujo Lyrical Nanoha A&#039;s,"Action, Comedy, Drama, Magic, Super Power",TV,13,8.1,41685,"After solving the incident of the scattered Jewel Seeds, Nanoha Takamachi happily returns to her everyday life, though now with added magic practice in the morning. Exchanging video messages with Fate Testarossa and the crew of the Arthra, Nanoha eagerly awaits the chance to speak with them in person again. But while studying in her room one day, Raising Heart suddenly calls out to Nanoha and warns her of an incoming attack!The attacker is a young girl named Vita, who calls herself a Belka Knight. She proves her strength by using an intelligent device with a mysterious cartridge system to quickly overwhelm Nanoha. Luckily, the Space-Time Administration Bureau is able to step in before she is completely crushed. Vita and her fellow knights Shamal, Signum, and Zafila are on a mission to steal magical power from mages in order to complete the Book of Darkness, one of the Lost Logia. For what sinister purpose are the knights after this Book of Darkness?"
18,418,32093,Tanaka-kun wa Itsumo Kedaruge,"Comedy, School, Slice of Life",TV,12,8.1,101335,"For high school student Tanaka, the act of being listless is a way of life. Known for his inattentiveness and ability to fall asleep anywhere, Tanaka prays that each day will be as uneventful as the last, seeking to preserve his lazy lifestyle however he can by avoiding situations that require him to exert himself. Along with his dependable friend Oota who helps him with tasks he is unable to accomplish, the lethargic teenager constantly deals with events that prevent him from experiencing the quiet and peaceful days he longs for."
19,419,12113,Berserk: Ougon Jidai-hen II - Doldrey Kouryaku,"Action, Adventure, Demons, Drama, Fantasy, Horror, Military, Seinen, Supernatural",Movie,1,8.09,66721,"The Band of the Hawk and their enigmatic leader Griffith continue winning battle after battle as their prestige throughout the kingdom of Midland grows. But their latest task is one that has seen failure from everyone who has attempted it: the subjugation of the impenetrable fortress of Doldrey. But with members like Guts—the captain of the Hawks raiders who can easily fell 100 men with his gigantic sword—such tasks prove to be trivial. However, in the aftermath of the battle, Guts decides to leave the Hawks in order to pursue his own dream and bids farewell to his companions, despite Griffiths attempts to make him stay. This single event causes Griffith to lose his composure, and leads him to make a decision that will alter his and the Hawks fates forever."
20,420,7338,Darker than Black: Kuro no Keiyakusha Gaiden,"Action, Mystery, Sci-Fi, Super Power",Special,4,8.09,136135,"Fleeing from the consequences of his decision at the Hells Gate, superpowered Contractor Hei and his companion Yin take refuge in a quiet inn, adopting the guise of a married couple in order to not draw suspicion. In an attempt to recover from recent events, Hei befriends the inns other guests. He discovers that one of them is a fellow Contractor tasked with killing him. Their resulting encounter spells disaster for both Hei and Yin, who are forced to fight for their lives and grapple with the emotional wounds sustained in their previous life together."
22,422,3014,Ginga Eiyuu Densetsu: Waga Yuku wa Hoshi no Taikai,"Action, Historical, Military, Sci-Fi, Space",Movie,1,8.09,15069,"Four months before Count von Lohengramm of the Galactic Empire faced Yang Wen-li of the Free Planets Alliance at the Battle of Astarte, he was still just Reinhard von Müsel. The youngest admiral in the Empires history, Reinhard was disdained and dismissed by his peers as the brother of the Kaisers concubine. Upon arriving at Iserlohn Fortress with his expeditionary fleet, Reinhard immediately receives an order from the ambitious and cunning Fleet Admiral Gregor von Mückenberger: to intercept an Alliance fleet in a neighboring starzone. Despite recognizing this as a veiled attempt to get him killed in combat, Reinhard nevertheless orders his tired and weary men to engage the enemy in the atmosphere of the gas giant Legnica. But unbeknownst to him, this will mark the first of his many historic encounters with the Hero of El Facil."
24,424,11135,Hybrid Child,"Drama, Historical, Romance, Sci-Fi, Shounen Ai",OVA,4,8.09,26036,"The skilled craftsman Kuroda created artificial humans called Hybrid Child—creatures who are neither machines nor dolls, but rather a reflection of the love shown to them. While they can feel human emotions and have their own consciousness, they are not real humans and require love to grow.Kotarou Izumi is the young heir to the noble Izumi family, so it is frowned upon when he brings an abandoned Hybrid Child he found in the garbage into their household. His family even attempts to throw away Hazuki—Kotarous name for the Hybrid Child—multiple times when he is not paying attention. But through overcoming these obstacles, their love and the bond connecting them grow stronger. However, ten years pass before a horrifying realization dawns on them: a Hybrid Child might not have an endless life span.Hybrid Child is a collection of three short love stories, depicting the relationship between the artificial humans and their owners."
25,425,5781,Isekai no Seikishi Monogatari,"Action, Comedy, Ecchi, Fantasy, Harem, Mecha, School",OVA,13,8.09,72021,"Kenshi Masaki has been kidnapped and brought to the world of Geminar by a mysterious group. To get back home, he agrees to help them assassinate the newly crowned empress of the Shtrayu Empire, Lashara Aasu XXVIII, using a giant robot called a Sacred Mechanoid.As her army fights them off, Lashara takes note of Kenshis abilities and demands that her attacker be captured alive, only to find out that the pilot is male which is extremely rare on Geminar. Believing it to be a waste to kill him, she makes Kenshi her attendant.As the empress new servant, Kenshi is required to accompany Lashara to the Holy Land, an academy where Sacred Mechanoid pilots hone their skills. His arrival attracts attention, but Kenshi is unaware that something sinister is brewing within the academy and it could plunge the entire world into war."
27,427,5678,Kobato.,"Comedy, Drama, Fantasy",TV,24,8.09,88986,"The friendly and sincere Kobato Hanato has a wish to go to a particular place no matter what. To fulfill this desire, she is tasked with helping people in their times of distress. For each mended broken heart, a small candy-like fragment is produced and fills a special bottle. Once the bottle is full, her wish will be granted.As Kobato carries out her mission alongside her stuffed toy companion, Ioryogi, she encounters various people troubled by their different situations. From a child struggling with his parents, a high school girl troubled about romance, and everything in between, Kobatos naturally sweet smile and outgoing personality are ready to brighten their day!"
28,428,6774,Kuuchuu Buranko,"Comedy, Drama, Psychological, Seinen",TV,11,8.09,41521,"The world of psychology is far from strange to the unusual Dr. Ichirou Irabu, a resident psychiatrist of Irabu General Hospital. He and his charming nurse Mayumi run through several patients, each suffering from a mental illness that harms their everyday life. Patients should be wary of the seductive Mayumi, with her spellbinding looks and devilishly short pink nurse uniform. On the other hand, the doctor seems to have three separate personalities: a child with an oversized lab coat; an intelligent, youthful man with feminine traits; and a selfish, outgoing green bear. While curing his patients in questionable ways, Dr. Irabu often tries to gain something from them outside of his profession—and in doing so, occasionally forgets his role as a doctor.As each patient struggles to face the nature of their distress, an obvious yet invisible thread ties their paths together."
29,429,1089,Macross: Do You Remember Love?,"Action, Mecha, Military, Music, Romance, Sci-Fi, Space",Movie,1,8.09,19240,"After warping light-years away from Earth, the spacecraft Macross carries a city of civilians and soldiers back home. They continuously fight off the threat of the Zentradi and Meltrandi, giant alien races with whom humanity wages war. During a battle, the Macross transforms into a mecha operated by fighter pilot Hikaru Ichijou. Thrust into a number of hardships, Hikaru grows close to the citys idol Minmay Lynn. As their relationship develops, however, it is viewed unfavorably by others due to Minmays status and popularity.With war raging on and the state of Earth unknown, Hikaru and his fellow soldiers fight on against their mysterious enemies. Throughout the bloodshed, Hikaru and Minmay attempt to keep hold of their feelings for one another. Minmay pours her heart into her music, which may just turn out to be the key to finding peace."
30,430,25161,One Piece 3D2Y: Ace no shi wo Koete! Luffy Nakama Tono Chikai,"Adventure, Comedy, Fantasy, Shounen",Special,1,8.09,30516,"After suffering great personal loss during the battle of Marineford, Monkey D. Luffy finds himself stranded on Rusukaina, a treacherous island crawling with huge and dangerous creatures. There, he has committed himself to a two-year stretch of training to learn ""Haki,"" the energy that combatants can use to grant themselves a variety of abilities in battle.Luffy is jerked away from his otherwise peaceful training by the abduction of Sandersonia and Marigold, sisters of his friend and ally Boa Hancock. With Boas aid, Luffy seeks to track down the infamous pirate responsible for the kidnapping, a man whose recent prison break is the result of Luffys own reckless actions. Luffy must use his developing grasp of Haki to defeat this new foe while coming to terms with his overbearing grief in the process."
31,431,995,Prince of Tennis: The National Tournament,"Action, Comedy, Shounen, Sports",OVA,13,8.09,25170,"Freshman tennis prodigy Ryouma Echizen and the Seishun Academy Boys Tennis Team have finally reached the National Tournament, eager to fight for the championship title and claim it as their own.Seishuns first match is against Higa Middle School, the Okinawa-based team labeled as the ""dark horse"" of the tournament. After watching Higa defeat their first round of opponents using dirty tactics, the Seishun team is determined to show them the value of a fair, hard-earned victory.Awaiting the winners of the matchup in the quarterfinals is one of Seishuns old rivals: Hyoutei Academy, who are determined to restore their pride after the events at the Kanto Regionals. Hyoutei seeks to prove to everyone that they deserve to be at the Nationals despite only qualifying through a special invitation.Tennis no Ouji-sama: Zenkoku Taikai-hen covers the beginning of the long-awaited National Tournament as Ryouma and the Seishun team meet foes of past and present, each with their own unique ideals on how tennis should be played!"
32,432,2752,Prince of Tennis: The National Tournament Semifinals,"Action, Comedy, Sports",OVA,6,8.09,21186,"The National Tournament continues for Ryouma Echizen and the Seishun Academy Boys Tennis Team as they face off against last years semifinalist, Shitenhouji Middle School. As winners of the Kansai Regionals, Shitenhouji is one of the top contenders to win this years tournament. Whats more, each member of the Shitenhouji team has skills that are said to surpass their Seishun counterparts. Shitenhouji also has Kintarou Tooyama, another ""super rookie"" who rivals Ryouma in strength and technique. Seishun will have to push the limits of their abilities to stand a chance at defeating the Kansai champions in this East versus West matchup."
33,433,15,Eyeshield 21,"Action, Comedy, Shounen, Sports",TV,145,8.08,83648,"Shy, reserved, and small-statured, Deimon High School student Sena Kobayakawa is the perfect target for bullies. However, as a result of running errands throughout his life, Sena has become agile and developed a skill for avoiding crowds of people. After the cunning Youichi Hiruma—captain of the Deimon Devil Bats football team—witnesses Senas rapid legs in motion, he coerces the timid boy into joining his squad. As Hiruma wants to conceal Senas identity from other clubs, Sena is forced to hide under the visored helmet of ""Eyeshield 21,"" a mysterious running back wearing the number 21 jersey. The legendary Eyeshield 21 can supposedly run at the speed of light and has achieved remarkable feats in the United States during his time at the Notre Dame College.Accustomed to avoiding his problems in the past, Senas specialty might just help him become the new secret weapon of the Deimon Devil Bats. As he interacts with his teammates, Sena gradually gains more self-confidence and forges valuable bonds along the way."
34,434,122,Full Moon wo Sagashite,"Comedy, Drama, Music, Romance, Shoujo, Supernatural",TV,52,8.08,59374,"Two years ago, Mitsuki Kouyamas friend, Eichi Sakurai, moved to America before she could confess her feelings to him. Though she cannot contact him, they made a promise to fulfill their respective dreams: Mitsuki wants to become a professional singer, and Eichi an astronomer. She hopes that one day her music will reach him across the world with a brilliance like that of the full moon.There is just one catch: Mitsuki suffers from throat cancer, which makes her voice quiet and singing strenuous. Her grandmother, who has a hatred of music, insists that Mitsuki undergo surgery to remove the cancer, but she refuses due to the risk of losing her voice. One day, two shinigami—Meroko Yui and Takuto Kira—appear to tell her that she only has one year left to live. This sudden revelation spurs Mitsuki into action, and she decides that with Meroko and Takutos help, she will become a professional singer in the time she has left.Full Moon wo Sagashite follows the emotional story of Mitsuki and her shinigami friends as they discover what it means to sing—and ultimately, what it means to live."
