,Unnamed: 0,anime_id,name,genre,type,episodes,rating,members,synopsis
35,1135,25687,Digimon Adventure tri. 1: Saikai,"Action, Adventure, Comedy, Drama",Movie,1,7.66,58274,"The gate to the Digital World has been closed for three years. Taichi Yagami and his friends have since moved on, and now that he is in his second year of high school, it is time for him to grow up. While everyone else knows what they want to do with their lives, Taichi remains unsure. Meanwhile, the group drifts further apart as they follow their own paths.One day, a rogue insectoid Digimon called Kuwagamon materializes and disrupts electronics all over the city. Taichi recklessly chases after it and ends up cornered by the attacking Digimon. Suddenly, the Digivice that he still carries—a digital device that serves various purposes including helping ones Digimon partner to evolve—glows, and Agumon appears. The two are able to defeat Kuwagamon, but why did the Digimon cross over to this world in the first place? What is happening in the Digital World, and how exactly does this involve Meiko Mochizuki, the new transfer student in Taichis class?"
36,1136,31552,Durarara!!x2 Ten: Onoroke Chakapoko,"Action, Mystery, Supernatural",Special,1,7.66,16171,"In spite of the mayhem that has been taking place in Ikebukuro, Shinra Kishitani and Celty Sturluson have decided to go on a short trip. Excited to finally be going out with the one he loves, the underground doctor makes it his priority to give Celty his undivided attention, even if it means rejecting phone calls from his good friend Izaya Orihara.However, despite his hopes of having a peaceful holiday, Ikebukuros various residents continue trying to reach him. Furthermore, just as Shinra begins to enjoy reminiscing about old memories on a carriage ride together with his beloved, Celty starts to notice a strange presence..."
37,1137,14131,Girls und Panzer,"Military, School",TV,12,7.66,104275,"""Senshadou"" is a traditional sport using World War II era tanks in elimination-based matches. Widely practiced by women and girls alike, its advertised as a form of art geared towards making ladies more prominent in culture and appealing to men. Becoming a worldwide phenomenon over time, the influence of senshadou leads to the creation of a world championship which will soon be held in Japan.Miho Nishizumi, who comes from a lineage of well-respected senshadou specialists, is at odds with the sport after a traumatic event led to her retirement and eventually a rift to form between her and her family. To steer clear of the practice as much as possible, she transfers to Ooarai Girls Academy where the senshadou program has been abolished. However, with the news of the upcoming championships, the school revives their tankery program, and Miho is pushed into joining.Now, with the aid of some new friends, she must overcome her past and once again take command of a squadron of tanks in an effort to save her school from closure, all while proving to her family that the Nishizumi-style of senshadou is not solely about victory."
38,1138,2002,Heroic Age,"Action, Mecha, Military, Sci-Fi, Space",TV,26,7.66,62530,"When the Golden Race invited other races to join them in the stars, three sentient races answered their call. The Goldens called them the Bronze, Silver and Heroic Tribes. Just before the Gold Tribe left to travel to another Universe, a fourth race appeared, traveling to the stars on their own accomplishments. The Golds named the human race the Iron Tribe. During the passing of time, humanity suffers at the hands of the more dominant races and is now facing extinction. Following a prophecy left by the Gold Tribe, Princess Deianeira sets out to search for the powerful being who might be able to save humankind. She meets a wild haired boy on an abandoned planet—a fateful encounter that will not only change the fortunes of Humanity, but also the fate of the universe.(Source: AniDB)"
39,1139,145,Kareshi Kanojo no Jijou,"Comedy, Drama, Romance, School, Shoujo, Slice of Life",TV,26,7.66,94165,"Yukino Miyazawa is the female representative for her class and the most popular girl among the freshmen at her high school. Good at both academics and sports on top of being elegant and sociable, she has been an object of admiration all her life. However, in reality, she is an incredibly vain person who toils relentlessly to maintain her good grades, athleticism, and graceful appearance. She wants nothing more than to be the center of attention and praise—which is why she cannot stand Souichirou Arima, the male representative for her class and the only person more perfect than her. Since the first day of high school, she has struggled to steal the spotlight from her new rival but to no avail.At last, on the midterm exams, Yukino gets the top score and beats Souichirou. But, to her surprise, he congratulates her on her achievement, leading her to question her deceptive lifestyle. When Souichirou confesses his love to Yukino, she turns him down and gloats about it at home with only a hint of regret. But the very next day, Souichirou visits Yukino house to bring her a CD and sees her uninhibited self in action; now equipped with the truth, he blackmails her into completing his student council duties. Coerced into spending time with Souichirou, Yukino learns that she is not the only one hiding secrets."
40,1140,5290,Keroro Gunsou Movie 3: Tenkuu Daikessen de Arimasu!,"Comedy, Sci-Fi, Shounen",Movie,1,7.66,2430,"The movie begins with Fuyuki Hinata and the Keroro Platoon exploring an abandoned temple in the mountaintop city of Machu Picchu in Peru. While on the exploration, Keroro accidentally sets off a trap, and by chance they find a hidden chamber with a large blue crystal in the center, on a stand that has a key in it. Keroro leans on the key, causing the room to activate a mysterious machine, this caused the entire temple to shake. As soon as the group realized what was happening, they run out of the room. While running, Keroro accidentally loses his Kero Ball while Fuyuki catches a fleeting glimpse of a glowing young woman as he is running out, and tells Keroro that there was a girl in the room, but he is forced to leave the room before he can say anything else. The group successfully escapes, while the girl (now sprouting a pair of glowing wings) watches them leave - while back in the chamber, something is growing within the crystal... (Source: AniDB) "
41,1141,250,Konjiki no Gash Bell!!,"Adventure, Comedy, Magic, Shounen, Supernatural",TV,150,7.66,51403,"Takamine Kiyomaro, a depressed dont-care-about-the-world guy, was suddenly given a little demon named Gash Bell to take care of. Little does he know that Gash is embroiled into an intense fight to see who is the ruler of the demon world. All of the demons have to pick a master on Earth and duke it out with other demons until one survives. Needless to say, Kiyomaro becomes Gashs master, and through their many battles, Kiyomaro learns the importance of friendship and courage. "
42,1142,23321,Log Horizon 2nd Season,"Action, Adventure, Fantasy, Game, Magic, Shounen",TV,25,7.66,215817,"After being trapped in the world of Elder Tale for six months, Shiroe and the other Adventurers have begun to get the hang of things in their new environment. The Adventurers are starting to gain the trust of the People of the Land, and Akiba has flourished thanks to the law and order established by Shiroes Round Table Alliance, regaining its everyday liveliness. Despite this success, however, the Alliance faces a new crisis: they are running out of funds to govern Akiba, and spies from the Minami district have infiltrated the city.As formidable forces rise in other districts, there is also a need to discover more about the vast new world they are trapped in—leading Shiroe to decide that the time has come to venture outside the city. Accompanied by his friend Naotsugu and the Sage of Mirror Lake Regan, the calculative Shiroe makes his move, hoping to unravel new possibilities and eventually find a way home."
43,1143,2743,Mobile Suit Gundam Seed: Seed Supernova - Tanekyara Gekijou,"Comedy, Parody",Special,4,7.66,5508,The first two shorts feature the original SEED cast and deal with an attempt by Yzak Joule to reclaim his his honor from Athrun Zala after having been one-upped at seemingly every contest with him since his childhood. The last two shorts feature the Minerva crew sent back in time on comical missions from Gil in an attempt to disrupt key events of the Seed era with disastrous yet hilarious effect.(Source: ANN)
44,1144,3626,Mobile Suit Gundam Wing: Operation Meteor,"Action, Adventure, Drama, Mecha, Military, Psychological, Sci-Fi, Space",OVA,4,7.66,6768,"Two video releases recapping events from the Gundam Wing TV series. Each Operation Meteor video contains an Odd episode and an Even episode. The Odd episodes feature Heero, Trowa and Wufei, while the Even episodes feature Duo and Quatre. The episodes also featured brief new footages of the characters after the final episode of the TV series. (Source: AniDB) "
45,1145,10020,Ore no Imouto ga Konnani Kawaii Wake ga Nai Specials,"Comedy, Seinen, Slice of Life",ONA,4,7.66,101495,"The true end arc of Ore no Imouto. These four episodes branch out after the 11th episode of the main TV series and present an alternative version to the end of the TV series. These episodes contrast with the good end arc of the TV series, which was an original ending written for the anime, and instead closely follows the original story from the light novels."
46,1146,1873,Plawres Sanshirou,"Adventure, Mecha, School, Sci-Fi, Shounen, Sports",TV,37,7.66,1718,"Plawres is a wrestling game that the players make their robots, which are about 30 cm tall, fight in the ring. The main character, Sugata Sanshirou, is a plawres player. Using his plawrestler, Juohmaru, he beats strong rivals.(Source: ANN)"
47,1147,528,Pokemon: Mewtwo no Gyakushuu,"Action, Adventure, Comedy, Drama, Fantasy, Kids",Movie,1,7.66,100089,"Using the fossil of the Legendary Pokémon Mew, Team Rocket has created the first successful Pokémon clone. Named Mewtwo, the man-made Pokémon quickly becomes upset with the circumstances of its creation and goes on a rampage. It is soon approached by Sakaki, the leader of Team Rocket, and is manipulated into committing evil acts.Repulsed by the tricks of mankind and the cruelties it has suffered, Mewtwo isolates itself from everyone and plots against humans whilst trying to discover its true purpose in life. Disguising as the worlds strongest Pokémon trainer, Mewtwo draws in the regions most powerful trainers who want to fight the new, mysterious opponent. With the fate of the world at stake, renowned trainers Satoshi, Takeshi, and Kasumi must battle against Mewtwo and defeat it before it brings about the downfall of humanity."
48,1148,2562,Shion no Ou,"Drama, Game, Mystery, Thriller",TV,22,7.66,20553,"Shion no Ou follows the story of Yasuoka Shion, a 13-year-old Shougi player with a past of tragedy. Shions parents were brutally murdered in front of her when she was 5 years old. The murderer sat down with her and challenged her to a game of Shougi, after telling her that if she wanted to stay alive she should forget how to speak, and forget what happened that night. Now Shion has entered the realm of female pro Kishi, mute but strong. As her playing gathers more and more attention, so do the questions about her past and the brutal murder she witnessed. Shions memories slowly come back, and the mystery begins to unravel, thread by thread. "
49,1149,1861,Slam Dunk: Zenkoku Seiha Da! Sakuragi Hanamichi,"Comedy, Drama, School, Shounen, Slice of Life, Sports",Movie,1,7.66,7992,"Set during the Inter High Championships, Shohoku take on Tsukubu, one of this years dark horses. Its a clash of acquaintances as Anzai will face his former student which is now the coach of Tsukubu, while Akagi & Kogure meet Godai their former classmate and Tsukubus captain. Finally Sakuragi is irked by the presence of Nango, Tsukubus center, who vies for Harukos attention.(Source: ANN)"
50,1150,8995,Tales of Symphonia The Animation: Sekai Tougou-hen,"Action, Adventure, Fantasy, Magic, Martial Arts, Shounen",OVA,3,7.66,14036,The third and final OVA series concluding the story of Tales of Symphonia: The Animation.
51,1151,17437,The iDOLM@STER Movie: Kagayaki no Mukougawa e!,"Comedy, Drama, Music",Movie,1,7.66,12262,"The idols of 765 Production continue on their neverending journey—towards a new stage, towards a bright and shiny future!The girls and their producer have gone through thick and thin, and have stood face to face with all kinds of difficulties.Its time again for the girls to foster their friendship, and through great discipline, they step forward to their starry future.(Source: Official website)"
52,1152,32673,Udon no Kuni no Kiniro Kemari,"Fantasy, Seinen, Slice of Life",TV,12,7.66,33885,"Taking a break from the hustle and bustle of Tokyo, Souta Tawara returns to his hometown in Kagawa. Though his parents are no longer around, his former home and family-owned udon restaurant reminds him of the times his family was still together. Reminiscing about his childhood, Souta enters the udon restaurant and discovers a grimy young boy sleeping.At first, Souta thinks nothing of the chance encounter and provides the boy with food and clothing. However, to his surprise, the boy suddenly sprouts a furry pair of ears and a tail! Souta soon learns that the nameless boy is actually the rumored shapeshifting tanuki that has been inhabiting Kagawa for many years. Thinking that the boy has been living a lonely life, he decides to take him in and name him Poko.Udon no Kuni no Kiniro Kemari follows the heartwarming relationship between Souta and Poko, and through the time they spend together, Souta recalls his own past, the place he left behind for the city, and the relationship he had with his father."
53,1153,1985,UFO Robo Grendizer,"Mecha, Sci-Fi, Shounen",TV,74,7.66,4381,"Duke Fleed is a survivor of the Fleed Planet who is escaped to the Earth, onboard a mysterious ""spaceship"", where is raised by Dr. Umon as his adoptive son, and known as Daisuke Umon. Years after his arrival, hes faced with the threat of King Vega and his army, who want to conquer the Earth. With his friends Koji and Hikaru (and later his younger sister Maria Grace), Duke decides to fight back using his best weapon - the almighty Grendizer."
54,1154,304,Aa! Megami-sama! Movie,"Comedy, Magic, Romance, Seinen, Supernatural",Movie,1,7.65,29330,"For centuries, a god named Celestin has been imprisoned on the moon for betraying the kingdom of Yggdrasil. Released by the fairy Morgan Le Fey, Celestin travels to Earth to reunite with his former pupil, the goddess Belldandy. Things go awry as Celestin erases Belldandys memories of her boyfriend Keiichi and uses her as a catalyst to wreak havoc on Earth and Yggdrasil. "
55,1155,12291,Acchi Kocchi (TV),"Comedy, Romance, School, Seinen, Slice of Life",TV,12,7.65,127973,"Feelings may come and go, but true love always remains in the heart. Tsumiki Miniwa is in love with her best friend, Io Otonashi. For her, confessing is nearly impossible; but to her friends, they seem to be the perfect match. Cute and petite, Tsumiki comes off more as a friend, and Ios attitude toward her is friendlier than toward others. Despite the constant teasing and obvious hints that his friends have been dropping, Io always seems to miss the signs. Throughout her everyday school life, Tsumiki spends time with her friends and Io. Will she finally muster enough courage to confess her true feelings?"
56,1156,1488,Area 88,"Action, Adventure, Drama, Military, Romance",OVA,3,7.65,6645,"Shin Kazama, tricked and forced into flying for the remote country of Aslan, can only escape the hell of war by earning money for shooting down enemy planes or die trying. Through the course of the series, Shin must deal with the consequences of killing and friends dying around him as tries to keep his mind on freeing himself from this nightmare. (Source: ANN)"
57,1157,4182,Darker than Black: Kuro no Keiyakusha Special,"Comedy, Parody, Sci-Fi",Special,1,7.65,87609,"A side-story of Darker than Black, also called Episode 26, that takes place during the events of Kuro no Keiyakusha. The Syndicate has another job for Hei and his team. This assignment involves the sought after possessions of a dead contractor, which are believed to have been buried beneath a cherry tree. Meanwhile, Misaki Kirihara and her team plan a trip to the Cherry Blossom festival."
59,1159,874,Digimon Tamers,"Adventure, Comedy, Drama, Fantasy, Shounen",TV,51,7.65,94391,"Digimon Tamers takes place in a world where the popular Digimon franchise is all the rage, consisting of a cartoon, video games, and the trading card game. Takato Matsuda is a huge Digimon fan thats particularly obsessed with the card game, and constantly daydreams about the universe therein. One day, he finds a mysterious blue card, which he slides through a scanner toy to use in the popular battle game. His toy suddenly glows and transforms into a Digivice, and Takatos fan-made design, Guilmon, materialises in front of him. Thrilled by the prospect of having a real-life Digimon, Takato embraces his new partner, and his adventures as a Digimon Tamer begin.Takato quickly discovers that being a Digimon Tamer is not all fun and games—in reality, its much more dangerous than the card games hes accustomed to. Wild Digimon have begun to appear all across Japan, causing rampages that result in chaos and mayhem. Armed with his Digivice, which can scan trading cards to strengthen Guilmon, Takato and his new partner set out to combat the rogue Digimon. They are tasked with protecting the world from Digimon attacks, whilst a mysterious organization determined to eliminate all Digimon and their Tamers lurks in the shadows... "
60,1160,2673,Doraemon Movie 27: Nobita no Shin Makai Daibouken - 7-nin no Mahoutsukai,"Adventure, Comedy, Fantasy",Movie,1,7.65,1583,"Nobita requests of Doraemon the Moshimo-box and wishes for the world to become a place where the use of magic is possible. Witchcraft replaces science and technology and everyone makes use of it on their daily lives, except for Nobita, who, like usual, isnt very good at conjuring spells. Frustrated, he plans on returning things to their past state, but his mother threw the Moshimo-box away. One day, Doraemon and his friends meet Professor Mangetsu, who studies magic and magical beings such as goblins, and his daughter Miyoko, and are warned of the dangerous approximation of the ""star of the Underworld"" to the Earths orbit. With the future of the planet at stake, the group must travel to the Underworld and pierce the heart of the Underworld King with a silver dart, as detailed in the ancient texts of ""The Chronicles of the Underworld"". Their attempts are, however, thwarted and Miyoko captured. Doraemon and his friends then decided to use the Time Machine to return to the past and, using Doramis Moshimo-box, they manage to restore the Earth. The events on the Underworld continue, however, to take place in a Parallel Universe, where Miyoko is still captive. As a result, the group is once again forced to travel to the Underworld and defeat its tyrannical ruler once and for all. (Source: AniDB)"
61,1161,31376,Flying Witch,"Comedy, Magic, Shounen, Slice of Life, Supernatural",TV,12,7.65,95933,"In the witches tradition, when a practitioner turns 15, they must become independent and leave their home to study witchcraft. Makoto Kowata is one such apprentice witch who leaves her parents home in Yokohama in pursuit of knowledge and training. Along with her companion Chito, a black cat familiar, they embark on a journey to Aomori, a region favored by witches due to its abundance of nature and affinity with magic. They begin their new life by living with Makotos second cousins, Kei Kuramoto and his little sister Chinatsu.While Makoto may seem to be attending high school like any other teenager, her whimsical and eccentric involvement with witchcraft sets her apart from others her age. From her encounter with an anthropomorphic dog fortune teller to the peculiar magic training she receives from her older sister Akane, Makotos peaceful everyday life is filled with the idiosyncrasies of witchcraft that she shares with her friends and family."
62,1162,1251,Fushigi no Umi no Nadia,"Adventure, Comedy, Historical, Romance, Sci-Fi",TV,39,7.65,24229,"In 1889, the world is on the pinnacle of great discoveries in technology. In mankinds grasp for the future, a sinister foe known only as Gargoyle, obsessed with restoring the former Atlantean empire to the glory it once held, begins his plans to take over the world. Nadia, with the help of a young inventor, Jean Roque Lartigue, and Captain Nemo of the submarine Nautilus, must fight to save the world from Gargoyle and Neo-Atlantis. Based on the Novel 20,000 Leagues Under the Sea by Jules Verne.(Source: ANN) "
63,1163,32215,High School DxD BorN: Yomigaeranai Fushichou,"Action, Comedy, Demons, Ecchi, Harem, Romance, School",OVA,1,7.66,22497,Unaired anime episode bundled with the limited edition of High School DxD DX.2.
64,1164,2012,Jigoku Sensei Nube,"Adventure, Comedy, Horror, Romance, School, Shounen, Supernatural",TV,49,7.65,8908,"Nube is a clumsy, easygoing, and very kind teacher, but he has a secret under his glove on the left hand. He has a monster hand, and he also has the ability to sense ghosts and evil spirits. So he protects his dear students from these evil spirits with his monster hand, proving to be very powerful.(Source: ANN)"
65,1165,2848,Kappa no Coo to Natsuyasumi,"Adventure, Shounen",Movie,1,7.65,6953,"Kouichi Uehara is a fourth grade student living in the suburb of Tokyo. One day, he picks up a large stone which turns out to be a fossil of a baby ""Kappa"" who has been sleeping underground for the past 300 years, and names it ""Coo."" They become good friends and Coo starts living with Kouichis family. However, Coo has a hard time adjusting to life among humans and misses his kind."
66,1166,15813,Majokko Shimai no Yoyo to Nene,"Fantasy, Magic",Movie,1,7.65,8698,"Based on a manga ""Noroiya Shimai"" written by Hirarin and serialized in Monthly Comic Ryuu. It is a story about a pair of sisters who work as ""noroiya"" (cursers) using magic in a fantasy world. One day a big tree suddenly appears in a forest, and tall buildings that look like they are from our world can be seen entangled in it. The two sisters go there to investigate and get ported to our world. They then encounter two children who are startled by the sisters sudden appearance and rush back home but at home they see their parents turned into monsters...(Source: MAL News)"
67,1167,5162,Minami-ke Okaeri,"Comedy, School, Slice of Life",TV,13,7.65,45233,"A year has passed since Okawari and the three sisters have grown up. Their likings and moods are almost the same. Haruka, the older sister, is a love-giving mother to the younger sisters and a discipline follower. Kana, the middle one, leaves everything to the last possible moment and always gives trouble to the trio. Chiaki, the little one, is the calculating and manipulating one; she likes to be admired and loved by Haruka and always gives trouble to the less blessed Kana. Despite being an unbalanced family, they love each other with all their heart. The familys daily life is as funny as ever; trouble and love are always present. Now its time to see if theyll survive this age change since Haruka is now a young adult; she has even more responsibilities, having to watch over the young while integrating into the adult life.(Source: ANN)"
