,Unnamed: 0,anime_id,name,genre,type,episodes,rating,members,synopsis
90,11290,34107,Iizuka-senpai x Blazer: Ane Kyun! yori The Animation,Hentai,OVA,1,6.87,920,No synopsis information has been added to this title. Help improve our database by adding a synopsis here.
91,11291,8293,Gakuen Saimin Reido,Hentai,OVA,3,6.87,4850,"Futoshi is fat, smelly, and ugly, so he is teased and bullied by other students. But one day, he receives a parcel from his father who is an inventor. He opens it and finds a cell phone. According to his letter, he can hypnotize anyone using the cell phone. He is doubtful at first, but he visits a woman, Sayuri, who lives next door and tries it.... Yes, it works perfectly. He now plans to take revenge on the students who tease and bully him....(Source: ErogeShop)"
92,11292,14543,Koutetsu no Majo Annerose,"Action, Hentai, Supernatural",OVA,4,6.87,5152,"Amidahara is a twisted city, well beyond the reaches of any salvation. Here, humans, demons, and criminals walk the streets with the mighty witch Annerose being one of the most feared and respected of the citys denizens. As part of her abilities, she was able to form a binding spell with a human male, keeping him as her undead servant. This man, Rikurou Tachibana, was about to end up sold to slavers, but instead, he wound up in the eternal service of Annerose—something her other servent, Mitico didnt take too kindly to. Rikurou doesnt know whats worse, Mitico being able to chop him up into tiny pieces, only to be resurrected, or having to deal with the intense sexual frustration of living with Annerose.Both of these problems get set aside, however, when Annerose and her servants take on a case involving a girl named Miki and her missing brother. The events of Koutetsu no Majo Annerose will lead the unlikely heroine into the workings of the Kuurou Group and their leader Lee Mayfeng, a sworn enemy from Anneroses past. Mayfengs contempt for Annerose is deep enough to plunge into the depths of sexual depravity and shes willing to do anything to humiliate and ruin her. The danger only grows from there as yet another malevolent force is at work, one that goes well beyond threatening Amidahara and aims to bring about ruin to the entire world."
93,11293,32405,Marshmallow★Imouto★Succubus★,Hentai,OVA,Unknown,6.87,2211,Based on the erotic game by Dwarfsoft.
94,11294,33505,Tsumamigui 3 The Animation,Hentai,OVA,Unknown,6.87,1400,"Akito Natsuki decides to spend his one month long summer holiday in his home town after his workplace closes down for renovations. With no money and nothing to do he decides to take it easy. At home Miyuri, his sister-in-law he was once fond of, and Sayoko who always treated him like her own son, were waiting for him. Akito tried to hide his feelings as always and acted out the part of the brother-in-law, but after a slip of the tongue his real feelings are revealed. Then his stagnant relationships with Miyuki and Sayoko start to develop again, and eventually he gets deeply involved with them.(Source: MyFigureCollection)"
95,11295,31189,Watashi ga Toriko ni Natte Yaru,Hentai,OVA,2,6.87,2330,"Shiho and Saki may be focusing a lot of their efforts on the girls swim team, but most of the action in their lives is taking place outside of the pool. Shiho discovers one of the schools male students hiding in her changing room locker with a camera, waiting for the chance to film her. Though he was bullied into the situation, Shiho is prepared to show him no mercy and punish him through the most pleasurable means she can think of.Saki on the other hand is committed to her boyfriend who has more than a little bit of a fetish for underwear. How will he react to the new competitive swimsuit that Saki is wearing though? A meeting on the roof of the high school will determine that, but theres the dangerous, yet tantalizing, chance that they might get discovered.When a high school has a busty swim team and an unofficial voyeur club, the combination of them gives you the events of Watashi ga Toriko ni Natte Yaru."
96,11296,10695,Yume Kui: Tsurumiku Shiki Game Seisaku,Hentai,OVA,2,6.87,4758,The staff members of a certain hentai producing company get personally involved in their work. Perhaps a little too involved as some some male staffers begin to cross the line between fiction and reality.
97,11297,1408,Kao no nai Tsuki,Hentai,OVA,5,6.86,7095,"Suzuna is the only daughter of the Kuraki family. She is training hard to become a priestess. Tomomi brings her to the house of her husband-to-be. The mansion is under a strange spell, releasing the sexual desires of everyone inside. "
98,11298,15541,Namanaka Hyaku Percent!: Katamusubi no Shinpa,Hentai,OVA,3,6.86,3017,"""Shinpa"", the practice of having on ones person a shoelace which color signifies his or her preferred sexual fetish. In this way also is one able to search out his/her ideal partner.(Source: translated and adapted from official site by Cranston)"
99,11299,3919,Shimaizuma: Shimaizuma 3 The Animation,Hentai,OVA,2,6.86,2393,"Art school student Fushimi Kenta looks for inspiration wherever he can find it. When a successful painter takes him under his wing, his creativity is aroused the moment he meets the painter’s wife. Seduced by her beauty and exotic dancing skills, Kenta’s art comes second to learning the horizontal tango. Soon he’s dancing in the sheets with any girl within reach.(Source: ANN)"
