,Unnamed: 0,anime_id,name,genre,type,episodes,rating,members,synopsis
14,6914,31300,Irodorimidori: Change Our Mirai!,Music,Music,1,5.85,721,"The members of the band Irodorimidori—guitarists Arishiana Agata and Nazuna Tennouzu, keyboardist Nagi Kobotoke, drummer Serina Akesaka, and bassist Naru Hakobe—are performing at their maiden concert. As these passionate girls begin their musical journey, their voices will unite them in their future endeavors and change their destiny for the better."
16,6916,21421,Mahou Shoujo Taisen,Magic,TV,26,5.85,12783,"""Mahou Shoujo Taisen"" is a project created from a variety show for the Otaku ""2.5 Chigen TV"" (2.5 Dimension TV). The characters are the mahou shoujo that represent each local town in Japan. The characters that won from the second illustration competitions that were held on pixiv will appear in the anime.(Source: MAL News)"
31,6931,31157,ClassicaLoid,"Comedy, Music",TV,25,5.84,11717,"Ever since her father used up the last of the family fortune and skipped town, Kanae Otowa has lived in her familys ancestral mansion, Otowakan. With no way to pay off her fathers debts, Otowakan is being foreclosed and Kanae must oust the remaining residents—her friend Sousuke Kagura, and two strange people who claim to be her fathers acquaintances, Wolfgang Amadeus Mozart and Ludwig van Beethoven. After somehow being resurrected, Mozart and Beethoven have started going by ""Motes"" and ""Beethes"" respectively, and begun to indulge in a variety of idiotic, non-musical pursuits.While stubbornly refusing to leave Otowakan, Beethes unlocks the hidden power of Musik, saving Otowakan from demolition and delaying his eviction. With this discovery, other Musik users are drawn to Otowakan, including Frédéric Chopin, Franz Liszt, and Franz Schubert. However, not all Musik users have innocent desires. Across the city, the enigmatic Johann Sebastian Bach sits atop a tall building, plotting how to use his Musik."
58,6958,30920,Utopa,Sci-Fi,Movie,1,5.83,590,"Hundreds of years after the 20th century, nature and the ecosystem have been devastated due to use of nuclear and biological weapons. Most of the Earth has been contaminated and is collapsing into ruin, and a great majority of plants and animals are now extinct. The world heads to the ""Big Six,"" the sixth mass extinction event. Humanity built cities in the sky, migrating the endangered species of animals and plants there. Over many years, the animals evolved in these isolated cities. With artificial genetic crossbreeding, they acquire language, bipedality, and build a life and civilization for themselves free from want. No one thinks of the world below any longer. One day, a single plant seed wanders into one of the sky cities, and the children Kui, Hiruma, and Root discover it. Unable to resist the temptation to look into the world outside, they decide to undertake an adventure to the outside world, unknowing that once they set foot on the ground, they will never be able to return.(Source: MAL News)"
64,6964,13309,Kyoto Animation: Hoshi-hen,Fantasy,Special,1,5.82,2295,"An incomplete storyboard rests on a desk. Within it, are a boy and girl who suddenly jump to life and escape the confines of the sheet of paper in order to kickstart their story—one defined by their own actions. As they journey across the desk, the world around them begins to transform and signals the start of their vivid new adventure."
75,6975,17513,Diabolik Lovers,"Harem, School, Shoujo, Vampire",TV,12,5.81,107960,"At the behest of her father, Yui Komori goes to live in a secluded mansion, home to the six Sakamaki brothers—Shuu, Reiji, Ayato, Kanato, Laito, and Subaru—a family of vampires. Though at first the siblings are confused as to why the girl has arrived, they soon realize that she is to be their new ""sacrificial bride,"" not to mention their other, more carnal intentions for her. After meeting the brothers, Yui quickly begins to question why her father would have sent her here and why she feels a strange, new pain in her chest. With each brother more sadistic than the last, Yuis life as a captive takes a harrowing turn in her new home. As her days turn into endless nights, and each brother vows to make her his own, Yui falls deeper and deeper into madness and ecstasy."
98,6998,32438,Mayoiga,"Drama, Horror, Mystery, Psychological",TV,12,5.8,117090,"A bus full of eccentric individuals is headed towards the urban legend known as Nanaki Village, a place where one can supposedly start over and live a perfect life. While many have different ideas of why the village cannot be found on any map, or why even the police cannot pinpoint its location, they each look forward to their new lives and just what awaits them once they reach their destination.After a few mishaps, they successfully arrive at Nanaki Village only to find it completely abandoned. Judging from the state of disrepair, it has been vacant for at least a year. However, secrets are soon revealed as some of the group begin to go missing while exploring the village and amidst the confusion, they find bloody claw marks in a forest. As mistrust and in-fighting break out, will they ever be able to figure out the truth behind this lost village?"
