,Unnamed: 0,anime_id,name,genre,type,episodes,rating,members,synopsis
86,9386,31054,"Letchu, Getchu, Saru Getchu",Comedy,TV,76,5.05,104,"The monkeys are up to no good again, but this time theyre on the ""heroes"" side. Performing no good magic shows, cloning themselves with a ninja Jutsu and filling UFO catchers with themselves are just a few of the tricks theyre pulling, while at the same time trying to adapt themselves to the human lifestyle. "
87,9387,32310,"Letchu, Getchu, Saru Getchu Episode 0",Comedy,Special,1,3.52,54,"Episode 0 of Letchu, Getchu, Saru Getchu TV series."
88,9388,22421,Licca-chan to Mahou no Kuni,"Fantasy, Kids",ONA,7,4.38,72,"Takara Tomys popular doll ""Licca-chan"" got its own animation ""Licca-chan and the Magical World"" produced by DLE Inc.This time the theme is a telephone, based on Licca-chans (Rika-chans) phone, and the story has elements that capture the girls hearts such as Magic and Becoming a Princess.As supporting characters theres the vivid colored ""Bear"", a humorous take on princess as ""Ann Queen"" (voiced by Asa Komuro) and other original characters, creating an original scenario.(Source: DLE,  Inc.)"
89,9389,33782,Life!,"Comedy, Slice of Life",TV,Unknown,5.25,91, The series follows characters humorous everyday lives.
90,9390,16820,Lightning Atom,"Action, Kids, Super Power",Movie,1,5.11,62,The story of a young boy who uses his electric super powers to help the innocent.
91,9391,32784,Lina Poe Poe,Music,Music,1,3.93,69,"A music video for Lina Linas song ""Lina Poe Poe""."
92,9392,18155,Linetown,Comedy,TV,50,6.18,369,"Featuring characters from NHNs popular app such as Moon, Brown, Connie, James, Jessica, and Sally living  happily together in Line Town. "
93,9393,13177,Little Charo,Slice of Life,TV,50,6.57,131,NHKs English education program featured the adventures of a puppy named Charo in New York.
94,9394,13179,Little Charo 2,Slice of Life,TV,50,6.3,103,"NHKs English education program. In Little Charo 2, the puppy journeys with his master through a mysterious place called the Middle World, which lies between the World of the Living and the World of the Dead.(Source: AniDB)"
95,9395,13465,Little Charo: Touhoku-hen,Kids,TV,12,6.25,102,"Charo venture around Tono, Iwate, a city in Japans Tohoku (Northeast) region, attempting to find the Eight-Starred Note in order to prevent the reappearance of the Tenaga-Ashinaga monster of local legend.(Source: ANN)"
96,9396,25027,"Little Polar Bear: Shirokuma-kun, Doko e?","Adventure, Fantasy, Kids",Movie,1,6.56,107,Based on the childrens book Little Polar Bear by Dutch author Hans de Beer.
97,9397,25029,"Little Polar Bear: Shirokuma-kun, Fune ni Noru","Adventure, Fantasy, Kids",OVA,1,5.78,109,A continuation of adventures of the Little Polar Bear.
98,9398,28097,Little Twins,"Adventure, Kids",OVA,3,6.0,62,"In these adaptations of lsamu Tsuchidas picture books for children, Tiffle and Tuffle are two little twins in pointed hats who live on Coracle Island and have a few light-hearted adventures. (Source: The Anime Encyclopedia)"
99,9399,28099,Little Twins: Bokura no Natsu ga Tondeiku,"Adventure, Kids",Movie,1,6.71,61,"The length and quality suggests this movie was the fourth video installment, dumped on theaters as a promotional exercise for the tapes.(Source: The Anime Encyclopedia)"
