,Unnamed: 0,anime_id,name,genre,type,episodes,rating,members,synopsis
1,3201,2595,D.C.II: Da Capo II,"Drama, Ecchi, Romance, School",TV,13,7.05,25225,"The undying Sakura Trees return. Based on a PS2 sequel of the original DaCapo game, the story once again takes place on Hatsunejima, but is set 53 years after the events of D.C. and D.C.S.S.. Although some characters will probably look a bit familiar to the initiated eye, the cast is a new one. The new main protagonist is Yoshiyuki Sakurai, who lives next door to the Asakura sisters Yume and Otome, who are the granddaughters of Junichi and Nemu from the first season."
4,3204,870,Dragon Half,"Comedy, Fantasy, Parody",OVA,2,7.05,11596,"Mink is no ordinary teenage girl, being half-human and half-dragon. Her father had fallen in love with a red dragon he intended to kill, and instead of slaying the dragon, he married her. Their union gave birth to Mink, who inherited horns, a tail, retractable wings, and incredible strength—characteristics which signify her dragon half nature. Mink spends her days accompanied by her friend Pia, a dwarf girl with overprotective parents, and her best friend Lufa, an elf with great healing powers but impressively bad magic. The three find themselves mooning over the dreamy and charming dragonslayer, Dick Saucer. But in a sudden, absurd turn of events, Mink gets closer than ever to the object of her fantasies, only to realize that her love may never be reciprocated because of her dragon heritage.Thus, the trio sets out on a quest to find a potion that will make Mink fully human. They may unwittingly make enemies, but they are sure to have one heck of a good time."
11,3211,3318,Kimi ga Nozomu Eien: Next Season,"Drama, Romance",OVA,4,7.05,21064,            by MAL_editing_team
23,3223,10572,Ro-Kyu-Bu!,"Comedy, Ecchi, School, Sports",TV,12,7.05,46940,"Subaru Hasegawa has the ambition to become one of the best basketball superstars of all time. However, this comes to an apparent halt when his schools basketball team ceases activities for a year. Shocked by the news, he decides not to involve himself in basketball anymore.One day, his aunt Mihoshi Takamura invites him to coach the Keishin Academy girls’ basketball team on how to play the sport, and he reluctantly agrees. He meets sixth-graders Tomoka Minato, Maho Misawa, Airi Kashii, Hinata Hakamada and Saki Nagatsuki, and begins training them in the sport with one goal: to defeat all strong opponents along the way.Ro-Kyu-Bu! follows the effort of five elementary girls and their coach as they improve their cute style of playing basketball."
26,3226,14617,Stranger: Mukou Hadan Pilot,"Action, Adventure, Historical, Samurai, Seinen",Special,1,7.05,4741,"Young Nanashi is a drifting samurai under the service of an enigmatic monk who teaches the ways of life. In search for the meaning of life, Nanashi is forced to partake in certain horrendous acts to overcome the corrupt governments of China and Japan. The mysterious and observant samurai is forced to show a dark side to accomplish his goals and rescue society."
27,3227,24133,Taimadou Gakuen 35 Shiken Shoutai,"Action, Ecchi, Fantasy, Harem, Military, Romance, Supernatural",TV,12,7.05,99133,"In a world plagued by magical dangers and threats, there exist special warriors—known as Inquisitors—who are tasked with non-violently preventing these threats and nefarious actions. The Anti-Magic Academy is a specialized school built to educate and train these Inquisitors, which splits its students into small squads in order to train them to work together. Among these talented squads is the 35th Test Platoon, also known as the ""Small Fry Platoon"" due to its low ranking and incompetent members. However, everything changes when Ouka Ootori, a powerful yet rebellious former Inquisitor, is forced into joining due to her tendency to break rules and committing a serious violation: the killing of a witch. Tempers flare upon her arrival, as she clashes with their clumsy captain Takeru Kusanagi and argues with the rest of the squad over her views on witches. This eclectic group has a long way to go if they wish to succeed and climb the ranks at the Anti-Magic Academy: they must first set aside their differences and come to work together as a team."
31,3231,30547,Touhou Niji Sousaku Doujin Anime: Musou Kakyou Special,"Fantasy, Magic",OVA,1,7.05,2540,"After finding Alice Margatroids doll in the Scarlet Devil Mansion, Marisa Kirisame obliges herself to give it back to its rightful owner. However, in her search for Alice, she stumbles upon Hakugyokurous gardener Youmu Konpaku and Eienteis moon rabbit Reisen Udongein Inaba fighting over a single watermelon."
32,3232,26453,Tribe Cool Crew,"Music, School",TV,50,7.05,3334,"Haneru Tobitatsu is a hyperactive middle schooler with a passion for dancing. Inspired by his idol Jey El, the hottest star in the world of dancing, Haneru practices outside Memorial Hall every day after school. Unbeknownst to him, his ""secret"" practice sessions are being watched by Kanon Otosaki—her true identity being the famous online dancer, Rhythm—who also frequents the same location for practice. When Haneru finds out about this, he shows an immediate interest in teaming up with her.Slowly realizing the joy of performing with others, the duo makes their way into the world of street dancing, where they meet Kumonosuke, Mizuki, and Yuzuru, ultimately forming the dance group ""Tribe Cool Crew."" As they face off against tough competition, they strive to one day realize their dream of sharing the stage with Jey El."
34,3234,2006,Yu☆Gi☆Oh! (1999),"Adventure, Comedy, Fantasy, Game, Shounen",Movie,1,7.05,26934,"The card game ""Duel Monsters"" has become all the rage in Domino City. The rules are simple: two players, known as ""Duelists,"" fight each other with the monster cards they have collected in their decks and deduct Life Points. Each Duelist starts with a total of two thousand Life Points, and whoever loses all of them first is defeated in the battle.One day, a timid boy named Shougo Aoyama buys a deck that contains the ""Red Eyes Black Dragon,"" a legendary card said to bring victory to those courageous enough to fight. Soon, word of the card in Shougos hands begins to spread, eventually reaching the competitive Duelist Seto Kaiba. Desiring to collect the strongest cards in any way possible, Kaiba invites Shougo and his rival Yuugi Mutou to a Duel Monsters tournament—but will Shougo be able to overcome his fear of losing?"
37,3237,3359,Amatsuki,"Action, Fantasy, Historical, Shoujo, Supernatural",TV,13,7.04,41920,"Tokidoki Rikugou is a history-hating student who flunks out of his Japanese History course; his high school forces him to make up for his failed grade by attending a special museum lecture. Its star exhibit, a vast recreation of the Edo Period, promises to alleviate the delinquent students poor grades with an elaborate simulation of the Tokugawa Shogunate: the Edo Bakumatsu Walking Tour and Exhibition. Knowing next to nothing about samurai culture or the times hes walked into, he is quickly surprised to learn of the superstitious nature of Japan during the 1600s. Quickly dismissing the existence of gods and demons, he is shocked when confronted by a demon on a bridge, who attacks the unsuspecting high-schooler. Saved by a mysterious swordsman named Kuchiha, he discovers that he can no longer escape the simulation at the history museum.Meeting another swordsman named Kon Shinonome, he discovers another contemporary that was trapped in the simulation before him. Quickly adjusting to his new home, Tokidoki must now help protect the village from demons, while uncovering the mystery of both the simulation and the company that created it."
42,3242,17827,Daitoshokan no Hitsujikai,"Harem, Romance, School",TV,12,7.04,46874,"""The Shepherd,"" an urban legend of Shiomi Academy, is said to appear before hardworking students to grant them a wish. While engrossed in a book inside the schools renowned Great Library, Kyoutarou Kakei, a second year student and the Library Clubs de facto president, receives an email from the Shepherd foretelling an event that will change his fate. Worried by the message, Kyoutarou rushes over to a nearby train station and encounters fellow student Tsugumi Shirasaki, whom he saves from being hit by a derailing train. Grateful for his heroic actions, Tsugumi joins the Library Club and invites Kyoutarou to participate in her mysterious ""Shiomi Happy Project."" Together with other new members of the club, they strive to make the academy a better place and uncover the identity of the enigmatic Shepherd."
44,3244,28221,Etotama,"Action, Comedy, Fantasy",TV,12,7.04,36463,"Every 60 years, the heavens conduct a sacred ritual called ETM12. This custom involves selecting worthy Eto-musume—celestial beings representing different animals—to become one of the members of the Chinese zodiac, or Eto-shin. However, since the first ETM12 two thousand years ago, the original batch of Eto-shin reigns with no one being able to replace them.Nyaa-tan is a cat Eto-musume who aspires to become a member of the zodiac in the ongoing ETM12. Fulfilling her ambition requires her to secure 12 seals, one for each Eto-shin. To that end, she must win various types of battles using Sol/Lull—divine energy created by peoples positive emotions. This task is not easy however, as her powers as an Eto-musume are far below the abilities of a single Eto-shin. As such, she needs a constant source of energy.But in a chance encounter, Nyaa-tan meets Takeru Amato, a man who has just transferred to the apartment where she is secretly staying. To Nyaa-tans delight, Takeru discovers that he gives out high quality Sol/Lull—something that sets him apart from most people. With this, the story of Takeru and Nyaa-tan begins. As Takeru supports Nyaa-tan in her dreams, he meets the Eto-shin and begins to uncover a mysterious past."
49,3249,2999,Hi no Tori: Yamato-hen,"Drama, Historical",OVA,1,7.04,1069,"At his fathers command, Oguna, the youngest prince of Yamato, sets out to kill Takeru Kawakami, the leader of Kumaso. However, upon arriving in Kumaso territory, he is injured by the stray arrow of a young local woman named Kajika who is hunting game. Eager to compensate for the terrible mistake, she escorts Oguna to her village to treat his wound. But as the two rapidly fall in love, the prince makes a disturbing discovery: Kajika is Takerus younger sister!Conflicted between his newfound love and family duty, Oguna seeks advice from the Phoenix, a legendary immortal bird that serves as Kumasos guardian. Compelled to make a decision, will the Yamato prince betray his own for the woman he loves, or will he murder Kajikas brother as commissioned?Inspired by the Yamato Takeru Japanese legend, Hi no Tori: Yamato-hen chronicles the tragic story of an ill-fated couple, showing how true love can conquer hate and adversity even among the greatest of uncertainties."
51,3251,21511,Kantai Collection: KanColle,"Action, Military, School, Sci-Fi, Slice of Life",TV,12,7.04,100999,"With the seas under constant threat from the hostile ""Abyssal Fleet,"" a specialized naval base is established to counter them. Rather than standard naval weaponry, however, the base is armed with ""Kanmusu""—girls who harbor the spirits of Japanese warships—possessing the ability to don weaponized gear that allows them to harness the powerful souls within themselves. Fubuki, a young Destroyer-type Kanmusu, joins the base as a new recruit; unfortunately for her, despite her inexperience and timid nature, she is assigned to the famous Third Torpedo Squadron and quickly thrust into the heat of battle. When she is rescued from near annihilation, the rookie warship resolves to become as strong as the one who saved her."
58,3258,31884,Mahoutsukai Precure!,"Action, Fantasy, Magic, School, Shoujo, Slice of Life",TV,48,7.04,3865,"In the human realm, witches and wizards seem to be mere creations of fantasy. Ever the adventurous teenager, Mirai Asahina sets out to disprove this notion by following the tracks of a peculiar shooting star that had fallen the night before. Sure enough, Mirai soon has a chance encounter with Liko—a clumsy witch apprentice who hails from the Magic World, a colorful realm inhabited by magicians.As if by fate, the appearance of strange villains forces Mirai and Liko to join hands. In doing so, they unleash their strength as a pair of legendary magicians—the ""Maho Girls Precure!"" Now gifted with unbelievable power, the unlikely duo embarks on an adventure filled with magical spells and powerful gemstones. Along the way, the two girls discover the hidden marvels that tie their individual worlds together."
59,3259,1951,Manie-Manie: Meikyuu Monogatari,"Adventure, Fantasy, Horror, Sci-Fi, Supernatural",Movie,3,7.04,9568,"Manie-Manie: Meikyuu Monogatari is an anthology film composed of three short films by acclaimed directors Rintaro, Yoshiaki Kawajiri, and Katsuhiro Otomo.Labyrinth LabyrinthosWhile Sachi is searching for her cat, Cicerone, they both fall through a mirror and become trapped in a mysterious, mind-bending labyrinth. They follow a clowns shadow into the distance, not knowing where it will lead them.Running ManBob Stone is a reporter working on an article about racer Zack Hugh, the ten-year reigning champion of an extremely popular and deadly automobile race. By the time the two meet, Zacks body and mind are shells of what they used to be. When the next race starts, Bob observes what happens when both man and machine are pushed to their breaking point, and what it takes to be an enduring champion.The Order to Stop ConstructionSalaryman Tsutomo Sugioka is dispatched into the heart of a dangerous jungle in order to halt a construction project after the foremans mysterious disappearance. There, he discovers the deadly and uncontrollable world created by the automated construction robots. When the chief robot is resistant to his orders, Tsutomo must figure out another way to stop the project before his companys financial losses become too great."
69,3269,31559,Prince of Stride: Alternative,Sports,TV,12,7.04,79630,"""Stride""—an extreme sport that combines parkour, free running, relay, and sprinting—is what made first year high school student Nana Sakurai enroll in Honan Academy, after being captivated by the schools stride team. Sharing the mutual intention of joining the team is fellow first year and stride maniac, Takeru Fujiwara, and together they request to join. Much to their dismay, however, the stride club is no longer active due to lack of members, and they are now operating under the shogi club.In order to revive the stride club, Nana and Takeru recruit first year Riku Yagami—a fast runner who is interested in almost every sport. With this new team, the club now aims high at a new goal: to win the prestigious End of Summer competition, and bring the Honan stride team back to their prime."
70,3270,5996,Prince of Tennis: Oshougatsu Special,"Action, Comedy, Shounen, Sports",Special,1,7.04,5000,"The New Year has finally arrived for the Seishun Academy Boys Tennis Team. As part of the festivities, Ryouma Echizen and his fellow first-year club members—Satoshi Horio, Kachirou Katou, and Katsuo Mizuno—celebrate by reminiscing about the past year. As the freshmen revel in nostalgia, it seems as if a strange hanetsuki tournament has begun among the rest of the team."
72,3272,28625,Shisha no Teikoku,"Historical, Psychological, Sci-Fi",Movie,1,7.04,31182,"By the 19th century, humanity has cultivated technology enabling the reanimation of corpses. Unable to experience individual thoughts or emotions, the corpses are programmed by humans to act as laborers in various occupations.This newfound technology, however, comes with a catch. Science may be able to restore the corpses ability to move, yet it cannot return what every corpse loses at death: the soul. But Doctor Victor Frankenstein, who vanished shortly after his revolutionary work on corpse reanimation, is said to have revived the only corpse in possession of a soul.In pursuit of this scientific knowledge, London medical student John Watson hopes to fulfill his promise to his late partner, Friday. After being scouted by a government agency, Watson is on a hunt to obtain Frankensteins notes, which he believes hold the key to the secrets of the soul. During his search, Watson uncovers the harsh realities of the developing corpse technology and the price he must pay to advance his research."
73,3273,7768,Tantei Opera Milky Holmes,"Comedy, Mystery, Super Power",TV,12,7.04,28812,"""Toys"" are powers bestowed upon those chosen to wield them, each having qualities that are unique to their users. Some of these individuals are born pure, using their powers to become detectives. Others bloom laced with poison and choose to become phantom thieves. These two opposing factions caused the formation of various detective academies around the globe—training detectives to fight and catch the phantom thieves.Sherlock Shellingford, Nero Yuzurizaki, Hercule Burton, and Cordelia Glauca form ""Milky Holmes"", a group recognized as the cream of the crop in the Yokohama-based Holmes Detective Academy. However, in a skirmish against the phantom thief Arsene, their Toys suddenly disappear, deeming them unfit to continue as detectives. Stripped of their prestigious life and thrown into a rundown attic, they face expulsion if they fail to regain their powers within the next three months.Tantei Opera Milky Holmes tells the story of a once-legendary group in their journey to recover their Toys, as well as attempting to continue their line of work without the powers that once defined their career."
77,3277,687,Tokyo Mew Mew,"Adventure, Comedy, Fantasy, Magic, Romance, Sci-Fi, Shoujo, Supernatural",TV,52,7.04,67936,"Ichigo Momomiya expected her date with her crush, Masaya Aoyama, to have a more romantic ending than her falling asleep after she sees a vision of a cat entering her body. Things get even stranger when, the next day, she begins displaying cat-like behaviors such as an intense craving for fish. When Masaya is attacked by a monster, she discovers that she is able to transform into the cat-eared magical girl, Mew Ichigo.After she saves Masaya, two researchers named Ryou Shirogane and Keiichiro Akasaka approach her and reveal they had injected her with Iriomote Cat DNA in order to create a magical girl that can save the world from aliens. Ichigo is tasked with fighting these monsters, but saving the world proves to be just too much for Ichigo to handle by herself. Fortunately, she learns that there are four other girls just like her, and now, Ichigo must find them quickly before the aliens completely take over the planet."
85,3285,31763,Accel World: Infinite∞Burst,"Action, Game, Romance, School, Sci-Fi",Movie,1,7.03,21916,"Some time after the events involving Burst Linker Dusk Taker, Kuroyukihime recalls recruiting Haruyuki Arita to the ""Brain Burst"" program—an application that allows players to accelerate their cognitive functions until time seems to stop. Since his arrival, Haruyuki has risen to fame among the other Burst Linkers and has been helping Kuroyukihime achieve her goal of reaching the highest level in the game.During a territorial battle with their Legion Nega Nebulus, Haruyuki and his friends are kicked out of the program after a destructive storm in-game. All over Tokyo, security cameras are malfunctioning, which Kuroyukihime deduces is related to the Brain Burst glitch. Determined to fix the problem, Nega Nebulus must recruit the other Legions to find the source of the issue and restore the acceleration ability."
88,3288,11703,Code:Breaker,"Action, Comedy, School, Shounen, Super Power, Supernatural",TV,13,7.03,135255,"Although cheerful and delicate, Sakura Sakurakouji is a skilled martial artist with a sense of fairness that never falters—no matter the situation. Upon witnessing people burning in blue flames while on a bus ride home, she calls the police to bring their murderer to justice only to find that no evidence remains. However, all her doubts about what she saw vanish when the next day, the new transfer student Rei Oogami joins her class; he is the very boy she watched commit murder in cold blood.Rei is kind, sweet, and quickly becomes popular, contradicting Sakuras accusations. Soon enough, she learns his true nature: a Code Breaker, or ""one who does not exist."" To Sakuras shock, Rei—armed with mysterious powers—seeks to exact justice according to the principle of ""an eye for an eye."" Determined to bring Rei to the right path, Sakura keeps close to him in the hopes of redeeming him from his ways before others are hurt."
