,Unnamed: 0,anime_id,name,genre,type,episodes,rating,members,synopsis
0,7400,32606,Onigiri,"Comedy, Fantasy, Supernatural",TV,13,5.47,15364,"Ancient Japan is under attack by powerful beings called ""Kamikui,"" and it is up to the ""Oni"" and his band of eight beautiful female warriors to stop them. Each of these girls have unique skills, abilities, and personalities. They partner themselves with the Oni, Jin, to stop the miasma of darkness sweeping across Japan. Onigiri follows the escapades of Jin and his merry companions as they strengthen their bonds and fend off the demonic invasion."
1,7401,12599,Ijime: Ikenie no Kyoushitsu,"Drama, Shoujo",OVA,1,5.46,805,The March issue of Shogakukans Ciao shoujo magazine bundled a DVD with a special anime of Igarashi Kaorus Ijime manga.
2,7402,1725,Keitai Shoujo,"Comedy, Drama, Romance, School",ONA,6,5.46,3655,This is about Hiro Aida and his friends. Their daily life at school and first romantic encounters with all the fun and confusion. All these people are connected to each other through cell phone messages.The anime has 5 regular episodes and 1 Epilogue episode.
3,7403,24633,LolitA☆Strawberry in Summer,Music,Music,1,5.46,196,"Animated music video for Tokyo Girls Style ""LolitA☆Strawberry in Summer"""
4,7404,28717,Luigi&#039;s Toy Adventure,Adventure,ONA,1,5.46,455,"A stop-motion short from Bandai, promoting the line of Super Mario Figuarts."
5,7405,30840,Many Things SD Gundam,"Comedy, Mecha, Parody",Special,2,5.46,249,Specials included on SD Gundam Collection Box.
6,7406,32697,Ozmafia!!,"Fantasy, Harem, Historical, Romance, Shoujo",TV,12,5.46,10290,The anime will feature an original story from the game on which it is based. 
7,7407,1341,Violence Jack: Harlem Bomber-hen,"Action, Drama, Horror",OVA,1,5.46,4566,"Kanto Hell Earthquake has demolished the metropolitan completely. After the earthquake, Slum King is kidnapping girls and sell them as sex slaves. Mari is wandering on the devastated field looking for her lover, Ken. But she is also kidnapped by them. While she is tortured and trained as a sex slave, Ken saves her. Ken has become the member of Slum King. The king offers condition to him; in return for releasing her, he has to kill Violence Jack. (Source: AniDB)"
8,7408,1340,Yami no Shihosha Judge,"Horror, Seinen, Supernatural",OVA,1,5.46,1488,"Hoichiro Ohma works in an office. Everybody knows him as a silent, humble man. Even his girlfriend, Nanase, doesnt suspect that he could be something more, but he is. When a person dies as a victim of murder; when someone kills himself with a curse on his lips; when someones death needs to be judged, he is there, for he is a Judge Of Darkness. Following the Laws Of Darkness, with a book made of human skin and an unusual parrot, he pronounces judgement over living criminals that would otherwise go free.(Source: ANN)"
9,7409,16656,Zettai Junpaku♡Mahou Shoujo,"Action, Ecchi, Harem, Magic",OVA,1,5.46,5410,Doujinshi anime Blu-ray Disc offered at the Comic Market 82 event on August 2012.
10,7410,1819,Daimajuu Gekitou: Hagane no Oni,"Horror, Mecha, Sci-Fi",OVA,1,5.45,1112,"In the year 1999, a team of UN scientists in an attempt to tap into a new energy resource on a deserted island called Sansara, unknownigly open a portal to another universe, unleashing dormant biomechanical entities. Three years later, Takuya Goroza returns to the island of Sansara urged by a mysterious request by college chum Haruka Alford. Little does he know, his old friend isnt what he appears to be... (Source: ANN)"
11,7411,28057,Dangobei Torimonochou: Hirake - Goma no Maki,"Action, Adventure, Comedy",Movie,1,5.45,129,Heibei and his companions are involved in a fight against bandits.
12,7412,8772,Happy Weekend,"Kids, Music",Music,1,5.45,166,A music video for the song by Konishiki that was featured on NHKs Minna no Uta program.
13,7413,6843,Kangaroo no Tanjoubi,Adventure,Movie,1,5.45,419,A baby kangaroos family and friends try to save him from a bad old wolf.  Short film from 1940.
14,7414,8717,Kumo ga Haretara,Music,Music,1,5.45,297,"A happy Minna no Uta song reminiscent of Singing in the Rain, this time its dancing umbrellas. Animation by Taku Furukawa and song by Aya Etsuko."
15,7415,3596,Lightning Trap: Leina &amp; Laika,"Action, Sci-Fi",OVA,1,5.45,406,"The fourth and final OVA of the Leina-centric Machine Robo: Revenge of Chronos spin-off/sequel. Instead of following the story of the previous Wolf Sword Legend continuity, Lightning Trap takes place in another universe.In present day Tokyo, traveling has never been more comfortable than aboard the Lightning L808, Japans new luxury passenger plane. One day, on what seemed to be a routine flight, Haruka Leina and the planes passengers were unaware of the mysterious and top secret cargo brought aboard, which attracted the attention of international terrorists set on obtaining it. Now, with a dangerous hostage situation at hand, only special agent Laika Strange and brave Leina may be able to save the passengers, and keep the deadly cargo from falling into the wrong hands..."
16,7416,25393,Master of Torque 2,"Action, Sci-Fi",ONA,1,5.45,329,"A continuation of the first season.Makina lost consciousness when the Marishi Machina suit developed by the Hyuga Corporation seized control of her body and sent her charging onto the new Shutoko expressway on an MT-07. Luckily, Dan was able to stop her before it was too late. With Makina on the back of his MT-09 Street Rally, Dan began riding back towards the Genesis Café only to be intercepted by Hyuga Corporation chairman Mitsukuni Hyuga. He was waiting for them with an unsettling expression on his face.Dan was sure that he would be forced to resign his job for getting the heir to the company’s presidency, Kotaro Hyuga, involved in this mess. But when Makina confronts Mitsukuni about the truth behind the incident that claimed their parents’ lives, Dan is given an order he would never have expected.Dan keeps trying to avoid facing the trauma he experienced as a child, but is encouraged to find the truth by Makina. Sanae, the owner of the Genesis Café, seems to notice their troubled state and takes matters into her own hands.Can Dan face his past and free himself of the curse he has borne and reclaim his future with his own hands?The interlocked gears of fate driving the destinies Dan, Makina and Kotaro begin to move again, and the next part of their story is about to unfold...(Source: Yamaha site)"
17,7417,30600,Military! Special,"Comedy, Ecchi",Special,1,5.46,2063,Episode 13 included with the Blu-ray/DVD release. 
18,7418,27437,Mushiba Tetsudou,"Adventure, Fantasy, Kids",Movie,1,5.45,158,"""Brush your teeth, or the Cavity Express will come get ya!""Dentist apprentice boy EGG, and his side-kick cavity pal C1 hops into the mechanical-biological-train ""Cavity Express"" to explore through cavity world to accomplish necessary training need to achieve yearning DOCTOR title!Toothbrush and Toothpaste as his arsenal, Boy Egg resist against bad-nasty-cavities to rush for the ""End of the Journey Station""!!!Cavity Express is one of a kind, fantasy adventure animation!(Source: AniDB)"
19,7419,1059,Mutant Turtles: Choujin Densetsu-hen,"Action, Adventure, Comedy, Sci-Fi, Super Power",OVA,2,5.45,1660,"When the Teenage Mutant Ninja Turtles acquire Mutastones from Crys-Mu, the spirit of light, they acquire the ability to enhance themselves into Super Turtles for a duration of three minutes. Meanwhile, the evil Shredder and his minions Bebop and Rocksteady stumble upon the Dark Mutastone, which transforms them into Devil Shredder, Supermutant Bebop and Supermutant Rocksteady, respectively. But the Turtles have one more trick up their shells: all four of them can combine into their ultimate form—Turtle Saint.(Source: ANN)"
20,7420,10674,Omake,Comedy,Movie,1,5.45,339,Some short pieces of funny animations and penakisticope.(Source: Yamamura Animation)
21,7421,4391,Saru Masamune,"Adventure, Military",Movie,1,5.45,659,Short movie from 1930 about a soldier traveling a great distance to deliver a letter. Along the way he receives a sword from a monkey. 
22,7422,29956,Swimming,Dementia,Movie,1,5.45,125,"The short animation evokes all the awkwardness of a school swimming class. A chubby young boy, steps up reluctantly for his turn, after watching the sporty prowess of his peers.(source: Official website)"
23,7423,27927,Urawa no Usagi-chan,"Comedy, School, Slice of Life",TV,12,5.45,8554,"An original anime advertising Urawa City in Saitama, Japan."
24,7424,7475,Ano Ko ni 1000%,"Romance, School, Shoujo",OVA,1,5.44,1084,"Ano Ko ni 1000% is a high school love story. Azusa Kawahara is the soccer team manager, and her love for childhood playmate Ikumi is mutual. Although the whole school knew what was happening between Azusa and Ikumi, there were rivals who came between them.(Source: Wikipedia)"
25,7425,32789,Answer,"Music, Supernatural, Vampire",Music,1,5.44,103,"A music video for ""Answer"", a song by Red Dracul Scar Tissue and Jazztronik."
26,7426,29629,Coffee Break,,Movie,1,5.44,265,A short film by Furukawa Taku.
27,7427,7523,Fuku-chan no Sensuikan,"Comedy, Historical, Military",Movie,1,5.44,183,"Fuku-chan was one of the most popular newspaper comic strip boy-characters in Japan at the time. The film portrays a submarine attack on an enemy cargo ship. Though this, too, was to boost patriotism, Japanese children particularly enjoyed the scenes in which the kitchen crew cooked in the submarine kitchen. Released in November of the same year, the food shortage was quite serious in Japan, and the abundant food supply in the submarine kitchen -- vegetables, fruit, fish, rice, and more which were already luxury items in Japan at the time -- was prepared into various dishes along with a merry, rhythmic song.(Source: AniDB)"
28,7428,7569,Idol Ace,Comedy,ONA,1,5.44,559,In summer 2005 an original promotional animation of 2.5 minutes length was produced by Shogakukan for the upcoming release of the Idol Ace manga by Adachi Mitsuru in the Weekly Young Sunday magazine.The short features the main character being recorded throughout the day by a peeping pervert.(Source: AniDB)
29,7429,8993,Juliet,"Ecchi, Romance",OVA,1,5.44,284,"Based on the manga by U-Jin.This is a story of two siblings, Anzu and Naruto Nozaki, heirs to the fabulous Nozaki fortune. Naruto appears to be an overbearing sis-con. In fact, hes madly in love with Anzu, because theyre not blood-related. He confines her to the family mansion for ""security,"" depriving her of companionship and a real life. At age 16, she starts to rebel. She smuggles in a kitten as a pet (Naruto hates cats) and then escapes in a delivery truck. Naruto catches up to her and realizes that she cant be confined like a bird in a cage. He agrees to let have a normal life, but just then, tragedy strikes (Source: Collectr)"
30,7430,6318,Kigurumikku V3,"Comedy, Ecchi, Magic, Mecha, Parody",ONA,3,5.44,1181,"The high spirited girls Azuki Edomae, Mutsumi Mutsuki and Serika Shihodo, put on their ""KIGURUMI""costumes instantly transforming them into the super heros Kigurumikku-Swan, Kigurumikku-Falcon and Kigurumikku-Swallow. Follow these super-girls as they defend Minamachi City and bring peace to the town."
31,7431,13085,Kitsutsuki Keikaku,Slice of Life,Movie,1,5.44,194,Puppet animation by Tadanari Okamoto.
32,7432,29946,Orchestra,Music,Music,1,5.44,137,"When an artist seeks to visualize a musical number, they can fulfill the desire by producing an animation to accompany the sound and rhythm. In this sequence, an assembly of wavy lines metamorphose to Ludwig van Beethovens ""Symphony No. 2 in D Major, Op. 36 - IV. Allegro molto,"" as performed by an orchestra. The lines seamlessly transform into many shapes and objects—such as musicians, instruments, animals, angels, and demons. This phantasmagoria is a true spectacle for the eyes and ears."
33,7433,29771,Recorder,"Dementia, Music",Movie,1,5.44,199,Short animation by Ryu Kato.
34,7434,29673,Shin Tenchi Souzou,Comedy,Movie,1,5.44,129,Independent animation by Tsukioka Sadao.
35,7435,18723,Soul Reviver,"Action, Seinen, Supernatural",Special,1,5.44,326,"3D CG promotional video for the Soul Reviver manga by Fujisawa Tohru.In the manga, the dead can be brough back to life, if their souls can be restored before disappearing into the void. Between death and the void is the world of the dead, and two individuals - the former detective Jin Ryuusuke and the dead high school girl Sekimachi Kurara - salvage souls in this realm.(Source: ANN)"
36,7436,21215,Zettai Shougeki: Platonic Heart Picture Drama,"Action, Ecchi, Martial Arts",Special,4,5.44,481,Short picture drama specials included in BD/DVD volumes.
37,7437,30739,Ane Log: Moyako Neesan no Honpen wo Tobidashite Tomaranai Monologue Specials,"Comedy, Ecchi",Special,3,5.44,1264,"In addition to the flash anime, 3 short special episodes were included on the Ane Log Fan Disc.Episodes#1: Sekai no Ane Ijin no Jikan#2: Moya-nee Boot Camp#3: Ane Denwa Soudan"
38,7438,30341,Tarzan,Dementia,Movie,1,5.43,130,Furukawa Taku film.
39,7439,2462,Toushinden,"Action, Martial Arts",OVA,2,5.43,2400,"For one year, Master Swordsman Eiji Shinjo has been haunted by the memory of his battle with the renegade champion, Gaia - a battle that was cut short by the forces of the malevolent syndicate known as ""the organization."" Denied victory, Eiji left the tournament followed by his opponents mocking laughter. Worse still, Eiji walked away no closer to finding his long lost brother, Sho. But now, a mysterious warrior is hunting down the champions of the previous tournament and using their own moves against them - and it looks like that person may be Sho. Who is this powerful new foe and who is his next target? Eiji and Kayin, his closest friend and greatest rival, struggle to unravel the mystery before they, too, join the ranks of the defeated. The answer lies at the heart of the Organization and its plans for world domination. At last, the ultimate battle between the greatest fighters in the world will be decided. But if Eiji loses, his friends - Ellis - may Die... (Source: AniDB)"
40,7440,15533,Yakimochi Caprice,Slice of Life,Special,2,5.43,328,"Special ending animation sequence for the ""Anime Seijin: Tokimeki Recipe"" cooking and talk show. The ""nonsensical romantic fantasy"" of the anime centres around a kitten named Loup and a puppy named Noix — both of whom believe that they are actually human girls. (Source: ANN) "
41,7441,31309,Balloon,Dementia,ONA,1,5.42,230,A short animation by Yutaro Kubo.
42,7442,12561,Benkei tai Ushiwaka,"Action, Comedy",Movie,1,5.42,410,"Benkei tai Ushiwaka is a short animated Japanese film made in 1939 by Kenzō Masaoka. It is based on the legendary encounter between Saitō Musashibō Benkei, who was collecting swords for the Buddha, and Minamoto no Yoshitsune, who was called Ushiwaka in his youth.(Source: Wikipedia)"
43,7443,2983,Digital Devil Story: Megami Tensei,"Adventure, Demons, Drama, Fantasy, Horror, Mystery, Psychological, School, Supernatural",OVA,1,5.42,2660,"Akemi Nakajima, is a high school student with a genius talent for computer programming. One day, Yumiko Shirasagi is transferred to the same class as him. She feels she knows Nakajima from somewhere, but doesnt try to deal with it. After school, Nakajima and a couple of classmates held a ceremony to summon the devil. Nakajima summons the devil Loki on the computer display while presenting a female offering. What will happen to Yumiko, who witnessed the scene?(Source: Official site, edited)"
44,7444,1075,Netrun-mon the Movie,Comedy,OVA,1,5.42,961,"""Netrun-mon THE MOVIE #1"" is an original animation DVD conceived by Netrunner Magazine to celebrate their 5th birthday. This 30-min OVA is directed by Poyoyon Rock (of ""Popotan"" fame) and stars cute Netrunner characters Nini-tan and friends. (Source: AniDB)"
45,7445,5826,Oira no Yakyuu,Sports,Movie,1,5.42,866,Movie from 1930 about a baseball game between rabbits and tanuki. 
46,7446,7448,Pacusi,Comedy,TV,18,5.42,215,Pacusi is a story of Pacusi and his family. Little happenings in ordinary days are described. We can enjoy the warmhearted and big strange world of Pacusi.
47,7447,21607,Picotopia,"Fantasy, Music",ONA,1,5.42,547,RIKENs (The Incorporated Administrative Agency Rikagaku Kenkyusho) promotional video with animation by Mirai Mizue and music by twoth.
48,7448,1285,Soukihei MD Geist,"Mecha, Military, Sci-Fi",OVA,1,5.42,7802,"In the distant future, mankind has colonized other planets in the universe. While many planets lived in peace, the planet Jerra has been ravaged by decades of war. Geist is an M.D.S. (Most Dangerous Soldier), an enhanced human with unsurpassed combat capabilities and an insatiable lust for battle. Because of his uncontrollable nature, Geist is cryogenically frozen and locked in a satellite. Several years later, the satellite crashes and Geist wakes up from his sleep to engage in another war. This time, to help the army stop the planets central computer from activating a doomsday device that will lead to total annihilation of all life on Jerra. (Source: ANN)"
49,7449,10954,Toei Robot Girls,"Mecha, Parody, Sci-Fi",ONA,1,5.42,1208,"A pilot film streamed on the anime studio Toei Animations website. The female leads in the film are dressed as various famous robots in Toeis anime catalog—the girls are personifications of robots in the Gaiking (""Gai-chan""), Magnerobo Ga-Keen (""Gacky""), and Superhuman Combat Team Baratack (""Bara-tan"") and the newly added character is from the anime Planet Robot Danguard Ace.(Source: ANN)"
50,7450,28241,Ahiru Rikusentai,"Action, Historical, Kids, Military",Movie,1,5.41,178,Ducks get into a conflict with frogs and start a war.
51,7451,1596,Arcade Gamer Fubuki,"Action, Comedy, Ecchi, Parody, Shounen, Sports, Super Power",OVA,4,5.41,3201,"Fubuki Sakuragasaki is a powerful gamer who, with the power of her Passion Panties, climbs up the ranks of the BAG (Best of Arcade Gamer) tournament to become the greatest Arcade Gamer in the world. However, the evil Gulasic Group is out to conquer the world through said tournament, and their gaming skills will prove to be a challenge. Fubuki must team up with the legendary Mr. Mystery to combat the four Gods of Gaming and make the world of arcade gaming safe for all. (Source: ANN)"
52,7452,1528,Bishoujo Yuugekitai Battle Skipper,"Comedy, Mecha, Sci-Fi",OVA,3,5.41,883,"Despite the title, this is not a feature but the three-part OAV Battle Skipper (1995), which Takashi Watanabe directed before going on to Slayers. When the members of the Etiquette Club at St. Ignacios School for Girls go down the tubes--literally--they acquire the skimpy outfits they wear to pilot the unfortunately named BSs or Battle Skippers, state-of-the-art military mecha. As ""Extars,"" the Etiquette Club members fight to eliminate evil from the world, which means the bizarre schemes of Sayaka, the nasty, super-rich president of the rival Debutante Club, and her flunky, Todo. The series was created to promote a line of robot toys from Tomy, and viewers who are willing to accept high school girls quarrels escalating into battles involving satellite weaponry may enjoy these silly adventures.(Source: AniDB)"
53,7453,28305,Broots,"Mecha, Sci-Fi",Special,1,5.41,132,"The original six-minute ""pilot"" featured a slightly different version of Might Orbots called Broots (pronounced ""Brutes""). Rob and Ono looked similar to their finished selves, though definitively more late 70s-like. The Orbots, while having the same names as in the finished product, are subtly different, and obviously unfinished. Even their combined form aka ""Super-Broots"" would go through some more developmental evolution before becoming Mighty Orbots.(Source: Wikipedia)"
54,7454,9356,Cool Cool Bye,"Action, Adventure, Fantasy",OVA,1,5.41,374,"Two brothers are riding around on their hover bikes, when suddenly a giant metal fortress gets in their way. After a brief battle, the duo manages to gravely wound the fortress. It retreats and dumps our heroic pair in a wasteland.But this wasteland is inhabited by nomads that indicate that the fortress was hidden inside a mountain. The nomads plead for the duo to finish the job. Two of the natives go with them as guides, and somewhere along the way the gain the help of a fairy that can transform into a mech-warrior woman.(Source: irreality.org.uk) "
55,7455,1705,Genma Taisen: Shinwa Zenya no Shou,"Adventure, Drama, Horror, Sci-Fi, Shounen, Supernatural",TV,13,5.41,798,"In the distant future, monsters and inhumans roam the land, and the ruling Evil King seeks a human woman to bear him powerful, force-adept heirs. Non offers herself to the Evil King in order to save her village from Ape Clan raiders, and gives him twin sons, Loof and Jin. She and her sons are exiled by the ungrateful villagers, however, and Nons companion Nue (a Demon Clan member changed into a wolf for disobedience) takes Loof to be raised by his father, the Evil King. The Evil Ones Queen Parome despises humans, however, and her malevolence towards Loof deepens...(Source: AnimeNfo)"
56,7456,2897,Nandarou,Comedy,Special,1,5.41,1584,"A short TV advertising spot featuring a small green pig with enormous eyes. The title Nandarou implies that even its creators didnt really know what kind of creature it was supposed to be. However, NTV (Nihon TV) chose it as their stations mascot. (Source: ANN, Nausicaa.net) "
57,7457,7060,Ring of Gundam,"Mecha, Sci-Fi, Space",Special,1,5.41,2411,"The story of ""Ring of Gundam"" takes place in a new era long after the events of the first Mobile Suit Gundam series One-Year War. In this world setting, a giant 600-kilometer-wide ring now floats in lunar orbit. An Earth Federation Forces member named Eiji discovers an object called ""Beauty Memory"" buried in a high-altitude, massive rockbed on Earth.(Source: ANN)"
58,7458,32289,Anison Nippon,"Action, Sci-Fi",ONA,1,5.4,209,Short animation by Rapparu.
59,7459,34324,Chiryokumaru,Action,ONA,1,5.4,817,"Inside a majestic museum, a young warrior gets attacked by shadow beasts born from peoples fear and uncertainty over what they dont know. The warrior fights against them using the energy charger on his waist, but soon the energy runs out. In this desperate situation, he finds a new, unexpected source of power.(Source: YouTube)"
60,7460,7530,Hana to Chou,Fantasy,Movie,1,5.4,203,"An early color animation which uses the color to help tell the story. Three butterflies save a bird that falls out of its nest during a rainstorm. The butterflies decide to ask the flowers for cover, but the red rose will only help the red butterfly since they are the same color.(Source: AniDB)"
61,7461,28355,Henna ABC,"Kids, Music",Music,1,5.4,103,"A music video for the song ""Henna ABC"" by Miyuki Ichijou, and NHK Tokyo Childrens Choir. Aired as part of NHKs Minna no Uta program. "
62,7462,2765,Momotarou: Umi no Shinpei,"Action, Military",Movie,1,5.4,700,"A monkey, a dog, a pheasant, and a bear travel southward after resting in their villages at the foot of Mt. Fuji. A squadron flies to Onigashima under the command of Momotarou. Parachutes blossom in the sky. Momotarou and company will take over the island after a swift and successful mission. The village children pretend parachuting with glee as they run towards Mt. Fuji.(Source: Imagica)"
63,7463,32344,Nana-iro Megane,Music,Music,1,5.4,90,"Yukie Nakauchis music video collaboration with song creator Koni. The MV aired on NHKs E-Tele ""Digista Teens"" program."
64,7464,14743,Nara Shika Monogatari,Comedy,ONA,1,5.4,228,"If the deer of Japanese Nara Park are bullied, they will become like this. "
65,7465,8679,Saboten ga Nikui,"Comedy, Kids, Music",Music,1,5.4,161,A dung beetle and a scorpion among others are taunted and teased by some cacti. A stop motion animation with song by Yamada Kuniko for NHKs Minna no Uta segment.
66,7466,31102,Taiko no Tatsujin: 15 Shuunenkinen Short Animation,Game,ONA,1,5.4,461,"Toshio Suzuki and Studio Ghibli produced the short to commemorate the 15th anniversary of the Taiko no Tatsujin (Taiko: Drum Master) rhythm game series. The short features Taiko no Tatsujin characters Don-chan and Kacchan, as well as an original mouse character. The short will also be broadcast as a TV ad later. (Source: ANN)"
67,7467,25377,TOTO Green Challenge,Slice of Life,ONA,1,5.4,115,A four minute educational commercial by TOTO about water and how the TOTO ecotechnology works.
68,7468,4176,Wanna-Be&#039;s,"Action, Comedy, Sports",OVA,1,5.4,763,"This OVA begins with a tag-team battle between the elegant girls of Dream Team and the heavy-face-painted women of Foxy Ladies. Naturally, the Dream Team gets the crap kicked out of them, but not before one of them makes one strong attempt at lifting the 250-pound Foxy lady over her head. The ones to take their place are Eri and Miki of the Wanna-Bes team. Miki and Eri are both just fun girls who want to have fun, but once they begin their new training with the mysterious Kidou Corporation, the same corporation that trained the Dream Team, they discover that there is something deeper behind their training. "
69,7469,5304,Akiba-chan,"Comedy, Kids, Slice of Life",TV,10,5.39,1383,"Akiba-chan focuses on the daily life of Akiba-chan and four fellow TV and game fans in the Maison de Akiba apartments. Buildup Entertainment (Gundam: Mission To The Rise, Macross Plus) produced the computer animation with director Junya Kabe (Specter, D) and character designer Poyoyon Rock (Nurse Witch Komugi, Starship Girl Yamamoto Yohko). (Source: yukianimereviews.com)"
