,Unnamed: 0,anime_id,name,genre,type,episodes,rating,members,synopsis
4,3104,5039,Kurozuka,"Action, Drama, Historical, Horror, Romance, Sci-Fi, Vampire",TV,12,7.08,52145,            by MAL_editing_team
12,3112,30375,Starmyu,"Music, School, Slice of Life",TV,12,7.08,21032,"Yuuta Hoshitani enrolls in the prestigious Ayanagi Academy in hopes of finding the high school student who inspired him. The academy is well-known for producing exceptional musical talent, but students must first compete for acceptance into the Musical Department. At the top of the department is the Kao Council—a group of third-year students who possess a great deal of influence over the school and admission into the department. The fastest route to entering the department for Hoshitani is to find a way into a Star Team, which would allow him to be taught by a member of the Kao Council.After catching the eyes of Itsuki Ootori, Hoshitani finds himself under the tutelage of the Kao Councils most eccentric member. Alongside him on Team Ootori is his roommate, Tooru Nayuki, fledgling Kabuki actor Kakeru Tengenji, the quiet Shuu Kuga, and Kaito Tsukigami, the younger brother of famous Ayanagi alumni Haruto.As Hoshitani struggles with his lack of talent, his teammates must also overcome their shortcomings. Facing opposition from other talented Star Teams, including the other four members of the Kao Council, Team Ootori must carve their own path as they aim to perform in the Ayanagi Festival. "
13,3113,33033,Starmyu OVA,"Music, School, Slice of Life",OVA,2,7.08,2447,"After a successful Ayanagi Festival, Yuuta Hoshitani and the members of Team Ootori celebrate the beginning of a new year and their final semester as first years at Ayanagi Academy. However, with Itsuki Ootori expelled from the Kao Council, Team Ootori no longer qualifies as a Star Team. Stripped of their privileges, they also will not be allowed to participate in the upcoming graduation ceremony. Desperate to get their mentor back, Hoshitani and the others hatch a plan to convince the Kao Council to allow Ootori to reassume his former position."
23,3123,11285,Black★Rock Shooter (TV),"Action, Drama, School, Slice of Life",TV,8,7.07,198991,"On the first day of junior high school, Mato Kuroi happens to run into Yomi Takanashi, a shy, withdrawn girl whom she immediately takes an interest in. Mato tries her best to make conversation with Yomi, wanting to befriend her. At first, she is avoided, but the ice breaks when Yomi happens to notice a decorative blue bird attached to Matos phone, which is from the book ""Lil Birds At Play."" Discovering they have a common interest, the two form a strong friendship.In an alternate universe, the young girls exist as parallel beings, Mato as Black★Rock Shooter, and Yomi as Dead Master. Somehow, what happens in one world seems to have an effect on the other, and unaware of this fact, the girls unknowingly become entangled by the threads of fate."
24,3124,3407,Blassreiter,"Action, Sci-Fi",TV,24,7.07,55444,"Modern Germany is plagued by an outbreak of ""Amalgams."" Existing solely to wreak havoc, these cybernetic entities spawn from rotting flesh and can fuse with technology to gain new abilities. With society left in the wake of their destruction, the Xenogenesis Assault Team (XAT) is formed to suppress the threat. Alongside its primary mission to protect against the Amalgam attacks, the organization is also researching the newly discovered ""amalgamated"" humans which possess rational thought and are far deadlier than their non-sentient counterparts.Joseph Jobson is one such amalgamated human who has full control over his powers. Although successful in his line of work as a lone warrior, an unfortunate encounter with the recently-turned-Amalgam Gerd Frentzen makes him a priority target of the XAT. As he eludes the organization and seeks new allies, Joseph is transformed into the Blassreiter—a being heralded as the strongest Amalgam in existence. Now, he must fight back with his newfound powers to uncover the truth behind not only his past, but also the entire Amalgam conflict."
31,3131,127,Gate Keepers,"Action, Comedy, Fantasy, Mecha, Sci-Fi, Shounen",TV,24,7.07,14582,"Technology, science, and industry—this is 1969 Tokyo, and there is no better time to be alive! But a shadow looms quietly around every corner: ""Invaders"" have infiltrated the populace, and nobody knows who or what they are.Only the members of the top-secret agency AEGIS know of their existence. Covertly fighting the enemy is their job, but only those with the ability to open ""Gates"" to another world can truly defeat them. Within AEGIS is a specialized task force known as the ""Gate Keepers."" Composed of extraordinary individuals with a variety of Gate-related abilities, they are the only ones who can save humanity from the vicious Invaders plaguing the planet.Shun Ukiya is an average high school student who lives with his widowed mother and little sister. While on his way home from school one day, he comes across a group of Invaders heading toward his house. In a desperate plight to save his family, Shun discovers he possesses the ability to open a Gate, allowing him to harness massive amounts of energy. With his newfound ability exposed, he catches the attention of AEGIS, and particularly the interest of one of its Gate Keepers, Shuns childhood friend Ruriko Ikusawa."
52,3152,9874,Touhou Niji Sousaku Doujin Anime: Musou Kakyou,"Fantasy, Magic",OVA,2,7.07,18305,"In the hidden magical land of Gensokyo, shrine maiden Reimu Hakurei constantly makes sure that supernatural incidents involving mythical creatures known as youkai remain as infrequent as possible. As part of her shrines traditions, she hosts an annual summer banquet that invites a variety of guests, ranging from humans to even the strongest of youkai.On the morning of the banquet, however, the shrines donation box suddenly goes missing. Furthermore, there appears to be no trace of any theft whatsoever. As Reimu, her friend Marisa Kirisame, and news reporter Aya Shameimaru investigate the situation, they realize that others also have missing possessions. With each step closer to piecing the puzzle together, the group soon understands that this phenomenon is more than just simple thievery—an incident on par with Remilia Scarlets mist or Yuyuko Saigyoujis youkai cherry blossom."
54,3154,15489,Yu☆Gi☆Oh! Zexal Second,"Action, Fantasy, Game, Shounen",TV,73,7.07,11293,"After defeating a mysterious enemy, Yuuma Tsukumo, along with the help of Kaito Tenjou and Ryouga ""Shark"" Kamishiro, has thwarted the Barians plans. However, Yuuma is still on a quest to retrieve the Number Cards to restore Astrals memories. The Seven Barian Emperors catch wind of Yuuma and Astrals endeavors and begin to collect the cards themselves to achieve their ultimate goal: destroying Astrals world in exchange for saving their own.Though only five of the emperors are present, they unanimously decide on annihilating Astral and Yuuma once and for all. Elsewhere, with their newfound powers of ZEXAL, Astral and Yuuma work to eliminate the enemy force that threatens Earth and the rest of the universe.Yu☆Gi☆Oh! Zexal Second unveils the mysteries and unpleasant surprises that lie in the wake of Yuumas adversities. As Astral struggles to accept his past and the consequences it may have brought, will the gods continue to shower their fortune upon Yuuma on yet another perilous adventure?"
55,3155,18677,Yuusha ni Narenakatta Ore wa Shibushibu Shuushoku wo Ketsui Shimashita.,"Comedy, Ecchi, Fantasy, Romance",TV,12,7.07,115338,"Dreaming of becoming a hero and vanquishing the Demon King, Raul Chaser enters the Hero Training Program in pursuit of his ambition. However, when the Demon King is defeated and peace returns to the world, the Hero Training Program is suspended indefinitely, making it impossible for anyone to become a hero.Two years later, Raul reluctantly works at a small electronics store called Magic Shop Leon. Though the former hero-in-training is plagued by the mundanity of working in retail, everything changes with the arrival of a new hire. Appearing at first to be just a boy with good looks, ""he"" turns out to be a female demon by the name of Fino Bloodstone. She is not just any old demon either—Rauls new coworker is in fact the daughter of the late Demon King! Handed the responsibility of training this eccentric new employee, Raul soon finds his life becoming livelier than it ever was before."
57,3157,873,.hack//Roots,"Adventure, Drama, Fantasy, Game, Sci-Fi",TV,26,7.06,50480,"After the termination of the incredibly popular virtual reality MMORPG ""The World,"" a new version of the game—The World R:2—is brought online. On his first day in the game, newcomer Haseo thinks he has made some friends to quest with. However, as if mocking his sentiments, they kill his character just for fun. Luckily, he is saved by a mysterious, one-armed player named Ovan who offers to show him around The World. Alongside Ovan and his cleric friend Shino, Haseo enjoys a wonderful first year in the game. But this peaceful life is shattered when Shinos character is killed by a familiar figure notoriously known as Tri-Edge, whose victims have all fallen into comas in the real world. In a fit of rage, Haseo vows to find the elusive Tri-Edge and kill him.Taking place during Haseos first year in The World, .hack//Roots explores the friendships Haseo built in the game before Tri-Edge ripped them away."
60,3160,13145,Cardfight!! Vanguard: Asia Circuit-hen,"Action, Adventure, Demons, Game, Shounen",TV,39,7.06,11031,"Following their intense battle in the national tournament, Team Q4 disbands, with everyone returning to their regular lives. While paying a visit to Card Capital, Aichi Sendou notices an unfamiliar customer in the shop. After teaching the secretive boy about Cardfight Vanguard, he realizes that his usual deck has become entirely different. Although it contains a variety of units Aichi has never seen before, everyone insists that the cards are the same ones that he has always been using. Moreover, the strange boy disappears without a trace, leaving Aichi further puzzled. As Aichi gets accustomed to the new bizarre deck, he aims to unravel the mystery behind the incident and the peculiar boy."
61,3161,30903,Children Record,Music,Music,2,7.06,745,"Children Record features two songs, the titular one serving as an opening to the Kagerou Project song series.Kisaragi AttentionFor the ultra-popular idol Momo Kisaragi, going out in public is nearly impossible. No matter what, she always seems to capture everyones attention. Shes not even that talented! With so many doubts, one would think she might as well quit. However, after meeting with the ""Mekakushi-dan,"" Momo may finally find a place to belong.Children RecordLong ago, the heat-haze began drawing in victims, granting them red-eyed powers—but these powers bring more pain than good. Through the despair, these affected children push ever onward to a future full of hope."
62,3162,16512,Devil Survivor 2 The Animation,"Action, Demons, Supernatural",TV,13,7.06,101266,"The countdown to extinction begins on Sunday with the arrival of the Septentriones, otherworldly invaders set on the eradication of mankind. Caught in the crossfire, Hibiki Kuze and his friends join in the war for humanitys survival by signing contracts with demons to become ""Devil Summoners."" Soon, their abilities attract the attention of JPs, an underground agency led by Yamato Houtsuin. Once recruited into JPs, Hibiki and his friends fight and bond alongside other ordinary citizens who are Devil Summoners. However, with each new day, another Septentrione appears to wreak havoc upon Japan. Even if many lives are lost in the process, before that night ends, the young summoners must defeat the invaders at all costs."
65,3165,11809,gdgd Fairies,Comedy,TV,12,7.06,2284,"Pikupiku, Shirushiru, and Korokoro are three fairies that live on a floating island. Whether theyre chatting about the weird things they encounter in their daily lives, goofing off in the enchanted ""Room of Light and Magic,"" or gazing into their looking pool that shows bizarre worlds, the fairies are always having fun in whatever way they can."
75,3175,9712,Maria†Holic Alive,"Comedy, Parody, School, Shoujo Ai",TV,12,7.06,40502,"When Kanako Miyamae transferred to a new all-girls school, she hoped to find true love. What she found instead was the beautiful Mariya Shidou, a charming classmate Kanako met on her first day. But Mariya has one flaw: she is actually a cross-dressing boy! After discovering Mariyas secret and becoming stuck with him as her roommate, Kanakos life has become a series of misfortunes. All she wants is to find the girl of her dreams, which is hard to do with the meddling of the sadistic Mariya and his sharp-tongued maid Matsurika Shinouji.Maria†Holic Alive continues the story of Kanako as she deals with being Mariyas roommate and aims to find true love, while enduring high school itself."
81,3181,25099,Ore ga Ojousama Gakkou ni &quot;Shomin Sample&quot; Toshite Gets♥Sareta Ken,"Comedy, Ecchi, Harem, Romance, School",TV,12,7.06,77774,"Kimito Kagurazaka is a commoner with a fetish for mens muscles—or at least thats the lie he must keep telling if he wants to keep himself out of trouble at the elite all-girls school, Seikain Academy. Kidnapped by the school under the assumption that he prefers men, Kimito is made to be their ""commoner sample,"" exposing the girls to both commoner and man so that the transition to the world after school is not jarring. Threatened with castration should his sexual preferences not match the schools assumptions, Kimito keeps up the facade to protect his manhood.But there are eccentric individuals around every corner who begin to make Kimitos life even more difficult. Among them are Aika Tenkuubashi, a social outcast who blurts out whatever comes to mind; Hakua Shiodome, a young genius; Karen Jinryou, the daughter of samurai who is obsessed with defeating Kimito; and Reiko Arisugawa, the perfect student who has delusions of marrying Kimito. Along with the commoner himself, these four girls make up the Commoner Club, which attempts to teach the girls more about life outside the school, while Kimito gradually learns about the odd girls surrounding him."
85,3185,31374,Shingeki! Kyojin Chuugakkou,"Comedy, Parody, School, Shounen",TV,12,7.06,52928,"On his first day of junior high, Eren Yeager comes face-to-face with a titan—and has his lunch stolen! From that day on, he holds a grudge against titans for taking his favorite food from him, a cheeseburger, vowing to eliminate their kind once and for all. Along with his adoptive sister Mikasa Ackerman and their friend Armin Arlert, the trio traverse the halls of Titan Junior High, encountering familiar faces and participating in various extracurricular activities as part of the Wall Cleanup Club.A parody of the immensely popular parent series, Shingeki! Kyojin Chuugakkou places beloved characters as junior high school students, fighting to protect their lunches from gluttonous titans."
91,3191,308,Zettai Shounen,"Drama, Fantasy, Mystery, Sci-Fi, Shounen",TV,26,7.06,11165,"Oftentimes, people are most vulnerable when they are lonely and unable to get along with those around them. Isolation is felt more keenly amongst a crowd, so some will try to find solace in the strangest of places, where the unknown lurks. Such people include Ayumu Aizawa, a former city boy now living in the countryside of Tana, and Kisa Tanigawa, a young girl who has a hard time relating to others. What these two share in common is a feeling that their life has gone astray. Zettai Shounen tells a story of strange phenomena affecting two different settings, with no explanations of their origin or sudden appearance. All that is known is that these phenomena seem to center on individuals with mixed emotions toward themselves and others."
92,3192,2404,Zombie-Loan,"Action, Horror, Shounen, Supernatural",TV,11,7.06,93637,"Do you know when you are going to die? Michiru Kita does, as she has the ability to see a ""ring of death"" on the necks of those around her—and the darker the ring, the closer one is to death. One day, she notices that two boys in her class, Chika Akatsuki and Shito Tachibana, have completely black rings. Seeking to warn them of their impending demise, she stumbles onto their secret: they are already dead, but are kept alive due to a contract with Zombie-Loan, a mysterious loan office. Of course, nothing comes without a price, as the boys must hunt down and kill zombies in order to pay off their debt. And once they learn about Michirus ""Shinigami Eyes,"" they drag her into their crazy world."
99,3199,8728,Code Geass: Hangyaku no Lelouch - Kiseki no Birthday Picture Drama,"School, Supernatural",Special,1,7.05,18422,"On a lively December day at Ashford Academy, the students are joyously preparing for tomorrow’s school festival. However, the celebrations come to an abrupt halt when terrorists strike the academy. The students are taken hostage and put under lockdown as militant remnants of the Neo-Chinese Federation seize control of the school.Little do the aggressors realize that among the student body are those with extraordinary powers, including the Geass-wielding Lelouch Lamperouge and Britannian soldier Suzaku Kururugi. To protect their school and restore the peace, Lelouch and the student council must band together again to bring about one last miracle."
