,Unnamed: 0,anime_id,name,genre,type,episodes,rating,members,synopsis
70,7470,2054,Carol,"Fantasy, Magic, Shoujo",OVA,1,5.39,537,"Carol is the tale of a teenage girl whose life seems normal enough until she notices music disappearing from all around her, such as the sound of Big Ben, her father`s cello-playing, and the concert of her favorite band, Gaball Screen. After hearing some mysterious voices, Carol is transported to a fantastic world where she must fight against the evil monsters who are stealing the music from Earth. She meets and is assisted by three dashing heroes: Clark, Tico, and Flash.(Source: AniDB)"
71,7471,21875,Chou Akuukan Bouheki Cheese Napolitan,Music,ONA,1,5.39,554,"GMO Internets full 3D CG two-minute anime special featuring its two female mascots. The video features the image song ""Up To You"" by Maaya Uchida and Sumire Uesaka.(Source: ANN)"
72,7472,19209,Devour Dinner,"Dementia, Fantasy",Movie,1,5.39,215,Various scenes of predation. 
73,7473,21717,Koisuru Niwatori,Music,Music,1,5.39,129,A lovesick hen directs her attention to an unlikely recipient.Music video of a song by Taniyama Hiroko. Featured in NHKs Minna no Uta. 
74,7474,1949,Mahou no Chocolate,"Drama, Romance",OVA,1,5.39,2277,"Mami-chan has a crush on her schools soccer club star, Ishida-senpai, and tries against hope to work up the courage to give him chocolate for Valentines Day. She learns from her friend Koko-chan of the mysterious Magical Chocolate. Will the magic make Mamis dream come true?(Source: AnimeNfo)"
75,7475,33693,Meitantei Gordon,"Comedy, Mystery",ONA,1,5.43,107,Gordon is a famous detective from England providing input on a murder during a dinner party. 
76,7476,14023,R²: Rise R to the Second Power,Music,Music,1,5.39,240,"Based on a manga by Hakoda Maki serialised in Comic Blade Brownie.A pizza delivery boy must save the world! Young Kenta Akagi has never been anywhere except for his hometown of Lutzheim, where he currently ekes out an existence as a pizza delivery boy. Faraway places, strange foreign folks, the wars they fight, and the adventures they have are just stories to him, until he meets a young girl - the kind of girl that wars are fought over! People seem afraid of her, but Kenta doesnt understand why. All he knows is that he seems to remember her from somewhere, and that he has to protect her no matter what!Note: This short animation clip was released as part of the special Comic Blade Digital DVD sold at Animate.(Source: AniDB)"
77,7477,30075,Yuki no Hi no Tayori,Music,Music,1,5.39,122,A music video for the song by Youko Yoda that was featured on NHKs Minna no Uta program.A little girl reminisces in winter of what spring will bring.
78,7478,3463,A.LI.CE,Sci-Fi,Movie,1,5.38,1034,"In the year 2000, Alice Hayashi wins a trip to the moon in a sweepstake. However, when her shuttle launches, something goes terribly wrong, and the next thing she knows, she has crashed somewhere in a frozen wasteland. Before she can get her bearings, strange soldiers begin to attack her, forcing her to flee.Eventually, Alice meets a young man called Yuan, who tells her that she is in Lapland in the year 2030. The soldiers pursuing her belong to Nero, an enigmatic leader who controls the world through his supercomputer. He is also responsible for reducing the Earths population by over seven billion. Convinced that Nero has something to do with her time jump, Alice, Yuan, and the android maid Maria journey to Kingdom, the shadowy fortress that Nero rules from."
79,7479,12865,Ai wa KAT-TUN,Comedy,ONA,5,5.38,1513,"The mobile content developer MTI released a series of mobile phone anime shorts inspired by the all-male musical group KAT-TUN. Animated versions of the singers Kamenashi Kazuya, Taguchi Junnosuke, Tanaka Kouki, Ueda Tatsuya, and Nakamaru Yuuichi appear in unintentionally romantic situations with their younger sister. Each of the mobile anime series five 50-second episodes highlights one KAT-TUN performer.(Source: ANN)"
80,7480,32811,Black Ocean,Music,Music,1,5.38,83,"A music video for Imeruats song ""Black Ocean"". "
81,7481,5869,Chou no Sainan,Action,Movie,1,5.38,619,A short movie from 1931 about a mouse stealing a butterflys wings and her journey to get them back.
82,7482,16389,Komachi to Dangorou,"Adventure, Comedy, Kids, Sci-Fi",ONA,2,5.38,215,"Niigata citys publicity mascot characters, Komachi Hanano and Dangorou Sasa, search for the mysterious stone that was stolen after it had fallen from the skies."
83,7483,15389,Kremlin,"Comedy, Seinen",ONA,5,5.38,458,"A gag, flash animation comedy that centers around a purported college student named Haruo ""Cat"" Kyattsuyama who only went to his school, the low-tier Kunekune College, once. One day, he sees a cute Russian Blue cat named Kan-u abandoned in a cardboard box on the roadside somewhere in Japan. Kyattsuyama pretends not to see the cat, and continues to do so for an entire year. Surprisingly, no one has shown up to try to save the cat, so Kyattsuyama finally decides to pick the cat up — however, by then, there are now three Russian Blue cats instead of just one. Kyattsuyama asked the cats for their names, and they all said ""Kan-u."" The anime shorts are inspired by Kaoru Curry-zawas ""Kremlin"" cat gag comedy manga. (Source: ANN) "
84,7484,30160,Oppai ga Ippai,"Kids, Music",Music,1,5.38,104,"Music video for the song Oppai ga Ippai by Kana Bunke (ぶんけかな) that was featured on the Fuji TVs show ""Hirake! Ponkikki."""
85,7485,7449,Pacusi no Uta,Comedy,Special,1,5.38,225,Special episode of Pacusi.
86,7486,17163,Peeping Life: The Perfect Evolution Specials,"Comedy, Slice of Life",Special,3,5.38,220,3 bonus episodes centering around TV Asahis female announcers.
87,7487,11729,Space Neko Theater,Comedy,ONA,1,5.38,584,"Cat lovers by cat-lover, love for cats, which are animated omnibus CM and assortment of fictional programs."
88,7488,25545,Tanu no Magical Holiday,"Kids, Music",Music,1,5.38,100,No synopsis information has been added to this title. Help improve our database by adding a synopsis here.
89,7489,31426,Urawa no Usagi-chan Special,"Comedy, School, Slice of Life",Special,1,5.38,764,Unaired episode included in Blu-ray and DVD sets.
90,7490,13087,Youkoso Uchuujin,Comedy,Movie,1,5.38,190,Stop motion animation of aliens on a guided tour around an amusement park. (Source: AniDB) 
91,7491,5025,Dengeki Oshioki Musume Gootaman: Gootaman Tanjou-hen,"Action, Comedy, Ecchi, Parody",OVA,1,5.37,2106,"Mari Amachi is a very devout Christian who transfers to Perfect Religion Academy. A school devoted to all religions of the world in effort to make its students the next world leaders in religion. Her friend Saori is kidnapped by the Black Buddha cult; a group who wishes to take away religious freedom though force and brainwashing. Mari prays to God for help but Buddha answers the call, instead! Mari aspires only to help her friend and she is transformed into Butt Attack Punisher Girl Gotaman. Between fighting bad guys, making a deal with Buddha, and wearing scandalous costumes, is it more than Mari can take? "
92,7492,30105,Fukashigi no Kazoekata,Kids,ONA,1,5.37,143,"An anime commissioned by The National Museum of Emerging Science and Innovation (Miraikan for short) for its ""The Art of 10^64 -Understanding Vastness-"" exhibition which ran from August 1, 2012 to April 15, 2013.This is an example about combinatorial explosion.""I want to demonstrate how amazing combinatorial explosion is! Please dont stop me!""Teacher and children tell you how difficult it is.(Source: Official YouTube Page)"
93,7493,28639,Futon,Dementia,Movie,1,5.37,358,"A futon, a traditional Japanese mattress, as seen by Yoriko Mizushiri, becomes the vehicle of dream fantasies combining the most pleasant sensations such as the morning coffee, the warmth of bedding and a soft rice carpet under one’s feet. Lazy stretching serves as a start of sensuous, sleepy gymnastics. With a fluid movement, the passive body will turn once again from the left to the right of the mattress to dive into the fantasies of even deeper unconsciousness a little while later.(Source: Krakow Film Festival)"
94,7494,31108,Green Dakara x Bakemono no Ko,Music,ONA,2,5.38,1086,"In the first ad titled ""Sashiire"" (Insertion or Present), a song tells the story: the brands Green Dakara-chan and Mugi-chan enter the world of The Boy and The Beast, and they give Green Da-Ka-Ra mineral water and barley tea to the movies main character Kyūta and his beast teacher Kumatetsu.The first ad debuted online on Wednesday, and will air nationwide on Saturday. The second 15-second ad, ""Market,"" will debut online and on television next Wednesday. Then, after the film itself opens on July 11, the campaigns website will present an exclusive 80-second version of the video.(Source: ANN)"
95,7495,30162,Hone Hone Rock,"Kids, Music",Music,1,5.37,101,"Music video for the song ""Hone Hone Rock"" by Shimon Masato that was featured on the Fuji TVs show ""Hiragana! Ponkikki."""
96,7496,1751,Jikuu Bouken Nuumamonjaa,"Action, Comedy, Fantasy",OVA,1,5.37,5348,"Its the night before the fair celebrating the Kingdom of Guardias one thousand year anniversary. When the humans have gone to sleep for the night, excited about the next days celebration, the monsters come out to play.Nuu and Mamo are two little monsters itching to have their own adventure in time and space, and their adventure group Nuumamonjaa is recruiting new members. Since neither is particularly strong in the brains department, their adventure turns into a disaster as they get into one mishap after another.A fast drinking competition, a close encounter with a robotic cat, and a high-speed car chase—this might be more adventure than the tiny duo bargained for!"
97,7497,31512,Love &amp; Gift,Slice of Life,ONA,1,5.37,155,"A and B have never met each other, but there is a thread that ties them together.(Source: Official website)"
98,7498,28653,Maze,,Movie,1,5.37,138,Abstract stop motion animation by Tochka.
99,7499,22471,Mirakururun Grand Purin!,"Kids, Music",Music,1,5.37,152,Animated music video for Minihams Mirakururun Grand Purin! with the singers appearing as hamster characters.
