,Unnamed: 0,anime_id,name,genre,type,episodes,rating,members,synopsis
0,11200,31788,Ero Manga! H mo Manga mo Step-up♪,Hentai,OVA,Unknown,7.11,2967,Based on the erotic game by Clock Up. 
1,11201,6590,Makai Kishi Ingrid,"Demons, Fantasy, Hentai, Martial Arts",OVA,4,7.11,5068,"Dark existences were secretly invading Tokyo, the diabolic city. Behind the success of ninjas of justice called Taimanin, the darkness starts the action... Hell knight Ingrid revealed the betrayal of a diabolic doctor, Sabato Kiryuu, who has belonged to a group of darkness, Kanomado. She follows after him who managed to escape from the spot. However, she gets the counterattack from Kiryuu in a certain hideous church and becomes captive. With vengeance, Kiryuu tries to destroy Ingrids noble soul and decoy her boss, Edwin Black the vampire, into coming to save her. He encourages a group of monsters who have the desire for revenge against Ingrid to disgrace her body...(Source: DLsite)"
2,11202,18693,Tenioha!: Onnanoko datte Honto wa Ecchi da yo?,Hentai,OVA,2,7.1,3727,Based on the erotic game by Rootnuko+H.
3,11203,4763,Tsuma Shibori,"Hentai, Romance",OVA,2,7.11,4230,"Kousuke lives a boring life without women.... One day, his father introduces a woman, Madoka, and he is forced to live with her. Madokas older sister Sakura starts to live with them to keep watch on them and his cohabitation with two beautiful sisters starts....a world filled with wives in need of some attention awaits him.(Source: saishuu.com)"
4,11204,21925,Chichiiro Toiki,Hentai,OVA,2,7.1,4124,"Based on the adult manga by Goban.Takashis childhood friend Saya and his younger sister Mika may not see him as a real man, but just being around them has been provoking him more and more. Following yet another failed proposal on his part, Saya feels bad for him and lets him grope her breasts, but it quickly gets out of hand and turns into a full night of full-blown sex!(Source: H-Moe) "
5,11205,23479,Itadaki! Seieki♥ Special,Hentai,Special,1,7.1,2815,"Having found a beautiful partner that is well-versed in sexual matters, Kanzaki certainly counts himself lucky. However, reality soon catches up with him, and he wonders why someone as attractive as Mari Setagaya wants to hang out with his mundane self.When Kanzaki reveals his doubts to his girlfriend, Mari worries that he might be getting bored of her. She decides to use her innate charm as a half-succubus and prove to Kanzaki that she has eyes only for him. "
6,11206,10106,Sweet Home: H na Oneesan wa Suki Desu ka?,"Harem, Hentai",OVA,3,7.1,4175,"Ryuichi is a university student. He used to live alone and enjoyed his school life. But one day, his apartment was destroyed by a fire.... He reluctantly comes back to his house. But his house has been changed to a boarding house for girls...! It seems there is no place for him to live. But they all allow him to stay there together! His new life begins like this....(Source: Himeya Shop)"
7,11207,5194,Aneimo,Hentai,OVA,2,7.09,7244,"Takumi lives next to Mizuki and Satsukis house. They have been good friends since they were kids, going shopping and skiing together. One day, Kazuyoshi, Takumis father, brings two girls, Saori and Yui, back to their house, and accepts them as new family members. At first, he is confused, but gradually becomes closer to them..."
8,11208,10694,Bloods: Inraku no Ketsuzoku 2,Hentai,OVA,2,7.09,7086,"The Sagimiya family is cursed in that its members are sexually aroused in the presence of another of the same bloodline. Sagimiya Misaki and her elder twin, Shun, are both disgusted over this and have sworn to resist the calling of their blood. However, Shun loses his composure and goes to their elder sister, Kagu, for release. After Misaki finds out, she too loses her resolve and seeks out Shun.(Source: ANN)"
9,11209,3771,"Nee, Chanto Shiyou Yo!",Hentai,OVA,5,7.09,6171,"Based on a game by Candy Soft My name is Kuya Hiiragi. Actually, I have six elder sisters. The eldest sister is Hinano Ne-san although she looks quite young. She is always worrying about that, so if she is treated like a child, she gets angry. The second sister is Kaname Onee-sama. She is a popular lawyer and is known as the ""Icy Lawyer"". In fact, she is my first love. The third is Serori Ne-Ne. She is half Japanese and half North European. She has the most voluptuous body of all the sisters, but her behavior is very childish. The fourth is Tomoe Ne. Although she looks quite stern, she is actually quite gentle and gets teased by the other sisters. The fifth is Takane Aneki. She is highhanded, and treats me like a servant. She often beats me. The youngest sister is Umi Oneechan. She takes care of me a lot, and devotes much love to me.When I was a child, I was adopted by the Hiiragi family. But because the father was afraid that the sisters would spoil me, I was sent to a relative to train myself. It is the first time I`ve gone home since then. I was very excited to see them again, especially Kaname, my first love.They welcomed me home, but late at night, Kaname Onee-sama raped me, and treated me like a toy. I felt very ashamed and I made up my mind to train my sex technique to put her to shame...with the help of the other sisters.(Source: AnimeNfo)"
10,11210,2446,Nikuyome: Takayanagi Ke no Hitobito,Hentai,OVA,4,7.09,3316,"Mitsuko is a beautiful woman who had just married. She went to her husbands house and began to live with his family, but it was the beginning of her life as a sex slave for most of the males in her husbands family."
11,11211,4358,Aniyome wa Ijippari,Hentai,OVA,2,7.08,7882,"Based on the game by Tinker Bell.Tsutomus parents passed away several years ago, before that they ran a flower shop. Now its run by his older brothers wife, Mai and he is living with them. Tsutomus brother now works somewhere else, so Mai is left alone and her only support is Tsutomu, who helps her running the flower shop. Because Tsutomus brother is busy and havent been home for a while, Mai feels very lonely which Tsutomu notices and decides to support and satisfy Mai while his brother is away. Now theres also Kozue, Mais friend and senpai who recently got hired as part-time worker. Kozue has noticed Tsutomu and Mais relationship and she envies them because she is also very lonely, because her husband is rarely home. Mai sympathizes with Kozue and allows her to date Tsutomu. Now what will happen as these three indulge themselves to their desires and feelings? (Source: AniDB)"
12,11212,16914,Chu Shite Agechau: Oshikake Oneesan no Seikou Chiryou,Hentai,OVA,2,7.08,3659,Based on the erotic game by Syrup: Honey Sweet.
13,11213,29807,Honoo no Haramase Paidol My★Star Gakuen Z The Animation,Hentai,OVA,1,7.08,2254,Based on the adult novel by Minami Ebinuma and Squeez.
14,11214,11321,Nee Summer!,Hentai,OVA,2,7.08,7929,"Yuuta Yamauchi is an average high school student preparing for exams through his summer vacation. His older cousin Kei Higashide, who takes pity on him as her ""little brother,"" devotes her time and patience to tutor this relative in need.One day, Yuuta manages to take a photo of his classmate and crush, Youko Kaji, as a gust of wind lifts her skirt. When Kei finds out about it, she laughs at Yuutas juvenile infatuation and starts teasing him about his sexual preferences. From words to deeds, she offers him her own grown-up body—and Yuuta quickly takes advantage of the opportunity.As summer passes on and the relatives start enjoying more time together, their initially bland tutoring sessions soon turn into a passionate and fiery relationship."
15,11215,20849,Oni Chichi 2: Revenge,Hentai,OVA,2,7.08,6423,"Three of the Makino sisters—Natsume, Akira, and Fuyu—plan to attend a school training camp at the beach. Since they must find someone to come with them in their sick advisers stead, the sisters choose to go along with their father, Kenichi. However, given his illicit desires, Kenichi plans to do more than simple training with them."
16,11216,32518,Shoujo kara Shoujo e...,Hentai,OVA,Unknown,7.08,1964,Based on the erotic manga by Shiomaneki. 
17,11217,6194,Stretta The Animation,Hentai,OVA,2,7.08,5625,"Ruma is the most beautiful and popular girl on school, she acts nice and polite with her classmates and friends, but she has a side that almost every male student knows and that is that she has the perfect sex body and she likes to have sex with any student she wants, where she wants and when she wants. Actually she only feeds with the sperm of her sexual encounters. The couples from Stringendo & Accelerando also appear in this OVAs and are Strettas photo-targets so she can masturbate later with their sexual encounters. (Source: ANN) "
18,11218,8039,Oppai no Ouja 48,Hentai,OVA,2,7.07,3815,"The other day, when I was reading an adult book, I thought, ""I can tell whose breasts they are by just looking at them. Well, am I a king of oppai?"" However, there was no way to prove it.... But one day, I receive a letter and it includes a bunch of free sex tickets! Also, the reverse side of each ticket has the photo of someones breasts. When Im confused, a girl, Nil, appears in front of me. According to her, Im qualified to take part in a game. It seems the tickets arent fake. My mission is to look for a girl whos got the same breasts printed on the ticket. Like this, my search for oppai begins....(Source: ErogeShop)"
19,11219,10280,Uchuu Kaizoku Sara Special,"Hentai, Sci-Fi",Special,1,7.07,2441,An exclusive sequel included in the DVD Box of Uchuu Kaizoku Sara.
20,11220,5902,Hyakujitsu no Bara,"Drama, Yaoi",OVA,2,7.06,17362,"Two soldiers from warring countries are bound by a pledge as master and servant. Taki Reizen is a Commander of sublime beauty, shouldering the fate of his nation. Called ""Mad Dog"" because of his rough temperament, Klaus has sworn his loyalty to him as a knight. Despite this, those around them are cold and disapproving, full of various misgivings. For all their genuine feelings, what will come of love made cruel by the violence of war? "
21,11221,32063,Kyonyuu Hitozuma Onna Kyoushi Saimin,Hentai,OVA,Unknown,7.06,2045,"Morishita Wataru grew up on a motherless family, but despite his lonely environment, he worked hard and managed to enroll on the prestigious Ousei academy. The school is run by an old scholarship rule, in which the students grades are tied to the teachers evaluation, so the teachers inevitably give the students a strict education.Morishita has good grades, but on a class where everyone is an excellent student, his grades where below the average. Her homeroom teacher Tsukishima Kyoko was particularly strict on him, and not only about his grades, but even on his daily life. Morishita was very stressed between the difficult studies and the harsh teaching, but he had someone to help him, she was the assistant homeroom teacher of his class Shirakawa Miwa, a kind, maternal woman who understood Moshitas circumstances and was always on his mind.However, she suddenly announced her marriage, and Morishita who lost his friend and only moral support fell into despair. Naturally he could not concentrate on his studies and ended up getting the lowest score on the scholarship test, ending up going to special classes after school.His stress was bigger than ever, now that her admired Miwa was going to be anothers man woman and his grades are the lowest. At that moment, his smartphone started to vibrate, checking it out of curiosity, there was an app he had never seen called ""Hypnosis app""...(Source: VNDB)"
22,11222,741,Sensitive Pornograph,"Comedy, Drama, Hentai, Romance, Yaoi",OVA,1,7.06,27518,"For four young men, love and intimacy are in the air, even though they may not be aware of it. Sensitive Pornograph holds within it two tales of sexual romance for two different couples of men. The first is a tale between two manga artists, Seiji Yamada and Sono Hanasaki. Both are familiar with each others work, though upon meeting each other, Seiji is shocked to find out that Sono is actually a man, ten years his senior. Love quickly blossoms between the two, but will soon be tested when Seiji begins to hear rumors about Sonos past sexual exploits.In the second tale, Koji Ueno is a part-time pet sitter, hired to take care of a rabbit named Aki for a new client. To Kojis complete surprise though, not only is there no rabbit in the house, but the only thing in the apartment is a bound and gagged man in the closet who says that he is Aki. More troubling than this is that Aki informs Koji that they are both in danger of upsetting the client, and the only way for Koji to get out safely is for them to make love together.Two stories, four men, and the one emotion of love that unites them all in the new twists their lives have taken."
23,11223,13595,"Suki de Suki de, Suki de The Animation",Hentai,OVA,2,7.06,5108,The story follows two girls and their relationships with their older brothers.(Source: ANN)
24,11224,19859,Yokujou Bazooka The Animation,Hentai,OVA,1,7.06,2361,Based on the adult manga by Taropun
25,11225,29809,3Ping Lovers!☆Ippu Nisai no Sekai e Youkoso♪ The Animation,Hentai,OVA,1,7.05,3541,Based on the adult visual novel by Hadashi Shoujo. 
26,11226,13219,Himesama Gentei!,Hentai,OVA,2,7.05,4132,"This is the first title by Princess Sugar. Celina is the princess of the prosperous western European country of Mellberg and came to Japan to study at a normal school while concealing her true identity. Since she is a distant relative to Yuu, she ends up living in his house. One day, the princess of the resource-rich country of Marualand, Olivia, was exiled to Japan in a coup d’état. Quickly gaining notice around the town, she was treated like a honored guest. However, Yuu disapproved of her snobby attitude since he had grown accustomed to being around princess Celina. Then, Celina told Olivia not to be near him as he is her most precious person. Not backing down from the challenge, she states that she will make him hers. (Source: VNDB) "
27,11227,12959,Ojousama Yomeiri Kousou!,Hentai,OVA,2,7.05,3853,"The story revolves around a transfer student, Mamoru Amakawa. One day he received two love letters: one from Sakura Sumiyoi, daughter of the gang leader who owns the northern half of the city, and the other from Ageha Kurosaki, daughter of the Black Rose mafia leader who rules the southern half of the city. Unfortunately, these two fell in love with him and willing to do anything just to get his affection. How will he cope with these sticky situations?(Source: Livez Einzweil) "
28,11228,31810,Amakano,Hentai,OVA,Unknown,7.04,2695,"Its only the end of November and the hot springs town Yomase-machi was already a winter wonderland, having been dyed white from the falling snow. Yuuki moved to this snowy town to help his grandparents shovel snow at their home, the former boarding house Yamanouchi-sou. He met many warm-hearted people, including the shrine maiden Sayuki who worries about her inability to properly greet strangers, his mysterious but playful housemate and senpai Mizuki, and the local cafés cheerful and energetic kouhai mascot Koharu. Even though he was still feeling lost, he tried to get used to living in this snowy land. During that time, his grandfather suggested that he find love while he is still young and lead a new life in earnest. Nows the time for him to take the first step and fall in love.(Source: VNDB)"
29,11229,21001,Dekakute Ecchi na Ore no Ane,Hentai,OVA,1,7.04,3843,Based on the adult PC game by Marine (brand of Marigold).
30,11230,2432,Discipline,"Hentai, School",OVA,6,7.04,15917,"The prestigious Saint Arcadia School has recently started admitting male students, and Takuro Hayami is among those joining. Elated at the prospect of sharing the dormitory with charming and well-endowed classmates, he fails to realize that the girls at the academy are sex-hungry deviants.A regular student at first glance, Takuro instantly becomes the target of aggressive courting. When Yuuki Miyagishi, one of his roommates, manages to seduce him, she discovers his special ability: outstanding sexual prowess! Hayamis ""Ultimate Sex Power"" soon becomes known across campus, and what started as playful kinkiness turns into a fierce competition as every student club strives to persuade Takuro into joining their ranks. Hidden beneath Saint Arcadias sugar-coated reputation lurks a desperate sexual power struggle—and the arrival of the new transfer student might just be the tipping point."
31,11231,17745,Kakushi Dere,Hentai,OVA,3,7.04,3528,"Nonoka goes out of her way to make a written confession to the older brother of one of her classmates, but he doesnt even read the letters. This prompts her to stop by in person, and express her ""hate"" for him through various antics..."
32,11232,3992,Himekishi Lilia,"Demons, Fantasy, Hentai, Horror, Magic, Supernatural",OVA,6,7.02,5445,"The princess knight Lilia Evelvine is set to succeed her father as the ruler of the Leuven kingdom, but her jealous brother, Dirk, will do anything to halt her ascension to the throne. With the aid of Kiriko, his court enchantress, and Sand, the servant of the King of Demons, the dastardly prince enacts a coup to gain control of the castle and become the next king. He succeeds, but not before being reminded of his agreement with Sand: to extract the holy energy within Lilia as a tribute to the King of Demons. Dirk then proceeds to corrupt his mother and Lilia with all sorts of perversions, hoping to fulfill his task on time while turning the two into his loyal slaves."
33,11233,3375,Kirepapa.,"Comedy, Drama, Romance, Yaoi",OVA,2,7.02,30628,"Chisato Takatsukasa, a 35-year-old author, has such a youthful appearance that anyone would think him to be in his early twenties. His work is inspired by his idol—the best-selling mystery author Saki Shunka, who is as much of an enigma herself as the plots of the books she writes.Chisato is also the extremely overprotective father of 15-year old Riju, convinced that the ""friends"" his son constantly brings over are nothing but predators waiting for the perfect opportunity to defile his precious boy. As a result, Chisato will stop at nothing to ensure they never come over again, resorting to the most extreme of methods.There is not a man he hates more, however, than Rijus rather persistent best friend Shunsuke Sakaki, who just wont go away regardless of what Chisato tries to do. But the motivations of these characters lie as secrets bubbling just below the surface. Why is Chisato so wary of Rijus friends, and what exactly does Shunsuke know about the mysterious author his friends father idolizes?"
34,11234,2433,Lingeries,Hentai,OVA,3,7.02,4344,"As Yusuke Nakonishi begins his new job at the Best Beauty Body Lingerie Company, little does he know that hes about to find himself in the center of a ring of business and sexual intrigue. Charged to disrupt and eliminate the cohorts of an opposing faction, Nakonishi thrusts himself on the prowl after three of his sexy co-workers around whom this sex drama spirals.(Source: AniDB)"
35,11235,3970,Sentakuya Shin-chan,Hentai,OVA,2,7.02,5039,"Based on the game by Black Package.Shinji Oura is a part-time launderer since one month. Hes working for Asai Cleaning under Sayaka, a rather young widow.While trying to gain the heart of his employer, Shin-chan doesnt miss an occasion to mess around with the housewives of his neighbourhood, especially with Marissa the hot chick from Bangkok!"
36,11236,3479,Taimanin Asagi,"Action, Demons, Hentai, Martial Arts, Supernatural",OVA,4,7.02,7603,"The world is a dangerous place. Humans and demons coexist under delicate circumstances, dictated by an unspoken pledge not to influence one another. Unfortunately, there are always those willing to break the agreement for their own selfish gain. Seeking to combat these outliers, the Japanese government employs the Taimanin—an elite group of female human ninjas—to maintain the balance of power between the mundane and the otherworldly.After the defeat of her greatest nemesis Oboro, Asagi Igawa decides to retire from the Taimanin and devote herself to a peaceful, average life with her boyfriend Sawaki Kyousuke. However, little does she know that Oboro managed to survive thanks to a pact with a demon. Having sworn revenge on Asagi, she abducts her—along with Sawaki and her younger sister Sakura—and subjects them to sexual and psychological abuse without mercy. Though Asagis resolution is absolute, there is little she can do when Oboro turns the ninjas closest ones against her by humiliating them in the most heinous ways imaginable."
37,11237,30898,Tsunpri,Hentai,OVA,1,7.02,2362,"This story is divided into 2 parts:The first focuses on Diana, who is in charge of ""rewarding"" a knight for her bravery and protecting the royal family, while the second focuses on Reiana, after a dangerous battle in which she considerably risked her life, she is in charge of visiting this same gentleman who saved her life, and by chance of fate, they end up being more united than ever."
38,11238,2852,Accelerando: Datenshi-tachi no Sasayaki,Hentai,OVA,4,7.0,7484,"Waitress Tamaki has sex with her playmate Kurono at the café she works for. Ignorant of their relationship, their common friend, Ohashi, visits the café as usual to see Tamaki whom he secretly loves. However, Kurono notices Ohashis feelings. In order to incite him into confessing his feelings to her, Kurono molests Tamaki and makes her wait on him as she is. As she was sexually excited, she gives off a females scent, which, in turn, excites Ohashi. Meanwhile, Tomoe, a friend of Kuronos appears... Will Ohashi be able to confess his love to Tamaki?(Source: AnimeNfo)"
39,11239,5719,Sex Pistols,"Comedy, Drama, Supernatural, Yaoi",OVA,2,7.0,15885,"An average boy named Norio is suddenly getting a lot of unwanted romantic attention. A fall down the stairs into the arms of a handsome stranger sets off the beginnings of an explanation, and it is one Norio never could have possibly imagined. Soon a whole new world opens up for Norio revealing a secret society of special people evolved from animals other than monkeys. Norio turns out to be a particularly rare breed and his DNA is in high demand. Now that hes suddenly the prey, itll take much effort to survive in this modern jungle. This story revolves around a high school boy who discovers that he is part of a select group of humans who did not evolve from monkeys, but various animals such as leopards and black bears. (Source: ANN) "
40,11240,10488,Shocking Pink!,"Harem, Hentai",OVA,2,7.0,3877,"A boy named similar to Zhuge Liang, from Romance of Three Kingdoms meets a girl who believe that shes a desendant of Liu Bei. She wants him to become her strategist. (Source: MU) "
41,11241,21363,Tokubetsu Jugyou 3 SLG The Animation,Hentai,OVA,2,7.0,2601,"Based on a game by Bishop.Ishizuka Kengo has started working as a teacher at the school he graduated from and has been given the job of taking care of the old school building until it gets demolished. While for others that task may have been troublesome for him it is an opportunity to satisfy his dark desires, and he wastes no time doing so...Ishizukas first target is Morimiya Saki, a student at the school, but soon he also targets Sakis friend Arisa, Sakis mother Rie, and another teacher at the school—Mashima Mikako. What awaits these four at the hands of the sadistic teacher?(Source: AniDB)"
42,11242,5464,Cafe Junkie,Hentai,OVA,2,6.99,7889,"Even though Masaru is about to graduate from a technical college pretty soon he still has no job. One and only pleasure for him is to spend time at a cafe called ""Hidamari"". The cafe is owned by his childhood friends Nanami and Kurumis parents and they are working there too. One day, he learns another one of his childhood friends is coming back to his town. He says ""I wanna meet her soon."". Triggered by his word, Nanami and Kurumi start to approach him in a very different way than they ever did before...(Source: ErogeShop edit)"
43,11243,2136,Front Innocent: Mou Hitotsu no Lady Innocent,Hentai,OVA,1,6.99,7713,"During the Civil War, the powerful landowner Carson had a beautiful daughter with an innocent heart. As Faye enjoys an intense sexual relationship with her friend John and her servant girl Sophia, the end of her innocent days draws near. The mysterious Lord Mark has set his eyes on her and will stop at nothing to get her.(Source: Anime-Legion)"
44,11244,747,Haru wo Daite Ita,"Drama, Romance, Yaoi",OVA,2,6.99,15269,"The adorable and attractive main characters of Haru wo Daiteita are Kyousuke Iwaki and Youji Katou who are both in the film industry, having starred in various adult video films and are trying to climb the ladder of success and become greater actors. Iwaki is accepted to star in a popular movie, having beaten Katou in the auditions. During their time together, Katou believes he is in love with Iwaki-San, who on the contrary refuses to believe that he is in love. It is later on that another gay actor comes back to Japan and co-stars with Katou that problems starting arising. And it is from then on that the two realise where their hearts are set.(Source: ANN)"
45,11245,19631,Tayu Tayu,"Harem, Hentai, Romance",OVA,4,6.99,3579,"Tayu Tayu is an anime adaptation of the adult manga of the same name by Yamatogawa.Since his parents moved abroad for business, Reiji was forced to live at his old place in the country side. When he decided to enjoy an open air bath, two female childhood friends notice him. Thats where the story begins...(Source: BakaBT, edited)"
