,Unnamed: 0,anime_id,name,genre,type,episodes,rating,members,synopsis
6,5606,8985,Yojouhan Shinwa Taikei Specials,Comedy,Special,3,6.41,10005,"Watashi, Seitarou Higuchi, Akashi, Ozu, and Ryouko Hanuki share various stories about a submarine that can travel through land, each one trying to outdo the others in terms of creativity. Ranging from a journey to stop the melting of the ice caps, to a quest to stop perverts from spying on girls, and to a fishing trip, no topic is off-limits."
17,5617,28883,Hidan no Aria AA,"Action, School, Shoujo Ai",TV,12,6.4,39538,"Akari Mamiya, a first-year student from Tokyo Butei High, idolizes the S-rank Butei Aria Holmes Kanzaki and wishes to follow in her footsteps. Despite only being an inept E-rank Butei, Akaris resolve to improve remains strong. After the idea of having an Amica contract (a senior-student mentorship program) with Aria is brought up, Akari submits a request form attempting to establish said contract. Her classmates and friends do not expect Aria to accept Akaris request, mainly because of the girls strict selection process, but to everyones surprise, Aria gives Akari a chance through a test, which Akari miraculously passes! However, Aria will not officially make Akari her Amica until Akari meets her standards.Training under Aria will be no easy feat, as she has to concurrently manage her relationships with her friends. Will Akari have what it takes to walk down the same path as her idol?"
41,5641,1583,009-1,"Action, Mecha, Sci-Fi, Seinen",TV,12,6.39,11097,"Mylene Hoffman, a beautiful cyborg spy with the codename ""009-1"" lives in an alternative world where the cold war never ended, continuously on-going for 140 years. The world is split into two factions, the West and the East block. A masquerade of peace between the two is slowly dissipated as the conflict occurs. Through politics, the two factions battle over supremacy over technology to threats of a nuclear attack. Mylene Hoffman, teaming up with three other agent, gets surrounded by deception, chaos and rivalry as she carries out missions assigned by her superiors."
43,5643,15085,Amnesia,"Fantasy, Josei, Mystery, Romance",TV,12,6.39,134349,"After fainting at work, a young lady awakens in the back room of the café she works at with no memory of her life or those around her. Two of her friends, whom she soon learns are named Shin and Toma, are called to help her get home safely. Once she is alone, she meets a spectral boy named Orion that only she can see and hear. He explains that she lost her memories because of his chance visit to her world, so he vows to help her remember who she is.However, regaining her departed memories without worrying those around her may be more difficult than she realizes. In addition to the gloomy Shin and the protective Toma, she must be wary of arousing the suspicions of the captivating Ikki, the quick-witted Kent, and a mysterious man who lurks in the distance. As her amnesia entangles her in the lives of each of these men, her fragmented memories return piece by piece, and the mysteries of her circumstances slowly come to light."
73,5673,2789,B-Densetsu! Battle Bedaman,"Adventure, Fantasy, Kids, Shounen",TV,52,6.38,6545,"Upon the creation of marble launching machines known as B-Daman, people started to participate in the competitive sport B-DaBattles. However, B-Daman contain hidden powers which enhance marble shooting that can be misused for combative purposes.One night, a certain object residing behind the walls of a restaurant calls upon Yamato Daiwa—a boy raised by cats. Yamato has been having visions of the object which resembles a machine familiar to everyone. Little does he know, hidden behind the walls is not a mere machine, but the fate of the world."
74,5674,2156,Bakugan Battle Brawlers,"Action, Fantasy, Game",TV,52,6.38,25846,"Mysterious cards came down from the sky one day. Capable of summoning powerful creatures from another dimension, they became the centerpiece of a new game called Bakugan. The game gained instant popularity among children and teenagers, with the best of them competing in a worldwide ranking.Meanwhile, war for domination over Vestroia, the homeland of Bakugan cards, rages on. Invaded by the White Dragon Naga and his servants, the Doom Beings, the realm becomes increasingly destabilized. Dimensions begin to merge and many Bakugan players come to realize that their pastime is not merely a game.Danma Kuusou, one such Bakugan player, intends to become the World Rankings leader someday. However, during one of his fights he experiences a vision of a clash in Vestroia. The fight suddenly moves to Earth, where Danma comes into possession of a talking, mighty fire Bakugan, Pyrus Dragonoid.He soon gets dragged into the conflict, and together with his Bakugan Brawlers team, must traverse the dimensions and restore balance in a ravaged world."
76,5676,13807,Corpse Party: Missing Footage,"Horror, School",OVA,1,6.38,57507,"Someday a group of classmates will perform a charm at night after school—the Happy Sachiko charm. This paper doll ritual is meant to make them stay friends forever, but performing it incorrectly will lead them to be dragged down into a dilapidated phantom of Tenjin Elementary School, which had been torn down years ago. Trapped until they can reunite and perform the charm correctly, the students will have to solve the mystery of the haunted school in order to make it out alive.Before that ill-fated event, however, the friends led ordinary lives. Corpse Party: Missing Footage reveals an insight into the students lives on the day before they were thrust into a waking nightmare."
93,5693,29511,Ongaku Shoujo,"Music, Slice of Life",Movie,1,6.38,6289,"On her way to her first day of high school, Eri Kumagai is captivated by a girls singing. Her song is beautiful but ends abruptly when the girl steps on a cats tail and disrupts the moment. Eri pushes this out of her mind until that same girl rushes into her class late, cat in hand, and claims that the name on the attendance list—Chiharu Yuzuka—is her ""false name"" and she is actually called Haru Chitose.Much to Eris distaste, she cannot escape the eccentric Haru, as the two happen to share the same dormitory room. Haru causes one headache after another, but when she snoops around in Eris laptop and discovers that she is an online composer, Eri is furious. Haru, enamored by Eris music, desperately wants to sing with Eri, but Eri is dead set against it. Will the two be able to find common ground?"
97,5697,13175,Shiranpuri (Movie),"Drama, School",Movie,1,6.38,3104,"When a young boy witnesses Yaragase and his gang bully his classmate Don, he becomes incredibly uncomfortable. Unable to intervene out of fear of becoming their next target, the young boy decides to mind his own business. As Yaragases tormenting becomes increasingly worse, the boys sense of guilt continues to grow. After he talks to an oden stand owner who believes that people who watch and do nothing are just as bad as those bullying, will the young boy be able to end his classmates misery?"
