,Unnamed: 0,anime_id,name,genre,type,episodes,rating,members,synopsis
5,2205,22865,Rokujouma no Shinryakusha!? (TV),"Comedy, Harem, Romance, School, Supernatural",TV,12,7.33,76880,"After Koutarou Satomis father is suddenly relocated for his job, the first-year high school student is faced with finding a cheap place to live by himself. Naturally, he jumps at the chance to move into Corona Houses Room 106 for a mere five thousand yen a month. But while everything goes well at first, Koutarou soon gets a lot more than he bargained for after stumbling upon a mysterious cave while working his part-time job.The following night, Koutarou is visited by various seemingly mythical figures, all of whom claim ownership of the poor students apartment. Among the invaders are Sanae Higashihongan, a ghost supposedly haunting the room, magical girl Yurika, alien princess Theiamillis Gre Fortorthe, and Kiriha Kurano, a direct descendant of the Earth People. But more importantly, each of these four girls needs Koutarous apartment for her own reasons and won’t back down without a fight!Rokujouma no Shinryakusha!? is a comedic battle royale over a six-tatami mat apartment involving supernatural beings, romantic high school hijinks, and a deceptively cordial landlady."
6,2206,21561,Ryuugajou Nanana no Maizoukin (TV),"Comedy, Supernatural",TV,11,7.33,101326,"Nanae Island is a man-made island in the Pacific Ocean that holds everything necessary for the proper education and training of children. It was created by the Great Seven, a group of adventurers headed by Nanana Ryuugajou, as a place for the young to chase their dreams.After being disowned and exiled by his family, high school student Juugo Yama arrives on this island, happy to finally be free of his father. Upon moving into his new room, he discovers the ghost of Nanana Ryuugajou, bound to the island after her unsolved murder 10 years ago. Nanana tells Juugo that, just before her death, she hid items with unique and mysterious powers all across the island—items known as the Nanana Collection. Hoping to uncover clues that will help him find the culprit behind her death, Juugo, with the help of self-proclaimed ""Master Detective"" Tensai Ikkyuu and her cross-dressing maid Daruku Hoshino, sets out on his search."
10,2210,100,Shin Shirayuki-hime Densetsu Prétear,"Comedy, Drama, Fantasy, Magic, Romance, Shoujo, Super Power",TV,13,7.33,37394,"Due to her fathers remarriage, robust 16-year-old Himeno Awayuki moves into a large mansion with a beautiful garden—the quintessential dream house for any girl her age. However, much to Himenos disappointment, her new stepfamily doesnt really seem to like her, as her stepmother often occupies herself with her father, her younger stepsister Mawata ignores her, and her other stepsister—the equally aged Mayune—tries to prank her at every opportunity.But Himeno doesnt have time to dwell into thoughts of hopelessness—her new life has now become involved with a group of seven magical boys known as the Leafe Knights, after they ask her to become a magical princess who can borrow their powers! Although Himeno accepts their request and becomes the Prétear, she feels doubtful in her abilities to protect the world and its Leafe, the source of energy for all life. Will Himeno be able to find happiness among her new family and also save the Earth from the enemy, the Princess of Disaster?"
12,2212,12191,Smile Precure!,"Action, Fantasy, Magic, Shoujo",TV,48,7.33,10568,"To teenager Miyuki Hoshizora, fairy tales are a world of wondrous encounters and happy endings. Inspired by her love for these stories, she lives every day searching for happiness. While running late on her first day of school as a transfer student, Miyuki meets Candy—a mysterious fairy from the world of fairy tales, Märchenland. However, when Candy disappears as quickly as she appeared, Miyuki is left believing the encounter was only a dream.After an eventful first day, Miyuki finds a mysterious library at school. While combing through the bookshelves, she is transported next to Candy, who claims to be searching for the so-called legendary warriors, Precure. When forced to protect Candys and everyone elses happiness, Miyuki transforms into ""Cure Happy,"" one of the Precure warriors! As Cure Happy, Miyuki is now tasked with finding the other legendary warriors and protecting the world from destruction, all while possibly discovering her very own happy ending."
17,2217,13939,Accel World EX,"Action, Game, Romance, School, Sci-Fi",OVA,2,7.32,61198,"ReverberationA mysterious avatar has hijacked the Umesato Junior High Local Network, trapping students and stripping them of their clothes and belongings. After learning that other schools are facing a similar problem, Kuroyukihime gathers Haruyuki Arita and the other members of Nega Nebulus—one of the Seven Great Legions—to solve the mystery.VacationHaruyuki is due for a physical re-examination in two weeks. If he fails, he will not be allowed to participate in any more territory battles with Nega Nebulus. To ensure that their legion does not lose their ""Silver Crow,"" Chiyuri Kurashima takes it upon herself to help Haruyuki get into shape before his examination."
25,2225,2030,El Cazador de la Bruja,"Adventure, Drama, Mystery",TV,26,7.32,31874,"Nadie is a bounty hunter with an attitude, and shes got a lock on her next target: Ellis, a young amnesiac girl who is a suspect in the murder of a famous scientist. Nadie manages to apprehend Ellis, but on a whim, decides to accompany her to Wiñay Marka, a place which supposedly holds the key to unlocking Elliss memories and her mysterious past. However, Nadie cautions Ellis that this does not mean she will go free—once Ellis has found what she is looking for, Nadie will turn her over to the authorities. With Elliss connection to a gemstone called the Inca Rose as their only guide, the two set off on their journey south through Mexico to search for the mysterious ""Eternal City"" of Wiñay Marka."
28,2228,31737,Gakusen Toshi Asterisk 2nd Season,"Comedy, Ecchi, Fantasy, Harem, Romance, School, Sci-Fi, Supernatural",TV,12,7.32,101287,"Gakusen Toshi Asterisk 2nd Season continues the story of Genestella students Ayato Amagiri and Julis-Alexia von Riessfeld, who have progressed to the next round of the Phoenix Festa after a long and strenuous battle with sisters Irene and Priscilla Urzaiz.Despite Julis and Ayatos best attempts, the fact that Ayatos powers have been sealed is no longer a secret. Now at a major disadvantage, the duo must come up with a plan if they are to have any hope of winning the Phoenix Festa. Only one thing is for sure: the troubles heading their way are only going to get more insurmountable from here on."
29,2229,32071,Gantz:O,"Action, Drama, Ecchi, Horror, Psychological, Sci-Fi, Seinen, Supernatural",Movie,1,7.34,8569,"Death does not have to be the end; one can live again, but only through beating the game posed by the black ball called Gantz.On his way home to celebrate his younger brothers birthday, brave and kind-hearted student named Masaru Katou is stabbed to death. He awakes in a small room with a cityscape view in the heart of Tokyo—and he is not alone. To his surprise, it is not the afterlife, but the waiting room for a high stakes game with their lives on the line. Before he has the chance to process the situation, Masaru is handed a gun and teleported into the center of Osaka to carry out one simple task: eliminate any alien on sight.Accompanied by the aged Yoshikazu Suzuki, the stunning idol Reika Shimohira, and the cold but experienced Jouichirou Nishi, Masaru must overcome his fears in order to survive the game and return home to his waiting brother."
31,2231,2899,Higurashi no Naku Koro ni Special: Nekogoroshi-hen,"Comedy, Mystery",Special,1,7.32,46415,"As a punishment for losing an intense poker game, Keiichi Maebara, Rena Ryuuguu, Mion Sonozaki, Satoko Houjou, and Rika Furude must walk around town dressed in costumes. Wanting to avoid being seen by more people, Keiichi convinces the group to visit Yagouchi—a deserted neighboring village.Mions mention of a nearby abandoned quarry spikes the attention of Rena and Keiichi. Still, as she tells them more about the mysterious incidents surrounding the place, they debate whether it would be wise to explore it."
33,2233,16774,Inferno Cop,"Action, Police",ONA,13,7.32,37500,"Jack Knife Edge Town is as edgy as it sounds, and its up to Inferno Cop to stop that edge from tearing his city apart. Hes both law and outlaw, dispensing ungodly justice to evildoers like a candy machine. Lowlifes, gangsters, and even hellspawn all infest Inferno Cops hunting ground, but thats the good news. The bad news? Prior to the story, his family was brutally murdered by Southern Cross, a shady organization that made the worst mistake imaginable by doing so. Now, Inferno Cops limiters have been removed and his mercy rung more dry than the entrails of his victims. Something is welling up in Inferno Cops city, however, and soon hell face the most daunting gauntlet of his life involving him literally falling into and escaping from Hell. A flaming head wont be enough to ward off the true evil thats rapidly approaching—Inferno Cop must call upon all his allies and his own wacky antics to conquer the trials that await him."
34,2234,28387,Joukamachi no Dandelion,"Comedy, Seinen, Slice of Life, Super Power",TV,12,7.32,64307,"The Sakurada siblings live a normal life in a typical Japanese household. Well, thats what their father, the king, wants for them at least. As members of the royal family, each sibling possesses a unique ability, and over two thousand security cameras have been placed around town to make sure the children are safe and sound. Moreover, all nine of them have been designated as a potential successor to the throne with the decision that the next ruler will be selected through an election.However, for the timid Akane Sakurada, the third eldest daughter who wields the power to manipulate gravity, all of this attention is a complete nightmare. With all the cameras constantly monitoring the candidates and even broadcasting their actions on the Sakurada-dedicated news channel, she decides that if she becomes king, the cameras have got to go. But just how will she convince the public that she is the most suited to rule if she cant even overcome her own shyness?! Election season is in full swing as the search for the next king begins in Joukamachi no Dandelion."
35,2235,21563,Kamigami no Asobi,"Fantasy, Harem, Romance, Shoujo, Supernatural",TV,12,7.32,61410,"After discovering a mysterious sword in the storehouse of her home, third-year high school student Yui Kusanagi finds herself suddenly transported to a different world. While exploring her new surroundings, she meets five strange yet handsome men before coming face to face with Zeus: the king of the gods. In order to restore the deteriorating relationship between the gods and humans, Zeus has created the Academy of the gods and has chosen Yui to be its one and only instructor. She has one year to educate the young and reluctant deities—including the five strangers she met earlier—on what it means to be human while learning about the gods herself; otherwise, they will all be trapped in Zeus realm forever."
46,2246,14749,Ore no Kanojo to Osananajimi ga Shuraba Sugiru,"Comedy, Harem, Romance, School",TV,13,7.32,156116,"The infidelity of Eita Kidous parents not only made his family fall apart, but also made him skeptic of love. Having no intention to delve into romance, Eita devotes his entire high school life to his studies in order to become a doctor.It did not take long for the beautiful and popular Masuzu Natsukawa to notice Eitas apathy. Tired of being the object of peoples affection, she asks him to pretend to be her boyfriend, as she too feels disgusted at the notion of love. Eita, however, refuses—yet Masuzu has one trick left up her sleeve: Eita’s journal and threatening to post the embarrassing content online if he does not comply.Now entangled in a fake romance with the most desired girl at school, Eitas life is turned upside down. Whether envied by his peers or receiving a confession, he must cope with his newfound relationship and all the troubles that come along with it."
48,2248,1120,Pokemon: Mizu no Miyako no Mamorigami Latias to Latios,"Adventure, Comedy, Drama, Fantasy, Kids",Movie,1,7.32,42389,"As they continue their journey through the Johto region, Satoshi and his friends visit Altomare, an island city that hosts an annual racing event called the Pokémon Water Race. While Takeshi and Kasumi are enjoying themselves, strange things seem to be happening to Satoshi—he somehow loses the water race, sees some women attack a girl with their Pokémon, and despite them saving her, the girl later denies ever seeing Satoshi and Pikachu before!Fortunately for Satoshi, his confusion clears up as he learns that the girl he and Pikachu saved earlier was actually a Pokémon named Latias, who likes to disguise herself as her human friend, Kanon. Latias and another Pokémon, Latios, are known as the Eon Pokémon, as they inhabit and guard Altomare along with a mystical blue sphere called the Soul Dew. An ancient legend of Altomare is highly connected to the Eon Pokémon and the Soul Dew, and is well known among the locals—as well as among Latias earlier assailants, the thief sisters Zanner and Lyon. As the thieves attempt to capture both the Eon Pokémon and the Soul Dew, Satoshi is forced to act in order to stop them from bringing disaster to Altomare."
55,2255,10232,Tamayura: Hitotose,"Comedy, Drama, Slice of Life",TV,12,7.32,25760,"In her last year of middle school, Fuu Sawatari had trouble dealing with her emotions following the sudden death of her father. Through the help of her brother and childhood friend, she rediscovered her love for photography, an activity she and her father often did together. In addition, she decided to attend high school in Takehara, her fathers hometown and a place they often visited when she was younger.It has been one month now since Fuu moved to Takehara and became close with her current group of friends: carefree Kaoru Hanawa, excitable Norie Okazaki, and quiet Maon Sakurada. Together with them and several acquaintances around town and abroad, Fuu continues her mission of capturing the joys of everyday life using her fathers camera, while also helping her friends discover their own passions."
56,2256,14835,The iDOLM@STER Shiny Festa,"Comedy, Drama, Music",OVA,3,7.32,9893,"The girls of 765 Production Studio are eagerly preparing for the International Music Festival on Vacation Island. Coupled with an amusement park and a high-class resort, the festival promises several days of fun for everyone. That is, until their producer announces that they only have enough room for one unit to participate.In three different scenarios where everyone is split into three groups, one of the three is chosen to partake in the International Music Festival, where they are treated to a three-day vacation before starring in the festivals concert. From the moment they step off the boat until the main event, each group of girls experiences the festival in their own way, excited to take part in the highly anticipated performance."
57,2257,30740,Young Black Jack,"Drama, Historical, Seinen",TV,12,7.32,42139,"In the 1960s, a gifted young medical student tries to make a name for himself. Kuroo Hazama is a reserved young man with unusual black-and-white hair, a body covered with scars, and a dark past. Despite only being a medical student, his surgical brilliance starts to attract attention after he completes a seemingly impossible operation. Together with the spirited and honest intern Maiko Okamoto and Yabu, a close friend with a troubled life, Hazama devotes himself to the world of medicine. However, his path to becoming a respectable surgeon is a difficult one as student riots, war, and corruption are consuming Japan. Hazama quickly finds himself caught up in a series of nefarious circumstances that challenge his integrity as a person and his path towards becoming a surgeon. Young Black Jack chronicles the story of a man capable of performing unthinkable feats of medicine, and the journey that leads him to become the legend known as Black Jack."
59,2259,33929,Boku no Hero Academia: Jump Festa 2016 Special,"Action, Comedy, School, Shounen, Super Power",Special,1,7.32,17401,"UA High School must regain the publics confidence after the surprise villain attack during class 1-As training session. Although some of the teachers were gravely injured in the attack, Izuku ""Deku"" Midoriya and his classmates must continue to learn and train, and utilize their quirks in varying environments and circumstances. Boku no Hero Academia: Sukue! Kyuujo Kunren! follows class 1-A as they attempt to finally complete their training. However, theres a masked figure roaming around the training center. Have the villains responsible for the previous incident returned to finish the job? If so, are the students ready to fight back?"
60,2260,2513,Detective Conan OVA 03: Conan and Heiji and the Vanished Boy,"Adventure, Comedy, Mystery, Police, Shounen",OVA,1,7.31,8252,"Conan and Ran are visiting Heiji and Kazuha in Osaka when the four come across a trio of kids while touring the city. These children, who look eerily similar to the Detective Boys but with different personalities, are looking for their friend who has gone missing—and the two young detectives agree to help find the vanished boy."
68,2268,16668,Kakumeiki Valvrave,"Action, Mecha, Space",TV,12,7.31,96718,"In the 71st year of the True Era, humans have successfully expanded into space and have started living in independent galactic colonies. The world itself is split between two major nations: the Atlantic Rim United States (ARUS) and the Dorssia Military Pact Federation (Dorssia)—superpowers that wage war against each other on Earth and far into outer space. In this war-torn era, a third faction comprised of Japan and Islands of the Oceanian Republic (JIOR), reside peacefully and prosper economically, maintaining neutrality between themselves and their militant neighbors.Kakumeiki Valvrave commences in an outer space JIOR colony, where 17-year-old Haruto Tokishimas peaceful life is turned upside down as a sudden Dorssian fleet breaches the neutral colony. Their objective is to seize the Valvraves: powerful, but rumored mechanized weapons hidden deep within Harutos school, Sakimori Academy. In the ensuing chaos, Haruto stumbles upon one of the targeted Valvraves. With his friends lives in peril, Haruto enters the mecha and seals a contract for its power in exchange for his humanity. With the aid of L-elf—an enigmatic Dorssian agent and gifted strategist—Haruto and the Valvrave initiate a revolution to liberate the world."
69,2269,274,Kiddy Grade,"Action, Ecchi, Mecha, Sci-Fi, Super Power",TV,24,7.31,30766,"In the distant future, humanity has taken to the skies and colonized many planets throughout the universe. An agency known as the Galactic Organization of Trade and Tariffs (GOTT) has been formed to maintain order. Within GOTT, a secret squad of enhanced human beings—known as the ES Unit—carry out secret missions to put a stop to major galactic crimes. Two such operatives are the lowly C-ranked Éclair and Lumière.Despite being on the bottom of the totem pole, the pair wield formidable powers: Éclairs superhuman strength and lipstick whip and Lumières ability to take control of any computer. Together, they can take on any mission that GOTT throws at them. But as they complete more and more missions, the duo begin to uncover a major conspiracy that leaves them questioning everything they know about themselves and the entire galaxy."
77,2277,6999,Prince of Tennis: Another Story - Messages From Past and Future OVA Bonus,"Comedy, Sports",Special,2,7.31,4495,"Aru Hi no OshitariHyoutei Academys Yuushi Oshitari is fed up with being the unfunny one in his daily life. He sets out to rectify this by getting himself into an idiotic situation, but his tennis club teammates do not seem to understand what he is doing.Aru Hi no Oshitari 2Even though he is supposed to be the humorous one, Kenya Oshitari is concerned that his recent ""manzai"" jokes have not been landing. Luckily for him, his teammate from the Shitenhouji Middle School tennis team, Hikaru Zaizen, has come to save the day by replacing him as the laughing stock in the jokes."
79,2279,529,Saishuu Heiki Kanojo,"Drama, Romance, School, Sci-Fi",TV,13,7.31,58051,"Chise is an ordinary schoolgirl: small, frail, and not particularly intelligent. Her greatest joy is her budding romance with her classmate and childhood friend, Shuuji. They both live in a small military town in Hokkaido, where high schoolers have few concerns other than who is dating whom and complaining about the steep climb up ""Hell Hill"" every day before school.One day, Shuuji and his friends make a trip to Sapporo to buy gifts for their girlfriends. A massive air raid on Sapporo that day kills thousands, including one of Shuujis friends, and signals the beginning of a war. Fleeing from the carnage, Shuuji spots Chise, though now she has steel wings and a massive gun where her right arm should be. Against her will, she has been transformed into the ultimate cyborg weapon, capable of leveling entire cities.As the war rages closer and closer to their hometown, Chise and Shuujis relationship is strained by her transformation, and they are left to wonder whether she is even still human."
82,2282,3594,Tears to Tiara,"Action, Adventure, Fantasy, Magic",TV,26,7.31,50455,"As the Holy Empire rises to power, the neighboring lands begin to gradually fall under its control. The Empires conquest eventually reaches the small island of Erin, home to the Gael tribe. There, a priestess named Riannon is kidnapped to be offered as a living sacrifice to the demon king Arawn, a malevolent being rumored to have caused untold destruction in the past.Riannons brother, First Warrior Arthur, rescues her, when Arawn suddenly materializes before them as a handsome grey-haired man. Hiding his true identity and remaining enigmatic, Arawn pledges his power and leadership to the tribes cause and joins Arthur, Riannon, and their merry band of friends—including a talented swordsman, an agile hunter, and a group of ecstatic pixies—as they fight back against the Empire, while uncovering the dark secrets of the land along the way."
84,2284,201,Video Girl Ai,"Comedy, Drama, Ecchi, Romance",OVA,6,7.31,13970,"After a crushing rejection, the heartbroken Youta Moteuchi trudges home. On his way, a dimly lit video store catches his eye, and he ends up purchasing a ""video girl"" tape meant to ease the hearts of lonely men. However, when he tries to play it in his broken VCR, a beautiful girl leaps out of his TV and lands on his bed. Calling herself Ai Amano, she looks like a golden opportunity for Youta to finally experience true love—that is, until her personality, now troubling thanks to the broken VCR, shows through. Despite her flaws, however, Ai wholeheartedly promises she will ensure Youta finds happiness and true love in his life.Video Girl Ai follows the daily life of a teenage boy and his pursuit of a fulfilling romance. With the help of his virtual guardian angel, Youta sets forth to find the girl of his dreams."
87,2287,2333,Anime Sanjuushi,"Adventure, Drama, Historical, Romance",TV,52,7.3,2102,"In 1625, the young DArtagnan leaves his village in Gascony to embark for Paris with his grandparents blessings, taking only his fathers sword and a letter of introduction. Seeking audience with Tréville, Captain of the Musketeers of the Guard and his late fathers comrade, the poor nobleman aims to become a great hero in the service of King Louis XIII.The young adventurer is astonished by the massive size of Paris, but also overwhelmed. He wanders the city streets, befriending a young orphan named Jean. However, he also ends up offending three of the Musketeers of the Guard: Porthos, Aramis, and Athos. Confronted by the Parisian guards over their illegal dueling, DArtagnan and the Musketeers fend off five of Cardinal Richelieus soldiers, and the four of them quickly become friends.The four new comrades set off to stop the Cardinal from starting war between England and France, and protect the image of Queen Anne dAutriche, the wife of Louis XIII. But what will be the cost of their efforts?"
88,2288,6901,Battle Spirits: Shounen Gekiha Dan,"Action, Game, Shounen",TV,50,7.3,1135,"Dan Bashin is a spirited teenager known for his aggressive playstyle in the card game Battle Spirits, earning him the title of ""Clash King."" One day, a mysterious green-haired girl transports him to the otherworldly land of ""Grand Rolo,"" where disputes are settled by card duels.Upon his arrival, Dan is immediately thrust into a conflict between the kingdoms imperial army and its oppressed natives. There, he learns that he is a prophetic warrior known as a ""bearer of cores light,"" chosen to save the land from its evil king. Accompanied by a young boy named Zungurii and the eccentric witch Magisa, Dan travels across Grand Rolo and encounters the other chosen warriors through card battles. With the name of the Clash King gaining fame throughout Grand Rolo, secrets that lurk within the shadows of the kingdoms colonial past begin to surface. Only time will tell if Dans campaign will affect the world on a scale much larger than he ever could have imagined."
