,Unnamed: 0,anime_id,name,genre,type,episodes,rating,members,synopsis
36,436,1594,Jigoku Shoujo Futakomori,"Horror, Mystery, Psychological, Supernatural",TV,26,8.08,79816,"Ai Enma and her companions continue to offer their service of revenge against those who have wronged others, and the price is as steep as ever—for damning the offender to hell, the person exacting vengeance is sent to the abyss as well. As they cast soul after soul into the darkness, a new sinister force is watching them: a little girl named Kikuri.While Ai continues her duties, she meets a boy named Takuma Kurebayashi, known as the ""Devils Child"" because of the horrific events that occur around him. Unfortunately, Takumas reputation leads the townspeople to use him as a scapegoat for those who have been ferried off to hell. When things quickly spiral out of control, Ai must find a way to bring an end to this senseless violence, as it poses a threat to her very existence."
37,437,3092,Junjou Romantica,"Comedy, Drama, Romance, Shounen Ai",TV,12,8.08,117910,"High school student Misaki Takahashi returns home to see his older brother being fondled by an unknown man. Bewildered by such a sight, Misaki finds out that the stranger is actually Akihiko Usami, a popular novelist and his brothers best friend. With the two of them slowly becoming acquainted, Akihiko ends up as Misakis private tutor. However, after stumbling upon the authors latest boys-love novel, Misaki becomes uncertain whether or not to trust Akihiko regarding his friendship with the students brother.Elsewhere, Hiroki Kamijou, a university teacher of classical literature and Akihikos friend, is grieving a failed romance. While on the edge of a mental breakdown, he meets student Nowaki Kusama, who wants his help for an upcoming exam. Despite denying Nowakis request numerous times, Hiroki eventually lends him a hand. As the two get closer, more revelations about the student are made.Furthermore, when wealthy teenager Shinobu Takatsuki finds out that his older sister has divorced Hirokis coworker You Miyagi, he immediately wants to date the same man—as he saved Shinobu from a robbery three years prior. Even so, You does not feel the same way and attempts to scare him off. However, the educator soon realizes that Shinobu will do anything for their destined romance.Junjou Romantica collects three love stories, narrating every couples romance."
38,438,10721,Mawaru Penguindrum,"Comedy, Drama, Mystery, Psychological",TV,24,8.08,156689,"For the Takakura family, destiny is an ever-spinning wheel, pointing passionately in their direction with equal tides of joy and sorrow before ticking on to the next wishmaker. With their parents gone, twin brothers Kanba and Shouma live alone with their beloved little sister Himari, whose poor health cannot decline any further.On the day Himari is given permission to temporarily leave the hospital, her brothers take her out to the aquarium to celebrate, where the familys supposed fate is brought forth with her sudden collapse. However, when Himari is inexplicably revived by a penguin hat from the aquariums souvenir shop, the hand of fate continues to tick faithfully forward.With her miraculous recovery, though, comes a cost: there is a new entity within her body, whose condition for keeping her fate at bay sends the boys on a wild goose chase for the mysterious ""Penguin Drum."" In their search, the boys will have to follow the threads of fate leading from their own shocking past and into the lives of other wishmakers vying for the Penguin Drum, all hoping to land upon their chosen destiny."
40,440,3588,Soul Eater,"Action, Adventure, Comedy, Fantasy, Shounen, Supernatural",TV,51,8.08,580184,"Death City is home to the famous Death Weapon Meister Academy, a technical academy headed by the Shinigami—Lord Death himself. Its mission: to raise ""Death Scythes"" for the Shinigami to wield against the many evils of their fantastical world. These Death Scythes, however, are not made from physical weapons; rather, they are born from human hybrids who have the ability to transform their bodies into Demon Weapons, and only after they have consumed the souls of 99 evil beings and one witchs soul.Soul Eater Evans, a Demon Scythe who only seems to care about whats cool, aims to become a Death Scythe with the help of his straight-laced wielder, or meister, Maka Albarn. The contrasting duo work and study alongside the hot headed Black☆Star and his caring weapon Tsubaki, as well as the Shinigamis own son, Death the Kid, an obsessive-compulsive dual wielder of twin pistols Patty and Liz.Soul Eater follows these students of Shibusen as they take on missions to collect souls and protect the city from the worlds threats while working together under the snickering sun to become sounder in mind, body, and soul."
41,441,4106,Trigun: Badlands Rumble,"Action, Comedy, Sci-Fi",Movie,1,8.08,68181,"Vash the Stampede is a contradiction. He has a notorious reputation as ""The Humanoid Typhoon,"" laying anything he comes across to waste on the desolate planet of Gunsmoke. However, Vash is in fact very non-confrontational and kind-hearted, living by a code of pacifism.Twenty years ago, a high-profile bank heist went sour. The ringleader, Gasback Gallon Getaway, swore to get back at his backstabbing crew and the man who stopped him from killing them: Vash the Stampede. In the present day, the traitorous crew has been living the good life as successful entrepreneurs and politicians. Although two decades have passed, Gasbacks bitterness has not waned as he aims to take them down one by one, by any means necessary. Just in time to foil Gasbacks plot, Vash has arrived in Macca City. Teaming up with the mysterious Amelia Ann McFly, along with the insurance agents Milly Thompson and Meryl Stryfe, Vash is ready to rumble. "
42,442,387,Haibane Renmei,"Drama, Fantasy, Mystery, Psychological, Slice of Life",TV,13,8.07,120731,"Born from a cocoon in the village of Old Home, a young Haibane—a being with a halo and small gray wings—awakens to a world she does not understand without memories of her past. Named Rakka for the dream of falling she had while inside the cocoon, she soon becomes accustomed to life in the strange town. However, there are strict rules for the Haibane, such as being forbidden to leave the village or go near the walls surrounding it. These, along with mysterious disappearances of their kind on their ""Day of Flight,"" begin to unsettle Rakka and the others since they know almost nothing about their own kind.Haibane Renmei tells not only Rakkas story but also of those around her, as they live their lives with no memories of the past while trying to break free from their former pain and ultimately find salvation."
44,444,1088,Macross,"Action, Mecha, Military, Music, Romance, Sci-Fi, Space",TV,36,8.07,44157,"After a mysterious spaceship crashes into Earth, humanity realizes that they are not alone. Fearing a potential threat from space, the world pushes aside their nationalism, conflicting interests, and cultural differences, unifying under the banner of the United Nations. The newly formed UN forces decide to repurpose the alien spacecraft, naming it SDF-1 Macross. Unfortunately, on the day of its maiden voyage, a fleet of spaceships belonging to a race of aliens known as the Zentradi descend upon Earth, and the SDF-1 Macross, acting of its own accord, shoots down the incoming squadron, sparking an intergalactic war.In an attempt to escape, the Macross tries to launch itself into the Moons orbit, but the ship—as well as the city it was in—is teleported to the far reaches of space. Caught up in this mess are Hikaru Ichijou, a free-spirited acrobatic pilot, and Minmay Lynn, an aspiring singer. These two, alongside Macross crew, experience an epic journey rife with grief and drama, coming face-to-face with the cruelties of war along the way."
45,445,10620,Mirai Nikki (TV),"Action, Mystery, Psychological, Shounen, Supernatural, Thriller",TV,26,8.07,657190,"Yukiteru Amano is a shy middle schooler who regularly keeps track of what he does in his daily life by writing down all of his activities on his phone—a digital diary. Despite having no friends at school, Yukiteru is frequently seen talking to his supposedly imaginary friends Deus Ex Machina, the god of time and space; and Deus servant, Mur Mur.One day, Yukiteru wakes up and discovers that certain events of his day are preemptively displayed on his cellphone. While initially dismissing it as a coincidence, he slowly realizes that the incidents written in his phone actually take place in the near future. After spending the day benefiting from this new asset, Yukiteru learns that his classmate Yuno Gasai possesses a similar diary.As the two team up to defeat an odd pursuer and head back to their respective homes, Deus Ex Machina explains that they—alongside 10 other contestants—have been drawn into a survival game whose victor will become the deitys successor. With no other options, Yukiteru and Yuno must use their cellphones—now called ""Future Diaries""—to survive this unforgiving battle royale."
49,449,22319,Tokyo Ghoul,"Action, Drama, Horror, Mystery, Psychological, Seinen, Supernatural",TV,12,8.07,618056,"A sinister threat is invading Tokyo: flesh-eating ""ghouls"" who appear identical to humans and blend into their population. Reserved college student Ken Kaneki buries his nose in books and avoids the news of the growing crisis. However, the appearance of an attractive woman named Rize Kamishiro shatters his solitude when she forwardly asks him on a date.While walking Rize home, Kaneki discovers she isnt as kind as she first appeared, and she has led him on with sinister intent. After a tragic struggle, he later awakens in a hospital to learn his life was saved by transplanting the now deceased Rizes organs into his own body. Kanekis body begins to change in horrifying ways, and he transforms into a human-ghoul hybrid. As he embarks on his new dreadful journey, Kaneki clings to his humanity in the evolving bloody conflict between societys new monsters and the government agents who hunt them."
50,450,11113,Usagi Drop Specials,"Josei, Slice of Life",Special,4,8.07,36351,"Happa no SuizokukanOne morning, Daikichi Kawachi finds Rin Kaga eagerly crafting fish out of autumn leaves. Wanting to spur her newfound interest, Daikichi helps Rin learn more about the beautiful and diverse animals that live under the sea.Santa-san eSpending their first Christmas together, Daikichi and Rin prepare to welcome Santa Claus and his reindeer.Osora ni MankaiWith the cherry blossoms in full bloom, Rin wants to go flower watching the next day with Daikichi alongside Kouki and Yukari Nitani. However, the forecast of a spring storm may dampen their plans.Kaeri MichiAfter their visit to a summer festival, Kouki is still energetic and wishes to look around more. Daikichi decides to take the group on a quick detour before heading home."
51,451,6586,Yume-iro Pâtissière,"Kids, School, Shoujo",TV,50,8.07,36921,"Aside from her deep passion for eating cakes, the clumsy Ichigo Amano has never been successful at anything.  After an encounter with Henri Lucas, a famous patissier, Ichigos amazing tasting abilities—although unbeknownst to her—are discovered.  Recognizing her talent, Henri offers her the chance to attend St. Marie Academy, a prestigious culinary school which specializes in desserts.In spite of the fact that she is a beginner lacking skills, thanks to Henris recommendation, Ichigo is placed in the topmost group with the ""Sweets Princes."" The princes, famous throughout the school for their magical treats, are Sennosuke Andou, an expert in traditional Japanese sweets; Satsuki Hanabusa, with a flair for candied flowers; and Makoto Kashino, a gifted chocolatier. Ichigo and the Sweets Princes, each accompanied by their ""Sweets Spirits""—fairies who make patissiers dreams come true—all work towards their goals in the competitive world of sweets."
52,452,66,Azumanga Daioh,"Comedy, School, Slice of Life",TV,26,8.06,170901,"Chiyo Mihama begins her high school career as one of the strangest students in her freshman class—a tiny, 10-year-old academic prodigy with a fondness for plush dolls and homemade cooking. But her homeroom teacher, Yukari Tanizaki, is the kind of person who would hijack a students bike to avoid being late, so ""strange"" is a relative word.There certainly isnt a shortage of peculiar girls in Yukari-senseis homeroom class. Accompanying Chiyo are students like Tomo Takino, an energetic tomboy with more enthusiasm than brains; Koyomi Mizuhara, Tomos best friend whose temper has a fuse shorter than Chiyo; and Sakaki, a tall, athletic beauty whose intimidating looks hide a gentle personality and a painful obsession with cats. In addition, transfer student Ayumu Kasuga, a girl with her head stuck in the clouds, fits right in with the rest of the girls—and she has a few interesting theories about Chiyos pigtails!Together, this lovable group of girls experience the ups and downs of school life, their many adventures filled with constant laughter, surreal absurdity, and occasionally even touching commentary on the bittersweet, temporal nature of high school."
53,453,8142,Colorful (Movie),"Drama, Slice of Life, Supernatural",Movie,1,8.06,63263,"Upon arriving at the train station of death, an impure soul is granted a second chance at life against his will. Reincarnating into the body of Makoto Kobayashi, a 14-year-old boy who recently committed suicide, the soul is tasked to identify the boys greatest sin in life within a time limit of six months. Although it remains reluctant toward continuing life as Makoto, the soul soon begins to notice the complexities of peoples emotions and actions.Deconstructing the ideas of fractured families and suicide, Colorful explores the intricacies of the daily struggles humans face but are too abashed to confront."
56,456,227,FLCL,"Action, Comedy, Dementia, Mecha, Parody, Sci-Fi",OVA,6,8.06,305165,"Naota Nandaba is an ordinary sixth grader living in a city where nothing amazing ever seems to happen. After his brother Tasuku leaves town to play baseball in America, Naota takes it upon himself to look after everything Tasuku left behind—from his top bunk bed to his ex-girlfriend Mamimi Samejima, who hasnt stopped clinging to Naota since Tasuku left. Little does Naota know, however, that his mundane existence is on the verge of being changed forever: enter Haruko Haruhara, a Vespa-riding, bass guitar-wielding, pink-haired psychopath whose first encounter with Naota leaves him with tire tracks on his back and a giant horn on his head. Though all he wants is some peace and quiet, when Haruko takes up residence at his parents home, Naota finds himself dragged into the heart of the greatest battle for supremacy that Earth—and quite possibly the entire universe—has ever seen."
57,457,73,Full Metal Panic! The Second Raid,"Action, Mecha, Military",TV,13,8.06,155340,"After overcoming various tumultuous events, mercenary sergeant Sousuke Sagara of Mithril and ""Whispered"" school girl Kaname Chidori return to their normal high school lives. Sousuke continues his efforts to assimilate with the civilian population and manage his mission at the same time, while Kaname attempts to support his endeavors (even though his antics often drive her up a wall). However, as their lives calm, new problems begin to appear. The appearance of an independent terrorist organization  known as Amalgam and internal conflicts within Mithril threaten to wreak unity into a series of failures and betrayals. And new, powerful Arm Slave models only worsen the situation when the worlds peace is at stake. As Kaname and Sousuke face their own inner battles amidst life-threatening fights, will they be able to make the right choices and change their future?"
58,458,4898,Kuroshitsuji,"Action, Comedy, Demons, Fantasy, Historical, Shounen, Supernatural",TV,24,8.06,424919,"Young Ciel Phantomhive is known as ""the Queens Guard Dog,"" taking care of the many unsettling events that occur in Victorian England for Her Majesty. Aided by Sebastian Michaelis, his loyal butler with seemingly inhuman abilities, Ciel uses whatever means necessary to get the job done. But is there more to this black-clad butler than meets the eye?In Ciels past lies a secret tragedy that enveloped him in perennial darkness—during one of his bleakest moments, he formed a contract with Sebastian, a demon, bargaining his soul in exchange for vengeance upon those who wronged him. Today, not only is Sebastian one hell of a butler, but he is also the perfect servant to carry out his masters orders—all the while anticipating the delicious meal he will eventually make of Ciels soul. As the two work to unravel the mystery behind Ciels chain of misfortunes, a bond forms between them that neither heaven nor hell can tear apart."
59,459,19111,Love Live! School Idol Project 2nd Season,"Music, School, Slice of Life",TV,13,8.06,91864,"Otonokizaka High School has been saved! Despite having to withdraw from the Love Live!, the efforts of μs were able to garner enough interest in their school to prevent it from being shut down. What more, following the conclusion of the first, a second Love Live! is announced, this time on an even larger stage than before. Given a chance for redemption, the nine girls come together once more to sing their hearts out and claim victory.However, with the end of the school year approaching, the graduation of the third years draws near. As they attempt to reach the top of the Love Live!, they must also consider their future and choose what path the group will take. Though the question of whether to continue without the third years or disband weighs heavily on the minds of its members, μs must quickly come to an answer with graduation right around the corner.Love Live! School Idol Project 2nd Season continues the story of the girls as they laugh, cry, sing, and dance in their journey to determine the future of their group and conquer the Love Live! in their last chance to win with all nine girls together."
61,461,22097,Magi: Sinbad no Bouken,"Action, Adventure, Fantasy, Magic, Shounen",OVA,5,8.06,52351,"Not so long ago, mysterious structures called Dungeons began appearing all over the world. No one knows what they are or how they came to be, but adventurers and armies around the world instantly took interest in them. Thousands set out to explore the Dungeons, but so far, not a single person has returned.In a Parthevian port, a young boy is about to make a name for himself. Sinbad is good-natured, strong, and craving adventure. A kind deed leads to his meeting with Yunan, an enigmatic traveler who is far more powerful than his frivolous personality lets on. Yunan instructs Sinbad to attain the ""power of the king"" and change the world—by conquering a Dungeon. The eager boy readily accepts, setting out on the grand adventure he so craved.Taking place 15 years before the events of the original series, Magi: Sinbad no Bouken chronicles Sinbads youth as a Dungeon conqueror. Along the way, the budding adventurer and merchant will have to face many obstacles, but anything is possible with the power of a king."
62,462,15689,Nekomonogatari: Kuro,"Comedy, Romance, Supernatural",TV,4,8.06,173264,"After surviving a vampire attack, Koyomi Araragi notices that his friend and savior, Tsubasa Hanekawa, has been acting strange. When he happens to cross paths with her on his way to a bookstore and sees she has a bandage on her face, he knows something must definitely be wrong. Araragi wants to help her, but Hanekawa assures him that her wound is just something she received at home and that he should not concern himself with it. But when a white cat with no tail is hit and killed by a car, the pair bury the creature and the real trouble begins.When Araragi later pays a visit to his friend Meme Oshino and recounts the days events, he is informed what they have buried is actually an apparition, one perfect for Hanekawa in her current state. Tasked with finding his friend to confirm her safety, he discovers that she has attacked her parents, possessed by the ""Sawari Neko."" Now, it is up to Araragi to help Hanekawa as she once helped him."
63,463,957,Saiunkoku Monogatari,"Adventure, Comedy, Drama, Fantasy, Historical, Romance",TV,39,8.06,50951,"Shuurei Kou, the daughter of a noble yet impoverished family, is a clever young lady who dreams of becoming a government official and contributing toward her country. However, her dream is out of her reach as such a position is forbidden to women. While her father works a low wage job as an archivist at the palace, Shuurei has to juggle odd jobs to make ends meet. Then, one day, an unexpected visit changes her life. Shuurei is called to assist Ryuuki Shi, the new emperor who is known for slacking on his duties and preferring the company of men. Tempted by the generous compensation, she readily accepts the chance to become the young emperors consort for six months. Luckily, she is not alone as Seiran Shi, her trusty friend, joins her as Ryuukis bodyguard. While tasked with transforming the new emperor into a responsible ruler, court life and politics prove troublesome as Shuurei faces the challenges of her new life.Set in a fictional country, Saiunkoku Monogatari centers on the idea of meaningful leadership, its adversities and the rewards that come alongside a prospering nation."
64,464,24,School Rumble,"Comedy, Romance, School, Shounen",TV,26,8.06,178553,"Just the words ""I love you,"" and everything changes—such is the nature of the bittersweet trials of high school romance. Tenma Tsukamoto, a second year, is on a quest to confess her feelings to the boy she likes. Kenji Harima, a delinquent with a sizable reputation, is in a similar situation, as he cannot properly convey his feelings to the one he loves. Between school, friends, rivalries, and hobbies, these two will find that high school romance is no walk in the park, especially as misunderstandings further complicate their plight.School Rumble is a high-octane romantic comedy full of relatable situations, as Tenma and Kenji both try to win the hearts of those they desire."
66,466,849,Suzumiya Haruhi no Yuuutsu,"Comedy, Mystery, Parody, School, Sci-Fi, Slice of Life",TV,14,8.06,428569,"If a survey were conducted to see if people believed in aliens, time travelers, or maybe espers, most would say they do not; average high school student Kyon considers himself among the non-believers. However, on his first day of school, he meets a girl who soon turns his world upside down.During class introductions, the beautiful Haruhi Suzumiya boldly announces her boredom with ""normal"" people and her intention of meeting supernatural beings. Dumbfounded, Kyon learns of her frustration with the lack of paranormal-focused clubs at their school and unwittingly inspires her to start her own club. She creates the Spreading Fun all Over the World with Haruhi Suzumiya Brigade, otherwise known as the SOS Brigade.Following the SOS Brigades founding, Haruhi manages to recruit Kyon and three other members: quiet bookworm Yuki Nagato, shy upperclassman Mikuru Asahina, and perpetually positive Itsuki Koizumi. Despite their normal appearance, the new members of the SOS Brigade each carry their own secrets related to Haruhi. Caught up in the mystery surrounding the eccentric club leader, Kyon is whisked away on a series of misadventures by Haruhi and the SOS Brigade, each one bringing him closer to the truth about who and what she is."
67,467,2623,Flanders no Inu (Movie),"Drama, Historical",Movie,1,8.05,8505,"Nello Daas is a gifted artist residing in a village on the outskirts of Antwerp, Belgium. He earns a living by selling milk in a market in the middle of the city alongside his ailing grandfather. His best friend, Alois Cogez, is the daughter of his callous landlord, who believes that Nello is corrupting his daughter and unbefitting her class. Angered by Alois closeness to a peasant, her father sends her away to a school in Antwerp to prevent them from meeting again. While continuing his daily market runs, Nello stumbles upon an art contest surrounding the famous Peter Paul Rubens—a Flemish artist he holds in high regard. Not only does the contest offer a monetary prize, but it also comes with the opportunity to study art at a school in the same city Alois is studying. Now with a goal in mind, Nello begins to brainstorm the perfect piece, but a series of adversities threatens to end his dreams prematurely.Yet, through thick and thin, is his loyal dog, Patrasche, whom he saved from the brink of death at the hands of a cruel owner. As Nello endures through various hardships, Patrasche supports him throughout them. Flanders no Inu is a reimagined film that captures the classic story between an innocent boy and his faithful canine best friend as they traverse together until the bitter end."
68,468,268,Golden Boy,"Adventure, Comedy, Ecchi",OVA,6,8.05,113040,"Kintarou Ooe is a specialist in part-time work, riding all over the highways and byways of Japan on his trusty steed, the Mikazuki 5, and finding employment wherever he can. His adventures bring him knowledge and experience that cant be taught in a classroom, from political corruption to the delicacy of a young womans heart. With nothing but the open road before him—not to mention the many beautiful women along the way—Kintarou pursues his spirit of education while attempting to hold down his various odd jobs, however undignified they may be. As he learns from each task he takes on, who knows what could happen? He might even be able to save the world one day. One thing is for sure—this will all be very educational!"
