,Unnamed: 0,anime_id,name,genre,type,episodes,rating,members,synopsis
88,8288,9447,Byulbyul Iyagi 2,"Drama, Psychological",Movie,6,5.86,122,"This film consists of 6 animated shorts produced by the Human Rights Commission of Korea.  Like the previous movie, the stories deal with seeing the world through the eyes of people who are different from social norms.  The film was nominated for Best Animated Feature in 2008 from the Asia Pacific Screen Awards.1. ""The Third Wish” (AN Dong-hui, RYU Jeong-wu). A fairy godmother appears before a visually impaired young woman to grant her three wishes. But this is no fairytale. The irritable middle-aged fairy wants to finish her job as soon as possible. Yet she proves to be helpful as she leads the woman through a busy marketplace, which is delightfully reminiscent of ""Amelie"". But its no walk in the park, as busy urbanites show no consideration for our protagonist. Yet she prevails through obstacles. With a walking stick, she taps together the heels of her shiny new shoes and follows the ""yellow brick road"" (guiding tiles for the visually impaired) around the city.2. ""Ajukari” (HONG Deok-pyo) is a street-style cartoon. It comically depicts how a certain macho ""complex"" can cripple men. Male circumcision becomes the ultimate standard for being ""manly"" and those who have failed to do the deed are forever fearful of going to public baths.3. ""Baby"" (LEE Hong-su, LEE Hong-min) portrays the difficulties a career woman faces in having a child. ""Im not saying you cant have maternity leave, but can you afford to raise a child while working?"" asks her boss. This smart story portrays everything from mother and daughter-in-law relationships to a parody of ""Tazza: The High Rollers"" and hilarious episodes where an ""ambulance bus"" picks up several patients en route.4. ""Shine Shine Shining"" (KWON Mi-jeong) is drawn like a warm, watercolor storybook for children. Grade schooler Eun-jin is smart and popular, but she has a secret. She hides her curly hair, which she gets from her Filipino mother, in braids.5. ""Merry Golasmas"" is an adorable claymation, or stop motion animation of models constructed from clay, plasticine, etc. It explores physical discrimination or stereotypes. In an open audition to find a Santa Claus, the real Santas ― one whos black, another whos Asian, a female Santa and one in a wheelchair ― lose to a fake Santa, a pot-bellied, Caucasian.6. “Lies"" explores homosexuality. Drawn in pastel-like sketches with art deco-esque details, it is a stunning digital cut-out animation, A homosexual man is forced by his parents to marry a woman, while others are pressured to fake having a girlfriend or receive ""therapy"" to become straight.(Source: The Korean Times)"
89,8289,33863,Cakes,Comedy,ONA,Unknown,2.58,56,Sweets having idle chatter.
90,8290,32738,Calbee Hitokuchi Gekijou,"Comedy, Slice of Life",Special,18,4.38,46,"A series of short commercials advertising Calbees snack products. The first commercial, which premiered in August, was made to mark the 50th anniversary of the companys Kappa Ebisen snack. "
91,8291,27915,Captain,"Shounen, Sports",Special,1,6.44,93,"Before Captain became a TV series it was a one-shot TV special that garnered the highest ratings of any anime that month. For its re-run on August 20th, 30 minutes of new content was added in which brought in more ratings that trumped the previous statistic."
92,8292,9905,Captain (TV),"Shounen, Sports",TV,26,6.46,208,"The original is an impressive sports manga featuring not heroes, but common boys, and the story depicts the growth of Sumiya 2 junior high school baseball team (the successive captains and players) in downtown Tokyo. Takao Taniguchi, who was a substitute player of the second team of Aoba Gakuin, a prestigious junior high school in the baseball world, but he transferred to Sumiya 2 and he became the captain of the baseball club. After steady training, the team try to do a final game in the regional preliminaries, against Aoba Gakuin."
93,8293,18759,Captain the Movie,"Shounen, Sports",Movie,1,6.41,106,The movie focuses on a game between Sumiya 2 and Aoba Gakuin. 
94,8294,23721,Carino Coni,"Fantasy, Kids",TV,26,6.93,99,"A shy little Carino Coni is a rabbit boy who just started to live alone in the forest away from his family.Everyday Conis heart raises with joy playing with his siblings who lives nearby, but suddenly cries of lonesomeness, which he cannot explain.This story is about all heart warming stories Coni encounters, and how he himself become not so lonely anymore as he gradually grows up.(Source: playsetproducts.jp)"
95,8295,32345,Celebration and Chorale,Music,Movie,1,5.28,93,"Yukie Nakauchis musical work using principal percussionist Niel DePontes ""Celebration and Chorale"". Yuuki Matsumura was the arranger for the piece."
96,8296,33344,Cello Hiki no Gauche,"Fantasy, Kids, Music",Movie,1,4.21,72,A Miyazawa Kenji story adapted as a puppet animation.
97,8297,26303,Cello Hiki no Gauche (OVA),"Drama, Fantasy, Music",OVA,1,5.88,163,Gauche is having trouble perfecting his piece for his performance in 10 days when he hears a knock on his door...
98,8298,33728,Chain Chronicle: Haecceitas no Hikari Part 1,"Action, Adventure, Fantasy, Magic, Shounen",Movie,1,6.67,5589,"Set in the land of Yuguto, the people thought that the land they live is the size of the world, but it’s actually divided into several areas, each with a respective king. Even though there were small wars among areas, the kings had roundtable meetings to maintain peace and balance. It was until a dark group of dark monsters appeared...(Source: MAL News)"
99,8299,18071,Chalk-iro no People,"Romance, Seinen",OVA,1,5.29,92,"An OVA with five short episodes from Seizou Watases romantic manga:""Building Without Tide""""Brother and Sister""""Sometimes Im Happy""""Ive Saved the Sidecar for You""""The Santa Quartet"" "
