,Unnamed: 0,anime_id,name,genre,type,episodes,rating,members,synopsis
92,9592,6067,Moeru! Oniisan,"Action, Adventure, Comedy",TV,24,7.33,252,"When Kenichi Kokuho was a small boy, he was lost in the mountains and never found. However, unknown to anyone, Kenichi has been brought up by his foster father in the wild. When Kenichi becomes 15 years old, his foster father tells him the truth about his background. As he finds out, Kenichi decides to go to a civilized society where his parents live. Everything Kenichi experiences in the town is a series of surprise and wonder. His family is delighted to see their son alive, but shocked at the fact that he has become wild and different from other children. And now, his new life is about to begin. His wild attitude and physical toughness cause various problems in the town. Kenichi has his own way to handle things, but it is too different for the most people to understand what he is up to. Can he get used to life in the town? "
93,9593,11959,Moeru! Oniisan (OVA),Comedy,OVA,2,5.89,104,No synopsis has been added for this series yet. Click here to update this information.
94,9594,5241,Mofu☆Mofu,Kids,TV,11,4.67,220,"Short episodes about Mofu☆Mofu, a little, soft, white alien, and its two friends, Meru and Miru. "
95,9595,23005,Mogura no Motoro,Slice of Life,Movie,1,9.5,62,No synopsis information has been added to this title. Help improve our database by adding a synopsis here.
96,9596,30760,Momoiro no Crayon,"Drama, Kids",OVA,1,5.06,54,An educational film about the abuse done upon intellectually disabled children.
97,9597,23881,Momon&#039;s Sand Witch,"Comedy, Kids",ONA,8,4.82,116,"Momon and her pet Tanu have been close friends since childhood and have always been together. Before long, Momon became an elementary school student, and one day when a new student transfers to her class, their lives begin to change..."
98,9598,25547,Momon&#039;s Sand Witch Bangai-hen: Tanu no Kyuujitsu,"Comedy, Kids",ONA,1,3.78,71,No synopsis information has been added to this title. Help improve our database by adding a synopsis here.
99,9599,23885,Momon&#039;s Sand Witch Episode 0,"Comedy, Kids",ONA,1,5.0,91,Episode 0 of Momons Sandwitch.
