,Unnamed: 0,anime_id,name,genre,type,episodes,rating,members,synopsis
58,12158,5568,"Rinkan Gakuen: Yamete! ...Okaasan, Minaide!",Hentai,OVA,1,5.43,1325,Based on the game by Lune loves K.
59,12159,7864,SF Lolita Fantasy Ome-1,"Hentai, Parody, Sci-Fi",OVA,2,5.43,292,Lolita hentai parodying the science-fiction genre.
60,12160,2315,Injuu Alien,"Action, Adventure, Hentai, Horror, Sci-Fi",OVA,1,5.42,1686,"The all female crew of the transport ship Muse is on a mission in deep space. They pick up an SOS signal and discover a derelict space cruiser where all the women have died mysteriously. They take the only survivor, a young woman named Flair, and detonate the ghost ship. However, the danger is just beginning. With Flair on the Muse, the romances between the women begin to take a new turn. One by one, the crewmembers are attacked by a mysterious alien presence, desperate to find a way to reproduce with human women.(Source: ANN)"
61,12161,3895,Pikkoman no Kichikumichi: Mayonaka no Milk Party,Hentai,OVA,1,5.42,733,"When a pretty college student with a perfect record decides to have one little adventure before graduation, it turns out to be one big problem. Her starring role in an adult video lands her plenty of admirers, ready to blackmail her for pleasure!"
62,12162,3981,Shokuzai no Kyoushitsu,Hentai,OVA,2,5.42,1483,"Nanases father has just been arrested for murder. While his guilt remains in question, a perverted gang of Nanases classmates have already passed judgment, and are punishing her for her fathers crimes. To atone for his sins, she must obey their every sexual command to satisfy their twisted desires. At school, in her room, and even on a crowded train. No matter where they are, Nanase must pleasure them in any way possible. But not all of Nanases classmates can be so easily satiated. Someones publishing very detailed articles about her nightly lustful escapades in a special Atonement Newspaper! Spread across campus, this public humiliation might just be worse than her nightly tortures!(Source: Atasteanime)"
63,12163,5107,Balthus: Tia no Kagayaki,"Action, Hentai, Romance",OVA,1,5.41,901,"In the village of Le-jeute, all is not well. Over shadowed by the mysterious factory city called Balthus, this peaceful little village are lured into life with the promises of pleasure that await them. But when the workers realize this, its too late to forsake the factory. (Source: ANN) "
64,12164,2991,Harumi-chan no Oita,Hentai,OVA,1,5.41,1712,Wafaru is a guy next door. One day he saw a little innocent looking girl in his room. Her name is Harumi. She asked Wafaru if she could stay with him. She didnt have anywhere to go. Because of her innocence she doesnt know anything about a mans body and even her body. Wafaru showed her his member and explained to her it was his pet. She loves playing with it so much without knowing what it really is. Wafaru cannot live with the lies he continues to tell her. In a fit of guilt he has way with her without revealing his secret.(Source: AniDB)
65,12165,3094,Rankou Choukyou: Maid ni Natta Shoujo,Hentai,OVA,1,5.41,713,"Born into a wealthy family, a young man is overpowered by his brute, cruel father. Shy and inexperienced, his first date turns out badly after he is rejected when trying to have sex with his date. Feeling depressed, he is walking to school when he comes across a beautiful girl, lost in his neighborhood. He soon finds out that she is the new family maid. Knowing his father`s predatory ways, the boy sits helplessly as his father rapes the new maid later that night. When the girl brings him dinner one day, the boy is overcome by his desire for her, and tries to have his way with her. Will he be able to confess his feelings for her, or will he turn out to be a predatory man just like his father? Will the girl accept his advances? What will fate bring for the girl and the boy?"
66,12166,3553,Reyon Densetsu Flair,"Action, Demons, Fantasy, Hentai",OVA,2,5.41,556,"An army of invading aliens attack the peaceful land of Lyon with lust and carnage on their minds. Only the combined forces of Swordsman Zeke, Swordswoman Neris and the psychic Flare stand between the sadistic Glode and his total subjugation of the people of Lyon. In Flare 2, the forest of Lyon becomes host to a malevolent force that consumes all who trespass its borders. When Lady Neris and her brother Eo disappear while investigating, it is up to Flare to discover what new evil lurks in the heart of Lyon! (Source: AniDB)"
67,12167,5555,Suishou no Yoru: Aoi Kokuhaku yori,Hentai,OVA,1,5.4,267,No synopsis information has been added to this title. Help improve our database by adding a synopsis here.
68,12168,3536,Youshou,"Demons, Hentai, Horror",OVA,2,5.4,745,"Justice has never been so naked!A super-secret cult of lesbians performs erotic experiments on bodies from the local hospital! Their purpose: to revive the spirit of their ancient leader in a virile human form. Now its up to the Midnight Strike Force, a team of busty justice fighters, to go undercover (and under the covers) to stop the nefarious acolytes before they succeed in their diabolically dirty schemes! (Source: Critical Mass Video)"
69,12169,5611,Ayatsuri Ningyou,Hentai,OVA,2,5.39,480,Shigeki is quite a normal student who constantly searches for adventures with young women.(Source: AniDB)
70,12170,4818,Houkago Renai Club: Koi no Étude,Hentai,OVA,2,5.39,605,Based on an adult game by Libido. 
71,12171,12551,Jisshuusei,Hentai,OVA,1,5.39,228,No synopsis has been added for this series yet.Click here to update this information.
72,12172,3563,Momone,Hentai,OVA,1,5.38,838,"A different college professor, Momone, has disturbing dreams of sexual deviation from her youth. She brushes the memory aside and makes her way to class. Along the way, every boy eyes her and has horny thoughts about the stacked teacher. The captain of the basketball team really likes her, but his rival Hino has other plans. When Momone seizes a porn mag from some boys, Hino claims its his, and asks if it makes her hot. Back in her apartment, Momone looks through the magazine, which does turn her on. Hino makes a grand entrance, and dominates his professor, forcing Momone to be his bitch. The next day, under instructions from Hino, Momone wears no underwear. Its part of Hinos plan to truly make Momone his own. And boy, hes not very nice about it, either! "
73,12173,5393,Soushitsukyou,"Hentai, Yuri",OVA,1,5.38,1092,"Naoto and his lover Miyuki were going to ski resort; however, their bus was stalled in blizzard. The passengers were helped by Natsuyo, a landlady of a Japanese style hotel, and they decided to stay at the hotel for a while. At that night, Naoto and Miyuki made love at the hotel over and over, but he couldn’t be satisfied, and finally he began to love Natsuyo. The situation was the same with other passengers. In this closed space, ritual and accidents continued... A bizarre and erotic story was just begun...(Source: AnimeNfo)"
74,12174,2349,Bondage Game: Shinsou no Reijoutachi,"Hentai, Psychological",OVA,2,5.37,4732,"Yuu is a girl who has lost her memories. She is mailed into a sadistic house of bondage where she and others are forced (or not) to serve their master, Renji, but there are serious consequences for those who fail."
75,12175,6622,Gakuen Maria: Bakunyuu Teachers,Hentai,OVA,1,5.37,891,Based on the manga by Aura Seiji(Source: AniDB)
76,12176,2480,Dragon Knight Gaiden,"Action, Demons, Fantasy, Hentai",OVA,1,5.36,712,"Takeru meets the boy Jodis which is in trouble for theft. Takeru saves him shares the night with him, finding out that Jodis is a girl. Later she is been kidnapped and Takeru goes to rescue her. (Source: AniDB)"
77,12177,5609,Emi to Yobanaide,Hentai,OVA,2,5.36,614,"Emi is a high-school girl with a very strong love for her younger step-brother. She finally decides that it is time to confess her love to him, since it is near her 18th birthday. But before the climactic moment where she can confess her love; debt collectors arrive to confiscate her fathers properties."
78,12178,3581,Requiem,Hentai,OVA,2,5.36,2413,"Based on a game by CLOCKUP Cannone is a violin that entrances people. Ceillia is a violin that was created by the angels that seals Cannone. Akio became a teacher for St. Cecillia Academy. He found Cannone sealed in the torture room under the chapel, he was fascinated by it`s power. The other violin picked a girl to use it`s powers to steal Cannone. (Source: Animenfo) "
79,12179,13917,Star☆Jewel Gaiden: Natsumi Oblivion,"Hentai, Yuri",OVA,1,5.35,883,"A war is being fought between the goddesses of dark and light. While the former try to steal the jewels from innocent women, leaving lifeless husks, the latter hunt the evildoers. Both types of goddesses are equipped with powers to fight, but their strongest weapons are their retractable penises—flooding the enemy with pleasure is the only sure-fire way to win.(Source: AniDB)"
80,12180,3883,Yu-No,"Hentai, Sci-Fi",OVA,4,5.35,661,"Takuyas father died during an accident while he was doing research. Worried about his young stepmother, Ayumi, Takuya follows her to Ken point. Watching her and her best friend, Mitsuki, from behind a rock, a sudden flash of light turns into an unearthly beautiful woman. The mysterious woman slips a ring on his finger, and Takuyas travels into a parallel world begins. This ring is the key between Takuya and his different realities.(Source: AniDB)"
81,12181,4699,Eisai Kyoiku,"Hentai, School",OVA,1,5.34,1484,"Based on the H-game by Amalgame. Certain subjects being taught these days at college arent always on the curriculum... Sex education is one of them! Here at our all-girls school, one male teacher takes it upon himself to best educate students in the ways of carnal knowledge. Using (and abusing) his authority, he lures the hottest students into his lair and has his sleazy way with them! In the the end, these girls will learn some lessons theyll never forget. At another college, a glowing phallus-shaped artifact possesses magical powers that turn innocent girls into raging sex maniacs. When a teacher is seduced by a student, he soon finds himself endowed with a power that the girls cannot resist... (Source: AniDB) "
82,12182,4463,Custom Reido,Hentai,OVA,1,5.33,1091,"Based on the game by Kiss.Arisugawa Academy. An all-girl school well known for its high standards with the upper class. However, there is a dark side to this educational facility. The Chairman of the academy, Takahashi Hiroaki, is actually a member of a secret organization whose prime objective is to cater to the sexual desires of government officials. Mutsuki Sayoko has fallen into the hands of this sinister being, who leads her to the path of libido. A high-class, well-behaved student or a horny, wicked sex slave... which is the true her?(Source: AniDB)"
83,12183,4575,Junk Story,"Action, Hentai, Sci-Fi",OVA,1,5.33,418,Relationship between a well equipped cyborg and the bounty hunter Mariko OBrian.
84,12184,3566,Hika Ryoujoku: Wana ni Hamatta Futari,Hentai,OVA,1,5.32,1062,"Shinichi becomes Megumis stepbrother after his mother marries Megumis father. Eventually, Megumi starts to love and regard Shinichi as her older brother. However, their idyllic life will soon turn into a nightmare of lust and debauchery..."
85,12185,4675,Detective File 1: Kindan no Ai,Hentai,OVA,1,5.31,943,"Private detective Takayasu Higishino rescues Ayane from two men who cornered her in an alley. Ayane is startled by Takayasus appearance, he looks just like her presumedly dead brother Shingo. Shingos car accident occured under strange circumstances, and Ayane has hired Takayasu to help her find out what really happened. Takayasu suspects Ayanes family maybe involved, so he heads back with Ayane to her family mansion, posing as Shingo, hoping to uncover the truth.(Source: ANN) "
86,12186,9851,O-parts: Oman,"Action, Comedy, Hentai, Mecha",Special,1,5.31,488,Something strange happens in girls school...
87,12187,4157,Pero Pero Candy,Hentai,OVA,1,5.31,359,Ero anime from the mid 1980s
88,12188,5542,Telepathist IQ Saiko,Hentai,OVA,1,5.31,252,"Earth can only be saved from alien invaders by the nubile bodies of young telepaths.Part of Little Mermaid Series along with Shining May, Punky Funky Baby, and Suashi no Houkago.(Source: AniDB)"
89,12189,7162,Yaruki Manman,"Comedy, Hentai, Parody",OVA,3,5.31,251,"Kazuma is the successor of the Shinno family which leads the sex scene. But now the sex scene doesnt bring much money so father Shino wants his son to visit a sex-study to earn some experience. But while being on the sex training he must not ejaculate in front of any of the women. When he comes, he’ll lose his heir. The hot Japanese geishas make it very difficult to hold on until the end. Will he finish his training?"
90,12190,3562,Chu^2,Hentai,OVA,1,5.3,798,"Wicked Trio 1 - The Affair Its a rainy night in Tokyo, and our ""Man"" receives oral pleasure from his ""Girl"" while parked in the hotel garage. In the elevator, ""Man"" digitally stimulates the ""Girl"" until shes begging for more. When they finally arrive at their hotel room, more is what she gets, maybe even more than she bargained on! Wicked Trio 2 - Lust In Space While an androgynous youth battles a monster, another creature attempts to ""have his way"" with his female companion. After disposing of the threat, the crystal on his chest transforms the youth into the damsels sister! But his young horny psyche is not ready to be denied! Wicked Trio 3 - Sextra Credit A nubile Redhead drives to her boyfriends condo; hes not at home, but his college tutor, a ""professor"", is. Red seduces the young teacher, and in the midst of their tryst, Boyfriend arrives home. Believe it or not, hes not upset and in fact joins in. Will the ""professor"" enjoy her new lifestyle? "
91,12191,9317,Doll Saaya,Hentai,OVA,1,5.3,304,"Once upon a time there was a guy. He had a toy doll named Saaya that he adored and had passion for. Later he came across the girl who was an exact copy of Saaya. He asked the girl to pose for him, and she agreed. However, for him she wasnt a person - all he wanted to see was his beloved Saaya..."
92,12192,2551,Nessa no Wakusei,"Hentai, Sci-Fi",OVA,2,5.3,1013,"Kate, the voluptuous, virginal new recruit of the Federal Space Army Security Police, is the newest detective in the force. Shes eager to prove her worth as an undercover agent, but that might not be as easy as she thinks. Her first assignment is to track down the villains who have been raping young women from the hot desert planet, Doune.(Source: ANN)"
93,12193,2592,Kimera,"Action, Horror, Sci-Fi, Supernatural, Vampire, Yaoi",OVA,1,5.29,3374,"Osamu and Jay are two cereal salesmen traveling for work when they encounter a barricade. Curious as to what is going on, they step out of their car and enter into a government secret. Two mysterious demon-like men have been terrorizing the military, who came to respond to a car crash involving a vehicle carrying government research material. Inside the car wreckage, Osamu finds a beautiful hermaphrodite with gold and crimson eyes trapped in a frozen chamber. Osamu shares a kiss with them through the glass before he is forced to flee the scene.Osamu and Jay interrogate Jays father, a top researcher at a government laboratory, who reveals that what Osamu and Jay saw was top-secret, and they would likely be sitting in prison if it werent for his influence. While Jay is ready to forget everything that happened, Osamu cannot let it go that easily. After stealing a security badge, Osamu finds where the person he kissed is being kept, and learns that their name is Kimera. Osamu wants to run away with the beautiful Kimera, though he does not know why Kimera is being held captive or what a relationship with them means for the future of humanity."
94,12194,5548,69 Pink Riders,Hentai,OVA,1,5.27,580,"Korean animation, consists of 7 stories not particularly related to each other, though some of them are. (Source: AniDB)"
95,12195,5564,Age Man to Fuku Chin,Hentai,OVA,1,5.27,410,"This is a sequel to and final part of to the ""Yaruki Manman"" series.(Source: AniDB) "
96,12196,5573,Rhythm: Koi no Rhythm,Hentai,OVA,2,5.27,323,"Hiro is a high school student with a very strong penchant for adventure. Legend has it that theres something truly wonderful hidden around his hometown, the only problems are trying to figure out what it is, and where to find it. After discovering a book filled with strange text in the college library, he recruits his friend Puri to translate it for him. She determines that there is indeed a legend involving a hero and his companions, teaming up together to find a magical cave.Meanwhile, a young woman named Fauna is afflicted with a very unusual condition that causes to her to yearn for sex uncontrollably while she sleep walks. Due to the possible dangers this puts her into, she and her friends are concerned enough to entertain the possibility of a local superstition. Allegedly, theres a flower that can help cure any ailment, and if true, could be the solution to Faunas problems.Neither of the parties in Rhythm: Koi no Rhythm realize that their separate paths are one in the same, and their intersection will lead them on an adventure none of them will ever forget."
97,12197,4496,Zero Sum Game: Sex Crime,Hentai,OVA,1,5.27,1075,"Yuukas boyfriend/husband has a brother in the band ""Zero Sum"" as the lead singer. After a request, she and her husband Yazaki got tickets to go backstage at a concert. However afterwards, all the band members, except Keith the leader, kidnapped her and raped her on the roof top all as a scheme by Keith who is madly in love with his brother. Now she cant forget nor can she get away.(Source: ANN)"
98,12198,5563,Chounouryoku Shoujo Barabanba,Hentai,OVA,1,5.26,345,One of the first OVA format adult anime. Based in the 1984 manga Barabanba by Go Nagai.(Source: AniDB)
99,12199,5663,G.T.R G-cup Teacher Rei,Hentai,OVA,4,5.26,395,No synopsis information has been added to this title. Help improve our database by adding a synopsis here.
