Unnamed: 0,anime_id,name,genre,type,episodes,rating,members,synopsis
500,2605,Sayonara Zetsubou Sensei,"Comedy, Parody, School",TV,12,8.03,174531,0
501,4163,Seto no Hanayome OVA,"Comedy, Parody, Romance, School",OVA,2,8.03,31973,0
502,3228,Zoku Sayonara Zetsubou Sensei,"Comedy, Parody, School",TV,13,8.03,74040,0
503,1485,Akachan to Boku,"Comedy, Drama, Shoujo",TV,35,8.02,8353,0
504,6351,"Clannad: After Story - Mou Hitotsu no Sekai, Kyou-hen","Drama, Romance, School",Special,1,8.02,138364,0
505,13119,Hakuouki Movie 2: Shikon Soukyuu,"Action, Drama, Historical, Josei, Samurai, Supernatural",Movie,1,8.03,9492,0
506,3782,Kara no Kyoukai 2: Satsujin Kousatsu (Zen),"Action, Mystery, Romance, Supernatural, Thriller",Movie,1,8.02,114415,0
507,3572,Macross F,"Action, Mecha, Military, Music, Romance, Sci-Fi, Space",TV,25,8.02,95551,0
508,8310,Magic Kaito,"Adventure, Comedy, Romance, Shounen",Special,12,8.02,27274,0
509,114,Sakigake!! Cromartie Koukou,"Comedy, School, Shounen",TV,26,8.02,67254,0
510,11813,Shijou Saikyou no Deshi Kenichi OVA,"Action, Comedy, Martial Arts, School, Shounen",OVA,11,8.02,24167,0
511,658,Touhai Densetsu Akagi: Yami ni Maiorita Tensai,"Game, Psychological, Seinen, Thriller",TV,26,8.02,48127,0
512,10012,Carnival Phantasm,"Comedy, Parody, Supernatural",OVA,12,8.01,71976,0
513,32370,D.Gray-man Hallow,"Action, Demons, Shounen, Super Power",TV,13,8.01,72499,0
514,22961,Date A Live: Encore OVA,"Romance, Slice of Life",OVA,1,8.01,48432,0
515,22777,Dragon Ball Kai (2014),"Action, Adventure, Comedy, Fantasy, Martial Arts, Shounen, Super Power",TV,61,8.01,42666,0
516,29787,Gochuumon wa Usagi Desu ka??,"Comedy, Slice of Life",TV,12,8.01,38102,0
517,7062,Hidamari Sketch x ☆☆☆,"Comedy, School, Slice of Life",TV,12,8.01,15748,0
518,11887,Kokoro Connect,"Comedy, Drama, Romance, School, Slice of Life, Supernatural",TV,13,8.01,283847,0
519,9088,Saiyuuki Gaiden,"Action, Adventure, Drama, Fantasy, Shoujo",OVA,3,8.01,5843,0
520,12815,Shirokuma Cafe,"Comedy, Josei, Slice of Life",TV,50,8.01,44668,0
521,12017,Tiger &amp; Bunny Movie 2: The Rising,"Action, Comedy, Mystery, Super Power",Movie,1,8.01,13567,0
522,6377,Zan Sayonara Zetsubou Sensei,"Comedy, Parody, School",TV,13,8.01,55402,0
523,1470,City Hunter,"Action, Comedy, Mystery, Shounen",TV,51,8.0,19963,0
524,780,Detective Conan Movie 02: The Fourteenth Target,"Adventure, Comedy, Mystery, Police, Shounen",Movie,1,8.0,26284,0
525,27633,Gekkan Shoujo Nozaki-kun Specials,"Comedy, Romance, School",Special,6,8.0,52672,0
526,2321,Giant Robo the Animation: Chikyuu ga Seishi Suru Hi,"Action, Mecha, Sci-Fi, Shounen, Super Power",OVA,7,8.0,12283,0
527,17273,Hetalia: The Beautiful World Specials,"Comedy, Historical, Parody",Special,4,8.0,8644,0
528,429,Kaleido Star: Legend of Phoenix - Layla Hamilton Monogatari,"Comedy, Drama, Shoujo",OVA,1,8.0,9268,0
529,18661,Kamisama Hajimemashita OVA,"Comedy, Demons, Fantasy, Shoujo, Supernatural",OVA,2,8.0,38678,0
530,14349,Little Witch Academia,"Adventure, Comedy, Fantasy, Magic, School",Movie,1,8.0,111703,0
531,1729,Maria-sama ga Miteru 3rd,"Drama, School, Shoujo Ai, Slice of Life",OVA,5,8.0,12394,0
532,31973,Mobile Suit Gundam Thunderbolt,"Action, Drama, Mecha, Military, Sci-Fi, Space",ONA,4,8.0,14419,0
533,17949,The Everlasting Guilty Crown,Music,Music,1,8.0,11663,0
534,996,Bishoujo Senshi Sailor Moon: Sailor Stars,"Adventure, Comedy, Drama, Fantasy, Magic, Romance, Shoujo",TV,34,7.99,52586,0
535,9465,Break Blade 4: Sanka no Chi,"Action, Fantasy, Mecha, Military, Shounen",Movie,1,7.99,41598,0
536,14175,Hanasaku Iroha: Home Sweet Home,"Comedy, Drama, Slice of Life",Movie,1,7.99,34630,0
537,11239,Hidamari Sketch x Honeycomb,"Comedy, School, Slice of Life",TV,12,7.99,12590,0
538,967,Hokuto no Ken,"Action, Drama, Martial Arts, Sci-Fi, Shounen",TV,109,7.99,40271,0
539,1695,Les Misérables: Shoujo Cosette,"Drama, Historical, Shoujo, Slice of Life",TV,52,7.99,9605,0
540,339,Serial Experiments Lain,"Dementia, Drama, Mystery, Psychological, Sci-Fi, Supernatural",TV,13,7.99,215829,0
541,7724,Shiki,"Mystery, Supernatural, Thriller, Vampire",TV,22,7.99,251093,0
542,2753,Ushiro no Shoumen Daare,"Drama, Historical",Movie,1,7.99,3811,0
543,8516,Baka to Test to Shoukanjuu Ni!,"Comedy, Romance, School, Super Power",TV,13,7.98,183722,0
544,779,Detective Conan Movie 01: The Timed Skyscraper,"Adventure, Comedy, Mystery, Police, Shounen",Movie,1,7.98,28947,0
545,1366,Detective Conan Movie 07: Crossroad in the Ancient Capital,"Adventure, Comedy, Mystery, Police, Shounen",Movie,1,7.98,21729,0
546,19319,Gundam Build Fighters,"Action, Mecha, Sci-Fi",TV,25,7.98,31606,0
547,15195,Hetalia: The Beautiful World,"Comedy, Historical, Parody",ONA,20,7.98,34960,0
548,187,Initial D Third Stage,"Action, Cars, Drama, Seinen, Sports",Movie,1,7.98,39374,0
549,30311,Kuroko no Basket 3rd Season NG-shuu,"Comedy, Sports",Special,9,7.98,10778,0
550,597,Neko no Ongaeshi,"Adventure, Drama, Fantasy",Movie,1,7.98,92499,0
551,400,Seihou Bukyou Outlaw Star,"Action, Adventure, Comedy, Sci-Fi, Space",TV,24,7.98,78600,0
552,18245,White Album 2,"Drama, Music, Romance, Slice of Life",TV,13,7.98,91075,0
553,10521,Working&#039;!!,"Comedy, Slice of Life",TV,13,7.98,117328,0
554,28907,"Gate: Jieitai Kanochi nite, Kaku Tatakaeri","Action, Adventure, Fantasy, Military",TV,12,7.97,244314,0
555,31637,"Gate: Jieitai Kanochi nite, Kaku Tatakaeri 2nd Season","Action, Adventure, Fantasy, Military",TV,12,7.97,153501,0
556,1571,Ghost Hunt,"Comedy, Horror, Mystery, Shoujo, Supernatural",TV,25,7.97,126426,0
557,267,Gungrave,"Action, Drama, Sci-Fi, Seinen, Super Power",TV,26,7.97,95825,0
558,253,Jungle wa Itsumo Hare nochi Guu,"Comedy, School, Slice of Life",TV,26,7.97,22214,0
559,22673,Kuroko no Basket 2nd Season NG-shuu,"Comedy, Sports",Special,9,7.97,20477,0
560,4080,Kyou kara Maou! 3rd Series,"Adventure, Comedy, Fantasy, Romance, Shoujo",TV,39,7.97,19510,0
561,27947,Lupin III (2015),"Action, Adventure, Comedy, Shounen",TV,24,7.97,16938,0
562,12917,Madang-Eul Naon Amtalg,"Adventure, Drama, Fantasy, Kids",Movie,1,7.97,1528,0
563,3750,Maria-sama ga Miteru 4th,"School, Shoujo, Shoujo Ai, Slice of Life",TV,13,7.97,11779,0
564,569,Musekinin Kanchou Tylor,"Comedy, Military, Parody, Sci-Fi, Space",TV,26,7.97,19841,0
565,6007,Ookami to Koushinryou II: Ookami to Kohakuiro no Yuuutsu,"Fantasy, Historical, Romance",OVA,1,7.97,81137,0
566,1253,Saint Seiya: Meiou Hades Meikai-hen,"Action, Adventure, Demons, Fantasy, Sci-Fi, Shounen, Super Power",OVA,12,7.97,21240,0
567,15771,Saint☆Oniisan (Movie),"Comedy, Seinen, Slice of Life",Movie,1,7.97,30814,0
568,397,Seikai no Senki II,"Action, Military, Romance, Sci-Fi, Space",TV,10,7.97,13888,0
569,949,Top wo Nerae! Gunbuster,"Action, Comedy, Drama, Mecha, Military, Sci-Fi, Shounen, Space",OVA,6,7.97,51724,0
570,11001,Toshokan Sensou: Kakumei no Tsubasa,"Action, Comedy, Military, Romance",Movie,1,7.96,10244,0
571,17909,Uchouten Kazoku,"Comedy, Drama, Fantasy, Slice of Life",TV,13,7.96,64897,0
572,21185,Baby Steps,"Romance, School, Shounen, Sports",TV,25,7.96,59818,0
573,9724,Break Blade 5: Shisen no Hate,"Action, Mecha, Military, Shounen",Movie,1,7.96,40053,0
574,6768,Code Geass: Hangyaku no Lelouch R2 Special Edition Zero Requiem,"Action, Mecha, Military, Super Power",OVA,1,7.96,23204,0
575,4872,Goku Sayonara Zetsubou Sensei,"Comedy, Parody, School",OVA,3,7.96,40358,0
576,12413,Jormungand,"Action, Adventure, Seinen",TV,12,7.96,137610,0
577,2076,Kindaichi Shounen no Jikenbo (TV),"Mystery, Shounen",TV,148,7.96,8655,0
578,31251,Mobile Suit Gundam: Iron-Blooded Orphans,"Action, Drama, Mecha, Sci-Fi, Space",TV,25,7.96,60525,0
579,5485,Shin Mazinger Shougeki! Z-hen,"Action, Mecha, Shounen, Super Power",TV,26,7.96,7872,0
580,5005,Tentai Senshi Sunred,"Comedy, Parody, Seinen, Super Power",TV,26,7.96,12236,0
581,890,Yuusha-Ou GaoGaiGar,"Adventure, Mecha, Sci-Fi, Shounen",TV,49,7.96,10031,0
582,269,Bleach,"Action, Comedy, Shounen, Super Power, Supernatural",TV,366,7.95,624055,0
583,14741,Chuunibyou demo Koi ga Shitai!,"Comedy, Drama, Romance, School, Slice of Life",TV,12,7.95,394399,0
584,1472,City Hunter 3,"Action, Comedy, Mystery, Shounen",TV,13,7.95,6723,0
585,33028,Danganronpa 3: The End of Kibougamine Gakuen - Zetsubou-hen,"Action, Horror, Mystery, Psychological",TV,11,7.95,65503,0
586,7304,Detective Conan Movie 08: Time Travel of the Silver Sky,"Adventure, Mystery",Special,1,7.95,6515,0
587,8609,Detective Conan OVA 10: Kid in Trap Island,"Adventure, Comedy, Mystery, Police, Shounen",OVA,1,7.95,7757,0
588,6033,Dragon Ball Kai,"Action, Adventure, Comedy, Fantasy, Martial Arts, Shounen, Super Power",TV,97,7.95,116832,0
589,8479,Hetalia World Series,"Comedy, Historical, Parody",ONA,48,7.95,64416,0
590,254,Jungle wa Itsumo Hare nochi Guu Deluxe,"Comedy, Slice of Life",OVA,6,7.95,8847,0
591,8525,Kami nomi zo Shiru Sekai,"Comedy, Harem, Romance, Shounen, Supernatural",TV,12,7.95,284846,0
592,19703,Kyousou Giga (TV),"Action, Fantasy, Supernatural",TV,10,7.95,67732,0
593,25517,Magic Kaito 1412,"Adventure, Comedy, Romance, Shounen",TV,24,7.95,43545,0
594,31764,Nejimaki Seirei Senki: Tenkyou no Alderamin,"Action, Adventure, Fantasy, Military",TV,13,7.95,86475,0
595,27775,Plastic Memories,"Drama, Romance, Sci-Fi",TV,13,7.95,213493,0
596,21339,Psycho-Pass Movie,"Action, Military, Police, Sci-Fi",Movie,1,7.95,94677,0
597,2104,Seto no Hanayome,"Comedy, Parody, Romance, School",TV,26,7.95,165008,0
598,24893,Sidonia no Kishi: Daikyuu Wakusei Seneki,"Action, Mecha, Sci-Fi, Seinen, Space",TV,12,7.95,57665,0
599,2150,Tanoshii Muumin Ikka,"Adventure, Comedy, Fantasy, Kids, Slice of Life",TV,78,7.95,7761,0
