Unnamed: 0,anime_id,name,genre,type,episodes,rating,members,synopsis
600,12445,Tasogare Otome x Amnesia,"Horror, Mystery, Romance, School, Shounen, Supernatural",TV,12,7.95,172367,0
601,543,Vampire Hunter D (2000),"Action, Drama, Fantasy, Horror, Romance, Sci-Fi, Vampire",Movie,1,7.95,68229,0
602,23225,Yuru Yuri Nachuyachumi!,"Comedy, Shoujo Ai, Slice of Life",OVA,1,7.95,28339,0
603,9252,Break Blade 3: Kyoujin no Ato,"Action, Fantasy, Mecha, Military, Shounen",Movie,1,7.94,42653,0
604,12893,Danshi Koukousei no Nichijou Specials,"Comedy, School, Shounen, Slice of Life",Special,6,7.94,49891,0
605,1505,Detective Conan Movie 09: Strategy Above the Depths,"Adventure, Comedy, Mystery, Police, Shounen",Movie,1,7.94,20347,0
606,4447,Detective Conan Movie 12: Full Score of Fear,"Adventure, Comedy, Mystery, Police, Shounen",Movie,1,7.94,19290,0
607,317,Final Fantasy VII: Advent Children,"Action, Fantasy, Super Power",Movie,1,7.94,138659,0
608,22265,Free!: Eternal Summer,"Comedy, School, Slice of Life, Sports",TV,13,7.94,150596,0
609,13117,Hakuouki Movie 1: Kyoto Ranbu,"Action, Drama, Historical, Josei, Samurai, Supernatural",Movie,1,7.94,12076,0
610,9563,Hidamari Sketch x ☆☆☆ Specials,"Comedy, School, Slice of Life",Special,2,7.94,8734,0
611,16904,K: Missing Kings,"Action, Super Power, Supernatural",Movie,1,7.94,98549,0
612,97,Last Exile,"Action, Adventure, Sci-Fi",TV,26,7.94,104193,0
613,20517,Little Busters!: EX,"Comedy, Drama, Romance, School, Slice of Life, Supernatural",Special,8,7.94,26709,0
614,2273,Mobile Suit Gundam Wing: Endless Waltz Movie,"Action, Drama, Mecha, Military, Sci-Fi, Space",Movie,1,7.94,35711,0
615,1735,Naruto: Shippuuden,"Action, Comedy, Martial Arts, Shounen, Super Power",TV,Unknown,7.94,533578,0
616,20159,Pokemon: The Origin,"Action, Adventure, Comedy, Fantasy, Kids",Special,4,7.94,85947,0
617,12403,Yuru Yuri♪♪,"Comedy, School, Shoujo Ai, Slice of Life",TV,12,7.94,83097,0
618,7044,Zan Sayonara Zetsubou Sensei Bangaichi,"Comedy, Parody, School",OVA,2,7.94,22704,0
619,31646,3-gatsu no Lion,"Drama, Game, Seinen, Slice of Life",TV,23,7.93,59492,0
620,32998,91 Days,"Action, Drama, Historical",TV,12,7.93,140604,0
621,30123,Akagami no Shirayuki-hime,"Drama, Fantasy, Romance, Shoujo",TV,12,7.93,157551,0
622,31339,Drifters,"Action, Adventure, Comedy, Fantasy, Historical, Samurai, Seinen",TV,12,7.93,102857,0
623,2890,Gake no Ue no Ponyo,"Adventure, Fantasy",Movie,1,7.93,140277,0
624,468,Ghost in the Shell 2: Innocence,"Mecha, Military, Police, Psychological, Sci-Fi",Movie,1,7.93,85714,0
625,29755,Haikyuu!! Movie 1: Owari to Hajimari,"Comedy, Drama, School, Shounen, Sports",Movie,1,7.94,13094,0
626,25303,Haikyuu!! OVA,"Shounen, Sports",OVA,2,7.93,30063,0
627,24471,Hoozuki no Reitetsu OVA,"Comedy, Fantasy, Supernatural",OVA,3,7.93,6073,0
628,516,Keroro Gunsou,"Comedy, Sci-Fi, Shounen",TV,358,7.93,31632,0
629,1425,Lupin III: Part II,"Action, Adventure, Comedy, Shounen",TV,155,7.93,10873,0
630,5310,Macross F Movie 1: Itsuwari no Utahime,"Action, Mecha, Military, Music, Romance, Sci-Fi, Space",Movie,1,7.93,20637,0
631,93,Mobile Suit Gundam Seed,"Action, Drama, Mecha, Military, Romance, Sci-Fi, Space",TV,50,7.93,96973,0
632,8038,Nodame Cantabile Finale Special,"Comedy, Josei, Music, Romance",Special,1,7.93,23388,0
633,322,Paradise Kiss,"Comedy, Drama, Josei, Romance, Slice of Life",TV,12,7.93,86380,0
634,6154,Saint Seiya: The Hades Chapter Sanctuary - Yomigaerishi Gold Saint-tachi no Shinwa,"Adventure, Sci-Fi, Shounen",Special,2,7.93,4975,0
635,7588,Saraiya Goyou,"Historical, Samurai, Seinen",TV,12,7.93,40819,0
636,10083,Shiki Specials,"Horror, Mystery, Supernatural, Vampire",Special,2,7.93,37657,0
637,1172,Slayers Try,"Adventure, Comedy, Demons, Fantasy, Magic, Shounen",TV,26,7.93,32742,0
638,31711,To LOVE-Ru Darkness 2nd Specials,"Comedy, Ecchi, Harem, Romance, School, Sci-Fi, Shounen",Special,2,7.93,22487,0
639,2265,Transformers the Movie,"Action, Mecha",Movie,1,7.93,6540,0
640,23249,Uchuu Senkan Yamato 2199: Hoshimeguru Hakobune,"Action, Drama, Military, Sci-Fi, Space",Movie,1,7.93,5431,0
641,202,Wolf&#039;s Rain,"Action, Adventure, Drama, Fantasy, Mystery, Sci-Fi",TV,26,7.93,171863,0
642,30370,Akatsuki no Yona OVA,"Action, Comedy, Fantasy, Shoujo",OVA,3,7.92,29398,0
643,9919,Ao no Exorcist,"Action, Demons, Fantasy, Shounen, Supernatural",TV,25,7.92,583823,0
644,1818,Claymore,"Action, Adventure, Demons, Fantasy, Shounen, Super Power, Supernatural",TV,26,7.92,316853,0
645,34036,Detective Conan: Episode One - Chiisaku Natta Meitantei,"Adventure, Comedy, Mystery, Police, Shounen",Special,1,8.1,2493,0
646,10090,Ghost in the Shell: Stand Alone Complex - Solid State Society 3D,"Mecha, Military, Mystery, Police, Sci-Fi, Seinen",Movie,1,7.91,7515,0
647,17895,Golden Time,"Comedy, Romance, Seinen",TV,24,7.92,273191,0
648,1824,Hadashi no Gen,"Drama, Historical",Movie,1,7.92,16474,0
649,4192,Hayate no Gotoku!!,"Action, Comedy, Harem, Parody, Romance",TV,25,7.92,67323,0
650,10357,Jinrui wa Suitai Shimashita,"Comedy, Fantasy, Seinen",TV,12,7.92,89373,0
651,30745,Kyoukai no Kanata Movie: I&#039;ll Be Here - Kako-hen - Yakusoku no Kizuna,Music,Special,1,7.92,10306,0
652,19489,Little Witch Academia: Mahoujikake no Parade,"Adventure, Comedy, Fantasy, Magic, School",Movie,1,7.92,53024,0
653,4472,Lucky☆Star: Original na Visual to Animation,"Comedy, Parody, School, Slice of Life",OVA,1,7.92,84833,0
654,19613,New Initial D Movie: Legend 1 - Kakusei,"Action, Cars, Seinen, Sports",Movie,1,7.92,7695,0
655,5530,Pandora Hearts,"Adventure, Fantasy, Mystery, Shounen, Supernatural",TV,25,7.92,229567,0
656,6591,Rurouni Kenshin DVD-BOX Special Ending,"Historical, Romance",Special,1,7.92,9695,0
657,10218,Berserk: Ougon Jidai-hen I - Haou no Tamago,"Action, Adventure, Demons, Fantasy, Military, Seinen, Supernatural",Movie,1,7.91,77103,0
658,388,Capeta,"Cars, Shounen, Sports",TV,52,7.91,9711,0
659,28999,Charlotte,"Drama, School, Super Power",TV,13,7.91,310137,0
660,1473,City Hunter &#039;91,"Action, Comedy, Mystery, Shounen",TV,13,7.91,6337,0
661,1379,Kino no Tabi: Nanika wo Suru Tame ni - Life Goes On.,"Adventure, Drama, Fantasy",Movie,1,7.91,26746,0
662,23293,Lupin the IIIrd: Jigen Daisuke no Bohyou,"Action, Adventure, Comedy, Drama, Seinen",Movie,1,7.91,5939,0
663,1910,Master Keaton OVA,"Adventure, Mystery",OVA,15,7.91,3205,0
664,33221,Mobile Suit Gundam Thunderbolt: December Sky,"Action, Drama, Mecha, Military, Sci-Fi, Space",Movie,1,7.92,2833,0
665,18897,Nisekoi,"Comedy, Harem, Romance, School, Shounen",TV,20,7.91,347599,0
666,31592,Pokemon XY&amp;Z,"Action, Adventure, Comedy, Fantasy, Kids",TV,47,7.91,15627,0
667,31380,To LOVE-Ru Darkness 2nd OVA,"Comedy, Ecchi, Harem, Romance, School, Sci-Fi, Shounen",OVA,3,7.91,18575,0
668,28677,Yamada-kun to 7-nin no Majo (TV),"Comedy, Harem, Mystery, Romance, School, Shounen, Supernatural",TV,12,7.91,193566,0
669,7193,Aoi Bungaku Series,"Drama, Historical, Psychological, Seinen, Thriller",TV,12,7.9,93074,0
670,1961,Arashi no Yoru ni,"Adventure, Comedy, Drama, Fantasy",Movie,1,7.9,11458,0
671,21405,Bokura wa Minna Kawaisou,"Comedy, Romance, School, Slice of Life",TV,12,7.9,159793,0
672,6024,Chi&#039;s Sweet Home: Atarashii Ouchi,"Comedy, Kids, Slice of Life",TV,104,7.9,16670,0
673,2761,Densetsu Kyojin Ideon: Hatsudou-hen,"Drama, Mecha, Sci-Fi, Space",Movie,1,7.9,2963,0
674,1491,Ginga Tetsudou 999,"Adventure, Drama, Sci-Fi, Space",TV,113,7.9,12672,0
675,106,Hana yori Dango,"Drama, Romance, School, Shoujo",TV,51,7.9,28341,0
676,5835,Hanasakeru Seishounen,"Drama, Romance, Shoujo",TV,39,7.9,37051,0
677,3604,Hidamari Sketch x 365,"Comedy, School, Slice of Life",TV,13,7.9,19180,0
678,11237,Hidamari Sketch x SP,"Comedy, School, Slice of Life",Special,2,7.9,7999,0
679,2828,Ie Naki Ko,"Adventure, Drama, Historical, Kids, Slice of Life",TV,51,7.9,4479,0
680,4087,Michiko to Hatchin,"Action, Adventure",TV,22,7.9,82625,0
681,28881,New Initial D Movie: Legend 2 - Tousou,"Cars, Seinen, Sports",Movie,1,7.9,4641,0
682,21473,Persona 3 the Movie 2: Midsummer Knight&#039;s Dream,"Action, Fantasy, Seinen, Supernatural",Movie,1,7.9,27462,0
683,582,Sexy Commando Gaiden: Sugoiyo!! Masaru-san,"Comedy, Martial Arts, School, Shounen",TV,48,7.9,6473,0
684,8311,Tegamibachi Reverse,"Adventure, Fantasy, Shounen, Supernatural",TV,25,7.9,36228,0
685,21995,Ao Haru Ride,"Comedy, Drama, Romance, School, Shoujo, Slice of Life",TV,12,7.89,227417,0
686,532,Bishoujo Senshi Sailor Moon S,"Drama, Magic, Romance, Shoujo",TV,38,7.89,66911,0
687,552,Digimon Adventure,"Action, Adventure, Comedy, Fantasy, Kids",TV,54,7.89,182208,0
688,13629,Furiko,"Drama, Music, Romance, Slice of Life",Special,1,7.89,8809,0
689,7645,Heartcatch Precure!,"Action, Comedy, Fantasy, Magic, School, Shoujo, Slice of Life",TV,49,7.89,12825,0
690,249,InuYasha,"Action, Adventure, Comedy, Demons, Fantasy, Magic, Romance, Shounen, Supernatural",TV,167,7.89,281632,0
691,4886,InuYasha: Kuroi Tessaiga,"Adventure, Comedy, Demons, Fantasy, Magic, Romance, Shounen, Supernatural",Special,1,7.89,16373,0
692,451,InuYasha: Tenka Hadou no Ken,"Adventure, Comedy, Demons, Drama, Fantasy, Historical, Romance, Shounen, Supernatural",Movie,1,7.89,51079,0
693,9734,K-On!!: Keikaku!,"Comedy, Music, School, Slice of Life",Special,1,7.89,50496,0
694,433,"Kumo no Mukou, Yakusoku no Basho","Drama, Military, Romance, Sci-Fi",Movie,1,7.89,103975,0
695,6115,Lupin III vs. Detective Conan,"Action, Adventure, Comedy, Mystery, Shounen",Special,1,7.89,15220,0
696,80,Mobile Suit Gundam,"Action, Mecha, Military, Sci-Fi, Space",TV,43,7.89,51566,0
697,1092,Mobile Suit Gundam III: Encounters in Space,"Action, Adventure, Drama, Mecha, Military, Sci-Fi, Space",Movie,1,7.89,11343,0
698,20767,Noragami OVA,"Action, Adventure, Shounen",OVA,2,7.89,104775,0
699,10119,Seitokai Yakuindomo OVA,"Comedy, School, Shounen, Slice of Life",OVA,8,7.89,63265,0
