Unnamed: 0,anime_id,name,genre,type,episodes,rating,members,synopsis
1900,147,Kimi ga Nozomu Eien,"Drama, Romance, Slice of Life",TV,14,7.41,90379,0
1901,16732,Kiniro Mosaic,"Comedy, School, Slice of Life",TV,12,7.41,78131,0
1902,844,Konjiki no Gash Bell!!: 101 Banme no Mamono,"Adventure, Shounen, Supernatural",Movie,1,7.41,4425,0
1903,6299,Maria-sama ga Miteru 4th Specials,Comedy,Special,11,7.41,3659,0
1904,7761,Masuda Kousuke Gekijou Gag Manga Biyori +,Comedy,TV,12,7.41,1123,0
1905,3225,Minami-ke Okawari,"Comedy, School, Slice of Life",TV,13,7.41,50837,0
1906,6288,Mobile Suit Gundam 00 The Movie: A Wakening of the Trailblazer,"Action, Mecha, Sci-Fi, Space",Movie,1,7.41,37069,0
1907,2926,Myself; Yourself,"Drama, Romance, School",TV,13,7.41,115075,0
1908,272,Noir,"Action, Drama, Mystery",TV,26,7.41,66036,0
1909,28683,One Piece: Episode of Alabasta - Prologue,"Action, Adventure, Fantasy, Shounen",OVA,1,7.41,4225,0
1910,326,Petshop of Horrors,"Horror, Josei, Mystery, Supernatural",TV,4,7.41,32696,0
1911,10711,Plastic Neesan,"Comedy, School",ONA,12,7.41,83977,0
1912,2744,Potemayo,"Comedy, School, Seinen",TV,12,7.41,11411,0
1913,5753,Precure All Stars Movie DX: Minna Tomodachi☆Kiseki no Zenin Daishuugou!,"Action, Fantasy, Magic, Shoujo",Movie,1,7.41,2957,0
1914,1329,Rail of the Star: A True Story of Children,"Drama, Historical",Movie,1,7.41,1302,0
1915,2193,Saiunkoku Monogatari Soushuuhen,"Adventure, Comedy, Drama, Fantasy, Historical, Romance",Special,9,7.41,3263,0
1916,22273,Selector Infected WIXOSS,"Game, Psychological",TV,12,7.41,80964,0
1917,868,Slayers Great,"Adventure, Comedy, Fantasy, Magic, Shounen",Movie,1,7.41,12760,0
1918,5226,Souten Kouro,"Action, Adventure, Historical",TV,26,7.41,9852,0
1919,15077,Tabisuru Nuigurumi: Traveling Daru,"Kids, Slice of Life",OVA,1,7.41,2565,0
1920,541,Tenchi Muyou! Ryououki 3rd Season,"Action, Comedy, Harem, Sci-Fi, Shounen, Space",OVA,6,7.41,12242,0
1921,32174,"The iDOLM@STER Cinderella Girls: Anytime, Anywhere with Cinderella.","Comedy, Drama, Music",Special,1,7.41,2602,0
1922,10834,Baka to Test to Shoukanjuu: Spinout! Sore ga Bokura no Nichijou,"Comedy, Romance, School, Super Power",Special,6,7.4,19758,0
1923,5356,Canaan,"Action, Seinen",TV,13,7.4,123217,0
1924,15611,Cardfight!! Vanguard: Link Joker-hen,"Action, Adventure, Demons, Game, Shounen",TV,59,7.4,9075,0
1925,20479,Choujigen Game Neptune The Animation OVA,"Action, Comedy, Fantasy, Sci-Fi",OVA,1,7.4,16067,0
1926,21395,Crayon Shin-chan Movie 22: Gachinko! Gyakushuu no Robo To-chan,"Comedy, Kids, Shounen",Movie,1,7.4,704,0
1927,2398,Digimon Adventure 02: Diablomon no Gyakushuu,"Adventure, Comedy, Drama, Kids, Sci-Fi",Movie,1,7.4,31961,0
1928,32410,Dimension W: W no Tobira Online,"Sci-Fi, Seinen",Special,Unknown,7.4,4799,0
1929,3727,Doraemon Movie 01: Nobita no Kyouryuu,"Adventure, Comedy",Movie,1,7.4,1773,0
1930,30694,Dragon Ball Super,"Action, Adventure, Comedy, Fantasy, Martial Arts, Shounen, Super Power",TV,Unknown,7.4,111443,0
1931,12231,Dragon Ball: Episode of Bardock,"Action, Adventure, Comedy, Fantasy, Martial Arts, Sci-Fi, Shounen, Super Power",Special,1,7.4,29030,0
1932,1906,Harukanaru Toki no Naka de: Maihitoyo,"Drama, Fantasy, Historical, Magic, Romance, Shoujo, Supernatural",Movie,1,7.4,4019,0
1933,1206,Ihatov Gensou: Kenji no Haru,"Drama, Historical, Slice of Life",Movie,1,7.4,3607,0
1934,940,Inukami!,"Comedy, Ecchi, Romance, Shounen, Supernatural",TV,26,7.4,47882,0
1935,2808,Irregular Hunter X: The Day of Sigma,"Action, Mecha, Sci-Fi, Shounen",OVA,1,7.4,6348,0
1936,4483,Mahoutsukai ni Taisetsu na Koto: Natsu no Sora,"Drama, Magic, Shounen, Slice of Life",TV,12,7.4,14911,0
1937,99,Mai-Otome,"Comedy, Drama, Fantasy, Magic",TV,26,7.4,36924,0
1938,1196,Masuda Kousuke Gekijou Gag Manga Biyori,"Comedy, Parody",TV,12,7.4,5423,0
1939,16444,Mondaiji-tachi ga Isekai kara Kuru Sou Desu yo?: Onsen Manyuuki,"Fantasy, Supernatural",OVA,1,7.4,44450,0
1940,4062,Musashi no Ken,"Shounen, Sports",TV,72,7.4,971,0
1941,5597,Natsu no Arashi!,"Comedy, Romance, Supernatural",TV,13,7.4,30098,0
1942,12467,Nazo no Kanojo X,"Ecchi, Romance, School, Seinen",TV,13,7.4,99788,0
1943,10928,Nogizaka Haruka no Himitsu: Finale,"Comedy, Romance",OVA,4,7.4,20660,0
1944,4114,Onegai My Melody: Kuru Kuru Shuffle!,"Comedy, Fantasy, Magic",TV,52,7.4,1962,0
1945,1526,Pokemon Advanced Generation: Mew to Hadou no Yuusha Lucario,"Action, Adventure, Drama, Fantasy, Kids",Movie,1,7.4,46887,0
1946,4921,Ramayana: The Legend of Prince Rama,Adventure,Movie,1,7.4,517,0
1947,2111,Rockman.EXE Movie: Hikari to Yami no Program,"Action, Adventure, Game, Kids",Movie,1,7.4,2562,0
1948,15963,Seitokai no Ichizon Lv.2: Watasu Seitokai,"Comedy, Harem, Parody, School",OVA,1,7.4,11554,0
1949,4063,Sekirei,"Action, Comedy, Ecchi, Harem, Super Power",TV,12,7.4,182713,0
1950,9355,Sekirei: Pure Engagement - Kanwa ni Dai,"Comedy, Ecchi, Harem",Special,1,7.4,26719,0
1951,9793,Senjou no Valkyria 3: Tagatame no Juusou,"Action, Fantasy, Military",OVA,2,7.4,9847,0
1952,6380,Tetsuwan Birdy Decode: The Cipher,"Action, Comedy, Sci-Fi",OVA,1,7.4,12944,0
1953,3089,The Sky Crawlers,"Drama, Military",Movie,1,7.4,32660,0
1954,944,The Third: Aoi Hitomi no Shoujo,"Action, Adventure, Sci-Fi, Seinen",TV,24,7.4,14304,0
1955,3457,Vampire Knight,"Drama, Mystery, Romance, Shoujo, Supernatural, Vampire",TV,13,7.4,286826,0
1956,935,Witchblade,"Action, Sci-Fi, Super Power",TV,24,7.4,64697,0
1957,14951,Wonderful Rush,Music,Music,1,7.4,6807,0
1958,92,After War Gundam X,"Adventure, Drama, Mecha, Sci-Fi, Space",TV,39,7.39,19132,0
1959,713,Air Movie,"Drama, Romance, Supernatural",Movie,1,7.39,44179,0
1960,3006,Atashin&#039;chi,"Comedy, Slice of Life",TV,330,7.39,1524,0
1961,13931,Bishoujo Senshi Sailor Moon: Sailor Stars - Hero Club,"Adventure, Comedy, Drama, Fantasy, Magic, Romance, Shoujo",OVA,3,7.39,4238,0
1962,2675,Doraemon Movie 17: Nobita to Ginga Express,Fantasy,Movie,1,7.39,1342,0
1963,2648,Doraemon: 2112-nen Doraemon Tanjou,"Comedy, Fantasy, Kids",Movie,1,7.39,1277,0
1964,2634,Doraemon: Doraemon Comes Back,"Comedy, Fantasy, Kids, Sci-Fi, Shounen",Special,1,7.39,723,0
1965,4726,Druaga no Tou: The Sword of Uruk,"Adventure, Fantasy",TV,12,7.39,46237,0
1966,27525,Fate/kaleid liner Prisma☆Illya 2wei Herz!,"Action, Comedy, Fantasy, Magic, Slice of Life",TV,10,7.39,42499,0
1967,664,Fullmetal Alchemist: Reflections,"Adventure, Comedy, Drama, Fantasy, Military, Shounen",Special,1,7.39,24987,0
1968,3508,Genius Party,"Action, Dementia, Fantasy, Mecha, Music, Psychological, Romance, Sci-Fi",Movie,7,7.39,18612,0
1969,6795,Genius Party Beyond,"Dementia, Fantasy, Music, Sci-Fi",Movie,5,7.39,10660,0
1970,4639,Gosenzo-sama Banbanzai!,"Comedy, Sci-Fi",OVA,6,7.39,2095,0
1971,386,H2,"Comedy, Romance, Shounen, Sports",TV,41,7.39,4450,0
1972,1663,Haha wo Tazunete Sanzenri,"Adventure, Drama, Historical, Slice of Life",TV,52,7.39,3685,0
1973,3335,Haikara-san ga Tooru,"Drama, Historical, Romance, Shoujo, Slice of Life",TV,42,7.39,1155,0
1974,13271,Hunter x Hunter Movie: Phantom Rouge,"Action, Adventure, Shounen, Super Power",Movie,1,7.39,44589,0
1975,6980,Kaidan Restaurant,"Horror, Kids, Mystery, Supernatural",TV,23,7.39,9994,0
1976,28623,Koutetsujou no Kabaneri,"Action, Drama, Fantasy, Horror",TV,12,7.39,253027,0
1977,8068,Kuroshitsuji Picture Drama,"Demons, Supernatural",Special,1,7.39,12446,0
1978,17247,Machine-Doll wa Kizutsukanai,"Action, Ecchi, Fantasy, School, Seinen",TV,12,7.39,136751,0
1979,30307,Monster Musume no Iru Nichijou,"Comedy, Ecchi, Fantasy, Harem, Romance, Seinen",TV,12,7.39,181845,0
1980,6512,Nyan Koi!,"Comedy, Harem, Romance",TV,12,7.39,142264,0
1981,8423,Ookiku Furikabutte: Natsu no Scorebook,"Comedy, Sports",OVA,2,7.39,2167,0
1982,418,Ranma ½: Chuugoku Nekonron Daikessen! Okite Yaburi no Gekitou-hen!!,"Adventure, Comedy, Shounen",Movie,1,7.39,13073,0
1983,6713,Ranma ½: Nettou Uta Gassen,"Comedy, Music",OVA,2,7.39,3676,0
1984,2486,Rumiko Takahashi Anthology,"Comedy, Drama, Romance, Shounen, Slice of Life, Supernatural",TV,13,7.39,3420,0
1985,1231,Saber Marionette J to X,"Action, Adventure, Comedy, Harem, Mecha, Sci-Fi",TV,26,7.39,8862,0
1986,16694,Sankarea: Wagahai mo... Zombie de Aru...,"Comedy, Ecchi, Horror, Romance, Shounen, Supernatural",Special,1,7.39,36573,0
1987,3861,Shaman King Specials,"Action, Comedy, Shounen, Supernatural",Special,5,7.39,12148,0
1988,536,Slayers: The Motion Picture,"Adventure, Comedy, Fantasy, Magic, Shounen",Movie,1,7.39,16046,0
1989,1147,Tenchi Muyou! Ryououki 3rd Season: Tenchi Seirou naredo Namitakashi?,"Action, Comedy, Harem, Sci-Fi, Shounen, Space",OVA,1,7.39,6870,0
1990,7861,The Rose and Women of Versailles,"Adventure, Comedy, Drama, Historical, Romance, Shoujo",Special,1,7.39,1628,0
1991,807,Tsubasa Chronicle: Tori Kago no Kuni no Himegimi,"Action, Adventure, Drama, Fantasy, Shounen",Movie,1,7.39,33633,0
1992,306,Abenobashi Mahou☆Shoutengai,"Comedy, Ecchi, Fantasy, Parody",TV,13,7.38,47752,0
1993,32977,Aggressive Retsuko,"Comedy, Music",TV,Unknown,7.38,5465,0
1994,282,Angel Heart,"Action, Drama, Mystery, Romance, Seinen",TV,50,7.38,9550,0
1995,11697,Area no Kishi,"Comedy, School, Shounen, Sports",TV,37,7.38,38310,0
1996,104,Ayashi no Ceres,"Adventure, Comedy, Drama, Horror, Psychological, Romance, Shoujo, Supernatural",TV,24,7.38,38336,0
1997,24727,Baka to Test to Shoukanjuu Ni!: Mahou Hideyoshi Hideyoshi,"Comedy, Magic",Special,1,7.38,9418,0
1998,6948,Bakemonogatari Recap,"Mystery, Romance, Supernatural",Special,1,7.38,28557,0
1999,5675,Basquash!,"Ecchi, Mecha, Shounen, Sports",TV,26,7.38,30323,0
